processed_text,HS,Abusive,HS_Individual,HS_Group,HS_Religion,HS_Race,HS_Physical,HS_Gender,HS_Other,HS_Weak,HS_Moderate,HS_Strong
bubarkan saja itu dewan perwakilan rakyat sama komisi pemberantasan korupsi sama saja bodoh nya,1,1,0,1,0,0,0,0,1,0,0,1
suu kyi antek komunis sindir suu kyi dute e menang nobel perdamaian,1,0,1,0,0,1,0,0,0,1,0,0
 terima kasih jokowi semoga tahun depan presiden baru bisa juga ada kebijakan yang lebih baik amin ,0,0,0,0,0,0,0,0,0,0,0,0
agenda demo dari turunkan jokowi penjarakan ahok terus ke partai komunis indonesia besok mungkin demo suruh angkat prabowo jadi presiden aksi 299 aksi maksa,1,0,1,0,0,0,0,0,1,0,0,1
 ferdinan harus pintar jaga congor jangan sok jagoan lawan kita jokowi bukan teman sendiri aku lihat kamu sudah sering serang sana sini kayak orang bego kubilang jabatan kamu sekarang ini diisi oleh ruhut tumpul a inya otak kakak,1,1,1,0,0,0,0,0,1,1,0,0
 gue ingin dengar itu bocah yang banyak berkhayal mimpi basah komentari ulah anak orang kayak itu ayo bocah itu presiden kita dihina ,1,0,1,0,0,0,0,1,0,1,0,0
 lagian apa pilih ditenggelamkan sih jadi sampah laut kan ,0,0,0,0,0,0,0,0,0,0,0,0
negara terjerat utang tapi kebijakan malah boros 2019 ganti presiden 2019 presiden baru pemerintah anggarkan rupiah 300 sama untuk gaji dosen asing,1,0,0,1,0,0,0,0,1,0,1,0
 harga dirimu turun hingga 180 derajat karena otak bercampur nanah dan kencing onta kapan sadar woi dan 2019 ganti telor ,1,1,1,0,0,0,0,0,1,1,0,0
 nah lah katanya anti asing ,0,0,0,0,0,0,0,0,0,0,0,0
warga moskow demo turunkan jokowi di negara nya save ustaz alfian,1,0,1,0,0,0,0,0,1,1,0,0
 haha cape dan gua kira video 13 detik dia benaran berbicara kampret ,0,1,0,0,0,0,0,0,0,0,0,0
 mukanya kayak meminta tolong anjir ,0,1,0,0,0,0,0,0,0,0,0,0
lengserkan jokowi rejim anti subsidi adalah rejim anti kerakyatan ,1,0,1,0,0,0,0,0,1,0,0,1
pagi pagi sudah ramai ahoker mau lengserkan jokowi jumat berkah,1,0,1,0,0,0,0,0,1,1,0,0
terima kasih pak gubernur atas pujiannya,0,0,0,0,0,0,0,0,0,0,0,0
 tolol apa hubungannya dengan rumah tangga urus saja kerjaanmu tidak usah banyak cakap kamu jadi menteri di pecat jadi gubernur malah membuat jaka a semakin tidak karuan sebentar lagi juga hancur itu jaka a ,1,1,1,0,0,0,0,0,1,1,0,0
hebat kok di penjara di penjaranya di zaman pula ,1,0,1,0,0,0,0,0,1,1,0,0
kelihatan banget bego nya empok silvy and agus debat final pemilihan kepala daerah jakarta,1,1,1,0,0,0,0,0,1,1,0,0
karena dia tidak punya program hanya modal bacot doang,1,1,1,0,0,0,0,0,1,1,0,0
sebuah pencitraan yang luwar biasa ya pak ,1,0,1,0,0,0,0,0,1,1,0,0
iya anak pemberontak pemerintahan revolusioner republik indonesia perjuangan rakyat semesta ya prabowo ,1,0,1,0,0,0,0,0,1,1,0,0
 ini nih yang mau di panggil yang terhormat yang mulia kerjanya bikin kacau negara ayo ramai ramai golput dewan perwakilan rakyat dan bubarkan dewan perwakilan rakyat ,1,0,0,1,0,0,0,0,1,0,0,1
 perek kamu adalah ,1,1,1,0,0,0,0,1,0,1,0,0
hidup the jack hidup bobotoh rezim jokowi akan musnah di 2019 ,1,0,1,0,0,0,0,0,1,1,0,0
 takut salah fokus kayak yang terjadi sekarang kata iya 10 ribu lapangan kerja ternyata buat asing ,0,0,0,0,0,0,0,0,0,0,0,0
 dan jokowi bukan mega begini kalau mau mencalonkan presiden sebaiknya mundur sekarang dan bikin pak ai ,1,0,1,0,0,0,0,0,1,1,0,0
 jembatan fenomenal dengan pemandangan fenomenal pula bravo presiden jokowi pembangunan jembatan rakyat bersama jokowi,0,0,0,0,0,0,0,0,0,0,0,0
 memang dia adalah begitu sudah terkutuk bro ,1,1,1,0,0,0,0,0,1,1,0,0
selamat kepada jokowi yang telah berhasil dalam menambah hutang karena bukan dia yang bayar tetapi rakyat good luck,1,0,1,0,0,0,0,0,1,1,0,0
rumput laut pun jadi potensi ekonomi unggulan jokowi sekali lagi,0,0,0,0,0,0,0,0,0,0,0,0
tetes embun terakhir menjadi saksi akulah perindu yang selalu menyebut namamu dalam bisu ,0,0,0,0,0,0,0,0,0,0,0,0
lihat diri sendiri pak jok masih belum becus mengurus negara kok sudah sombong sodori kaca ,1,0,1,0,0,0,0,0,1,1,0,0
aku menghindar bukan karena aku munafik tapi aku sadar aku ini siapa ,0,0,0,0,0,0,0,0,0,0,0,0
entah kenapa pesimisme yang justru ditonjolkan oleh rezim jokowi,1,0,1,0,0,0,0,0,1,1,0,0
rekam jejak pendidikan formal 1 fakultas ekonomi universitas gajah mada siapa anies sandi,0,0,0,0,0,0,0,0,0,0,0,0
nak kamu lihat istana di seberang sana berdoa lah bersama ayah dan rakyat semuanya nak semoga tahun depan pemimpin yang sekarang tinggal di sana pulang ke kampung halamannya tidak lagi tinggal di sana 2019 ganti presiden,1,0,1,0,0,0,0,0,1,1,0,0
komplit sudah tidak hanya kebanjiran tenaga kerja asing tenaga kerja asing malahan jokowi restui warga negara asing duduki jabatan direksi badan usaha milik negara benar benar parah negeriku ini tidak ada pilihan lain selain 2019 ganti presiden 2019 ganti presiden ,1,0,1,0,0,0,0,0,1,1,0,0
 cebong tidak pikir sampai sebegitu buat bikin jalan sudah berapa km itu dan habis buat jadi satpam rupiah ,1,1,0,1,0,0,0,0,1,0,1,0
siapapun gubernur dan presidennya rakyatnya ya kita juga ,0,0,0,0,0,0,0,0,0,0,0,0
anies sandi gunakan produk saracen ,1,0,0,1,0,0,0,0,1,0,1,0
ini sebuah serangan balik perang twit kubu yang menelan seorang kader golkar yang dikenal juga sebagai konsultan politiknya anies sandi,1,0,1,0,0,0,0,0,1,1,0,0
buku biografi alfian ibrahim diluncurkan ,0,0,0,0,0,0,0,0,0,0,0,0
 bagaimana dengan gambar no 3 kayaknya itu yang sering dibahas di kelas rezim keuangan ,0,0,0,0,0,0,0,0,0,0,0,0
asisten gubernur kepala depan emen kebijakan ekonomi dan moneter bi dody budi waluyo mengatakan ,0,0,0,0,0,0,0,0,0,0,0,0
asisten gubernur kepala depan emen kebijakan ekonomi dan moneter bi dody budi waluyo mengatakan ,0,0,0,0,0,0,0,0,0,0,0,0
 malah modelnya itu yang munafik mainkan sara rakyat indonesia masih waras jadi hasutanmu tidak berpengaruh untuk ganti presiden ,1,1,1,0,0,0,0,0,1,1,0,0
inggris widjanarko mengabdikan hidup untuk seni budaya dan sosial,0,0,0,0,0,0,0,0,0,0,0,0
 makin lama bikin puyeng kepala itu pak prabowo sama amin rais itu om nada nada bicaranya enggak bermutu sama sekali,1,0,1,0,0,0,0,0,1,1,0,0
bilang sayang lebih dahulu kamu juga yang meninggalkan gue lebih dahulu kontol ,1,1,1,0,0,0,0,1,0,1,0,0
papa minta ketua fraksi rakyat mau nya setya novanto keluar dari dewan perwakilan rakyat bukan di pecat dari ketua dewan perwakilan rakyat percuma saya di pecat dan masih ada di dewan perwakilan rakyat,1,0,1,0,0,0,0,0,1,1,0,0
 contoh nya daerah khusus ibukota impor bawang dari cina gubernur nya kroni sih tengku ,0,0,0,0,0,0,0,0,0,0,0,0
ky tidak berfungsi makan gaji buta habiskan anggaran pendapatan dan belanja negara hakim nakal merajalela bubarkan ,1,0,0,1,0,0,0,0,1,0,0,1
presiden kelima ri yang juga ketua umum partai demokrasi indonesia perjuangan megawati soekarno putri menyebut pidato soekarno sebagai tiga tinta emas abad 20 ,0,0,0,0,0,0,0,0,0,0,0,0
 prabowo bermimpi kalau jadi ri 1 mustahil jadi jangan mimpi di siang bolong mas piyu sakit mimpi nya,1,0,1,0,0,0,0,0,1,1,0,0
kalau saya jadi ketua golkar setya novanto sudah saya pecat karena bikin malu pak ai ,1,0,1,0,0,0,0,0,1,1,0,0
 nah lah zul masa selembar softex dibilang lebih berharga dari congor kamu zul ,0,1,0,0,0,0,0,0,0,0,0,0
 verifikasi cepat kamu sipit ,0,0,0,0,0,0,0,0,0,0,0,0
 rezim sekarang lebih istimewa mungkin mereka melihatnya dari bawah tanah semakin hancur itu baru benar ,1,0,0,1,0,0,0,0,1,0,1,0
ini kebobrokan birokrasi saat anies sandi menjabat nanti via ,1,0,1,0,0,0,0,0,1,1,0,0
 kalau ini paling takut sama rezim ,0,0,0,0,0,0,0,0,0,0,0,0
akan terbit 26 mei 2016 berkata baik atau diam ninik handrini info ,0,0,0,0,0,0,0,0,0,0,0,0
pm x9cheh bajingan kalian semua malah seenaknya duduk duduk sudah berapa hari telat konstruksinya marah dengan muka serius ,1,1,0,1,0,0,0,0,1,0,1,0
masak wakil rakyat tidak memberikan contoh yang baik untuk rakyatnya dalam membayar tagihan listrik kenapa bisa sampai listrik tidak bayar mau salahkan jokowi karena tingkat ekonomi lesu amp membuat fadli zon tidak bayar listrik ,1,0,1,0,0,0,0,0,1,1,0,0
 tidak hidup cebong kalau tidak produksi dan makan hoaks ,1,1,0,1,0,0,0,0,1,0,1,0
cepat tidak selalu lebih hebat pun lambat tidak membuatnya jadi cacat stop comparing my self to other ,0,0,0,0,0,0,0,0,0,0,0,0
open follow for rupiah sekalian follow nih rupiah sok kecantikan padahal pacarnya kayak tai ,1,1,1,0,0,0,0,0,1,1,0,0
 sih asing mau rebut kekayaan indonesia ,0,0,0,0,0,0,0,0,0,0,0,0
 memangnya aku najis ,0,1,0,0,0,0,0,0,0,0,0,0
 haha mampus dan selamat bergalau ria ,1,1,1,0,0,0,0,0,1,1,0,0
sekarang masak tidak bisa kan sudah belajar ,0,0,0,0,0,0,0,0,0,0,0,0
bola itu buat dimainkan di lapangan bukan buat dimainkan mainkan di congor kamu yang bapuk ,1,1,1,0,0,0,1,0,0,1,0,0
 matamu memang picek kebencianmu terhadap pak jokowi menutupi hati dan pikiranmu sejarah baru tercipta di era pak jokowi makanya buka kaca mata itu kamu cuma melihat hutang negara di era pak j,1,1,1,0,0,0,1,0,0,1,0,0
sudah lebih dari 50 tahun freepo di kuasai oleh pihak asing baru di masa pemerintahan jokowi se a pak jonan menjadi menteri energi dan sumber daya mineral freepo kita ambil alih sahamnya jonan jos ,0,0,0,0,0,0,0,0,0,0,0,0
mbah berfatwa kalau berbicara anjing itu tidak papa asal jangan diikuti dengan kata kamu atau nama orang oke sip anjing ,0,1,0,0,0,0,0,0,0,0,0,0
cinta itu memang buta tapi jangan biarkan ia memilih yang salah ,0,0,0,0,0,0,0,0,0,0,0,0
 2019 memang pemilihan presiden pasti yang banyak prestasinya banyak pengalamannya dan hasil kerjanya terbukti itu yang akan menjadi presiden ,0,0,0,0,0,0,0,0,0,0,0,0
 tai ternyata akun kamu tau begitu gue blok ,1,1,1,0,0,0,0,0,1,1,0,0
 tidak usah begitu bang kita ini mau presiden yang baru kalau begini terus bagaimana mau dapat yang baru,0,0,0,0,0,0,0,0,0,0,0,0
merasa asing sih ,0,0,0,0,0,0,0,0,0,0,0,0
tua tua pun bodoh betul otak ,1,1,1,0,0,0,0,0,1,1,0,0
abang bisa bahasa asing ya basa asing tidak bisa lah itu tadi iya no iya no itu kan basa inggris dek bukan basa asing ,0,0,0,0,0,0,0,0,0,0,0,0
 menghormati kinerja pemerintah yang bagaimana negara hampir hancur kamu bilang harus menghargai kinerja pemerintah bego boleh dongok jangan ,1,1,1,0,0,0,0,0,1,1,0,0
benar benar benar dan benar gue duduk sama keren lagi wkwk mana meja sepetak lagi kampang ,0,1,0,0,0,0,0,0,0,0,0,0
hai guys mari kita mengulas hari ini kunjungan presiden jokowi siang ini 17 april 2018 ke bandara ke ajati majalengka terima kasih jokowi 2019 tetap jokowi,0,0,0,0,0,0,0,0,0,0,0,0
anies sandi gunakan produk saracen untuk kampanye ,1,0,1,0,0,0,0,0,1,1,0,0
orang yang kayak tai itu adalah ketika dia yang membuat kesalahan tetapi orang lain yang harus meminta maaf ,0,1,0,0,0,0,0,0,0,0,0,0
 anjing aku tertawa ,0,1,0,0,0,0,0,0,0,0,0,0
 sudah kodrat pecun dang memang paling pintar cari alasan ,1,1,1,0,0,0,0,1,0,1,0,0
new post presiden jokowi soroti minimnya promosi asian games has been published on wa a online ,0,0,0,0,0,0,0,0,0,0,0,0
 berburu bunga bangkai ayo ,0,0,0,0,0,0,0,0,0,0,0,0
 memang anjing itu orang sarap pusing gue lihatnya ,1,1,1,0,0,0,1,0,0,1,0,0
 edan ini kutipan berbobot bwangeeeeeeuuut ,0,1,0,0,0,0,0,0,0,0,0,0
 anggota dewan perwakilan rakyat nya saja yang dipotong ,0,0,0,0,0,0,0,0,0,0,0,0
 aku itu aku dan ku tau matamu sipit tapi dilihat dari mana itu aku ,0,0,0,0,0,0,0,0,0,0,0,0
 sejak kamu direct message pakai capslock terus bilang gue cocot wkwk ,0,1,0,0,0,0,0,0,0,0,0,0
mayoritas warga tak ingin jokowi jadi presiden lagi klik rmol survei,0,0,0,0,0,0,0,0,0,0,0,0
kalau ikan tidak bisa hidup tanpa air tapi kalau aku tidak bisa hidup tanpa kamu ,0,0,0,0,0,0,0,0,0,0,0,0
 semakin aneh di rezim ini rakyat sudah pintar mas bro terima kasih media sosial ,0,0,0,0,0,0,0,0,0,0,0,0
 goreng terus zon yang penting demi naikan nilai prabowo apapun hajar saja tabrak saja ,1,0,1,0,0,0,0,0,1,1,0,0
 memang cebong kalau tidak fitnah tidak makan kenyang dan kalau tidak curang ya tidak menang ,1,1,0,1,0,0,0,0,1,0,1,0
cinta itu memang buta tapi jangan sampai ia memilih yang salah ,0,0,0,0,0,0,0,0,0,0,0,0
dan apakah bubarkan komisi pemberantasan korupsi sudah jadi keharusan melihat semua jejak rekamnya ketika berhadapan dengan penguasa komisi pemberantasan korupsi mandul ,1,0,0,1,0,0,0,0,1,0,1,0
 sepertinya mulai kumat lagi ya penyakitnya putus mulu mau naikan tarif lagi ya kacrut ,0,1,0,0,0,0,0,0,0,0,0,0
 pepatah itu cocoknya buat jongos yang nyaring mengibulnya saking sibuk kerja pencitraan dolar meroket sih tablo plonga dongok ,1,1,1,0,0,0,0,0,1,1,0,0
 nanti kalau pak prabowo jadi presiden sikap sih pendekar 1 kuping ini akan berubah haluan ,1,0,1,0,0,0,0,0,1,1,0,0
 haha jangan terlalu keras bro kita tetap hargai mereka yang tetap ingin ganti presiden walaupun mereka tidak memilih prabowo yang penting kita fokus dukung prabowo ,0,0,0,0,0,0,0,0,0,0,0,0
 ada yang maling duit waktu olahraga dan terciduk sampai sekarang tidak ada yang menemani dia mampus kampang banget jadi orang ,1,1,1,0,0,0,0,0,1,1,0,0
 anjing memang jokowi mengakui jika jadi presiden segala urusan daerah khusus ibukota lebih mudah diatasi,1,1,1,0,0,0,0,0,1,1,0,0
 kata rakyat kecil makin lama kalian makin tidak jelas ,1,0,0,1,0,0,0,0,1,0,1,0
 terima kasih pak presiden yang selalu memberikan selamat dengan tulus semoga sehat selalu pak allah memberikan yang terbaik kepada pak jokowi amin salam dua periode ,0,0,0,0,0,0,0,0,0,0,0,0
top cerita 30 proyek strategis jokowi rupiah 94 8 triliun rampung,0,0,0,0,0,0,0,0,0,0,0,0
presiden ri 1 1r soekarno 2 2oeha o 3 3j habibie 4 abdurrahman wahid 5 soekarno putri 6 bambang yudhoyono 7 toko widodo 8 8 ,0,0,0,0,0,0,0,0,0,0,0,0
 semua sudah terang benderang asal polisi mau usut tuntas sebelum dilantik kalau pemilihan kepala daerah terkait asma saracen kepala kepolisian republik indonesia kepala kepolisian republik indonesia,1,0,1,0,0,0,0,0,1,1,0,0
selama ada novel di komisi pemberantasan korupsi sandi tetap aman mana mungkin novel usut wakil gubernur sepupunya mana mungkin juga usut kasusnya anies ,1,0,0,1,0,0,0,0,1,0,1,0
sesuai tap majelis permusyawaratan rakyat sementara harus di pecat kalau jokowi diam maka jokowi lah pelanggar tap majelis permusyawaratan rakyat sementara layak di lengserkan kalau majelis permusyawaratan rakyat takut 98 ulang,1,0,1,0,0,0,0,0,1,0,0,1
 timbal baliknya tenaga kerja asing min cepat cepat dipulangkan tolong ,0,0,0,0,0,0,0,0,0,0,0,0
berengsek gue baru lihat anjeeeeng fix banget gue pingsan dulu bye ,1,1,1,0,0,0,0,0,1,1,0,0
aku selalu buat keputusan terus dari hati aku terus cakap itu terkadang macam bodoh tah lah ,0,1,0,0,0,0,0,0,0,0,0,0
gubernur yang membuat bangga bangsa indonesia,0,0,0,0,0,0,0,0,0,0,0,0
kampungan sekali udik payah kampungan sekali udik payah ,0,0,0,0,0,0,0,0,0,0,0,0
 lalu kembali aku berbisik kepadanya dengan lebih lembut dan penuh cinta mukamu mangan gaji buta kampret ,1,1,1,0,0,0,0,0,1,1,0,0
dukungan anti hoaks dan pilihan kepala daerah damai oleh warga kecamatan sukolilo susilo bambang yudhoyono,0,0,0,0,0,0,0,0,0,0,0,0
barel ada dugaan bom ,0,0,0,0,0,0,0,0,0,0,0,0
 najis kamu mengirim pesan tidak jelas direct message gue tidak dibalas bodoh amat gue doakan nanti pentas kamu tidak menang ,1,1,1,0,0,0,0,0,1,1,0,0
 malu memalukan gerindra punya admin surat pemberitahuan tahunan ini ,1,0,1,0,0,0,0,0,1,1,0,0
 kalau felix pilih agama tinggalkan negara ini ,1,0,1,0,0,0,0,0,1,1,0,0
 bangsat apa dah kamu sangat tidak ramah sama gue ,1,1,1,0,0,0,0,0,1,1,0,0
 berani bubarkan komisi pemberantasan korupsi akan berhadapan dengan rakyat kamu anjing,1,1,1,0,0,0,0,0,1,1,0,0
 mungkinkah sandi dan anies menyusul sahabat sahabatnya yang jadi buron dan yang sudah ditangkap itu sebelum dilantik ,1,0,0,1,0,0,0,0,1,0,1,0
 oi ternyata riri wkwk ya kamu ganti nama pengguna sama dan sih kan asing ,0,0,0,0,0,0,0,0,0,0,0,0
 onta xadsekar ,1,1,1,0,0,0,0,0,1,1,0,0
gue sudah kabur nak bagi gue spesifik task jangan masuk campur bajingan ,1,1,1,0,0,0,0,0,1,1,0,0
 sudah pelupa otak mulai tidak menyambung ,1,0,1,0,0,0,0,0,1,1,0,0
diminta sebagai saksi meringankan di persidangan surat pertanggungjawaban fiktif gubernur sumbar tidak datang,0,0,0,0,0,0,0,0,0,0,0,0
 ini masih cacat banget mengeditnya lah tapi terima kasih ya huhu ,0,1,0,0,0,0,0,0,0,0,0,0
 x9cmaju kamu sini anjing fanny dan babi lah sakit perut aku gelak ,1,1,1,0,0,0,0,0,1,1,0,0
 anggota dewan perwakilan rakyat yang amnesia parah begini kok ada yang memilih dan merasa diwakili orang ini wkwk ,0,0,0,0,0,0,0,0,0,0,0,0
a seorang yang suka sendirian entah kenapa tapi nanti juga balik lagi ,0,0,0,0,0,0,0,0,0,0,0,0
kamu mahasiswa jurusan d3 ekonomi keuangan,0,0,0,0,0,0,0,0,0,0,0,0
admin gerindra pamer kepintaran ,0,0,0,0,0,0,0,0,0,0,0,0
 tanya amin rais dulu dia yang bikin kacau dan menyuruh reformasi pilihan kepala daerah salah satu hasilnya ,1,0,1,0,0,0,0,0,1,1,0,0
 mari kita lihat saja sejauh mana parahnya jaka a tanpa ahok ini nanti setelah pelantikan gubernur baru ,1,0,1,0,0,0,0,0,1,1,0,0
tak pasal keluar perkataan babi bila baca last twit ,0,1,0,0,0,0,0,0,0,0,0,0
cc lagi nafsu tenaga kurang ,1,0,1,0,0,0,0,0,1,1,0,0
 jangan biasa main framing urusan data ekonomi saya paham owa,0,0,0,0,0,0,0,0,0,0,0,0
ini adalah keren habis ,0,0,0,0,0,0,0,0,0,0,0,0
wkwk mampus tidak salah gue diblok dia sejak jaman jokowi ahok mencalonkan gubernur gaya kamu mengintip mengintip anies sandi ,1,0,1,0,0,0,0,0,1,1,0,0
 lembaga survei nya bagian dari tim jokowi jadi independensi nya di ragu kan,1,0,1,0,0,0,0,0,1,1,0,0
 ppp gelar musyawarah nasional alim ulama bahas calon wakil presiden jokowi,0,0,0,0,0,0,0,0,0,0,0,0
 kampret tolol orang kayak kamu itu paling susah tidak nge i2 lo kalau copy paste begitu yang lengkap malas gue bahasnya terlalu sering menyodorkan kok copy paste gambar tanpa tau dari mana sumber nya payah ,1,1,1,0,0,0,0,0,1,1,0,0
 ppp jadi bangkai nih 2019 ,1,1,0,1,0,0,0,0,1,0,1,0
komisi pemberantasan korupsi ri awasi pertahanan izin cuti ikut pilihan kepala daerah tapi masih kendalikan proyek di pemerintahan,0,0,0,0,0,0,0,0,0,0,0,0
 sesuai janji woi kamu balik jadi kibum anjir kunyuk sudah back eak ,0,1,0,0,0,0,0,0,0,0,0,0
sesuai janji woi kamu balik jadi kibum anjir kunyuk sudah back eak ,0,1,0,0,0,0,0,0,0,0,0,0
diam diam baik rupiah makin nyungsep atas dolar sudah tembus rupiah 14 441 saja sebenarnya gue malah senang kalau langsung tembus 16 ribu biar cepat lengser nih rezim kodok ,1,1,1,0,0,0,0,0,1,1,0,0
 haha lancar semua nih babi betul sudah lah nak sambung kerja ,0,1,0,0,0,0,0,0,0,0,0,0
kecerdasan susilo bambang yudhoyono bermain dua kaki di depan publik susilo bambang yudhoyono bergabung di koalisi merah putih mengusung prabowo hatta di belakang susilo bambang yudhoyono koalisi dengan jend merah,1,0,1,0,0,0,0,0,1,1,0,0
 yang dungu itu orang yang mau ganti presiden tetapi tidak tau siapa mikiiiir ,1,1,1,0,0,0,0,0,1,1,0,0
bagi bagi sembako gembar gembor atas nama presiden kalau berutang diam diam baik atas nama rakyat 2019 ganti presiden 2019 presiden baru 2019 ganti presiden baru,1,0,1,0,0,0,0,0,1,1,0,0
 pengembangan industri nasional sekarang diarahkan untuk menindaklanjuti produktivitas daya saing dan pengembangan teknologi leonard tampubolon deputi bidang ekonomi badan perencanaan pembangunan nasional ready for industry 4 0 fm,0,0,0,0,0,0,0,0,0,0,0,0
yang perlu di sadari krisis moneter itu sebenarnya krisis ekonomi ,0,0,0,0,0,0,0,0,0,0,0,0
mengemis like mengemis komen atau apa sih udik banget kayak baru main facebook ,1,1,1,0,0,0,0,0,1,1,0,0
asing sama lini masa sendiri ,0,0,0,0,0,0,0,0,0,0,0,0
 jadi tidak nih mencalonkan calon wakil presiden nya mud sudah tua bangkai masih kuat cuit juga nih ,1,1,1,0,0,0,0,0,1,1,0,0
 tabayun sebelum ngomyang cocot busuk wkwk dipelihara memainkan isu sara kok bangga ,1,1,1,0,0,0,1,0,0,1,0,0
 kakak kamu kredit tidak punya tetapi pinjaman negara banyak,1,0,1,0,0,0,0,0,1,1,0,0
jokowi jangan berutang mulu gue sudah memberi tau dari jaman susilo bambang yudhoyono jauhi mereka bilang suruh gue ,1,0,1,0,0,0,0,0,1,1,0,0
pilihan kepala daerah tegal komitmen herujito sugono dalam pilihan kepala daerah bersih dan damai,0,0,0,0,0,0,0,0,0,0,0,0
 siapa yang telat memberi tau kamu edan sarap gue bergaul dengan cigax jifla calis sama siapa itu licew juga ,0,1,0,0,0,0,0,0,0,0,0,0
mungkin maksud pemerintah dengan dihibahkan ke mereka maka akan tercatat sebagai aset dan bisa dianggarkan biaya perbaikan dan perawatannya secara rutin ,0,0,0,0,0,0,0,0,0,0,0,0
 dulu 98 dolar 12 000 koar koar meminta rezim lengser sekarang sudah mau tembus 15 000 malah makin jadi penjilat penguasa kasihan rakyat selalu jadi korban propaganda politikus busuk ,1,1,1,0,0,0,0,0,1,1,0,0
jembatan tuban yang ambruk diresmikan presiden soeha o tahun 1980,0,0,0,0,0,0,0,0,0,0,0,0
 bangga jadi jongos memang kamu sendiri sudah apa saja babu jilat memek busuk jablay alexis ,1,1,1,0,0,0,0,1,0,1,0,0
 cebong kurang kopi eta adalah harga harga naik mengakuinya masih bisa beli padahal adalah berutang ,1,1,0,1,0,0,0,0,1,0,1,0
 memang kampungan dan norak baru tau ,0,1,0,0,0,0,0,0,0,0,0,0
 tidak usah spoiler bangsat ,1,1,1,0,0,0,0,0,1,1,0,0
 tambah sipit tidak punya mata baru tau ,0,0,0,0,0,0,0,0,0,0,0,0
 kesalahan beliau adalah tak bisa dibeli rezim ,0,0,0,0,0,0,0,0,0,0,0,0
gubernur daerah khusus ibukota salat jumat bersama erdogan,0,0,0,0,0,0,0,0,0,0,0,0
gubernur daerah khusus ibukota salat jumat bersama erdogan,0,0,0,0,0,0,0,0,0,0,0,0
 itu yang disalami jokowi kok kayak ferdinan antek susilo bambang yudhoyono ya ,0,0,0,0,0,0,0,0,0,0,0,0
 anak kecil buta huruf dan huft ,0,0,0,0,0,0,0,0,0,0,0,0
jika kamu bukan anak raja juga bukan anak ulama besar maka menulislah imam al ghazali ,0,0,0,0,0,0,0,0,0,0,0,0
kunjungan anies ke turki tuai pujian ribuan warganet katanya ini gubernur apa presiden selengkapnya ,0,0,0,0,0,0,0,0,0,0,0,0
deklarasi pilihan kepala daerah 2018 aman dan anti hoaks warga penjarakan jabon,0,0,0,0,0,0,0,0,0,0,0,0
tsamara pengagum diktator soekarno,1,0,1,0,0,0,0,0,1,1,0,0
 itu tanda nya mau pilihan kepala daerah dan pemilihan presiden,0,0,0,0,0,0,0,0,0,0,0,0
 istirahat saja pak presiden momentum sudah berlalu saya pernah jadi saksi telinga dan mata awal rapat pembentukan pada di pacitan tahun 2003,0,0,0,0,0,0,0,0,0,0,0,0
 sedih saja punya kepala kepolisian republik indonesia kok begitu amat sih ketakutan banget dahhh dengan kedudukan ,1,0,1,0,0,0,0,0,1,1,0,0
pantasnya jadi r1 nih gubernur indonesia cc cep john ,0,0,0,0,0,0,0,0,0,0,0,0
 indonesia lawyers club boediono century ketika ini terjadi saya ikuti kasus ini cukup intens meski sekarang agak lupa tapi kuncinya kita cuma butuh 2019 ganti presiden itu ,1,0,1,0,0,0,0,0,1,1,0,0
rohingya kok seolah olah dijadikan alat politik oleh prabowo,1,0,1,0,0,0,0,0,1,1,0,0
dianggap pro ekonomi rakyat tuan guru bajang didorong ikut pemilihan presiden 2019,0,0,0,0,0,0,0,0,0,0,0,0
 h imam munandar gubernur riau periode 1980 1985 dan 1985 1990 memperoleh gelar datuk sri ,0,0,0,0,0,0,0,0,0,0,0,0
 warga semarang prihatin kontroversi puisi gus mus,0,0,0,0,0,0,0,0,0,0,0,0
warga semarang prihatin kontroversi puisi gus mus,0,0,0,0,0,0,0,0,0,0,0,0
baru mau 1 periode sudah blangsak apalagi menambah 2019 ganti presiden 2019 presiden baru,1,1,1,0,0,0,0,0,1,1,0,0
 gue buta bahasa asing a inya sangat lelah itu apaan min ,0,0,0,0,0,0,0,0,0,0,0,0
 alah kampret baru mau mengirim ,0,1,0,0,0,0,0,0,0,0,0,0
 untung aku kunti tidak ,0,0,0,0,0,0,0,0,0,0,0,0
ternyata senjata yang paling mematikan bukan bom nuklir tapi mulut ini dan astagfirullah ,0,0,0,0,0,0,0,0,0,0,0,0
menjadi perhatian penting dan genting bagi yang mulia presiden ri pak dan menteri tenaga kerja ri pak cc ,0,0,0,0,0,0,0,0,0,0,0,0
melempem maaf tenggorokannya lagi kering ,0,0,0,0,0,0,0,0,0,0,0,0
calon presiden 2019 trump itu dangkal dan bodoh jokowi itu sinting dan kalau saya jadi presiden korupsi hilang di negara ini ,1,1,1,0,0,0,0,0,1,1,0,0
jokowi lebih baik anda sadar diri saja turun jabatan dari pada di lengserkan oleh rakyat malu front pembela islam tidak akan mati ,1,0,1,0,0,0,0,0,1,1,0,0
menolak berita hoaks dan menyukseskan pilihan kepala daerah damai ,0,0,0,0,0,0,0,0,0,0,0,0
idiot banget sudah sih bang luki ,1,1,1,0,0,0,1,0,0,1,0,0
 semoga ada 3 kandidat calon presiden dan calon wakil presiden 1 prabowo subianto dan mas agus h yudhoyono gerindra demokrat partai keadilan sejahtera kapan pak ai bulan bintang 2 jokowi dan airlangga apa anto partai demokrasi indonesia perjuangan golkar nasional demokrat ppp psi 3 muha,0,0,0,0,0,0,0,0,0,0,0,0
 dulu pakai aparat dengan mantra anda anti pembangunan anda komunis ,0,0,0,0,0,0,0,0,0,0,0,0
makin nakal polisi dengan kasus kasus buatan makin kuat animo umat islam untuk lengserkan jokowi 2019 ,1,0,1,0,0,0,0,0,1,0,0,1
prabowo dalang kerusuhan mei 98 mustahil jadi presiden paparannya lengkap ,1,0,1,0,0,0,0,0,1,1,0,0
 sipit juga cakap ,0,0,0,0,0,0,0,0,0,0,0,0
akun masih dapat dilihat caranya tulis hikdun di kolom cari twitter enter muncul isi akun melihat lebih banyak klik more option,0,0,0,0,0,0,0,0,0,0,0,0
bambang soesatyo meminta seluruh kekuatan politik yang ada mempelajari sistem pelaksanaan pilihan kepala daerah langsung ia menuturkan sistem tersebut akan dilanjutkan jika memang memberikan manfaat bagi masyarakat,0,0,0,0,0,0,0,0,0,0,0,0
2 dalam perjalanannya kali ini presiden didampingi kepala staf kepresidenan koordinator staf khusus presiden teten masduki staf khusus presiden diaz hendro priyono dan komandan pasukan pengamanan presiden mayor jenderal tentara nasional indonesia mar suha ono jokowi kunjungan kerja,0,0,0,0,0,0,0,0,0,0,0,0
 arseto ini kunyuk yang sedang cari panggung ,0,1,0,0,0,0,0,0,0,0,0,0
 arseto ini kunyuk yang sedang cari panggung ,0,1,0,0,0,0,0,0,0,0,0,0
presiden jokowi sudah merampungkan 30 proyek strategis nasional play station network periode 2016 2017 senilai rupiah 94 8 triliun kita dukung pak jokowi 2 periode yang sudah terbukti se a melanjutkan pembangunan berkesinambungan 2019 tetap jokowi jokowi dua periode,0,0,0,0,0,0,0,0,0,0,0,0
komisi pemberantasan korupsi masih dibutuhkan semua yang dilakukan sudah baik kenapa tidak dewan perwakilan rakyat saja yang di bubarkan ,1,0,0,1,0,0,0,0,1,0,1,0
