processed_text,HS,Abusive,HS_Individual,HS_Group,HS_Religion,HS_Race,HS_Physical,HS_Gender,HS_Other,HS_Weak,HS_Moderate,HS_Strong
allah subhanahu wa taala tak paham toleransi harus dibuang ingin belajar toleransi keindonesiaan gabung sabang merauke 2016,1,1,0,1,1,0,0,0,0,0,0,1
 betul akhir akhir semua tanam dan makan sendiri circulation of uang malaysia akan dilanda musibah ekonomi,0,0,0,0,0,0,0,0,0,0,0,0
 kafan berasal dari budaya yahudi kenapa umat islam mengklaim ,0,0,0,0,0,0,0,0,0,0,0,0
 ngentot yukkk ,0,1,0,0,0,0,0,0,0,0,0,0
misi 4 membangun masyarakat yang gotong royong toleran dan harmoni selaras nilai budaya jawa barat yang luhur nomor tiga jawa barat asyik asyik menang,0,0,0,0,0,0,0,0,0,0,0,0
jika negeri ingin selamat cuma 1 syarat lengserkan jokowi jaga negara kesatuan republik indonesia selamatkan negeri ini ,1,0,1,0,0,0,0,0,1,0,0,1
bersikap adil dan juga tulus untuk memajukan kesejahteraan rakyat bila terpilih menjadi gubernur ,0,0,0,0,0,0,0,0,0,0,0,0
siapa pasangan calon gubernur dan wakil gubernur pilihan anda dalam debat terbuka pilihan gubernur jawa tengah 2018 malam ini ,0,0,0,0,0,0,0,0,0,0,0,0
siapa pasangan calon gubernur dan wakil gubernur pilihan anda dalam debat terbuka pilihan gubernur jawa tengah 2018 malam ini ,0,0,0,0,0,0,0,0,0,0,0,0
dan setelah memperingati tradisi seba di pendopo pemerintah kabupaten lebak akan dilanjut kembali be emu dengan gubernur banten wahidin halim hari ini 21 4 seba baduy 2018,0,0,0,0,0,0,0,0,0,0,0,0
kampung di danau sunter sekarang menjadi indah karena pemukiman warga tersebut dicat warna warni diresmikan oleh gubernur 24 maret 2018 lalu inisiatif ini untuk mendukung danau sunter dan sekitarnya menjadi tempat rekreasi ,0,0,0,0,0,0,0,0,0,0,0,0
barisan serba guna jaga ulama ,0,0,0,0,0,0,0,0,0,0,0,0
tokoh pemuda tokoh masyarakat dan tokoh ulama bersinergi mengikuti mingguan desa rawasari bagja diri,0,0,0,0,0,0,0,0,0,0,0,0
 foto partai demokrasi indonesia perjuangan silaturahmi ke imam besar masjid istiqlal ,0,0,0,0,0,0,0,0,0,0,0,0
plt gubernur bengkulu rohidin mersyah hadir pada upacara kebangsaan badan nasional penanggulangan terorisme badan nasional penanggulangan terorisme bersama forum koordinasi pencegahan terorisme forum koordinasi pencegahan terorisme provinsi bengkulu di lapangan rektorat institut agama islam negeri institut agama islam negeri bengkulu 11 ,0,0,0,0,0,0,0,0,0,0,0,0
namun dengan kondisi ekonomi nasional yang terbatas setelah penggantian kekuasaan pemerintah segera mengambil langkah strategis dengan mengeluarkan undang undang modal asing undang undang no 1 tahun 1967 dan freepo 51 ,0,0,0,0,0,0,0,0,0,0,0,0
morgan mendatangi agama yahudi kristen islam suku maya hindu buddha mencari tahu tentang kiamat the story of god,0,0,0,0,0,0,0,0,0,0,0,0
 43 program 18 melindungi sepenuhnya seluruh produk warisan budaya ekspresi budaya tradisional dan hak cipta para seniman asyik menang asyik menang,0,0,0,0,0,0,0,0,0,0,0,0
dengarkan cerita tentang eksodus etnis tionghoa 1959 dampak pp 10 keluarganya salah satunya tetapi dia masih merasa sangat indonesia meski besar di cina dia lebih nyaman dengan sesama tionghoa yang dari indonesia ,0,0,0,0,0,0,0,0,0,0,0,0
hak asasi manusia tidak hanya tentang hak sosial politik tetapi juga hak ekonomi sosial budaya pihri buhaira,0,0,0,0,0,0,0,0,0,0,0,0
ulama jawa barat dukung presiden joko widodo dalam pemilihan presiden 201 2019 tetap jokowi,0,0,0,0,0,0,0,0,0,0,0,0
pnh kerja di asing bermanfaat juga diterapkan di sekolah yang dominan enggan ,0,0,0,0,0,0,0,0,0,0,0,0
insya allah presiden aaamiinn,0,0,0,0,0,0,0,0,0,0,0,0
hakim bubarkan komisi pemberantasan korupsi ,1,0,0,1,0,0,0,0,1,0,0,1
menteri perhubungan presiden jokowi berikan berbagai ide dan arahan penting dalam proses pembangunan bandara ke ajati,0,0,0,0,0,0,0,0,0,0,0,0
buddha yang teroris ,1,0,0,1,1,0,0,0,0,0,1,0
 anak anak harus punya cita cita dan harus bersemangat hal tersebut disampaikan presiden saat be emu dengan anak anak penyintas kanker di istana kepresidenan bogor jawa barat jumat 6 4 sekretariat kabinet akhir pekan,0,0,0,0,0,0,0,0,0,0,0,0
 kenapa kan asyik tapi tergantung budaya apa sih wkwk,0,0,0,0,0,0,0,0,0,0,0,0
namun dengan kondisi ekonomi nasional yang terbatas setelah penggantian kekuasaan pemerintah segera mengambil langkah strategis dengan mengeluarkan undang undang modal asing undang undang no 1 tahun 1967 freepo 51 ,0,0,0,0,0,0,0,0,0,0,0,0
 ayo jaga keutuhan negara kesatuan republik indonesia tangkap penista agama stop kriminalisasi ulama ,1,0,1,0,1,0,0,0,0,0,0,1
 jaman susilo bambang yudhoyono yang demo partai demokrasi indonesia perjuangan,1,0,0,1,0,0,0,0,1,0,1,0
 ternyata sudah ciri khas orang nusantara membenci ras tionghoa ,1,0,0,1,0,1,0,0,0,0,1,0
 akun komunis,1,0,0,1,0,1,0,0,0,0,1,0
 tenaga kerja indonesia dan haji uma juga mengucapkan terima kasih kepada ketua kesatuan anak nanggroe aceh kana di malaysia dan kepada seluruh warga aceh di malaysia yang ikut menyumbang dan membantu proses pemulangan jenazah dan dan ,0,0,0,0,0,0,0,0,0,0,0,0
bagi cina ri negara masa depannya 75 tanah dikuasai siap usir pribumi dengan dewa perang ,1,0,0,1,0,1,0,0,0,0,1,0
60 para sahabat nabi pergi merantau dan mengembara ke timur mencari bani jawi di situlah permulaan bani jawi dan dapat menerima islam tanpa peperangan dan mendukung islam sebagai satu kewajiban ,0,0,0,0,0,0,0,0,0,0,0,0
sementara foto ini sedang hit di kalangan pemuka agama ,0,0,0,0,0,0,0,0,0,0,0,0
 bangsat bintaro komunis tidak berubah ,1,1,0,1,0,1,0,0,0,0,1,0
 menemukan jalan yang benar di organisasi yang diharamkan sepe i babi dan dilarang sepe i partai komunis indonesia dan ,0,0,0,0,0,0,0,0,0,0,0,0
mewah dampingi gubernur organization development hadiri acara puncak festival paskah gfg 2018,0,0,0,0,0,0,0,0,0,0,0,0
 kalau diamati bapak presiden ini menekankan pembangunan infrastruktur di daerah yang tak terduga bagus dengan demikian perkembangan ekonomi tidak hanya terfokus pada kota kota besar ,0,0,0,0,0,0,0,0,0,0,0,0
bangsa dan negara harus berani mengubur islam said menegaskan negara tidak boleh kalah oleh aksi teroris,1,0,0,1,1,0,0,0,0,0,1,0
kemarin revisi undang undang terorisme telah disahkan dewan perwakilan rakyat dengan harapan pencegahan terhadap aksi terorisme bisa lebih dimaksimalkan termasuk pelibatan tentara nasional indonesia polemik pemberantasan terorisme ,0,0,0,0,0,0,0,0,0,0,0,0
fahri hamzah bela prabowo masalah pe olongan pemerintah jokowi ke rohingya bubarkan partai komunis indonesia bubarkan partai komunis indonesia,1,0,0,1,0,1,0,0,0,0,0,1
ingin banget jilat memek ,0,1,0,0,0,0,0,0,0,0,0,0
selamat hari koperasi nasional koperasi sebagai landasan ekonomi bangsa harus dipelihara dan ditumbuh kembangkan dari ancaman praktik kakak el asing ,0,0,0,0,0,0,0,0,0,0,0,0
isis adalah islam islam adalah isis mau hidup baik tinggalkan islam stop salat mengaji,1,0,0,1,1,0,0,0,0,0,1,0
bandung bebas banjir nurul arifin menyatakan solusinya danau buatan bandung cantik bandung harmonis bandung memilih nuruli calon wali kota bandung calon wali kota bandung 2018,0,0,0,0,0,0,0,0,0,0,0,0
karena mereka sadar rezim ini kesempatan buat neo komunis bangkit kembali kapan lagi atau tidak sama sekali ,1,0,1,0,0,1,0,0,0,1,0,0
mari awasi sekeliling kita masing masing menjelang 30 si jika ada aktivitas antek komunis laporkan ke ulama dan tentara nasional indonesia ganyang partai komunis indonesia,1,0,0,1,0,1,0,0,0,0,0,1
selamat menuju ngewe yang halal bro ,0,1,0,0,0,0,0,0,0,0,0,0
 haha mantap tetap pada intinya yaitu ngentot ,0,1,0,0,0,0,0,0,0,0,0,0
alangkah indahnya di bubarkan ,1,0,0,1,0,0,0,0,1,0,1,0
2 presiden yakin indonesia akan menjadi negara yang semakin besar kokoh dan kuat apabila ulama dan umara nya selalu beriringan se a menjaga tali silaturahmi jokowi ajak ulama sejukkan pemilihan kepala daerah,0,0,0,0,0,0,0,0,0,0,0,0
puluhan ulama jabar menyatakan dukung jokowi maju pemilihan presiden 2019,0,0,0,0,0,0,0,0,0,0,0,0
 warga badui setelah selesai memperingati tradisi seba di pendopo pemerintah kabupaten lebak akan dilanjutkan kembali be emu dengan gubernur banten wahidin halim hari ini sabtu 21 4 seba baduy 2018,0,0,0,0,0,0,0,0,0,0,0,0
warga badui setelah selesai memperingati tradisi seba di pendopo pemerintah kabupaten lebak akan dilanjutkan kembali be emu dengan gubernur banten wahidin halim hari ini sabtu 21 4 seba baduy 2018,0,0,0,0,0,0,0,0,0,0,0,0
 warga badui setelah selesai memperingati tradisi seba di pendopo pemerintah kabupaten lebak akan dilanjutkan kembali be emu dengan gubernur banten wahidin halim hari ini sabtu 21 4 seba baduy 2018 ,0,0,0,0,0,0,0,0,0,0,0,0
 warga badui setelah selesai memperingati tradisi seba di pendopo pemerintah kabupaten lebak akan dilanjutkan kembali be emu dengan gubernur banten wahidin halim hari ini sabtu 21 4 seba baduy 2018,0,0,0,0,0,0,0,0,0,0,0,0
warga badui setelah selesai memperingati tradisi seba di pendopo pemerintah kabupaten lebak akan dilanjutkan kembali be emu dengan gubernur banten wahidin halim hari ini sabtu 21 4 seba baduy 2018,0,0,0,0,0,0,0,0,0,0,0,0
 warga badui setelah selesai memperingati tradisi seba di pendopo pemerintah kabupaten lebak akan dilanjutkan kembali be emu dengan gubernur banten wahidin halim hari ini sabtu 21 4 seba baduy 2018,0,0,0,0,0,0,0,0,0,0,0,0
warga badui setelah selesai memperingati tradisi seba di pendopo pemerintah kabupaten lebak akan dilanjutkan kembali be emu dengan gubernur banten wahidin halim hari ini sabtu 21 4 seba baduy 2018 ,0,0,0,0,0,0,0,0,0,0,0,0
warga badui setelah selesai memperingati tradisi seba di pendopo pemerintah kabupaten lebak akan dilanjutkan kembali be emu dengan gubernur banten wahidin halim hari ini sabtu 21 4 seba baduy 2018 ,0,0,0,0,0,0,0,0,0,0,0,0
warga badui setelah selesai memperingati tradisi seba di pendopo pemerintah kabupaten lebak akan dilanjutkan kembali be emu dengan gubernur banten wahidin halim hari ini sabtu 21 4 seba baduy 2018,0,0,0,0,0,0,0,0,0,0,0,0
menolak berita hoaks dan sukseskan pilihan kepala daerah damai di wilayah kota kediri ,0,0,0,0,0,0,0,0,0,0,0,0
badan eksekutif mahasiswa ri tegas akan hentikan pencalonan jokowi di pemilihan presiden 2019,0,0,0,0,0,0,0,0,0,0,0,0
 np flashback dan kamu bisa membuat masker rambutmu bahannya pun termasuk mudah di dapat kamu tinggal memilih entah itu masker alpukat telur santan buah buahan atau lidah buaya dan dan serasi ,0,0,0,0,0,0,0,0,0,0,0,0
 ngentot di atas dan ,0,1,0,0,0,0,0,0,0,0,0,0
sore guys warga badui setelah selesai memperingati tradisi seba di pendopo pemerintah kabupaten lebak akan dilanjutkan kembali be emu dengan gubernur banten wahidin halim hari ini sabtu 21 4 seba baduy 2018,0,0,0,0,0,0,0,0,0,0,0,0
tugas umat islam indonesia masih berat tegakkan hukum atau lengserkan jokowi ,1,0,1,0,0,0,0,0,1,0,0,1
bts mengungguli presiden korea selatan di polling 100 pembaca majalah time,0,0,0,0,0,0,0,0,0,0,0,0
4 apakah pernah mengalami kendala dalam mengatur waktu aku chat,0,0,0,0,0,0,0,0,0,0,0,0
bawang putih dapat meracuni anjing dan kucing ,0,0,0,0,0,0,0,0,0,0,0,0
jawa timur anti hoaks dan mendukung pilihan kepala daerah damai,0,0,0,0,0,0,0,0,0,0,0,0
beginilah gencarnya kampanye jelang pilihan kepala daerah net jawa tengah ,0,0,0,0,0,0,0,0,0,0,0,0
 dan warga badui setelah selesai memperingati tradisi seba di pendopo pemerintah kabupaten lebak akan dilanjutkan kembali be emu dengan gubernur banten wahidin halim hari ini sabtu 21 4 seba baduy 2018,0,0,0,0,0,0,0,0,0,0,0,0
 baru akan dan belum kalaupun jadi itu dibantu 4 bank asing jadi ,0,0,0,0,0,0,0,0,0,0,0,0
 mungkin dengan tes dna bisa ketahuan ini keturunan di tii partai komunis indonesia pemerintahan revolusioner republik indonesia partai keadilan sejahtera dan lain lain ,0,0,0,0,0,0,0,0,0,0,0,0
4 hal ketiga yang ingin dibahas presiden dalam ratas kali ini yakni sisi promosi untuk asian games 2018 baik di media media lokal maupun di media media internasional ,0,0,0,0,0,0,0,0,0,0,0,0
 yang penting jangan orang cina di indonesia ,1,0,1,0,0,1,0,0,0,1,0,0
 berita islam rizal ramli pasca gubernur baru daerah khusus ibukota jaka a lebih sejuk dan tenang,0,0,0,0,0,0,0,0,0,0,0,0
 berita islam rizal ramli pasca gubernur baru daerah khusus ibukota jaka a lebih sejuk dan tenang,0,0,0,0,0,0,0,0,0,0,0,0
nurul arifin tak goyah hadapi survei bandung cantik bandung harmonis bandung memilih nuruli calon wali kota bandung calon wali kota bandung 2018,0,0,0,0,0,0,0,0,0,0,0,0
al alquran dan sunah merintahkan perangi kafir berakibat memecah belah bangsa,1,0,0,1,1,0,0,0,0,0,1,0
 madinah itu sebuah negara yang dipimpin rasulullah dan dilanjutkan khulafaur rasyidin buktinya rasul mengirimkan surat ke berbagai negara melakukan perjanjian dengan negara lain mengatur ekonomi masyarakat berjihad melawa,0,0,0,0,0,0,0,0,0,0,0,0
setelah kasus partai komunis indonesia di lebih ramai ramai antek komunis membuat opini dan pernyataan mengaburkan kebangkitan partai komunis indonesia,1,0,0,1,0,1,0,0,0,0,1,0
pemerintahan gus ipul dan puti ke depan akan memperkuat program nawacita presiden jokowi di jawa timur program keluarga harapan super gus ipul puti,0,0,0,0,0,0,0,0,0,0,0,0
 aku bom surat berharga syariah negara ,0,0,0,0,0,0,0,0,0,0,0,0
lalu kepung yayasan lembaga bantuan hukum indonesia bubarkan hati ikatan alumni universitas indonesia oi dan seterusnya ,1,0,0,1,1,0,0,0,0,0,0,1
gubernur tantangan forum koordinasi pimpinan daerah ke depan semakin berat perlu kompakan,0,0,0,0,0,0,0,0,0,0,0,0
 laporkan juga alisa wahid yang menyamakan teroris buddha myanmar dengan front pembela islam,1,0,1,0,0,0,0,0,1,1,0,0
 ternyata masih dan banyak anjing ,0,1,0,0,0,0,0,0,0,0,0,0
 kenapa tidak ada kristen nusantara atau katolik nusantara ,0,0,0,0,0,0,0,0,0,0,0,0
bandara udara internasional ke ajati dibangun oleh gubernur ahmad heryawan tanpa gunakan anggaran pendapatan dan belanja negara pemerintah pusat insya allah siap beroperasi bulan depan ,0,0,0,0,0,0,0,0,0,0,0,0
jika ada sesuatu yang menimpa seorang mukmin pada tubuhnya sehingga membuatnya sakit maka allah akan menghapuskan dosa dosa,0,0,0,0,0,0,0,0,0,0,0,0
tjahjo mengatakan saat ini pemerintah masih memberikan waktu bagi fraksi yang ada di dewan perwakilan rakyat untuk melakukan lobi ,0,0,0,0,0,0,0,0,0,0,0,0
 sama gue dulu katolik tetapi berasa sama negeri jumlah katolik kristen buddha hindu dan islam hampir merata haha ,0,0,0,0,0,0,0,0,0,0,0,0
 sama gue dulu katolik tetapi berasa sama negeri jumlah katolik kristen buddha hindu dan islam hampir merata haha ,0,0,0,0,0,0,0,0,0,0,0,0
 naik pepaya sambil makan buaya ,0,0,0,0,0,0,0,0,0,0,0,0
pak ai aceh target 50 kursi parlemen hingga memenangkan pilihan kepala daerah 2018 ,0,0,0,0,0,0,0,0,0,0,0,0
 reog ponorogo di acara badan karantina ikan amp pengendalian mutu badan karantina ikan pengendalian mutu dan keamanan hasil perikanan kkp indahnya seni budaya nusantara karya amp karsa tradisi bangsa mesti dirawat mewujudkan kebudayaan yang berkepribadian bulan bakti kipm 2018 ,0,0,0,0,0,0,0,0,0,0,0,0
program 18 melindungi sepenuhnya seluruh produk warisan budaya ekspresi budaya tradisional dan hak cipta para seniman asyik menang asyik menang,0,0,0,0,0,0,0,0,0,0,0,0
warga badui setelah selesai memperingati tradisi seba di pendopo pemerintah kabupaten lebak akan dilanjutkan kembali be emu dengan gubernur banten wahidin halim hari ini sabtu 21 4 seba baduy 2018 im,0,0,0,0,0,0,0,0,0,0,0,0
 tidak asing dengan corak kayu coklat nya haha ,0,0,0,0,0,0,0,0,0,0,0,0
 saya melihat terutama di sisi promosi untuk asian games ini baik di media lokal maupun media media internasional yang belum ada pergerakannya kata presiden saat memimpin rapat terbatas membahas persiapan asian games di istana bogor rabu 18 4 ,0,0,0,0,0,0,0,0,0,0,0,0
 edan kepala kepolisian republik indonesia isu rohingya digoreng untuk menyerang pemerintahan jokowi ,1,0,1,0,0,0,0,0,1,1,0,0
minoritas muslim rohingya sekian lama dizalimi,1,0,0,1,1,1,0,0,0,0,1,0
 pancasila itu islami bagi kaum muslimin pancasila itu kristiani bagi pemeluk kristen pancasila itu hinduisme bagi pemeluk hindu pancasila itu buddhaisme bagi pemeluk buddha karena pancasila itu sumbernya dari agama ,0,0,0,0,0,0,0,0,0,0,0,0
tanpa budaya yang bermoral manusia tidak akan selamat ,0,0,0,0,0,0,0,0,0,0,0,0
 bersama mengajukan arsip presiden pe sama ri soekarno sebagai nominasi memori of the world ke kumparan news,0,0,0,0,0,0,0,0,0,0,0,0
 pengungsi asing bukan pengungsi asing dodol ,1,1,1,0,0,0,0,0,1,1,0,0
saat ini tren konsumsi video terus be umbuh dan memerlukan lebih banyak data,0,0,0,0,0,0,0,0,0,0,0,0
 memang bangkai ,1,1,1,0,0,0,0,0,1,1,0,0
tujuan dari proses kekuasaan adalah keamanan kesejahteraan dan keadilan bagi rakyat politician academy positif lugas dan mencerahkan,0,0,0,0,0,0,0,0,0,0,0,0
 bahkan anak dan istri nya pun tidak dapat di tolong karena telah melupakan tuhan dan menuhankan saint dan teknologi begitu pun sekarang yang terjadi di sebagian bangsa e,0,0,0,0,0,0,0,0,0,0,0,0
 air mata buaya ,0,0,0,0,0,0,0,0,0,0,0,0
perbedaan tidak menghalangi kami untuk be sayang read dari kiri agama katolik islam buddha vscocam,0,0,0,0,0,0,0,0,0,0,0,0
7 terakhir adakah tips untuk para pembaru tentang time manajemen yang efektif sebagai mahasiswa aku chat,0,0,0,0,0,0,0,0,0,0,0,0
semoga konferensi tingkat tinggi yang diprakarsai pemerintah bisa menjadi acuan dalam pemecahan masalah terkait nilai nilai islam muslim pro konferensi tingkat tinggi ulama 2018 konferensi tingkat tinggi islam wasatiyyah indonesia bisa indonesiabe oleransi ,0,0,0,0,0,0,0,0,0,0,0,0
 topeng monyet ke ramayana dan nya dan nya dan nya dan nya ,0,0,0,0,0,0,0,0,0,0,0,0
 rezim ini bubar kandangkan semua ganti komisi pemberantasan korupsi pro rezim ,0,0,0,0,0,0,0,0,0,0,0,0
ajak desak pemerintah keluarkan aturan islam dilarang di indonesia dapat salam pak dari ,1,0,0,1,1,0,0,0,0,0,0,1
semua agama itu baik saya tidak percaya kalau seseorang itu harus memeluk agama a agar bisa masuk surga mau islam kristen hindu buddha semua mengajarkan kasih dan kebaikan agama ada karena tuhan mau kita punya hidup yang lurus dan baik masuk surga,0,0,0,0,0,0,0,0,0,0,0,0
semua agama itu baik saya tidak percaya kalau seseorang itu harus memeluk agama a agar bisa masuk surga mau islam kristen hindu buddha semua mengajarkan kasih dan kebaikan agama ada karena tuhan mau kita punya hidup yang lurus dan baik masuk surga,0,0,0,0,0,0,0,0,0,0,0,0
gubernur jawa barat resmikan tiga monumen di kawasan ciletuh pelabuhan ratu,0,0,0,0,0,0,0,0,0,0,0,0
sore guys dengan sentuhan jokowi indonesia membangun riau proyek jalan tol pekanbaru dumai salah 1 ruas trans sumatra jalan tol sepanjang 131 km tersebut bakal rampung di tahun 2019 yuk kita lihat apa saja manfaat dan pandangan dari segi ekonomi dari protein energy malnutrition,0,0,0,0,0,0,0,0,0,0,0,0
jom mampus ,1,1,1,0,0,0,0,0,1,1,0,0
 mungkin begini belum lahir saat rezim politik suha o menguasai tentara nasional indonesia dan menunggangi ,0,0,0,0,0,0,0,0,0,0,0,0
gubernur ahmad heryawan mengukir sejarah bandara super megah ke ajati dibangun dengan biaya mandiri tanpa menggunakan anggaran pendapatan dan belanja negara murni dikelola oleh pemerintah provinsi jawa barat ini sejarah baru infrastruktur bagi indonesia ,0,0,0,0,0,0,0,0,0,0,0,0
 di dalam katolik ada istilah inkulturasi iman katolik diungkapkan atau ditampakkan dalam budaya setempat ,0,0,0,0,0,0,0,0,0,0,0,0
kesatuan dalam gereja katolik bersifat dinamis selaras dalam perbedaan dan mengikuti situasi kondisi dan perkembangan zaman salah satu manifestasinya adalah dispensasi untuk kawin campur pasangan katolik dan non katolik ,0,0,0,0,0,0,0,0,0,0,0,0
 tidak mengandung alkohol aman untuk anak amp untuk bayi pun aloclair plus ini tetap bisa digunakan finger off kemasannya tidak bersentuhan langsung dengan luka terbuat dari lidah buaya amp ekstrak kayu manis yang membuat rasa menjadi enak nyaman tid,0,0,0,0,0,0,0,0,0,0,0,0
menakutkan pembicaraan mengenai calon presiden ri hanya seputar bagaimana cara menang pemilihan presiden bukan mengenai siapa yang memiliki program pembangunan terbaik pemilihan presiden 2019,0,0,0,0,0,0,0,0,0,0,0,0
 2018 international monetary fund pe ahankan perkiraan pe umbuhan ekonomi global 3 9 international mau,0,0,0,0,0,0,0,0,0,0,0,0
terima kasih ya allah engkau telah tunjukkan kebesaranmu engkau telah membukakan mata hatiku yang buta karena cinta terima kasih tuhan engkau masih menolongku ,0,0,0,0,0,0,0,0,0,0,0,0
bila nak kawin nih kena simpan duit ilmu agama kena cukup semua benda kena cukup lah senang cerita,0,0,0,0,0,0,0,0,0,0,0,0
komisi pemberantasan korupsi tak boleh lemah mending dewan perwakilan rakyat yang bubar ,1,0,0,1,0,0,0,0,1,0,1,0
 undang undang md3 bagaimana itu ,0,0,0,0,0,0,0,0,0,0,0,0
 pak menga ikan ijab kabul sebagai perjanjian nikah langkah baik dalam rangka buang islam,1,0,0,1,1,0,0,0,0,0,0,1
jual stiker awas arus listrik tegangan tinggi ,0,0,0,0,0,0,0,0,0,0,0,0
 tolong bawa ke rumah sakit jiwa secepatnya,1,0,1,0,0,0,0,0,1,1,0,0
pendapat profesor pemenang debat pilihan kepala daerah jawa timur,0,0,0,0,0,0,0,0,0,0,0,0
warga badui setelah selesai memperingati tradisi seba di pendopo pemerintah kabupaten lebak akan dilanjutkan kembali be emu dengan gubernur banten wahidin halim hari ini sabtu 21 4 seba baduy 2018 dw,0,0,0,0,0,0,0,0,0,0,0,0
 memang kampungan banget ,1,1,1,0,0,0,0,0,1,1,0,0
 memek itu nikmat ku suka ,0,1,0,0,0,0,0,0,0,0,0,0
pledis buka audisi di cina ,0,0,0,0,0,0,0,0,0,0,0,0
4 apa saja tulisan yang telah dibuat aku chat,0,0,0,0,0,0,0,0,0,0,0,0
kita bisu kata bungkam dimana matamu aku perlahan padam bersama debarmu yang kian samar senja menghitam bersorak merayakan kepergian mencatat kembali sebuah kehilangan dan dan ,0,0,0,0,0,0,0,0,0,0,0,0
ritual buka bumi budaya yang dilakukan oleh masyarakat politeknik manufaktur negeri bandung untuk menyepakati langkah langkah dan menentukan jadwal turun sawah musim tanam gaduh tahun 2018 se a mensyukuri akan hasil panen yang di peroleh kawal petani ,0,0,0,0,0,0,0,0,0,0,0,0
pilihan kepala daerah bandung nurul arifin janjikan insentif untuk marbut dan guru pendidikan anak usia dini bandung cantik bandung harmonis bandung memilih nuruli calon wali kota bandung calon wali kota bandung 2018,0,0,0,0,0,0,0,0,0,0,0,0
 membangun industri dan iklim perikanan di indonesia jauh lebih penting dan sulit dibanding meledakkan kapal kapal asing ,0,0,0,0,0,0,0,0,0,0,0,0
koster ingin kembalikan kejayaan klungkung sebagai pusat seni budaya bali,0,0,0,0,0,0,0,0,0,0,0,0
ppp jangan buru buru tolak wacana pilihan kepala daerah lewat dewan perwakilan rakyat daerah,0,0,0,0,0,0,0,0,0,0,0,0
aku akan kembali ke regim diet ala ala komunis aku ,0,0,0,0,0,0,0,0,0,0,0,0
ulama adalah mereka yang memiliki kedalaman ilmu yang melihat dan menyikapi masyarakatnya dengan kasih sayang mari muliakan mereka ,0,0,0,0,0,0,0,0,0,0,0,0
mampus diare ,0,1,0,0,0,0,0,0,0,0,0,0
mari ingatkan sekaligus dukung pemerintah untuk tetap kelola ekonomi amp kesejahteraan rakyat meskipun kita berada di tahun politik susilo bambang yudhoyono ,0,0,0,0,0,0,0,0,0,0,0,0
 ikut pengalaman yang tak seberapa kerja pak time dengan cina lebih best dari kerja dengan melayu haha ,0,0,0,0,0,0,0,0,0,0,0,0
ini baru anak muda indonesia ,0,0,0,0,0,0,0,0,0,0,0,0
presiden as be emu dengan pm jepang di florida as untuk membicarakan soal denuklirisasi korea utara cnn indonesian news room,0,0,0,0,0,0,0,0,0,0,0,0
 lebih bagus kalau dewan perwakilan rakyat yang di bubarkan,1,0,0,1,0,0,0,0,1,0,1,0
dan gus dur bersikap sebagai seorang pemimpin muslim yang ramah idealis namun mencintai perbedaan pluralisme keren,0,0,0,0,0,0,0,0,0,0,0,0
bagusnya partai komunis indonesia partai komunis indonesia macam dan dibubarkan saja dan dijadikan organisasi terlarang ,1,0,0,1,0,1,0,0,0,0,1,0
 pakai cara partai komunis indonesia memberangus lawan politik nya ,0,0,0,0,0,0,0,0,0,0,0,0
wah lebaran padahal belum ya kang ,0,0,0,0,0,0,0,0,0,0,0,0
 bubarkan dewan perwakilan rakyat sarang kemiskinan rakyat,1,0,0,1,0,0,0,0,1,0,0,1
warga dusun mambang panasan lestarikan budaya sedekah bumi bagian 2 ,0,0,0,0,0,0,0,0,0,0,0,0
pemerintah kota cirebon optimis mampu merekam 19 000 calon pemilih pemula yang masih berstatus pelajar sama,0,0,0,0,0,0,0,0,0,0,0,0
 hiruk pikuk pilihan kepala daerah dan pemilihan presiden sejatinya adalah perseteruan antara antek asing barat asing asing dan pejuang negara kesatuan republik indonesia ,0,0,0,0,0,0,0,0,0,0,0,0
 indonesia bukan milik islam masih ada kristen buddha dan hindu camkan ,0,0,0,0,0,0,0,0,0,0,0,0
serunya pesta budaya derau di kutai kakak anegara ,0,0,0,0,0,0,0,0,0,0,0,0
presiden disebutkan akan meninjau acara yang diadakan oleh direktorat jenderal bea cukai be emak silaturahmi presiden ri dengan pengguna fasilitas kepabeanan dan peluncuran perizinan online pada selasa 27 maret 2018 ,0,0,0,0,0,0,0,0,0,0,0,0
 bubarkan dewan perwakilan rakyat dewan perwakilan rakyat daerah bentuk panitia khusus hak angket dari rakyat untuk bekukan dewan perwakilan rakyat dewan perwakilan rakyat daerah,1,0,0,1,0,0,0,0,1,0,0,1
a tenang selalu mempersiapkan diri dan tidak suka telat,0,0,0,0,0,0,0,0,0,0,0,0
bandara internasional ke ajati saya harapkan bisa diuji coba pada bulan mei 2018 bandara ini bisa menampung sekitar 5 6 juta penumpang tahap i terbesar kedua setelah soekarno hatta semoga bandara ini secara konkret bisa menggerakkan perekonomian di sel,0,0,0,0,0,0,0,0,0,0,0,0
2 terima kasih bapak presiden yang telah memberi ide ide amp arahan penting kepada kami dalam proses pembangunan bandara ke ajati sehingga menjadi bandara pe sama di indonesia yang merupakan hasil kerja bersama antara pemerintah pusat pemerintah daerah badan usaha milik negara amp sw,0,0,0,0,0,0,0,0,0,0,0,0
retweeted sidogiri media dan bagaimana tidak arab adalah latar belakang islam sejak kelahiran hingga perkembangannya beda jauh dengan agama nasrani dan yahudi meskipun kedua agama itu lahir di timur tengah namun perkembangannya terja,0,0,0,0,0,0,0,0,0,0,0,0
