processed_text,HS,Abusive,HS_Individual,HS_Group,HS_Religion,HS_Race,HS_Physical,HS_Gender,HS_Other,HS_Weak,HS_Moderate,HS_Strong
cina lagi cina lagi sebaiknya di usir saja ya merusak sih kerjaannya,1,0,0,1,0,1,0,0,0,0,0,1
tasik chini yang diiktiraf rizab biosfera oleh unesco sesungguhnya kayak dengan khazanah alam semula jadi flora amp fauna namun sejak 2009 persekitaran kawasan itu semakin terpengaruh akibat kegiatan pembalakan pelombongan amp perladangan yang tidak ter,0,0,0,0,0,0,0,0,0,0,0,0
pekerja lokal kalau ada masalah selalu cari yang patut disalahkan pekerja asing tempat saya beda ada masalah bicarakan cari solusi ,0,0,0,0,0,0,0,0,0,0,0,0
 wah kesempatan nih langsung deh dimanfaatkan buat pencitraaan oleh rezim ,0,0,0,0,0,0,0,0,0,0,0,0
 titit berjemaah dum camping ,0,1,0,0,0,0,0,0,0,0,0,0
setuju bubarkan komisi pemberantasan korupsi angkat jadi ketua badan pemberantasan korupsi berikutnya ,1,0,0,1,0,0,0,0,1,0,0,1
 lo kenapa kalau saya kristen saya pasti bakal menyimpan mp3nya di handphone ,0,0,0,0,0,0,0,0,0,0,0,0
 terus maksudnya indonesia yang mayoritas muslim suruh pilih pemimpin cina non muslim begitu ya jangan dong,1,0,1,0,1,1,0,0,0,1,0,0
 iya benar ini teman saya pemuka hindu di wilayah malang beliau pernah cerita hindu di india tidak sama dengan hindu di bali sedangkan hindu di jawa pun berbeda dengan hindu di bali karena cenderung mengadopsi adat budaya jawa kejawen,0,0,0,0,0,0,0,0,0,0,0,0
bila baca cerita cousin aku nih aku jadi malu dia buat cerita pasal agama aku sibuk buat cerita pasal makan kedai hipster ini adalah thread,0,0,0,0,0,0,0,0,0,0,0,0
warga badui setelah selesai memperingati tradisi seba di pendopo pemerintah kabupaten lebak akan dilanjutkan kembali be emu dengan gubernur banten wahidin halim hari ini sabtu 21 4 seba baduy 2018 direct message,0,0,0,0,0,0,0,0,0,0,0,0
 1 mata gue yang sipit kayak orang korea ini wkwk n2 keluarga n3 my suara n4 tinggi badan gue karena banyak yang bilang ideal v n5 aku adalah army dan i love my everything my life my bts x9,0,0,0,0,0,0,0,0,0,0,0,0
siapa pasangan calon gubernur dan wakil gubernur yang unggul dalam inews debat kandidat jawa tengah malam ini atau ,0,0,0,0,0,0,0,0,0,0,0,0
 apa yang km lakukan itu tidaklah patut km lakukan karena itu urusan pribadi masing masing jika ada masalah di sel ,0,0,0,0,0,0,0,0,0,0,0,0
ternyata komunis juga bisa menangis ,0,0,0,0,0,0,0,0,0,0,0,0
budaya kafir bersungguh kalau hal hal islam tidak diindahkan ,0,0,0,0,0,0,0,0,0,0,0,0
gus ipul ingin jadikan madura pusat ekonomi syariat jawa timur,0,0,0,0,0,0,0,0,0,0,0,0
 pak saya harap kementerian agama mau menggelar diskusi terbuka beradab saya siap memberi penjelasan,0,0,0,0,0,0,0,0,0,0,0,0
 lawan kita adalah yahudi zionis semua harus fokus ke sana itu lihat betapa rukunnya sesama orang yahudi meski beda aliran kalau kita sesama muslim tidak rukun bagaimana mau menang lawan yahudi ,1,0,0,1,1,0,0,0,0,0,1,0
 alhamdulillah bang hasil polling google kemarin,0,0,0,0,0,0,0,0,0,0,0,0
 mata gue tidak sipit ,0,0,0,0,0,0,0,0,0,0,0,0
 bani kampret hewan yang kotor sedangkan kecebong hewan yang habitatnya di sawah ,1,1,0,1,0,0,0,0,1,0,1,0
dan sekarang gue percaya buaya darat itu memang ada ,0,0,0,0,0,0,0,0,0,0,0,0
terkelu enggaklah ada fact yang dia sendiri tak tau berjangkit sampai ke yahudi sejarah nabi amp agama semoga dapat hidayah ,0,0,0,0,0,0,0,0,0,0,0,0
bubarkan saja panitia khusus komisi pemberantasan korupsi kalau perlu buat polling rakyat di luar parlemen biar yang menentukan bubarkan panitia khusus komisi pemberantasan korupsi ,1,0,0,1,0,0,0,0,1,0,0,1
ayo muslim indonesia jangan hanya berani penggal kafir beranilah diskusi baik baik mana majelis ulama indonesia nu muhammadiyah ikatan cendekiawan muslim indonesia ,1,0,0,1,1,0,0,0,0,0,1,0
 fnxqi fenomena nation branding korea selatan melalui citra girl band terhadap budaya konsumerisme abg menengah mikro kecil ke bawah ali ,0,0,0,0,0,0,0,0,0,0,0,0
luar biasa untuk mengawal pendistribusian pupuk tepat sasaran bagi para petani untuk musim tanam ke 2 dilaksanakan oleh badan usaha milik desa bina manfaat tlogorejo kepohbaru bojonegoro rencanakan dirikan kembangkan badan usaha milik desa menopang ekonomi rakyat ,0,0,0,0,0,0,0,0,0,0,0,0
kalau hanya sekadar kata maaf dimana lagi letak sama abat amp wibawa negara kesatuan republik indonesia sebagai negara yang berdaulat negara kesatuan republik indonesia tanah pribumi selamatkan negara kesatuan republik indonesia 20,0,0,0,0,0,0,0,0,0,0,0,0
astaga coba segera kasih foto sebelum setelahnya kalau ada min ,0,0,0,0,0,0,0,0,0,0,0,0
 harus begitu kita itu harus strict deh pokoknya kalau menyangkut kebijakan politik dalam negeri amp luar negeri yang menyangkut sama pihak asing kita jangan haram meniru negara komunis dalam melindungi keut,0,0,0,0,0,0,0,0,0,0,0,0
kemarin kayaknya ada yang kutipan twit tentang kristen mana ya ,0,0,0,0,0,0,0,0,0,0,0,0
 di sana ada cowok asing kan coba ajak kenalan bikin asyik saja nanti keluar bareng buat beli keperluan program kerja mengobrol di posko sampai malam betah sudah dan kalau tidak begitu bawa persediaan film biar tidak kurang kerjaan wkwk ,0,0,0,0,0,0,0,0,0,0,0,0
 yang biasa levai adalah kompas dan media indonesia kompas melalui aiman show dengan lebai mewawancarai tetangga teroris sekolah rumah dan lain lain dan nini kompas media kristen apa di gereja hobinya begitu ,0,0,0,0,0,0,0,0,0,0,0,0
 1 mengandung ekstrak lidah buaya n2 tidak mengandung alkohol n3 memiliki rasa manis n4 tidak bereaksi terhadap obat lain n5 aman digunakan untuk anak anak amp bayi n6 kemasan finger off yang tak bersentuhan dengan luka n7 tidak perih pada l,0,0,0,0,0,0,0,0,0,0,0,0
 memang sengaja melihat hasil pilihan kepala daerah daerah khusus ibukota yang memuaskan bagi mereka ,0,0,0,0,0,0,0,0,0,0,0,0
 iya kalah lawan bani taplak wkwk ,1,1,0,1,0,0,0,0,1,0,1,0
bukan fiktif tapi fiksi,0,0,0,0,0,0,0,0,0,0,0,0
 ih asli lah teman teman gue adalah banyak yang begitu sudah tak asing lagi malah ,0,0,0,0,0,0,0,0,0,0,0,0
budak budak twitter zaman kini memang wajib belajar pendidikan alquran sunnah gejala mempersendakan agama,0,0,0,0,0,0,0,0,0,0,0,0
 eh tapi aku tak tau nasabah itu menukar apa menabung apa bagaimana pokoknya mengurus mata uang asing ,0,0,0,0,0,0,0,0,0,0,0,0
cinta memang tidak buta cinta yaitu suatu hal yang murni luhur se a dibutuhkan yang buta yaitu seandainya cinta itu menguasai dirimu tanpa satu pe imbangan ,0,0,0,0,0,0,0,0,0,0,0,0
 lah saya ateis tidak ada kitabnya p dan dan ,0,0,0,0,0,0,0,0,0,0,0,0
nampaknya sudah satu paket penyokong cina babi pasti juga sokong lgbt,1,1,0,1,0,1,0,1,0,0,1,0
8 pada masa itu setidaknya ada 45 persen dari 4 7 juta warga bosnia memeluk agama islam sisanya adalah kristen o odoks katolik protestan dan lainnya ,0,0,0,0,0,0,0,0,0,0,0,0
 tes tes dan disini gue mau cerita 2 cerita sekaligus haha gue mau cerita dokter forensik yang bisa berhubungan langsung sama makhluk gaib ,0,0,0,0,0,0,0,0,0,0,0,0
 neo komunis kamu antek cina yang sebentar lagi musnah dari negeri ini ,1,0,1,0,0,1,0,0,0,1,0,0
ada yang utamakan budaya bangsa kayak trah soekarno ada yang utamakan agama kayak islam politik keduanya salah yang benar itu utamakan kaum pekerja dengan mengutamakan kaum pekerja maka jasa keuangan akan merasa aman jasa keuangan merasa aman maka industri,0,0,0,0,0,0,0,0,0,0,0,0
apakah sebuah kebetulan kristen suriah dan arab islam memakai sebutan alah allah yang sama kita punya bukti literatur pada suriah tetapi tidak pada arab islam ,0,0,0,0,0,0,0,0,0,0,0,0
save rohingya fuck kafir teroris buddha,1,1,0,1,1,0,0,0,0,0,1,0
hikayat misa melayu hikayat yang menceritakan salah silah kesultanan perak se a budaya di negeri perak hikayat di karang oleh pengarang raja chulan ibn raja hamid,0,0,0,0,0,0,0,0,0,0,0,0
 kalau saat itu nu tidak bergabung dengan nasakom negara ini akan dikuasai komunis 100 dan makanya mereka gagal menguasai negara kesatuan republik indonesia karena ada lawan yang terus menentang yaitu nahdlatul ulama ulama dan paham daki dajjal ,0,0,0,0,0,0,0,0,0,0,0,0
islam ihsan iman tiga pondasi yang harus selalu kamu selalu kamu revisi dan revisi keduanya tak akan selalu stabil karena ada nafsu dan sekutunya yang selalu mengusik,0,0,0,0,0,0,0,0,0,0,0,0
revisi hukum pidana dengan memasukkan klausul mengenai pekerja seks komersial sukarela sudah sangat dibutuhkan indonesia yang gencar mempromosikan diri sebagai surga wisata internasional senyatanya perlu memagari ,0,0,0,0,0,0,0,0,0,0,0,0
mari kita sebar kebaikan juga untuk jabar dengan memilih pasangan asyik no 3 dan pasangan sudirman ida untuk jawa tengah allahu akbar ,0,0,0,0,0,0,0,0,0,0,0,0
 itu yang saya katakan sejak dulu lagi kita tak takut dengan cina atau pak i dap tapi kita bimbang pemahaman yang dibawa oleh mereka ,0,0,0,0,0,0,0,0,0,0,0,0
 panas perut sudah nih kak maya sebentar jamban baru durian saja haha ,0,0,0,0,0,0,0,0,0,0,0,0
dukungan pilihan kepala daerah damai dari siswa siswi man 3 medan dan anti berita hoaks,0,0,0,0,0,0,0,0,0,0,0,0
 dan saya yakin anis menang di gurun pasir banyak onta nya ,1,1,1,0,0,0,0,0,1,1,0,0
sahabat sahabat warga jawa tengah mari terus tolak ujaran kebencian ikuti semangat kebersamaan mas amp dengan mas amp mbak kekompakan dua pasangan calon gubernur jawa tengah saat rayakan ulang tahun sudirman said,0,0,0,0,0,0,0,0,0,0,0,0
tidak melanggar undang undang apapun,0,0,0,0,0,0,0,0,0,0,0,0
 salah satu cara menghancurkan strategi musuhnya adalah dengan isu sara,1,0,1,0,0,0,0,0,1,1,0,0
 apa iya islam itu tidak boleh di lokalisasi lah kristen saja mas ada nusantaranya mas lihat saja di gereja di bandung ada yang pakai gamelan dan ada yang khotbah pakai bahas sunda jawa ada huria kristen batak protestan juga kurang nusantara apa ,0,0,0,0,0,0,0,0,0,0,0,0
potensi lokasi harus kita pelajari untuk daerah atas menoreh sabrang kidul purwosari girimulyo sangat cocok untuk be anam salak pendongkrak ekonomi sehari hari,0,0,0,0,0,0,0,0,0,0,0,0
 pak penyesatan yang dilakukan pengurus besar nahdlatul ulama tampaknya demi kebaikan padahal menyembunyikan jahat islam,1,1,0,1,1,0,0,0,0,0,1,0
dinda pe anyaannya apa kalau sosial adalah gue belum ,0,1,0,0,0,0,0,0,0,0,0,0
resmi ditutup gubernur jabar apresiasi musabaqah tilawatil quran ke xxxv tingkat jabar di sukabumi info desaku ,0,0,0,0,0,0,0,0,0,0,0,0
 semiotika budaya populer kebudayaan barat estetika selalu bahas era yunani dan romawi kuno ya allah pusing,0,0,0,0,0,0,0,0,0,0,0,0
ini menurut gue ya tidak usahlah kita ribet bikin nuklir katanya kecoa bisa be ahan dari nuklir bom atom sedangkan di sini banyak dijual kapur bagus kecoa bisa mati dan kapur bagus begitu begitu begitu begitu nuklir ,0,0,0,0,0,0,0,0,0,0,0,0
bantu bagikan bro ,0,0,0,0,0,0,0,0,0,0,0,0
 akulturasi suatu agama di suatu daerah adalah keniscayaan sepe i juga kristen di jawa yang berjalan berbarengan dengan tradisi jawa tapi kenapa tidak ada istilah kristen nusantara kristen adalah kristen islam adalah islam penyebutan isl,0,0,0,0,0,0,0,0,0,0,0,0
percayalah bahwa setiap manusia di dunia ini diuji oleh allah subhanahu wa taala dan dan yang kayak diuji dengan sifat tamak dan yang miskin diuji dengan kesusahan dan percayalah juga bahwa golongan lgbt diuji dengan lebih hebat ke ranah allah menguji dan,0,0,0,0,0,0,0,0,0,0,0,0
ternyata asimilasi itu masuk pola dominasi jadi ada budaya baru datang dan dia menghilangkan budaya lama nah itu kan masuknya dominasi soalnya dia menghilangkan budaya yang ada rumus asimilasi a b c,0,0,0,0,0,0,0,0,0,0,0,0
saya yakin mereka komunis zionis yahudi,1,0,0,1,1,1,0,0,0,0,1,0
 pintar tapi itu tugas utama pemerintah coba belajar lagi tugas utama dewan perwakilan rakyat ,0,0,0,0,0,0,0,0,0,0,0,0
 puri tri agung adalah tempat ibadah sembah bagi penganut agama buddha kong fu tse dan laotze ,0,0,0,0,0,0,0,0,0,0,0,0
 soalnya agama kami dan iman kami tidak perlu dibela dan tidak ada penistaan agama dosa dan tidak adalah milik sih maha pencipta dunia mengampuni dengan kasih adalah yang terbaik ,0,0,0,0,0,0,0,0,0,0,0,0
 aparat keparat biadaaaaa,1,1,0,1,0,0,0,0,1,0,1,0
 lulus uec lagi ramai lah cina x mengerti cakap melayu ,0,0,0,0,0,0,0,0,0,0,0,0
saya baru tau kalau spider man itu ternyata agama nya katolik sedangkan batman itu kristen monosit ,0,0,0,0,0,0,0,0,0,0,0,0
 yang menentukan adalah sistem metabolisme masing masing orang makan sedikit tapi penyerapannya tinggi jadi gampang gendut sebaliknya yang sistem penyerapannya rendah biar makan banyak tetap kurus ,0,0,0,0,0,0,0,0,0,0,0,0
new post dodi reza ajak ciptakan pilihan kepala daerah bersih di sumatra selatan,0,0,0,0,0,0,0,0,0,0,0,0
final lawan bani taplak akan disaksikan pak menonton tidak nih bareng dan ,0,0,0,0,0,0,0,0,0,0,0,0
 juga jago bakar isu partai komunis indonesia komunis,1,0,1,0,0,1,0,0,0,1,0,0
kalau cuma soal melokalisasi agama nu sudah kalah kreatif dengan kristen protestan di indonesia ada kristen jawa batak dan sebagainya p ,0,0,0,0,0,0,0,0,0,0,0,0
 dalam kristen ada namanya denominasi kelompok yang terakulturasi dengan budaya indonesia ada gereja kristen jawi wetan jawi wetan huria kristen batak protestan batak gpib dan lain lain ini ya sama saja kristen nusantara unik dalam ke bhineka annya ,0,0,0,0,0,0,0,0,0,0,0,0
 dari ribuan sperma yang berebut menetas menjadi kampret adalah sebuah kesalahan alam ,0,1,0,0,0,0,0,0,0,0,0,0
jelaskan terus islam yang sebenarnya satu titik masyarakat akan sadar islam berbahaya tetapi pada satu titik,1,0,0,1,1,0,0,0,0,0,1,0
asing lah nih forever young aku dengar ulang ulang sial dengan musik video sekali ,0,0,0,0,0,0,0,0,0,0,0,0
 tidak mau bisu ,0,0,0,0,0,0,0,0,0,0,0,0
pesan presiden joko widodo saya meyakini negara kita indonesia akan semakin besar dan kuat apabila ulama dan umara beriringan selengkapnya terkait pesan bapak presiden simak video berikut ini jokowi silaturahmi dengan ulama jokowi cinta ulama jokowi saja,0,0,0,0,0,0,0,0,0,0,0,0
 mengobrol ayo sama aku yang cantik dari cina ini wkwk ,0,0,0,0,0,0,0,0,0,0,0,0
 wkwk ditutupi sama taplak meja juga say biar tidak ketahuan ,0,0,0,0,0,0,0,0,0,0,0,0
 waktu nya ngewe ,0,1,0,0,0,0,0,0,0,0,0,0
 kahwin awal tak pe tapi biarlah ada landasan agama jangan jadikan usia sebagai penghalang utama bila sudah sampai masa untuk mereka kahwin kawinkanlah dan jangan tangguhkan tapi kena sama sama bantu kalau orang muda ada problem ,0,0,0,0,0,0,0,0,0,0,0,0
khofifah akan beberkan nawa bakti satya di debat malam ini,0,0,0,0,0,0,0,0,0,0,0,0
 ooo macam itu biasalah kena seimbang ada baik ada nakal ada kucing ada anjing ada abang ada lain lain ada dark side ada bright side tak chill dan tak sosial lah kalai tak ada pelengkap haha k bang selamat maju jaya sudah terjawab persoalan saya terima kasih ,0,0,0,0,0,0,0,0,0,0,0,0
 tol dibangun buat asing asing yang punya duit biar gampang transpo asinya buat jarah sumber alam di daerah daerah thread starter,0,0,0,0,0,0,0,0,0,0,0,0
freepo adalah perusahaan asing pe sama yang mendapat izin usaha tambang di indonesia 1960 pakar geologi freepo memastikan temuan cadangan tembaga dan emas di puncak jayawijaya sepe i yang dilaporkan peneliti belanda ,0,0,0,0,0,0,0,0,0,0,0,0
 dear bapak dan selamat malam kami acungkan jempol untuk bapak se a jajaran kabinet yang terus sibuk kerja kerja dan kerja dengan ,0,0,0,0,0,0,0,0,0,0,0,0
tidak ada jarak antara pak dengan alim ulama yang terjadi adalah ada kelompok politik yang berusaha menciptakan kesan atau citra presiden berjarak dengan ulama fakta insya allah menang melawan fiksi ,0,0,0,0,0,0,0,0,0,0,0,0
 halo bu dokter yang ada persekusi muslim di papua persekusi terhadap ujian akhir semester di bali fh di manado mayoritas modal terhadap minoritas uang di negara kesatuan republik indonesia bukan mayoritas muslim mempersekusi minoritas cina kristen dan lain lain ,0,0,0,0,0,0,0,0,0,0,0,0
 menisbahkan ketidaknetralan kata bahasa hanya kepada proses pemaknaan mengandaikan para pencipta kata hidup di ruang hampa sejarah budaya ,0,0,0,0,0,0,0,0,0,0,0,0
media sosial begitu begitu mengenalkan yang asing dan mengasingkan yang kenal ,0,0,0,0,0,0,0,0,0,0,0,0
itu menteri perdagangan kan cina sudah menumpang cari makan dan hidup di indonesia masih mau cari perkara sama pribumi usir dia dari negara kesatuan republik indonesia ,1,0,1,0,0,1,0,0,0,0,0,1
 sesungguhnya salat yang paling berat dilaksanakan oleh orang orang munafik adalah salat isya dan salat subuh hari bukhari ,0,0,0,0,0,0,0,0,0,0,0,0
 diskriminasi menjatuhkan aku reputasi kini menjadi bisu dan aaaa aaaakuuu ku layu ooo ooo oooo ,0,0,0,0,0,0,0,0,0,0,0,0
1 tidak beriman kepada tuhan dan rasul sepe i golongan ateis n2 beriman kepada tuhan tetapi menolak rasul seperti golongan anti hadis n3 beriman kepada tuhan tetapi menolak sebagian rasul sepe i yahudi menolak kerasulan nabi bisa as dan nasrani menolak,0,0,0,0,0,0,0,0,0,0,0,0
semakin bayak dia menangkap korupsi semakin menunjukkan komisi pemberantasan korupsi gagal bubarkan dan serahkan kepolisian dan kejaksaan,1,0,0,1,0,0,0,0,1,0,0,1
 ekonomi kok makin sulit iya,0,0,0,0,0,0,0,0,0,0,0,0
presiden pada peringatan harlah ke 58 pergerakan mahasiswa islam indonesia di gedung sabuga bandung selasa 17 4 meminta semua calon pemimpin untuk memiliki optimisme tahan uji tahan uji tahan banting amp selalu tawakal berserah diri kepada allah dengan tetap berusaha dan berikut,0,0,0,0,0,0,0,0,0,0,0,0
gebuk komunis partai komunis indonesia selamatkan negara kesatuan republik indonesia jangan kasih kendor jangan sampai pembantaian ulama dan kiai nu terulang,1,0,0,1,0,1,0,0,0,0,0,1
ekspor indonesia naik tajam pada bulan maret 2018 naik 10 24 dibandingkan dengan bulan februari 2018 terjadi surplus perdagangan sebesar 1 09 miliar dolar mudah mudahan ini menjadi pe anda bangkitnya kembali ekonomi indonesia,0,0,0,0,0,0,0,0,0,0,0,0
 gue tidak level sama ngewe online ,0,0,0,0,0,0,0,0,0,0,0,0
 2 hal yang aku suka dari si cepat ekspres yaitu 1 mendapatkan sms notifikasi pemberitahuan no resi sehingga kita bisa melacak paket barang kiriman 2 barang paket kiriman cepat sampai dengan aman tanpa cacat sedikitpun si cepat berkualitas ,0,0,0,0,0,0,0,0,0,0,0,0
berhijab itu sama sekali bukan budaya arab justru sebaliknya budaya arab adalah mengumbar aurat berhijab itu pun bukan budaya ia adalah syariat budaya adalah hasil cipta reka pikiran manusia sedangkan syariat adalah perintah tuhan yang menciptakan,0,0,0,0,0,0,0,0,0,0,0,0
bunyi klik tikus suara ketikan keyboard musik hampir 8 jam non stop mata perih bokong panas lengan ngilu dan jenuh ,0,0,0,0,0,0,0,0,0,0,0,0
mas saya sangat berharap jaka a bisa memperbanyak sekolah sekolah hafiz qur an sepe i di turki,0,0,0,0,0,0,0,0,0,0,0,0
 tai tidak mengajak ,0,1,0,0,0,0,0,0,0,0,0,0
deklarasi pilihan kepala daerah 2018 aman dan anti hoaks pukul jabon,0,0,0,0,0,0,0,0,0,0,0,0
 inus adalah modus para antek kaum liberal syiah dan yahudi untuk menghancurkan islam umumnya dan ahlusunah sunnah pada khususnya ,0,0,0,0,0,0,0,0,0,0,0,0
sesungguhnya cinta tidak buta ia hanya melumpuhkan logika mario teguh ,0,0,0,0,0,0,0,0,0,0,0,0
dalam dua hari terakhir keuskupan surabaya meminta saya untuk ikut mendampingi kaum muda katolik mereka disiapkan jadi kader pemimpin milenial ,0,0,0,0,0,0,0,0,0,0,0,0
allah memberikan dunia kepada manusia yang dia cintai dan yang dia benci tetapi dia tidak memberikan kesadaran ber agama kecuali kepada yang dia cintai maka barang siapa yang diberikan kesadaran ber agama oleh allah bera i ia dicintai oleh nya hari a,0,0,0,0,0,0,0,0,0,0,0,0
dagangan saya ramai bulan april ini ,0,0,0,0,0,0,0,0,0,0,0,0
 mana tau saya kan autis ,0,0,0,0,0,0,0,0,0,0,0,0
8 terakhir adakah tips untuk para pembaru yang ingin menjadi seorang freelance writer aku chat,0,0,0,0,0,0,0,0,0,0,0,0
kaum 1 2 kafir semakin radikal menyerang pusat pe ahanan umat islam kaum 1 2 kafir percaya dengan otak junk food nya yang kapasitasnya zero waspada adu domba kaum 1 2 kafir ,1,1,0,1,1,0,0,0,0,0,1,0
 maribe sayang tapi saya kafir takutnya waktu pemilihan presiden banyak yang unfollow kalau tidak maribe sayang dan mengobrol ,0,0,0,0,0,0,0,0,0,0,0,0
 bubarkan saja dewan perwakilan rakyat nya pasti stop korupsinya,1,0,0,1,0,0,0,0,1,0,0,1
bila hilang budaya malumu lakukanlah apa saja yang kamu kehendaki hari bukhari ,0,0,0,0,0,0,0,0,0,0,0,0
sukseskan pilihan kepala daerah tanpa hoaks galeri dinas komunikasi dan informatika kota metro kota metro news ayo ke dam raman,0,0,0,0,0,0,0,0,0,0,0,0
hati hati berita pilihan kepala daerah yang berbau hoaks madiun madiun today 100thmadiun kotak karismatik madiun tolak cukai ilegal kunjungi juga,0,0,0,0,0,0,0,0,0,0,0,0
 scene edan dan tanggal 18 mau tanggal keramat ,0,1,0,0,0,0,0,0,0,0,0,0
 memang gue sipit apa perasaan belo ,0,0,0,0,0,0,0,0,0,0,0,0
ini bukan soal budaya saya kira tapi etika dalam berpolitik ,0,0,0,0,0,0,0,0,0,0,0,0
 akupun merasa matanya mengecil setelah lama pakai kacamata dan katanya kalau bangun tidur tambah sipit ,0,0,0,0,0,0,0,0,0,0,0,0
 hati hati antek yahudi liberal lgbt syiah dan islam ya islam allah subhanahu wa taala sudah sempurnakan dan ada dalam al alquran dan adakah islam lain yang disebutkan dalam al alquran ,0,0,0,0,0,0,0,0,0,0,0,0
bahaya islam sudah terbukti lihat teroris islam isis dan lain lain di pandang dari sudut mana islam berbahaya ,1,0,0,1,1,0,0,0,0,0,1,0
 tapi perdebatan surat pemberitahuan tahunan ini memang tidak dapat dihindari sejarah gereja pun mencatat perpecahan pe sama dalam gereja terjadi waktu konsili yerusalem karena hal ini apakah tradisi yahudi merupakan bagian dari ajaran kristiani atau tidak ,0,0,0,0,0,0,0,0,0,0,0,0
 ini masih bicara soal pakaian di sampai sama kalau pengalaman di universitas universitas katolik melarang tidak menaungi organisasi kemahasiswaan di luar katolik tidak dapat uang usaha kecil menengah tidak boleh pakai fasilitas kampus untuk kegiatan tidak boleh open recruitment promosi universitas islam,0,0,0,0,0,0,0,0,0,0,0,0
merindukan mu bea i mengajarkan ku untuk menjadi pembunuh ulung dan sebab rasa rindu yang ada harus segera aku bunuh agar tak menjadi bom waktu yang bisa menghancurkan semuanya eaakkk ,0,0,0,0,0,0,0,0,0,0,0,0
closed agency yang membernya belum kenal dekat ada biar saya tidak merasa asing ,0,0,0,0,0,0,0,0,0,0,0,0
 temannya kakak gue pernah dan dan kamu jurusan apa dan aku sastra rusia nih dan pasti kamu komunis ya dan ,0,0,0,0,0,0,0,0,0,0,0,0
adem banget melihatnya allahu akbar ,0,0,0,0,0,0,0,0,0,0,0,0
p p jokowi empu rubah nasib rakyat k sehat infrastruktur khusus papua bangun infrastruktur agar tercipta sentra sentra ekonomi untuk tingkatan ekon rakyat papua mks ke pare pare jalan kereta api bangun jalan tol sama dan l di jakarta secara tidak langsung untuk ubah nasib rakyat,0,0,0,0,0,0,0,0,0,0,0,0
 raja ampat dan papua khususnya bagian barat banyak sekali orang maluku jadi budaya juga dibawa pembangunan dan penyebaran agama kristen di papua sepengetahuan saya ikut dipengaruhi orang maluku ambon karena kami dekat dengan orang bel,0,0,0,0,0,0,0,0,0,0,0,0
 sudah sipit ini tidak bisa disipitkan lagi dan dan dan dan ,0,0,0,0,0,0,0,0,0,0,0,0
 saksinya saksi bisu ,0,0,0,0,0,0,0,0,0,0,0,0
 haha roti buaya adalah buat nikahan pak ,0,0,0,0,0,0,0,0,0,0,0,0
kami mencintai ustaz ustaz ahlusunah namun apabila mereka tergelincir kepada satu kesalahan kami tidak se a me a membenarkannya dan kami akan saling menasihati dalam kebenaran amp kesabaran bukan taklid buta amp meninggalkan kebenaran dan dan sikap ,0,0,0,0,0,0,0,0,0,0,0,0
jadi kitab suci itu fiksi bukan kalau dulu orang bisa jelas jawab bukan atau fiksi dengan tanpa ragu jaman sekarang menjawab itu membuka kelompok mana sisi politik agama dan keberpihakan ,0,0,0,0,0,0,0,0,0,0,0,0
kristen nusantara bukanlah suatu aliran baru dalam kekristenan tapi suatu gerakan untuk mencegah paham radikalisme di bumi nusantara spe i halnya nu jangan biarkan hanya nu pemain tunggal mencegah paham radikalisme di negara kesatuan republik indonesia tercinta ini kita juga mari ter,0,0,0,0,0,0,0,0,0,0,0,0
 finansial mengajak para tenaga kerja indonesia buat menjadi pelaku usaha mikro kecil dan menengah wah menurut kalian lebih positif menjadi tenaga kerja indonesia pelaku usaha mikro kecil dan menengah apa keduanya ,0,0,0,0,0,0,0,0,0,0,0,0
 justru malah universal dia berbicara kitab suci bera i semua kitab suci dong menistakan semua kitab suci dan al qur an adalah salah satu kitab suci agama islam tidak ada keraguan di,0,0,0,0,0,0,0,0,0,0,0,0
baru sadar kalau bagi bagi bom takjil tempatnya di malang facepalm ,0,0,0,0,0,0,0,0,0,0,0,0
 haha sis tak pernah main sarah nih ini agenda yahudi semata ,0,0,0,0,0,0,0,0,0,0,0,0
pe anyaan mendasar kitab suci fiksi atau fakta oposisi b openg agama kitab suci fiksi alias kumpulan cerita fiktif umat cerdas amp beriman kitab suci adalah fakta kebenaran merujuk pada ayat al qur an itu sendiri bahwa tidak ada k,0,0,0,0,0,0,0,0,0,0,0,0
 kalau aku iyakan aku dikasih apa bisa menyipitkan matanya yang sudah sipit ,0,0,0,0,0,0,0,0,0,0,0,0
 anda bisa tukar atau kembalikan produk secara gratis untuk pengembalian barang kepada konsumen apabila barang tersebut rusak atau cacat produksi dengan layanan garansi selama 7 hari dan haus mini quiz hazid dan ,0,0,0,0,0,0,0,0,0,0,0,0
 cont dan atau berkenalan dengan orang asing ia tak akan banyak berbicara sampai menemukan satu kecocokan dengan orang tersebut yang akhirnya membukakan pintu hatinya untuk terbuka se a berbicara panjang sepe i ketika hyura bersama relasi atau cont,0,0,0,0,0,0,0,0,0,0,0,0
we belong together feat 2ne1 si park bom tahun rilis video musik 2008 dan tahun rilis lagu 2006 kuis big bang mtvn ,0,0,0,0,0,0,0,0,0,0,0,0
tidak apa apa tiap saat lihat kontol gratis masih bisa di skip yang penting bisa cuci mata melihat kesegaran yang hakiki ,0,1,0,0,0,0,0,0,0,0,0,0
di masyarakat yang hanya percaya pada hitam putih dunia ini tidak akan ada yang percaya kalau ada agamawan yang komunis perokok yang mendukung larangan merokok dan pekerja keras yang tidak sukses quotesmuke ,0,0,0,0,0,0,0,0,0,0,0,0
