processed_text,1-FR,2-GI,3-PI,4-DM,5-EDTRB,6-RE
halo ibu kondisi yang anda alami sudah tergolong tidak wajar dan perlu penanganan medis segera mengingat kondisi ini dapat berbahaya bagi ibu maupun janin mual dan muntah saat kehamilan muda trimester pertama yang tergolong normal dikategorikan sebagai morning sickness anda dapat mengalami keluhan mual dan muntah terutama pada pagi hari disertai rasa lelah mual dan muntah parah yang berkepanjangan pada saat kehamilan disebut hiperemesis gravidarum anda dapat mengalami keluhan lain seperti rasa terbakar di dada debar debar pusing sulit makan dan minum pada akhirnya hiperemesis gravidarum dapat menimbulkan komplikasi seperti kekurangan cairan berat badan janin rendah dan membahayakan kondisi ibu maupun janin segeralah mengunjungi rs ugd terdekat untuk mendapatkan pertolongan medis dokter akan menilai kondisi anda sehingga dapat ditentukan penanganan yang tepat penanganan utama adalah mencegah dan mengatasi dehidrasi misalnya dengan pemberian cairan melalui infus dan pemberian obat antimuntah dan antimual semoga membantu dr mira,1,0,1,1,1,0
halo asma ul terimakasih atas pertanyaan anda kondisi yang anda alami kemungkinan merupakan suatu kista bartholin yang terinfeksi bartholin sendiri merupakan suatu kelenjar yang terletak pada kedua sisi bibir vagina kelanjar bartholin dapat mengeluarkan cairan yang berperan sebagai pelumas saat berhubungan seksual penyabab dari timbulnya kondisi kista bartholin yang terinfeksi yaitu dikarenakan tersumbatnya saluran kelenjar dan akhirnya cairan pun tertampung dan membentuk kantong kista ini pun akhirnya terinfeksi oleh bakteri yang akhirnya menimbulkan gejala rasa nyeri pada benjolan selain dari kista bartholin yang terinfeksi kondisi yang anda alami dapat juga disebabkan oleh kista sebaseus lipoma fibroma hidradenoma kista disontogenik myoblastoma dll kami sangat menyarankan kepada anda untuk segera mengunjungi dokter spesialis kebidanan dan kandungan agar dilakukan serangkaian pemeriksaan lebih lanjut seperti pemeriksaan fisik organ intim tes laboratorium darah dll sehingga penyebab pasti dari benjolan di organ intim anda diketahui dan akhirnya penanganan yang tepat dapat diberikan klik artikel di bawah ini untuk lebih jelasnya kista bartholin demikian penjelasan yang dapat kami sampaikan semoga bermanfaat salam dr jati,1,0,1,1,1,0
halo mita terima kasih atas pertanyaannya jerawat merupakan masalah kulit yang umum yang dapat dialami siapa saja jerawat dimulai dengan adanya penyumbatan folikel rambut oleh minyak kulit sebum berlebihan dan sel sel kulit yang mati kondisi ini dapat diikuti dengan infeksi bakteri yang menyebabkan peradangan pada folikel rambut risiko seseorang mengalami jerawat dapat meningkat karena adanya perubahan hormon termasuk saat pubertas faktor keturunan tingkat stres penggunaan kosmeti efek samping penggunaan obat obata kebiasaan merokok dan gesekan kulit dengan benda lain keparahan jerawat yang terjadi pada tiap orang pun bervariasi jika anda mengalami jerawat ringan anda dapat melakukan perawatan mandiri seperti berikut ini bersihkan wajah dengan teratur dengan sabun pembersih yang lembut dua kali sehari anda boleh saja mengganti sabun wajah anda jika sudah tidak berjerawat hindari menggunakan kosmetik yang tebal pastikan anda selalu membersihkan wajah dari kosmetik sebelum tidur gunakan kosmetik dan produk perawatan kulit yang berbahan dasar air beristirahat dengan cukup mengelola stres dengan baik hindari memencet jerawat anda juga dapat menggunakan krim gel yang menganding benzoyl peroksida untuk mengatasi jerawat yang dapat dibeli bebas di apotek krim gel ini harus digunakan selama beberapa minggu sebelum menunjukkan hasil jangan ragu untuk berkonsultasi dengan dokter spesialis kulit jika keluhan ini sangat mengganggu dan tidak kunjung membaik semoga informasi ini berguna,1,0,1,1,1,0
selamat malam terima kasih telah bertanya di alodokter pada dasarnya baik obat gula ataupun produk yang anda sebutkan sama sama merupakan upaya menjaga kadar gula darah tetap stabil dan berada di rentang normal bagi penderita penyakit gula jadi harusnya tidak masalah digunakan bersamaan ketika seseorang mengalami penyakit diabetes atau sakit gula tubuh tidak mampu menyimpan kelebihan gula dalam darah ke jaringan sehingga kadar gula dalam darah meningkat hal ini tidak boleh dibiarkan terus menerus karena bisa memicu berbagai komplikasi seperti kerusakan saraf gangguan pembuluh darah membuat luka sulit sembuh gagal ginjal memicu kelainan pada mata dan masih banyak lagi bahkan seseorang bisa kehilangan anggota tubuhnya karena penyakit gula oleh sebab itu penting untuk menjaga kadar gula darah tetap normal itu dicapai dengan kontrol rutin ke dokter olahraga teratur mengonsumsi obat diabetes sesuai anjuran dan menjaga pola makan menjaga pola makan yang dimaksud dalam hal ini adalah mengurangi atau malah sama sekali tidak mengonsumsi makanan ataupun minuman yang manis hal ini tentu cukup menyiksa apalagi bagi mereka yang menggemari cita rasa manis karena itu sebagian produsen makanan menjual makanan yang didesain khusus agar relatif lebih aman dikonsumsi oleh orang dengan penyakit diabetes salah satunya adalah yang anda sebutkan jadi sekali lagi makan teratur memilih jenis makanan yang rendah gula atau yang memang dikhususkan bagi penderita diabetes dan mengonsumsi obat diabetes memang merupakan satu kesatuan penanganan yang harus dijalani penderita diabetes maka tidak masalah bagi anda untuk melakukan hal tersebut selama semua sesuai dengan anjuran aturan pakai dan petunjuk dokter pada kasus anda justru akan menjadi masalah jika yang anda tanyakan adalah produk yang umum atau tidak dikhususkan bagi penderita diabetes sekian semoga menjawab pertanyaan anda,1,0,1,1,1,0
salam alodokter terima kasih sudah bertanya di alodokter adanya keluhan demam yang anda rasakan selama hari ini merupakan suatu kondisi medis yang dapat membuat anda tidak nyaman terutama bila saat ini anda sedang menyusui keluhan demam yang terus berlangsung dalam beberapa hari naik turun dan disertai keluhan batuk dan flu kemungkinan hal ini dapat disebabkan oleh radang tenggorokan atau infeksi saluran nafas namun keluhan yang anda rasakan saat ini kemungkinan juga dapat disebabkan oleh kondisi medis lain karena secara umum pasien dengan radang tenggorokan atau infeksi saluran nafas ringan biasanya demam akan membaik setelah hari atau ke walaupun keluhan batuk belum membaik sehingga evaluasi lanjutan perlu dilakukan bila demam tidak kunjung membaik setelah obat habis atau setelah beberapa hari minum obat beberapa kondisi di bawah ini dapat memicu keluhan yang sama seperti tifus infeksi pencernaan infeksi paru infeksi saluran kencing berkaitan dengan pertanyaan anda bila dokter anda merencanakan pemeriksaan widal untuk kecurigaan ke tifus maka anda dapat melanjutkan pemeriksaan tes widal ini dan tes widal ini mempunyai nilai klinis baik terutama bila dilakukan setelah pasien demam lebih dari hari tes widal walaupun banyak memberikan nilai yang biasa karena kasus tifus di indonesia banyak dan luas sehingga beresiko overdiagnostik namun setiap dokter akan mempertimbangkan kondisi klinis anda temuan dari pemeriksaan fisik evaluasi pengobatan dan hasil pemeriksaan penunjang sehinnga diagnosa tifus tidak hanya ditegakkan dari hasil tes widal namun tanda klinis lain yang mungkin menunjang seperti perut kembung panas tinggi menggigil sakit kepala diare tenggorokan merah atau mungkin mual dan muntah pemeriksaan yang lebih spesifik juga dapat dilakukan seperti kultur kuman penyebab namun hal ini tergantung dari dokter yang merawat anda sehingga bila tes widal positif dan signifikan maka anda dapat melanjutkan obat dari dokter anda setelah evaluasi laborat penunjang dan jangan lupa anda menyampaikan ke dokter anda bahwa anda menyusui sehingga dokter dapat memilihkan obat yang aman untuk anda dan aman saat anda menyusui bilapun anda mempunyai keluhan batuk pilek dan hasil tes widal positif penegakan diagnosa hanya dapat dipastikan oleh dokter anda dan bilapun demikian dan hasil tes widal signifikan pemeriksaan fisik pemeriksaan klinis mendukung diagnosa tifoid maka kemungkinan diagnosa tifoid akan ditegakkan karena pasien tifoid dapat juga disertai keluhan batuk dan pilek juga walaupun tidak semua pasien tifoid akan mengalami keluhan batuk pilek oleh karena itu sebaiknya anda menyerahkan rencana penanganan ke doter anda dan sampaikan bahwa anda sedang dalam kondisi menyususi dengan demikian semua proses klinis dapat dijalani dan pengobatan aman untuk anda dan anak anda untuk saat ini dalam masa perawatan pengobatan dan pemulihan sebaiknya anda mengistirahatkan tubuh anda bilapun anda mendapatkan pengobatan namun tidak mengistirahatkan tubuh anda tidak istirahat tidur yang cukup maka keluhan anda akan semakin lama untuk sembuh cukupi air putih dan cukupi makanan sehat untuk anda demikian info yang bisa kami sampaikan terima kasih,1,0,1,1,1,0
alo terimakasih atas pertanyaan anda di alodokter gusi bengkak paling sering disebabkan oleh infeksi terutama jika disertai gejala muncul nanah bau tidak sedap dan rasa tidak nyaman di mulut maka dapat mengarah ke kondisi periodontitis umumnya bengkak yang berpindah tidak mungkin terjadi kemungkinan yang dapat terjadi jika bengkak mengenai jaringan sekitarnya bengkak yang terjadi pada rahang bawah anda tidak disebabkan karena obat ataupun penambalan yang anda lakukan sebelumnya dapat memeungkinkan bengkak atau sulitnya di buka pada rahang karena adanya inflamasi atau infeksi lainnya misalnya penumpukan karang gigi peradangan gusi karena sisa makanan kurang vitamin c higienitas mulut kurang untuk memastikan keadaan tersebut perlu idlakukan pemeriskaan fisik kembali guna untuk melihat kemungkinan penyebab dari rahang yang tidak dapat anda buka tersebut oleh sebab itu hendaknya anda berkonsultasi dengan dokter gigi secara langsung ada beberapa tips yang dapat dilakukan di rumah kumur dengan air garam hangat konsumsi buah dan sayur gunakna pasta gigi yang sesuai perbanyak air putih semoga bermanfaat sehat selalu,1,0,1,1,1,0
halo bekas luka sunat yang belum kering selama minggu bisa ada beberapa kemungkinan penyebabnya yaitu ada kemungkinan terjadi infeksi sehingga luka menjadi basah dan bernanah hal ini sering disebabkan perawatan luka yang tidak higienis cairan yag keluar merupakan serum yang normal ada pada bekas luka luka lambat sembuh karena faktor penyakit yang mungkin diderita misalnya pada orang dengan diabetes sulit untuk menentukan penyebab luka bekas sunat anda tampak basah tanpa pemeriksaan langsung periksakanlah ke dokter lalu nantinya dokter dapat menentukan terapi yang sesuai masa penyembuhan setelah sunat sangat bergantung pada beberapa faktor di antaranya yaitu teknik sunat usia saat dilakukan sunat dan perawatan luka teknik sunat ada beberapa yang tersering yaitu penggunaan kauterisasi istilahnya laser dan konvensional dengan teknik kauterisasi biasanya perdarahan sangat minimal dan masa penyembuhan juga lebih cepat dibandingkan teknik konvensional untuk teknik konvensional masa penyembuhannya umumnya membutuhkan waktu hari selama minggu pertama dokter mungkin belum memperbolehkan anda bekerja sunat ketika usia dewasa memang ada beberapa resikonya penyembuhan yang lebih lama serta bentuk penis yang tidak terlalu bagus adalah beberapa efek sunat setelah dewasa penyembuhan luka terlalu lama biasanya disebabkan banyak perdarahan serta bentuk luka yang kurang bagus selama tidak ada keluhan nyeri nanah hingga gangguan berkemih maka tidak ada yang perlu dikhawatirkan beberapa tips perawatan paska sunat jangan biarkan luka bekas sunat berkontak bergesek jaga kebersihan luka dengan mengganti perban bila pakai perban dan membasuh lukanya dengan air hangat lalu dikeringkan jaga juga kebersihan ini terutama setelah buang air dianjurkan untuk mandi dengan berendam di dalam air hangat untuk mengurangi proses radang gunakan semacam petroleum jelly pada sekitar bekas luka untuk melindunginya dari gesekan semoga bermanfaat dr muhammad fadhil,1,0,1,1,1,0
hai annisadchil terimakasih telah bertanya ke alodokter sebelumnya kami perlu mengetahui krim temulawak seperti apa yang anda gunakan apa saja kandungan krim tersebut apakah penggunaannya dilakukan di bawah pengawasan dokter temulawak curcuma xanthorrhiza adalah salah satu jenis tanaman obat yang diketahui memiliki beragam khasiat termasuk juga bagi kulit temulawak diketahui memiliki efek anti peradangan yang bisa membantu mengecilkan pori pori kulit yang melebar selain itu temulawak juga bisa membantu menyamarkan bekas luka pada kulit termasuk bekas dari jerawat namun seberapa besar efektifitas temulawak dalam menjaga kesehatan kulit seperti apa dosis serta cara penggunaannya yang tepat serta bagaimana efek samping yang mungkin ditimbulkan apabila temulawak diaplikasikan langsung ke kulit hingga kini masih perlu diteliti lebih lanjut sayangnya anda tidak menjelaskan jenis krim temulawak yang anda gunakan karena dewasa ini banyak krim kulit yang diklaim mengandung bahan alami termasuk temulawak padahal sesungguhnya di dalamnya telah ditambahkan juga zat lain yang bisa berdampak negatif pada kesehatan kulit tentunya hal ini bisa menyebabkan berbagai efek samping termasuk juga iritasi kulit yang kerap ditandai dengan rasa gatal perih panas mengelupas kemerahan bengkak dan sebagainya pada kulit kondisi inilah mungkin yang anda alami saat ini selain karena iritasi akibat penggunaan krim yang tidak tepat mungkin juga keluhan anda saat ini muncul karena sebab lain contohnya alergi infeksi kulit contohnya karena jamur atau virus dermatitis seboroik luka bakar psoriasis erupsi obat dan lain sebagainya untuk membedakan masing masing kemungkinan di atas anda perlu memeriksakan diri langsung ke dokter spesialis kulit dan kelamin dengan begitu dokter pun bisa melakukan tatalaksana terbaik sesuai dengan kondisi kulit anda saat ini bila benar keluhan diduga muncul karena iritasi akibat penggunaan krim maka dokter akan menganjurkan anda menghentikan penggunaan krim tersebut sembari meresepkan beberapa obat untuk mengatasi keluhan anda sekarang sebaiknya anda hentikan sementara penggunaan krim tersebut cuci kulit anda dengan sabun pembersih yang ringan jangan digosok gosok berlebihan kemudian bilas dengan air yang berkualitas baik jangan menggaruk berlebihan mengelupasi paksa atau mengoleskan apapun pada kulit yang mengalami keluhan kecuali bisa disarankan langsung oleh dokter anda lindungi juga kulit anda dari paparan sinar matahari yang berlebihan debu polusi serta zat yang yang berpotensi memicu iritasi semoga membantu ya dr nadia nurotul fuadah,1,1,1,1,1,0
terima kasih sinta telah bertanya di alodokter saya akan coba bantu jawab keluhan benjolan yang muncul pada payudara dapat disebabkan oleh fibroadenomamae fam adalah suatu tumor jinak yang terjadi pada payudara umumnya bejolan kecil lunak dengan batas yang tegas fibrokistik mammae pertumbuhan jaringan fibrosa yang abnormal umumnya benjolan ini berkaitan dengan siklus menstruasi kanker payudara adalah suatu pertumbuhan jaringan kanker pada payudara benjolan yang timbul tidak rata keras tidak dapat digerakkan untuk lebih mengetahui gejala yang ditimbulkan mengarah ke penyakit apa sebaiknya periksakan diri ke dokter bedah nantinya dokter akan melakukan pemeriksaan fisik terkait keluhan yang ditimbulkan bahkan mungkin memerlukan pemeriksaan tambahan seperti pemeriksaan usg atau biopsi apabila timbul keluhan benjolan yang timbul membesar dengan cepat disertai dengan penurunan berat badan nyeri yang hebat maka segeralah bawa ke rumah sakit terdekat untuk mendapatkan perawatan lebih lanjut demikian penjelasan singkat dari saya semoga dapat membantu terima kasih,1,0,1,1,1,0
hai try wastiqa benjolan pada vagina dapat disebabkan oleh berbagai macam penyebab beberapa diantaranya yang cukup sering adalah bisul benjolan pada bagian luar vagina berwarna kemerahan dengan rasa nyeri jerawat benjolan pada vagina luar vagina akibat penyumbatan disertai peradangan pori pori kulit abses benjolan disertai pembengkakan kemerahan dengan rasa nyeri hebat kista bartholin yaitu penyumbatan kelenjar bartholin sehingga terjadi benjolan kelenjar ini berfungsi untuk melumasi vagina saat berhubungan intim kutil kelamin yang ditularkan melalui hubungan seksual varises vagina yaitu pelebaran pembuluh darah pada vagina polip dan sebagainya sangat beragam penyebab benjolan pada vagina sehingga sangat sulit untuk menentukan penyebabnya tanpa melakukan pemeriksaan langsung penanganan yang dilakukan sangat tergantung dari penyebabnya karena lain penyebab memiliki penanganan yang berbeda diskusi terkait dapat anda ikuti pada topik berikut ini benjolan pada vagina semoga membantu ya terima kasih dr yan william,1,0,1,1,0,0
hai muria perti benjolan yang terdapat di area depan leher dapat disebabkan oleh beberapa hal diantaranya kelenjar getah bening yang membesar umumnya akibat infeksi gangguan pada kelenjar tiroid bisa diakibatkan oleh gondok kista tiroiditis dan proses keganasan limfoma tb kelenjar jika pada pemeriksaan sebelumnya sudah didiagnosa dengan kista tiroid maka akan diperlukan pemeriksaan lebih lanjut untuk mengetahui jenis benjolan di tiroid tersebut umumnya benjolan di tiroid dapat terdiri atas penyakit gondok peradangan pada kelenjar tiroid tumor jinak di tiroid dan kemudian proses keganasan riwayat benjolan mengeras membesar disertai demam dan nyeri dapat saja merujuk pada tiroiditis atau proses keganasan anda dapat berdiskusi lebih lanjut tentang hal ini dengan dokter yang memeriksa anda kami sangat menyarankan agar anda memeriksakan hal ini segera tanpa menunda nunda agar dapat dilakukan tindakan lebih awal dan tidak berpotensi bahaya bagi anda pemeriksaan yang mungkin dianjurkan dapat berupa usg tiroid biopsi scan nuclear dan pemeriksaan molekular diagnostik saran kami hindari memegang benjolan atau menekan nekannya sering sering lakukan pemeriksaan dan kontrol secara teratur ke dokter makan makanan cukup nutrisi setiap harinya demikian semoga dapat membantu anda,1,0,1,1,1,0
halo ibu tianti terimakasih sudah bertanya ke alodokter nyeri pada pinggang bisa disebabkan oleh jenis kelamin perempuan lebih berisiko untuk menderita nyeri pinggang hal ini disebabkan oleh kekuatan otot pria lebih kuat daripada wanita selain itu wanita saat hamil juga akan mempengaruhi bentuk kelengkungan dan elastisitas tulang belakang terutama pada bagian pinggang sehingga menimbulkan nyeri berat badan pada orang yang obseitas berisiko untuk menderita nyeri pinggang pekerjaan pekerjaan ynag banyak menggunakan aktifitas punggung seperti duduk terlalu lama medorong mengangkat dan membungkuk terlalu lama dapat meningkatkan risiko nyeri pinggang posisi yang salah posisi duduk yang salah atau posisi mengangkat barang yang salah dapat menyebabnya nyeri pinggang untuk membedakan sakit pinggang karena penyakit ginjal dengan penyakit pada otot atau tulang belakang di area pinggang maka perlu dilakukan pemeriksaan pemeriksaan yang dilakukan tidak cukup dengan rontgen saja namun pemeriksaan lain dengan dokter untuk mencari penyebab pasti pemeriksaan antara lain wawancara pemeriksaan fisik dan pemeriksaan tambahan mri saran yang dapat dilakukan saat ini kompres dingin berolahraga untuk menurunkan berat badan perbanyak konsumsi sayur dan buah berenang demikian penjelasan dari saya semoga dapat menjawab pertanyaannya jika membutuhkan konsultasi secara lebih mendetail ibu bisa menggunakan fasilitas chat bersama dokter dnegan mendownload aplikasi di play google com store alodokter salam dr kresnawati wahyu setiono,1,0,1,1,1,0
hallo ny dina marisa terima kasih telah berkonsultasi dengan kami di alodokter com gangguan pada sistem pencernaan memang sangat membuat tidak nyaman terlebih jika dialami oleh ibu hamil banyak penyebab dari kondisi gangguan saluran pencernaan yang sekarang anda alami yaitu perubahan pola makan perubahan sensitivitas terhadap makanan perubahan hormon infeksi bakteri atau virus pada saluran pencernaan nyeri perut yang anda alami adalah sensasi yang muncul karena adanya pergerakan usus yang meningkat hal ini menyebabkan berkurangnya waktu istirahat bagi usus sehingga akan muncul rasa nyeri rasa ingin buang air besar lebih sering mual bahkan sampai muntah untuk mengurangi peningkatan pergerakan usus tersebut maka sebaiknya anda mengobati penyebab yang mendasarinya ibu hamil adalah salah satu individu yang perlu perhatian khusus dalam penanganan dari setiap kondisi sakit yang sedang terjadi oleh karenanya kami sangat menyarankan kepada anda untuk segera berkonsultasi dan periksa dengan dokter yang anda percaya selama ini karena dengan melakukan pemeriksaan secepatnya maka penanganan dapat dilakukan sedini mungkin dan juga menghindari dari penggunaan obat yang tidak disarankan untuk ibu hamil terlebih jika anda mengalami muntah yang sering dan bab yang terus menerus maka hal tersebut dapat membuat anda mudah dehidrasi dan akan mengancam kesehatan anda serta bayi dalam kandungan anda sementara tetap perhatikan asupan cairan anda sebaiknya anda tetap mengonsumsi banyak air untuk menghindari dehidrasi selain itu hindari makanan yang membuat saluran pencernaan anda sensitif dan semakin memperburuk keadaan saluran pencernaan anda hindari makanan yang dapat memicu gangguan pencernaan seperti makanan tinggi lemak makanan yang digoreng makanan pedas susu dan produk susu serta makanan tinggi serat demikian yang dapat kami sampaikan kepada anda semoga penjelasan dari kami dapat membantu anda terima kasih,1,0,1,1,1,0
hai terima kasih atas pertanyannya untuk alodokter cacar air merupakan penyakit yang disebabkan oleh virus varicella zoster virus ini dapat ditularkan melalui udara dan sentuhan langsung cacar air ditandai dengan adanya bintil bintil berisi cairan yang gatal yang dapat muncu di hampir seluruh bagian tubuh setelah hari bintil bintil akan mengering dan mengelupas dengan sendirinya cacar air pada umumnya dapat sembuh dengan sendirinya meski tanpa penanganan khusus apapun pada orang dengan sistem imun yang baik cacar air perlu diwaspadai jika sudah menimbulkan gejala tidak biasa seperti leher kaku kejang kesulitan bergerak dan berbicara kondisi anda di mana cacar air sudah mengering dan menjadi koreng merupakan tahap di mana cacar air sudah memasuki fase akhir dan mengalami penyembuhan tidak ada larangan untuk melakukan aktivitas olahraga untuk keadaan yang anda alami olahraga bisa menjadi baik untuk tubuh anda karena dapat meningkatkan imunitas alami tubuh asal dilakukan dengan baik dan benar lakukanlah olahraga yang sesuai dengan kondisi anda saat ini dan mulailah dengan frekuensi kecil terlebih dahulu agar tubuh dapat beradaptasi dengan baik sekian semoga bermanfaat,1,0,1,1,1,0
halo berdasarkan hal yang anda ceritakan ada banyak hal yang bisa menyebabkan terjadinya sesak nafas pusing dan pandangan buram seperti anemia hipoglikemia kadar gula dalam darah rendah tekanan darah rendah dehidrasi kelelahan kondisi psikologis seperti cemas migrain kondisi cuaca misalnya terlalu lama terkena paparan sinar matahari untuk mengetahui diagnosis pasti dianjurkan agar anda berkonsultasi dengan dokter dokter perlu melakukan pemeriksaan fisik langsung wawancara medis terpadu pemeriksaan riwayat kesehatan dan tes medis penunjang seperti tes darah dll apabila kondisi ini sering terjadi muncul mendadak membuat kejang kejang hilang kesadaran dan mulai mengganggu aktivitas segera ke rumah sakit untuk dilakukan tindakan medis hal yang dapat anda lakukan terapkan pola hidup sehat dengan istirahat cukup dan olahraga rutin konsumsi makanan bernutrisi cukupi asupan air putih hindari merokok batasi konsumsi minuman berkafein kelola stres dengan meditasi atau relaksasi semoga membantu dr theresia,1,0,1,1,1,0
dear tian gonore adalah penyakit menular seksual yang disebabkan oleh bakteri neisseria gonorrhoeae bakteri ini menular lewat hubungan seksual baik secara vaginal oral lewat mulut maupun anal lewat anus gejala gonore pada pria cukup khas dan mudah dikenali berupa keluarnya cairan berwarna kuning putih atau hijau disertai rasa perih saat buang air kecil ai rkemih dapat juga disertai darah karena terjadi infeksi pada saluran kemih pengobatan gonore adalah dengan pemberian antibiotik baik antibiotik yang disuntik atau yang diminum hindari mengobati sendiri penyakit ini karena dapat menimbulkan kekebalan bakteri terhadap antibiotik sebaiknya anda berkonsultasi dengan dokter spesialis kulit dan kelamin dokter akan menelisik gejala yang anda alami dan melakukan pemeriksaan fisik terapi yang sesuai akan dokter berikan anjuran yang dapat anda lakukan hindari mengobati sendiri keluhan ini karena dapat menimbulkan kekebalan bakteri hindari membeli obat tanpa resep dokter hindari berhubungan seksual di luar pernikahan miliki waktu yang cukup untuk beristirahat dan tidur kelola stres dengan bijak artikel yang dapat anda baca gonore penyakit menular seksual semoga bermanfaat dan salam dr rony wijaya,1,0,1,1,1,0
