processed_text,1-FR,2-GI,3-PI,4-DM,5-EDTRB,6-RE
hai intanadanya benjolan sebesar kacang pada leher kiri dan kanan bisa disebabkan oleh pembengkakan dari kelenjar getah bening leher pada keadaan normal kelenjar getah bening dapat teraba teraba kenyal tidak nyeri mudah digerakan dan berukuran tidak lebih dari cm namun bisa juga disebabkan oleh kondisi lain seperti infeksi autoimun kanker obat obatan dan sebab lain yang tidak diketahui pembengkakan kelenjar getah bening kadang dapat hilang dengan sendirinya dalam beberapa bulan untuk mengetahui pasti penyebab dari pembesaran kelenjar getah bening diperlukan suatu pemeriksaan biopsi dimana dilakukan pengambilan sebagian kelenjar untuk dilihat dibawah mikroskop karena sudah berlangsung cukup lama sebaiknya anda ke dokter untuk dilakukan pemeriksaan langsung mengenai pembengkakan kelenjar getah bening dapat anda baca pada artikel dibawah ini pembengkakan kelenjar getah bening semoga membantu ya terima kasih dr yan william,1,0,1,1,1,0
alo ari nurjanah cedera pada bagian kepala tidak boleh dianggap remeh terutama jika sehabis cedera mengalami gejala seperti pingsan hilang ingatan sesaat kejadian muntah muntah sakit kepala hebat dan gangguan pada pandangan pengelihatan keluarnya darah dari mata hidung mulut maupun telinga selain itu cedera yang lokasinya dekat dengan area mata memiliki kemungkinan menyebabkan gangguan pada mata seperti misalnya pecahnya pembuluh darah ataupun kerusakan jaringan dari mata itu sendiri tidak dijelaskan secara rinci apakah warna keunguan tersebut terbatas pada kulit wajah di area sekitar mata ataukah justru warna keunguan tersebut terjadi pada bola mata itu sendiri warna keunguan pada permukaan kulit memberikan kesan adanya memar sebagai penanda adanya kerusakan pembuluh darah memar juga disertai dengan pembengkakan rasa nyeri dan rasa hangat pada bagian yang mengalami peradangan pada umumnya memar akan berangsung menghilang dengan sendirinya namun ada juga kondisi dimana kerusakan yang terjadi tidak hanya terbatas bagian kulit saja namun mengenai beagian yang lebih dalam lagi seperti misalnya kerusakan struktur tulang ataupun robekan otot misalnya sehingga proses pemulihan bisa jadi lebih sulit dan bahkan mungkin perlu mendapatkan penanganan medis namun apabila warna keungunan terjadi justru pada bola mata maka sebaiknya ari segera memeriksakan diri ke dokter mata untuk memastikan bahwa mata dan sistem pengelihatan tidak akan mengalami gangguan akibat cedera tersebut beberapa hal yang bisa ari coba lakukan adalah melakukan kompres dengan air dingin pada bagian yang bengkak dan memar untuk mengurangi bengkak dan nyerinya namun apabila cedera tersebut sudah berlangsung lebih dari hari maka gunakanlah kompres air hangat konsumsi maknaan yang tinggi protein seperti ikan telur tempe tahu dan ayam protein sangat baik untuk membantu memperbaiki jaringan tubuh yang rusak dan jangan menekan nekan bagian yang sedang sakit karena justru memicu peradangan baru artikel terkait untuk disimak pertolongan pertama pada kecelakaan sepeda motor semoga bermanfaat,1,0,1,1,1,0
halo hellas cacar air merupakan suatu penyakit yang disebabkan oleh virus varisela penyakit ini biasanya menyerang anak anak dibawah umur tahun dengan gejala sebagai berikut timbulnya ruam kemerahan pada tubuh demam pegal pegal sakit kepala kelelahan biasanya tidak diperlukan penanganan khusus pada kasus ini dikarenakan virus ini akan hilang dengan sendirinya biasanya dapat memakan waktu hari obat obatan yang biasa dipakai adalah obat penurun panas seperti paracetamol atau iburofen dokter juga dapat memberikan obat antivirus seperti acyclovir untuk mempercepat kesembuhan namun acyclovir bukan merupakan obat bebas sehingga diperlukan resep dari dokter untuk mendapatkannya berikut hal hal yang dapat dilakukan minum obat penurun panas istirahat yang cukup minum air putih yang cukup agar terhindar dari dehidrasi berolahraga secara teratur mengkonsumsi makanan yang sehat dan bergizi untuk menjaga daya tahan tubuh untuk mengetahui lebih lanjut mengenai cacar air silahkan baca artikel berikut cacar air semoga bermanfaat dr nugraha mauluddin,1,0,1,1,1,0
halo kelenjar bartholin adalah kelenjar yang terletak di kedua sisi vulva tepatnya di labia minora dan berfungsi menghasilkan pelumas saat hubungan seksual kelenjar ini termasuk yang sering mengalami masalah pada wanita seringkali ada hambatan aliran keluar dan membentuk kantung berisi cairan yang disebut kista bartholin jika terinfeksi disebut bartholinitis dan jika ada mengumpulan nanah disebut abses bartholin selain pemberian antibiotika tindakan bedah umumnya diperlukan apda kasus ini karena antibiotika saja umumnya tidak dapat menyembuhkan gangguan ini penanganan awal adalah dengan insisi drainase kista surgical drainage alternatifnya adalah dengan word catheter jika dilakukan dengan baik dan benar sebenarnya prognosis ramalan penyakitnya baik akan tetapi perlu menjadi perhatian bahwa meski dilakukan dengan baik pada pasien akan mengalami rekurensi sehingga rekurensi kekambuhan merupakan komplikasi yang memang paling sering terjadi dan inilah yang saya kira ibu alami pada kondisi seperti ini maka perlu dilakukan tindakan berupa marsupialisasi biasanya dicadangkan pada kasus yang rekuren kambuhan seperti insisi drainase biasa tetapi lebih luas wide eksisi kemudian rongga akan dijahit dan dilekatkan dengan dingding kanan kirinya untuk menutup rongga potensial dan mencegah kekambuhan eksisi jadi kelenjar diangkat dan jaringan sekitarnya juga lebih radikal dari marsupialisasi kedua prosedur diatas harus dilakukan oleh dokter spesialis dan biasanya dilakukan di ruang operasi pada kondisi seperti ini sebaiknya ibu konsultasikan dengan dokter ibu dokter obsgyn untuk penanganan yang tepat marsupialisasi umumnya tidak se radikal eksisi dan patut dicoba jika memang memungkinkan selain itu pada marsupialisasi kelenjar tidak dibuang sedangkan pada eksisi kelenjar akan dibuang jika kelenjar dibuang tentu saja akan sembuh karena kelenjarnya tidak ada lagi efek potensialnya adalah kurangnya pelumas saat hubungan seksual bisa diatasi dengan mudah menggunakan pelumas buatan yang dapat dibeli dengan mudah di berbagai tempat gunakan yang berbahan dasat air jika berusia ugt tahun sebaiknya disertai biopsi dan pemeriksaan pa untuk menyingkirkan kemungkinan adanya kanker keganasan pada kelenjar ini paska tindakan selain obat yang diberikan dan perawatan luka perlu dilakukan sitz bath merendam selangkanagan dalam baskom berisi air sabun hangat kali sehari menit untuk beberapa hari pertama paska tindakan kista bartholin bacaan lainuntuk bartholin cyst demikian yang dapat saya sampaikan semoga bermanfaat dr rico novyanto,1,0,1,1,1,0
halo kartokeluhan gelisah dan sesak menjelang tidur tidak khas untuk satu penyakit bisa saja keluhan tersebut disebabkan karena faktor psikis misalnya stres atau rasa cemas berlebihan stres psikis ini juga sering memicu keluhan lainnya salah satunya mual dan muntah keluhan keluhan tersebut akan menghilang jika anda mampu memanejemen stres dengan baik apabila keluhan tersebut menetap bahkan menganggu aktifitas sehari hari susah tidur dll maka sebaiknya anda segera menemui dokter guna pemeriksaan lebih lanjut mungkin saja pencetus keluhan anda adalah karena penyakit penyakit tertentu seperti gerd maag irritable bowel syndrome dll dokter nantinya akan melakukan pemeriksaan untuk mencari penyebab pasti keluhan penanganan terbaik akan disesuaikan dengan penyebab yang ditemukan obat obat penenang mungkin dapat diberikan jika ada indikasi yang ditemukan oleh dokter artikel berikut berkaitan dengan topik anda gangguan psikis semoga bermanfaatdr muhammad fadhil rahmadiansyah,1,0,1,1,1,0
halo susan sebaiknya kamu menghentikan pemakaian masker madu tersebut apa yang kamu alami sepertinya adalah suatu dermatitis kontak alergik yang mungkin terjadi akibat hipersensitivitas terhadap kandungan dalam madu tersebut beberapa hal lain yang perlu diperhatikan hentikan kontak terhadap alergen masker kenakan pelembab emolien anda dapat menggunakan obat obatan antihistamin seperti ctm cetirizin atau loratadin untuk mengurangi gejala tersebut jika gejala belum berkurang sebaiknya konsultasikan ke dokter dokter mungkin akan meresepkan obat obatan yang berisi campuran antihistamin dan kortikosteroid seperti deksametason betametason jangan menggaruk bagian yang gatal demikian yang dapat saya sampaikan semoga bermanfaat,1,0,1,1,1,0
hai tulang ekor berukuran relatif lebih kecil susah bab biasanya berhubungan dengan kurang konsumsi serat dan kurang minum air mineral sehingga tinja lebih keras dan menimbulkan nyeri saat bab pola makan tidak teratur sering mengabaikan keinginan bab gangguan pada usus seperti terjadi penyempitan penyumbatan kondisi psikologis misalnya stres atau lingkungan kamar mandi yang tidak nyaman konsumsi obat suplemen tertentu contohnya suplemen zat besi atau kalsium anda dapat membaca halaman penyebab konstipasi untuk mengetahui kondisi lebih lanjut dari tulang ekor sebaiknya anda periksa ke dokter sehingga dapat dilakukan pemeriksaan fisik serta tes penunjang seperti sinar x usahakan untuk konsumsi tinggi serat seperti sayur dan buah perbanyak minum air mineral tidak mengejan berlebihan saat bab dan tidak mengabaikan keinginaan untuk bab batasi kafein alkohol serta menghindari stres halaman berikut membahas pencegahan konstipasi semoga bermanfaat dr jessica winoto,1,0,1,1,1,0
halo obat pemutih yang beredar dipasaran sebaiknya dicermati dengan baik beberapa pedoman yang bisa anda jadikan acuan untuk pemilihan obat bebas antara lain adalah terdaftar bpom negara setempat dalam hal ini jika beredar di indonesia maka memerlukan surat bpom yang bisa anda cek melalui website bpom jangan termakan bujukan bukti standar fda segel rapi ada masa berlaku memiliki call center yang jelas dan bisa dihubungi obat gluta yang anda sebut belum memiliki standar penelitian medis yang cukup untuk memastikan keefektifan dari produk tersebut sehingga keamanannya juga belum bisa dipastikan secara medis baca topik suplemen pemutih semoga membantu dr yusi,1,0,1,1,1,0
alo terimakasih atas pertanyaannya benar penggunaan dot di usia yang terlalu dini kurang dari bulan memang berisiko tinggi membuat bayi mengalami bingung puting sehingga malas untuk menyusu langsung dari payudara hal ini disebabkan saat menyusu dengan dot bayi bisa dengan mudah mendapatkan susu akibat pengaruh gravitasi sehingga ia tidak perlu susah susah menghisap sebagaimana saat menyusu dari payudara bisa juga selain karena bingung puting kondisi bayi anda yang sulit menyusu langsung dbf disebabkan oleh rasa tidak nyaman di mulutnya seperti karena sariawan akan tumbuh gigi infeksi jamur gangguan pencernaan seperti karena gastroenteritis radang usus hernia hiatus atau juga kondisi medis lainnya baiknya jika keluhan bayi anda terjadinya baru beberapa hari terakhir tanpa ada keluhan lain yang menyertai seperti demam lemas mual muntah diare dan sebagainya maka anda lakukan dulu penanganan mandiri di rumah yakni dengan usahakan susui bayi anda asi langsung dari payudara sering sering susui bayi anda setiap jam sekali jangan menunggu ia terlalu haus agar tidak mudah marah saat asi anda tidak langsung keluar jika berhalangan menyusui bayi langsung jangan gunakan dot melainkan gunakan media lain yang tepat seperti cupfeeder pipet sendok jangan juga gunakan empeng untuk menenangkan bayi sering sering berinteraksi dengan bayi anda ajak ia bicara agar kembali mau menyusu langsung ke payudara anda tingkatkan kedekatan emosional anda dengan bayi anda jika bayi rewel atau menangis berlebihan saat tidak mau disusui langsung ke payudara jangan panik tetaplah tenang dan perbaiki perlekatan menyusui bayi supaya ia merasa lebih nyaman perbanyak produksi asi anda yakni dengan banyak minum makan makanan bergizi seimbang terutama jenis kacang kacangan dan jangan stres jika dengan upaya di atas kondisi bayi anda belum membaik juga anda bisa periksa langsung ke dokter atau konselor laktasi terdekat agar dicarikan solusi yang terbaik ya semoga membantu,1,0,1,1,1,0
hai guus benjolan pada leher anak dapat disebabkan oleh adanya infeksi baik infeksi bakteri seperti impetigo atau infeksi virus adanya infeksi di kelenjar getah bening sekitar leher limfadenitis atau akibat infeksi tb terutama jika anggota keluarga memiliki penyakit tersebut adanya alergi seperti eksim atopik urtikaria dermatitis kontak adanya kista kantong berisi cairan seperti ateroma abses konsultasikan dengan dokter terutama dokter anak mengenai kondisi yang anak anda alami pemeriksaan fisik dapat membantu menilai penyebab menjaga higienitas anak menghindari paparan terhadap bahan bahan yang dapat mengiritasi anak dapat membantu mengurangi kemungkinan infeksi dan alergi konsultasikan segera terutama jika ada demam malas menyusu semoga bermanfaat dan terima kasih salam dr alyssa,1,0,1,1,1,0
halo mumu terima kasih atas pertanyaannya di alodokter radang usus adalah kondisi di mana usus mengalami peradangan radang usus ini perlu diketahui lebih lanjut karena terdapat dua jenis penyakit radang usus yaitu penyakit crohn dan kolitis ulseratif kondisi ini muncul karena autoimun terhadap saluran pencernaan kolitis ulseratif adalah peradangan kronis yang terbatas pada usus besar atau kolon saja sedangkan penyakit crohn adalah peradangan yang bisa terjadi di seluruh sistem pencernaan mulai dari mulut hingga ke anus radang usus dapat menyebabkan beberapa gejala antara lain nyeri pada daerah perut nafsu makan berkurang mual penurunan berat badan diare bercampur darah yang bersifat hilang timbul dapat disertai demam kondisi radang usus sendiri dapat disebabkan oleh beberapa faktor seperti usia genetik merokok pengobatan pengobatan untuk mendiagnosis penyakit ini pun perlu dilakukan anamnesis pemeriksaan fisik serta pemeriksaan penunjang seperti tes darah prosedur endoskopi ataupun tes pencitraan seperti ct scan pengobatan radang usus sendiri dapat diobati dengan beberapa modalitas seperti obat anti inflamasi untuk menekan radang obat imunosupresi untuk menekan respon imunitas tubuh terhadap saluran pencernaan obat antibiotik bila ditemukan adanya infeksi serta obat obatan lain sesuai gejala dan hasil pemeriksaan disarankan untuk berobat ke dokter spesialis penyakit dalam untuk pemeriksaan dan penatalaksanaan lebih lanjut atau dapat kembali berobat ke dokter yang menangani kasus anda sejak awal lakukan pola makan dan pola hidup sehat istirahat cukup hindari mengkonsumsi obat obatan tanpa instruksi dokter semoga informasi ini membantu anda salam,1,0,1,1,1,0
halo sri puspita terimakasih atas pertanyaan anda perlu anda ketahui menstruasi merupakan proses luruhnya lapisan terdalam dinding rahim endomentrium akibat sel telur yang tidak mendapat pembuahan atau dengan kata lain tidak terjadi kehamilan secara teoritis seorang wanita yang mengalami menstruasi tidak mungkin hamil namun anda harus bisa membedakan antara darah menstruasi dengan darah yang dikeluarkan pada awal masa kehamilan perdarahan vagina selama awal kehamilan bisa disebabkan oleh banyak penyebab baik yang ringan ataupun yang mengarah pada kondisi serius berikut beberapa di antaranya pendarahan implantasi terjadi pada hari setelah pembuahan tidak memerlukan penanganan khusus dan akan terhenti sendiri keguguran kematian janin secara spontan sebelum usia kehamilan minggu ancaman keguguran terdapat tanda tanda keguguran namun kehamilan dan janin masih bisa diselamatkan kelainan pada leher rahim serviks seperti infeksi servisitis kehamilan ektopik untuk memastikan telah terjadi kehamilan atau tidak anda bisa melakukan pemeriksaan mandiri dengan testpack yang dijual bebas di apotek bacalah aturan pemakaiannya dan ikuti anjuran sesuai yang diinstruksikan di kemasan bila hasil tes masih negatif maka lakukan pemeriksaan konfirmasi minggu kemudian atau dengan berkonsultasi ke dokter kandungan dokter akan memastikan kehamilan melalui pemeriksaan usg terakhir anda perlu mengetahui bahwa pergaulan bebas bisa mengakibatkan beberapa gangguan kesehatan antara lain penyebaran penyakit infeksi menular seksual berpotensi menimbulkan kanker mulut dan tenggorokan akibat seks oral dan kanker anus karena seks anal khusus wanita berpotensi mengalami kanker serviks untuk itu sebaiknya hindari hubungan seksual di luar pernikahan salam dr lili,1,0,1,1,1,0
alo mia terimakasih atas pertanyaannya sulfit merupakan salah satu jenis bahan pengawet yang banyak digunakan dalam beragam jenis makanan dan juga minuman tambahan sulfit pada makanan dan minuman bsia membuat makanan lebih awet dan tidak cepat berubah warna meski terpapar udara bebas sejatinya asalkan dikonsumsi dalam batas yang wajar pengawet sulfit tidaklah berbahaya bagi ibu hamil hanya saja beberapa orang yang sensitif bisa mengalami alergi terhadap pengawet ini sehingga bila dikonsumsi berlebihan bisa membuat kulit menjadi gatal gatal bengkak kemerahan bruntusan sesak napas mual dan muncul banyak lagi keluhan lainnya sensitifitas berlebih terhadap sulfit ini juga bisa memicu diare muntah muntah dan kekambuhan asma jika kondisi seperti ini terjadi saat hamil tentu janin dalam kandungan anda bisa turut kekurangan oksigen dan perkembangannya bisa terganggu beberapa penelitian yang dilakukan pada mencit pun membuktikan bahwa konsumsi pengawet sulfit berlebihan selama hamil berisiko menyebabkan cacat janin teratogen meski belum ada uji klinis yang cukup terkait efeknya pada manusia sebab itu baiknya anda batasi asupan makanan atau minuman dengan pengawet sulfit ataupun beragam turunannya seperti sulfur dioksida natrium sulfit natrium bisulfit kalium bisulfit kalium metabisulfit dan juga natrium metabisulfit jika muncul keluhan berat usai mengkonsumsi produk makanan dan minuman yang mengandung sulfit segeralah periksakan diri anda ke dokter atau dokter kandungan ya semoga membantu,1,0,1,1,1,0
halo rizal kehamilan terjadi apabila sel sperma membuahi sel telur terjadinya kehamilan dipengaruhi oleh berbagai macam faktor yaitu masa subur wanita kualitas sperma pria usia dan suhu lingkungan sel sperma tidak hanya terkandung pada cairan ejakulasi pria saat pria terangsang secara seksual pria akan mengeluarkan sedikit cairan mani yang mengandung sperma sehingga apabila anda berhubungan tanpa mengenakan kondom maka kemungkinan untuk hamil tetap ada meskipun kemungkinannya lebih kecil apabila ejakulasi dilakukan di luar vagina senggama terputus sel sperma dapat bertahan hingga hari dalam rahim wanita apabila dalam kurun waktu hari setelah berhubungan wanita mengalami ovulasi pelepasan sel telur maka ada kemungkinan kehamilan akan terjadi mual bisa saja dirasakan setelah berhubungan seksual namun bukan berarti hubungan seksual yang menyebabkan mual mual dapat terjadi karena peningkatan asam lambung mencium aroma menyengat peningkatan hormon tertentu efek samping obat dan gejala penyakit medis lainnya untuk menghindari hal hal yang tidak diinginkan sebaiknya anda menggunakan kondom saat berhubungan dan hanya berhubungan dengan istri setelah menikah pasangan anda dapat melakukan pemeriksaan testpack mulai hari setelah berhubungan untuk mendeteksi kehamilan berikut informasi yang dapat anda baca untuk menambah wawasan tanda tanda hamil proses pembuahan terimakasih dan semoga membantu dr devika yuldharia,1,0,1,1,1,0
halo ratna terima kasih sudah bertanya di alodokter kemungkinan keluhan yang anda alami bisa disebabkan oleh infeksi alergi misalnya akibat penggunaan produk sabun tertentu iritasi misalnya akibat penggunaan pakaian dalam yang terlalu ketat cedera otot bila keluhan ini dirasa belum membaik dan bertambah berat seperti nyeri yang dirasakan bertambah hebat adanya gangguan pada buang air kecil adanya luka maka sebaiknya untuk melakukan pemeriksaan dokter secara langsung ya untuk memperoleh penanganan yang tepat beberapa keluhan yang dapat dilakukan adalah hindari penggunaan produk sabun atau perawatan yang menyebabkan alergi hindari penggunaan pakaian dalam atau celana yang terlalu ketat hindari melakukan hubungan seksual secara bebas dengan berganti ganti pasangan hindari merokok hindari menggaruk bagian luka tersebut karena dapat menyebabkan infeksi semoga dapat bermanfaat ya salam sehat,1,0,1,1,1,0
halo kontrasepsi dapat dilakukan melalui cara yaitu alami dan dengan bantuan ala t salah satu kontrasepsi alami yang sering digunakan adalah mal metode amenorhea laktasi menghitung masa subur dan mengeluarkan penis sebelum ejakulasi pemberian asi secara eksklusif dapat menghambat ovulasi dan menstruasi pada ibu yang baru melahirkan tetapi cara ini kurang efektif apabila asi dikeluarkan dengan pompa atau anda telah mendapatkan menstruasi sebaiknya segera gunakan metode kontrasepsi alami yang lain atau memilih kontrasepsi yang aman untuk ibu menyusui seperti pil kb atau suntik kb yang mengandung progestin implan dan iud untuk mengetahui kontrasepsi yang baik segera konsultasikan ke dokter untuk disesuaikan dengan kondisi anda salam dr aditya pratama,1,0,1,0,1,0
alo terimakasih atas pertanyaannya muncul benjolan yang membengkak dan kemerahan di kelopak mata memang bisa saja disebabkan oleh bintitan hordeolum kondisi ini terjadi ketika kelenjar minyak di kelopak mata meradang bisa karena infeksi bakteri atau mikroorganisme lain kelainan anatomis sejak lahir blefaritis roseola dermatitis kontak dan sebagainya bukan hanya bintitan keluhan di kelopak mata anda tersebut mugkin pula terjadi karena beragam pencetus lain seperti kalazion milia jerawat folikulitis dermatitis kontak digigit serangga skin tag hiperkeratosis tumor jinak atau ganas selulitis konjungtivitis blefaritis uveitis keratitis dan sebagainya agar keluhan anda membaik cobalah anda lakukan dulu tidak sembarangan memanipulasi benjolan baik itu memencet menusuk mengelupasi atau memberinya obat dan ramuan tanpa saran dokter kompres hangat area yang bengkak jaga mata anda agar selalu bersih jangan dulu gunakan kosmetika berlebihan di sekitar mata perbanyak istirahat di rumah kenakan kacamata pelindung jika harus keluar rumah rajin mandi dan mencuci muka dengan sabun yang ringan akan tetapi jika dalam hari keluhan malah terasa makin memberat lebih aman anda periksalah langsung ke dokter atau dokter mata terdekat agar ditangani sesuai penyebabnya ya semoga membantu,1,0,1,1,1,0
terima kasih telah bertanya kepada tim alodokter pada trimester awal kehamilan atau bulan pertama kehamilan janin sedang mengalami proses pertumbuhan rahim ibu juga sedang mengalami perubahan untuk menyesuaikan dengan proses kehamilan pada minggu minggu awal kehamilan dinding rahim akan menebal dan sel telur yang telah dibuahi akan ditanamkan di rahim sel telur ini akan berkembang sangat pesat sel sel tersebut akan berkembang menjadi janin dan placenta pada bulan pertama kehamilan kantung kehamilan dan placenta sudah mulai terbentuk kantung kehamilan dan placenta ini berfungsi melindungi janin dan memberikan asupan nutrisi dari ibu ke janin pada masa awal kehamilan kondisi ibu dan janin sangat rentan karena perkembangan lingkungan di dalam rahim dan perkembangan bayi belum sempurna sehingga ibu harus waspada dan menjaga kondisi kesehatan oleh karena itu sebaiknya kehamilan disadari sejak awal untuk memastikan kehamilan dapat dilakukan pemeriksaan dengan testpack dan pemeriksaan secara langsung ke dokter atau dokter spesialis kandungan pemeriksaan ini meliputi tanya jawab pemeriksaan fisik dan beberapa pemeriksaan penunjang seperti usg dan plano test apabila sudah dipastikan kehamilan dan usia kehamilannya ibu disarankan untuk mengikuti antenatal care anc yaitu suatu program untuk memonitoring edukasi dan penanganan medis kepada ibu hamil sehingga diharapkan dapat melakukan persalinan normal pemeriksaan anc ini dapat dilakukan di bidan atau dokter secara berkala minimal kali selama kehamilan yan meliputi kali pada trimester pertama kali pada trimester kedua dan kali pada trimester ketiga pelayanan anc ini meliputi t timbang bb dan pengukuran tinggi badan ukur tekanan darah ukur tinggi fundus uteri pemberian imunisasi tetanus toxoid tt pemberian tablet besi minimal tablet selama kehamilan tes laboratorium rutin dan khusus temu wicara atau konseling untuk usia awal kehamilan disarankan untuk persiapan mental ibu dan ayah karena pada usia awal kehamilan kondisi emosional ibu dapat berubah ubah dengan cepat dipengaruhi oleh perubahan hormon sehingga perlu pengertian dari keluarga persiapan fisik sebaiknya ibu menjaga kondisi tubuh tidak boleh terlalu capek kurangi aktivitas aktivitas berat sebisa mungkin menghindari perjalanan jauh apabila tidak terlalu dibutuhkan makan makanan yang bergizi terutama sayuran dan buah multivitamin tambahan yang mengandung vitamin dan mineral seperti vitamin b kompleks vitamin a vitamin d kalsium zat besi dan asam folat dapat dikonsumsi namun sebaiknya dikonsultasikan dahulu kepada dokter atau pada saat antenatal care anc demikian informasi dari saya semoga bermanfaat,1,0,1,0,1,0
