processed_text,1-FR,2-GI,3-PI,4-DM,5-EDTRB,6-RE
alo mikesmith terima kasih atas pertanyaannya saya akan coba jawab satu persatu ya obat arv yang anda minum regimennya sudah tepat regimen tersebut merupakan regimen yang direkomendasikan oleh who sebagai arv lini pertama jenis dan dosis obat yang anda minum sudah tepat maka seharusnya obat tersebut akan efektif mencegah replikasi virus secara progresif namun hal yang perlu diingat adalah jenis obat apapun saat dikonsumsi dengan dosis yang sama namun oleh orang yang berbeda tentu efektivitasnya akan berbeda misalnya orang demam keduanya meminum parasetamol mg x sehari ternyata parasetamol lebih efektif menurunkan demam pada orang b dibanding orang a hal tersebut terjadi pada tiap jenis obat efektivitas tidak dapat dipukul sama rata untuk tiap individu kondisi umum seseorang yang menentukan sejauh mana efektivitas obat tersebut setiap jenis obat tentu memiliki efek samping efek samping dapat muncul atau dapar pula tidak bergantung kepada masing masing individu sejauh ini efek samping dari arv adalah mual muntah diare sakit kepala perasaan lelah demam nyeri otot sulit tidur dan reaksi alergi harap diingat pula bahwa terdapat yang namanya interaksi obat artinya bila seseorang mengonsumsi beberapa golongan obag secara bersamaan dapat timbul interaksi antara obat tersebut interaksi juga dapat terjadi antara obat dan suplemen herbal multivitamin dan mineral atau bahkan dengan makanan minuman tertentu hal tersebut mungkin saja meningkatkan kejadian efek samping obat selain itu tidak tertutup kemungkinan bahwa pilek yang anda alami mungkin adalah manifestasi dari perjalanan penyakit anda kemungkinan lainnya adanya reaksi alergi terhadap suatu bahan yang tidak anda sadari sehingga menyebabkan pilek berkepanjangan konsultasikan hal ini dengan dokter yang merawat agar dokter dapat menilai kondisi anda tes hiv saat ini umumnya cepat dan reliable berbagai metode dikembangkan agar tes hiv mudah dilakukan tidak memakan biaya terlalu banyak dan hasilnya tepat kami tidak mengetahui riwayat hidup anda bagaimana aktivitas seksual anda adakah penggunaan obat terlarang dan sebagainya maka bila anda ingin melakukan tes hiv ulangan tentu hal tersebut menjadi hak anda sebagai pasien namun sebaiknya bicarakan dulu dengan dokter anda dokter akan menerangkan tes hiv apa saja yang sebaiknya anda tempuh bila hasilnya memang menunjukkan reaktif maka berarti anda memang positif hiv demikian penjelasan saya semoga dapat membantu anda salam,1,0,1,1,1,0
halo stmmi tanda tanda kehamilan dibagi menjadi jenis yaitu tanda tidak pasti hamil berhentinya siklus menstruasi mual dan muntah sering bak payudara membesar kulit hidung pipi dahi puting menghitam sulit bab varises tanda kemungkinan hamil pemeriksaan oleh tenaga kesehatan ditemukan tanda hegar tanda piskacek tanda braxton hicks tanda ballotement dan tanda chadwick terabanya bagian tubuh janin hasil testpack tanda pasti hamil gerakan janin dan denyut jantung janin melalui usg apakah saat ini anda masih mengkonsumsi antibiotik dan anti jamur dari dokter beberapa antibiotik dan anti jamur memiliki efek samping mual dan muntah hingga meriang saat pengobatan keputihan akibat infeksi seperti yang anda alami disarankan agar anda tidak berhubungan intim dahulu hingga pengobatan selesai hubungan intim dengan senggama terputus tidak menjamin untuk pencegahan kehamilan pada senggama terputus sperma tetap ada yang terkandung di dalam cairan sebelum ejakulasi keterlambatan haid dapat disebabkan oleh kehamilan stress kecemasan perubahan berat badan secara drastis masalah tiroid dan masalah medis pada organ reproduksi untuk mengetahui apakah anda hamil tidak anda dapat mencoba melakukan tes sederhana dengan test pack test pack dapat mulai dilakukan hari setelah berhubungan patuhi cara penggunaan testpack apabila testpack negatif tapi anda belum haid lakukan testpack ulang dan pastikan anda mematuhi tata cara penggunaan testpack dengan benar apabila hasil testpack positif sebaiknya anda berkonsultasi ke dokter kandungan agar dapat dilakukan usg untuk mengetahui tanda pasti hamil berikut informasi yang dapat anda baca untuk menambah wawasan testpack terlambat haid tanda tanda hamil terimakasih dan semoga membantu dr devika yuldharia,1,1,1,1,1,0
halo nisa terimakasih sudah bertanya di alodokter com bila melihat dari segi tumbuh kembang anak pada usia bulan terdapat beberapa hal yang sudah dapat dilakukan seorang anak diantaranya anak sudah dapat menegakkan kepala saat digendong dapat membalikkan badan ke posisi tengkurap atau telentang maupun sebaliknya dapat bersosialisasi dengan baik memegang mainan dan akan mulai berceloteh hingga tertawa berdasarkan keterangan anda dapat dilihat dimana perkembangan anak sesuai dengan seusianya hal tersebut merupakan hal yang normal bila dalam perkembangannya anak terlihat terlambat dengan teman seusianya sebaiknya anda membawa anak menemui dokter untuk dilakukan pemeriksaan lebih lanjut untuk saat ini sebaiknya anda rutin memeriksakan anak di posyandu atau dokter spesialis anak setiap bulannya untuk dipantau tumbuh kembang anak anda untuk saat ini anda sudah dapat membelikan mainan edukatif untuk sang buah hati untuk menunjang perkembangannya serta tidak lupa memenuhi kebutuhan gizi dan nutrisi sang buah hati sekian informasi yang dapat kami sampaikan semoga bermanfaat salam dr prasetyo,1,0,1,1,1,0
hai pertama tama saya ingin mengucapkan terima kasih telah memberikan pertanyaan di alodokter com saya dr radhianie djan akan mencoba membantu menjawab pertanyaan anda menghitung atau memperkirakan siklus haid setelah mengalami keguguran memang terkadang membingungkan pada saat keguguran janin telah berhenti berkembang namun kadar hormon kehamilan seorang ibu masih tinggi keguguran yang terjadi pada bulan pertama kehamilan tidak akan mempengaruhi anda dan keguguran yang terjadi pada kehamilan bulan kedua usia kandungan bulan akan meningkatkan risiko masalah kesehatan pada ibu jika anda mengalami keguguran pada bulan pertama kehamilan normalnya anda akan mendapatkan siklus menstruasi anda minggu setelah prosedur rata rata minggu pada beberapa kasus anda tidak akan mendapatkan menstruasi selama beberapa bulan atau menstruasi akan datang lebih cepat sekitar minggu setelah prosedur hal ini bervariasi pada setiap individu tergantung pada · kadar hormon kehamilan yang masih terdapat pada tubuh · tekanan psikis atau depresi dapat mempengaruhi siklus haid · kemungkinan lain yang mengakibatkan menstruasi terlambat tidak datang misalnya kehamilan atau adanya kista ovarium umumnya pada ibu yang mengalami prosedur kuret jumlah darah haid akan sedikit berkurang dan lama menstruasi menjadi lebih sebentar dibanding sebelum keguguran jika perdarahan menjadi lebih banyak sebaiknya anda berkonsultasi dengan dokter kandungan sekian informasi yang dapat kami sampaikan semoga informasi ini dapat bermanfaat untuk mengatasi keluhan anda salam dr radhianie djan bmedsc,1,0,1,1,1,0
alo terima kasih sudah bertanya di alodokter sebelumnya bolehkah saya mengetahui indikasi anda mengkonsumsi pil estrogen estrogen merupakan preparat hormon yang digunakan dalam mengatasi masalah kekurangan hormon estrogen dalam tubuh misalnya pada kondisi menopause di samping itu estrogen juga dimanfaatkan dalam mengatasi beberapa masalah lainnya misalnya pencegahan terhadap penipisan lapisan vagina mengatasi masalah pada indung telur mengatasi masalah osteoporosis paska menopause dan sebagainya sma halnya dengan obat lainnya estrogen juga memiliki efek samping seperti mual muntah berat badan naik sakit perut kembung gangguan menstruasi alergi dan sebagainya secara umum penggunaan estrogen haruslah berdasarkan anjuran dokter hal ini dikarenakan dosis estrogen pada setiap kondisi berbeda beda guna pemberian estrogen secara tepat maka perlu dilakukan pemeriksaan secara menyeluruh sebelumnya oleh karena itu disarankan bagi anda untuk tidak mengkonsumsi estrogen secara sembarangan tanpa anjuran dokter jika anda memiliki keluhan tertentu sebaiknya periksakan terlebih dahulu ke dokter jika anda berhalangan untuk bertemu dokter secara langsung anda dapat mencoba layanan hat bersama dokter pada aplikasi alodokter yang bisa anda unduh di google playstore maupun app store sekian semoga membantu,1,1,1,1,1,0
hai mawarmerah bila keluhan kulit kering yang anda alami hanya terjadi setelah mencuci wajah maka kemungkinan kondisi ini disebabkan oleh penggunaan sabun pembersih wajah yang tidak tepat pastikan untuk memilih pembersih wajah yang sesuai dengan tipe kulit anda berminyak normal atau kering agar sisa kotoran dapat terangkat secara efektif namun tidak menyebabkan kulit kering pilihlah sabun pembersih wajah yang tidak mengandung pewangi dan gunakan dalam jumlah secukupnya jangan terlalu banyak membersihkan wajah sebaiknya cukup kali sehari dan memakai air biasa untuk membilas wajah hindari penggunaan air panas untuk mencuci muka karena dapat menyebabkan kulit semakin kering namun demikian kulit yang kering dapat pula dipengaruhi oleh faktor yang lain seperti udara yang kering sering berada di ruangan yang menggunakan pendingin udara paparan sinar matahari kebiasaan mandi dengan air panas terlalu lama kondisi medis tertentu diabetes hipotiroid perubahan hormonal dan sebagainya untuk mengatasi kulit wajah yang kering berikut ini anjuran yang dapat anda lakukan mandi dengan air biasa dan batasi waktu mandi selama menit gunakan pelembab wajah setelah mandi atau mencuci muka pilih jenis pelembab yang mengandung minyak alami misalnya minyak zaitun atau minyak jojoba lindungi kulit dari udara kering atau paparan sinar matahari gunakan tabir surya saat beraktivitas di luar ruangan perbanyak minum air putih buah dan sayur meminimalisir stres dan istirahat yang cukup untuk menjaga kesehatan kulit namun jika keluhan yang dialami tidak kunjung membaik maka anda dapat berkonsultasi dengan dokter spesialis kulit agar mendapatkan penanganan lebih lanjut dokter terlebih dahulu akan melakukan pemeriksaan fisik untuk menilai kondisi kulit anda sehingga penanganan yang diberikan dapat disesuaikan dengan kebutuhan kulit informasi berikut ini dapat berguna mengatasi kulit wajah kering masker alami untuk kulit kering memilih pelembab wajah demikian semoga bermanfaat dr muliani sukiman,1,0,1,1,1,0
halo terkadang wajar seorang wanita mengalami telat haid telat haid tidak selalu bermakna kehamilan ada kondisi kondisi lain yang dapat menyebabkan telat haid di antaranya yaitu · berat badan berlebih atau kurang · konsumsi pil kontrasepsi · faktor stres · kondisi medis tertentu seperti sindrom polikistik ovarium pcos dan hipertiroid · menjelang menopause besar kemungkinan telat haid yang anda alami saat ini adalah efek dari konsumsi pil kb bercak darah yang keluar diluar haidpun adalah beberapa efek samping dari pil kb efek samping ini cukup wajar terjadi di awal awal penggunaan pil kb biasanya seiring dengan berjalannya waktu efek sampingnya akan teratasi dengan sendirinya jika terasa menganggu konsultasikanlah langsung ke dokter guna pertimbangan opsi lainnya semoga bermanfaat dr muhammad fadhil,1,0,1,1,1,0
selamat malam terimakasih atas pertanyaannya gejala batuk kronik lebih dari minggu disertai episode batuk darah pada orang dewasa maka yang perlu dicurigai pertama kali adalah infeksi tuberkulosis tb paru tb paru adalah infeksi oleh kuman mycobacterium tuberculosis pada organ paru kuman penyebab tb dapat menyerang berbagai organ namun umumnya infeksi primer terjadi di paru penularan penyakit ini yaitu melalui batuk atau bersin penderita dimana kuman dalam air liur tersebut dapat masuk melalui udara ke saluran napas suspek tb adalah seseorang dengan gejala atau tanda tb gejala umum tb paru adalah batuk berdahak lebih dari minggu yang disertai gejala pernapasan nyeri dada sesak napas batukndarah dan atau gejala sistemik demam tidak nafsu makan penurunan berat badan keringat malam dan mudah lelah untuk memastikan diagnosis tb diperlukan informasi gejala khas penyerta lain pemeriksaan fisik umum dan paru serta pemeriksaan penunjang untuk membantu diagnosis pemeriksaan penunjang yang utama adalah pemeriksaan dahak waktu dimana akan diamati keberadaan kuman penyebab tb dibawah mikroskop kemudian dapat pula dilakuka pemeriksaan rontgen dada sebagai konfirmasi atau pemeriksaan darah rutin jika diagnosis sudah ditegakkan maka segera dimulai pengobatan tb mengguakan kombinasi antibiotik yang telah ditetapkan pemerintah pengobatan harus dijalani dengan patuh selama minimal bulan dimana selama pengobatan akan dilakukan pemeriksaan rutin untuk menilai respon pengobatan pada pasien lakukanlah konsultasi lebih lanjut dengak dokter untuk pemeriksaan dan rencana pengobatan selanjutnya sementara hindari batuk bersin serta membuang dahak di tempat umum gunakan masker atau lakukan etika batuk yang benar yaitu dengan menutup mulut dan hidung dengan menggunakan lengan atas dan konsumsi makanan bergizi sekian semoga dapat membantu wassalam,1,0,1,1,1,0
halo isnu terima kasih telah bertanya di alodokter saya coba bantu jawab patah tulang atau fraktur adalah suatu kondisi dimana terjadinya diskontinuitas atau terputusnya jaringan tulang patah tulang disebabkan oleh berbagai macam hal seperti trauma atau kecelakaan pengapuran tulang atau osteoporosis pada usia lanjut aktivitas yang terlalu berat atau berlebihan dan lain sebagainya patah tulang sendiri dibagi menjadi beberapa jenis seperti patah tulang terbuka patah tulang tertutup patah tulang tidak lengkap patah tulang lengkap kondisi yang anda alami berupa patah tulang yang tidak menembus kulit kemungkinan disebabkan karena patah tulang tertutup pada patah tulang yang tertutup kita tidak mengetahui bagaimana keadaan tulang yang mengalami patah apakah mengalami patah tulang yang sederhana apakah patah tulang comminuted apakah patah tulang impacted untuk memastikan bagaimana kondisi tulang yang mengalami patah perlu diperiksakan ke dokter spesialis ortopedi dokter nantinya akan melihat kondisi tersebut dan memastikan nya dengan pemeriksaan rontgen sedangkan benjolan yang anda alami pada daerah tulang yang patah kemungkinan disebabkan karena infeksi pada tulang tersebut atau proses penyembuhan yang tidak sempurna sehingga tulang menjadi tumpang tindih untuk itu sebaiknya segera periksakan diri anda ke dokter terlebih jika anda juga merasakan gejala seperti demam nyeri bengkak dan kemerahan pada tulang tersebut semoga memabantu terima kasih,1,0,1,1,1,0
halo terima kasih atas pertanyaan yang disampaikan ke alodokter kami dapat memahami kekhawatiran yang anda rasakan gejala demam yang disertai keluhan badan pegal pegal dapat disebabkan oleh beberapa kemungkinan yang tersering antara lain common cold dikenal pula dengan istilah selesma yakni infeksi virus pada saluran napas atas keluhan berupa demam bersin bersin hidung tersumbat badan pegal pegal nyeri kepala menurunnya daya pengecapan dan penciuman faringitis yakni radang dinding faring dengan penyebab utama berupa infeksi virus keluhan berupa demam yang tidak terlalu tinggi nyeri tenggorokan batuk mata merah hidung berair badan pegal pegal infeksi virus dengue yakni spektrum penyakit akibat infeksi virus dengue yang ditularkan melalui nyamuk aedes keluhan berupa demam dengan pola pelana kuda nyeri kepala badan pegal pegal dengan tanpa tanda perdarahan berupa bintik bintik merah di kulit mimisan gusi berdarah buang air besar dengan tinja berwarna hitam muntah darah kehitaman malaria yakni penyakit karena infeksi plasmodium yang ditularkan melalui nyamuk anopheles keluhan berupa demam menggigil banyak berkeringat nyeri kepala badan pegal pegal mual muntah diare untuk membantu mengatasi demam dan badan pegal pegal anda dapat menggunakan obat penurun panas dan pereda nyeri yang dijual bebas contoh parasetamol dengan dosis mengikuti petunjuk pemakaian yang tertera pada kemasan obat anda disarankan untuk segera memeriksakan diri ke dokter atau dokter spesialis penyakit dalam bila ada gejala tanda sebagai berikut gejala tidak menunjukkan perbaikan dalam hari pengobatan dengan obat penurun panas dan istirahat yang cukup perdarahan berupa gusi berdarah mimisan bintik bintik merah pada kulit bab berwarna hitam atau merah segar kencing berdarah badan semakin lemas dan jantung nadi berdenyut semakin cepat atau justru melemah hingga tidak teraba sebagai anjuran anda disarankan untuk melakukan langkah langkah berikut ini cuci tangan dengan sabun sebelum makan dan minum perbanyak minum air minimal gelas sehari konsumsi makanan bergizi seimbang secara teratur termasuk sayur dan buah yang kaya vitamin c minimalisasi kontak dengan orang lain dengan keluhan serupa pelihara higienitas lingkungan supaya tidak menjadi sarana perkembangbiakan nyamuk guna memperkaya wawasan anda dapat membaca artikel tentang demam demikian informasi dari kami mudah mudahan senantiasa sehat semoga bermanfaat,1,0,1,1,1,0
hai surya terdapat beebrapa kondisi yang menyebabkan nyeri perut sebelah kanan gangguan pada hati dan empedu hepatitis batu empedu infeksi kandung empedu dsb gangguan pada saluran cerna usus buntu kanan bawah divertikulitis penyakit radang usus ibd inflamatory bowel disease dsb gangguan pada saluran kemih infeksi saluran kemih batu saluran kemih pada wanita gangguan pada organ reproduksi seperti indung telur tuba dsb masalah otot misalnya muscle cramping sering dicetuskan aktifitas sensasi seperti tertekan tertusuk karena aktifitas berlebihan dari otot tertentu psikogenik tumorjika terdapat keraguan anda dapat memeriksakan diri ke dokter selain diwawancara dan pemeriksaan fisik anda dapat diminta untuk melakukan beberapa pemeriksaan sesuai indikasi kecurigaan penyebab lab darah rutin fungsi hati empedu px urin usg dan foto rontgen perut ct scanbeberapa hal yang dapat anda lakukan untuk mengurangi nyeri saat latihan lakukan stretching peregangan yang cukup sebelum mulai berlari hindari makan berlebih jam sebelum berlaribeberapa tautan yang mungkin berguna bagi anda sakit perut sakit perut kanan sakit perut kanan bawah demikian yang dapat saya sampaikan semoga bermanfaat salam dr rico novyanto,1,0,1,1,1,0
halo penggunaan madu diyakini dapat menghilangkan jerawat namun hingga kini masih dibutuhkan penelitian lebih lanjut untuk memastikan hal itu karena penggunaan madu secara ilmiah belum terbukti dapat menghilangkan jerawat selain itu jenis kulit dan efek samping penggunaan madu terhadap seseorang tentunya berbeda beda jika anda mengalami gatal dan merah maka hindari penggunaan madu untuk sementara hingga dilakukannya pemeriksaan ke dokter sebaiknya untuk mengatasi jerawat yang membandel pada wajah dilakukan konsultasi terlebih dahulu dengan dokter pemberian obat ataupun tindakan lainnya akan disesuaikan dengan keluhan dan kondisi yang anda alami dan tentunya dalam menghilangkan jerawat dan bekasnya membutuhkan waktu dan kesabaran karena hal ini membuthkan proses untuk mencapai hasilnya sementara itu ada beberapa tips yang bisa anda lakukan seperti jaga kebersihan wajah dan jangan menggosok terlalu keras jika kulit anda kering gunakan pelembab yang tidak mengandung unsur parfum gunakan sabun dan pembersih wajah yang ringan gunakan air hangat saat membersihkan wajah konsumsi makanan sehat dan bergizi perbanyak buah dan sayuran minum air liter hari hindari merokok dan paparan asap rokok semoga membantu dr theresia,1,0,1,0,1,0
halo faujiah terimakasih atas pertanyaannya untuk alodokter beberapa minggu pertama setelah bayi dilahirkan bayi harus disusui setidaknya setiap jam atau sesuai kebutuhan bayi karena beberapa alasan lambung bayi masih sangat kecil dan tidak bisa menampung banyak susu sehingga bayi sangat cepat lapar produksi susu belum stabil sehingga belum tentu dapat mencukupi kebutuhan bayi hingga bayi kenyang menyusui bayi setiap jam sebaiknya dilakukan pada bulan pertama setelah bulan produksi asi biasanya sudah lebih stabil dan sudah banyak bayi sudah bisa minum dengan baik dan muatan lambungnya juga sudah lebih besar sehingga anda bisa mulai menyusui bayi lebih jarang setiap jam dan semakin besar bayi adan dapat menyusui dengan jarak yang semakin panjang meskipun demikian anda tetap direkomendasikan untuk menyusui sesuai kebutuhan bayi saja on demand kadang ada bayi yang lebih cepat lapar meski sudah berusia di atas bulan sehingga sebaiknya anda tetap menyusui bayi anda bila bayi anda lapar sekian informasi dari saya semoga cukup menjawab dr irna cecilia,1,0,1,0,1,0
hello untuk mengetahui lebih jelas mengenai efek samping masturbasi dan melakukan hubungan seksual yang berlebihan para peneliti bidang kesehatan masih harus melakukan banyak penelitian guna mendapatkan data yang akurat dan valid banyak peneliti menyebutkan bahwa melakukan masturbasi merupakan hal yang baik tetapi di sisi lain dapat meningkatkan perasaan bersalah pada beberapa individu dari beberapa penelitian yang sudah terbit beberapa efek negative jika melakukan masturbasi berlebihan adalah menurunkan jumlah sperma dalam cairan semen menurunkan sensitifitas dan memperlama waktu mencapai ejakulasi dapat menyebabkan pembengkakan dan luka pada organ intim mempengaruhi hubungan social kurangnya konsentrasi dan kemampuan mengingat beberapa penelitian menyebutkan gangguan kesehatan dapat terjadi seperti kelelahan nyeri punggung ejakulasi dini nyeri pada testis nyeri pada panggul namun melakukan hubungan seksual secara aman setia pada satu pasangan dan teratur merupakan tindakan yang menyehatkan efek samping secara biologis kurang lebih sama dengan efek negative yang diperkirakan akan timbul jika melakukan masturbassi yang terlalu sering semoga dapat bermanfaat salam dr henry andrean,1,0,1,0,1,0
dear ririn obesitas adalah kondisi berat badan seseorang dengan lemak yang banyak menumpuk dengan skor indeks massa tubuh lebih dari indeks massa tubuh dibuat dengan membagi berat badan kg dengan kuadrat tinggi badan m imt ult kekurangan berat badan normal atau sehat kelebihan berat badan ugt obesitaspenanganan obesitas adalah dengan mengubah gaya hidup gaya hidup santai dan pola makan yang buruk serta jarang berolah raga adalah faktor risiko utama yang harus diatasi untuk menangani obesitas jika ada faktor lain yang mendasari obesitas seperti diabetes hipotiroid penggunaan obat obatan apneu tidur tekanan darah tinggi maka konsultasi dengan dokter diperlukan berikut tipsnya kurangi makanan berlemak berkalori beralkohol perbanyak sayuran dan buah buahan nasi merah kacang kacangan daging tanpa lemak konsumsi dalam jumlah cukup kurangi makanan bergaram aktivitas fisik dan berolahraga seperti jalan kaki jam minimal kali seminggu hindari penurunan berat badan yang terlalu instan dibutuhkan keinginan dan tekad yang kuat serta disiplin tinggi karena proses penurunan berat badan memerlukan waktu yang lama jika anda memerlukan bantuan obat obatan atau operasi silahkan konsultasi dengan dokter berikut laman yang dapat dibaca obesitas demikian penjelasan saya semoga bermanfaat terima kasih dan salam dr rony wijaya,1,0,1,1,1,0
hallo noviadanya rasa tidak sedap pada hidung dapat disebabkan oleh berbagai macam hal dan bisa saja disebabkan oleh flu ataupun adanya gangguan pada hidung dan daerah di dalam hidung untuk itu dibutuhkan pemeriksaan langsung oleh dokter agar dapat menegakan suatu kelainan apa yang novi alami saat iniadapun kemungkinan yang terjadi adalah flu yang disebabkan oleh bakteri sehingga menyebabkan adanya bau tidka sedap dari infeksi bakteri tersebut adanya polip hidung yaitu pembesaran jaringan di hidung dan biasanya rapuh sehingga mudah terkena infeksi sinusitis yaitu infeksi pada rongga wajah sehingga akan menyebabkan rasa bau tidak sedap dari hidung dan flu yang tidak kunjung menghilang riwayat trauma pada wajah akan menyebabkan gangguan pada hidung dan salurannya sehingga dapat saja terjadinya luka dan atau lecet di bagian dalam sehingga memudahkan terjadinya infeksi dan kemungkinan lainnya untuk itu disarankan novita memeriksakan diri ke dokter secara langsung agar mendapatkan pengobatan yang tepat dan cepat adapun beberapa saran untuk novita lakukan adalah hindari membuang ingus dengan paksa karena dapat memicu terjadinya pembuluh darah di hidung pecah gunakan masker saat berpergian dan juga saat bertemu orang banyak hindari dari paparan asap dan debu konsumsi sayuran dan buah untuk menangkal radikal bebas seperti debu dan asap istirahat dan tidur yang cukup semoga informasinya dapat bermanfaat bagi novidr arnold,1,0,1,1,1,0
