processed_text,1-FR,2-GI,3-PI,4-DM,5-EDTRB,6-RE
salam keluhan yang anda rasakan kemungkinan disebabkan oleh angina stabil dimana terjadi kontraksi pada pembuluh darah koroner dan penyempitan pembuluh darah kaoroner jantung yang menyebabkan keluhan nyeri dada menjalar kondisi ini dapat berlangsung beberapa saat dan kemudian hilang beberapa pemicu keluhan ini stres penyumbatan pembuluh darah koroner obesitas tekanan darah tinggi hiperkolesterolemia payah jantungnamun bila keluhan ini sering muncul sebaiknya anda berkonsultasi langsung dengan dokter jantung untuk mendapatkan pemeriksaan yang diperlukan bila perlu dokter akan melakukan pemeriksaan penunjang untuk menilai fungsi jantung dan sistem yang terkait dengan begitu penanganan awal dapat diberikan sedini mungkin yang perlu anda lakukan adalah hindari rokok dan alkohol bila konsumsi tangani keluhan mag hindari stres istirahat yang cukup olah raga ringan bertahapdemikian info yang bisa kami sampaikan baca juga angina dr ulfi,1,0,1,1,1,0
evelyn yang baik tangan yang kebas atau kesemutan secara medis dikenal dengan paresthesia kondisi kesemutan in setidaknya mengindikasikan masalah pada persarafan yang bisa disebabkan oleh beberapa faktor adapun beberapa faktor tersebut meliputi carpal tunnel syndrome dimana terowongan karpal mengalami pembengkakan sehingga menjepit persarafan serta pembuluh darah yang ada arthritis atau peradangan sendi juga bisa menimbulkan masalah serupa penyakit metabolik seperti diabetes juga bisa menyebabkan gangguan saraf gangguan saraf lainnya seperti multipel sklerosis tumor otak stroke untuk mencari tahu penyebab pasti dari kondisi yang dialami tante anda penting untuk dilakukan pemeriksaan secara langsung oleh dokter saraf mandi air hangat dapat membantu melemaskan otot dan diharapkan bisa membantu mengurangi tekanan sekitar saraf tangan berikut kami lampirkan artikel mengenai tangan kesemutan semoga bermanfaat dr n k arief,1,0,1,1,1,0
alo aswin terima kasih atas pertanyaannya gigi berlubang merupakan masalah yang sering muncul pada gigi dan hal ini biasanya disebabkan oleh faktor sering mengonsumsi makanan manis penumpukan bakteri dan kebersihan mulut yang tidak terjaga sehingga plak yang menumpuk akan diubah oleh bakteri menjadi asam yang dapat mengikis gigi dan mempengaruhi struktur di sekitarnya biasanya gigi berlubang akan menimbulkan gejala seperti nyeri dan apabila dibiarkan begitu saja akan menimbulkan komplikasi seperti infeksi biasanya dokter gigi akan melakukan penanganan pada gigi berlubang tergantung dari kondisinya seperti dengan tambal gigi kurung gigi perawatan saluran akar gigi ataupun cabut gigi termasuk menggunakan alat alat seperti bor gigi dalam maraknya wabah covid sekarang ini kunjungan ke puskesmas dan rumah sakit kecuali pada kondisi gawat darurat memang tidak dianjurkan terutama dengan penggunaan alat alat kedokteran yang melibatkan bagian mulut karena infeksi covid ditularkan melalui droplet atau percikan yang keluar dari saluran napas seperti air ludah batuk dan bersin di mana penggunaan alat kedokteran gigi seperti bor dapat memudahkan penularan tersebut oleh karena itu kemungkinan besar semua praktek dokter gigi tidak menggunakan alat kedokteran gigi seperti bor untuk sementara namun tidak ada salahnya untuk anda memastikannya dengan menghubungi praktek dokter gigi yang anda akan kunjungi namun untuk sementara ini pemberian mefenamic acid atau asam mefenamat mampu meredakan peradangan pada gigi berlubang termasuk nyeri yang dirasakan semoga informasi ini dapat membantu salam,1,0,1,1,1,0
alo dewi anda sebaiknya menambahkan keterangan sejak kapan gejala anda rasakan dan bila apa timbul gejala tersebut sesak napas yang timbul pada kondisi tertentu disertai mengi batuk berulang dan gambaran bronkitis pada foto sinar x kemungkinan mengarah kepada asma bronkiale atau bronkitis kronik serangan asma tidak harus terjadi pada masa kanak kanak melainkan dapat pula baru terjadi saat dewasa pada asma seseorang mengalami sensitivitas terhadap suatu kondisi atau suatu bahan yang menyebabkan saluran pernapasan sembab dan menyempit saluran pernapasan mengalami peradangan dan terjadi pengeluaran lendir berlebih hal tersebut yang menyebabkan seseorang menjadi sesak napas dan batuk pencetusnya beragam misalnya perubahan emosi kelelahan debu asap makanan tertentu bulu hewan dan sebagainya anda dapat memeriksakan diri langsung kepada dokter paru untuk mengetahui kondisi anda lakukan kontrol secara rutin hingga tegak diagnosis anda dokter mungkin perlu melakukan uji fungsi paru dan foto sinar x ulangan terapinya akan disesuaikan dengan diagnosis tersebut usahakan anda rutin berolahraga dan perbaiki ventilasi ruangan harapannya hal tersebut mampu mengurangi kekambuhan sesak napas salam,1,1,1,1,1,0
alo mellania gejala nyeri pada lutut dapat disebabkan oleh berbagai hal mulai dari artritis peradangan pada sendi cedera pada ligamen lutut robekan meniskus bursitis dan sebagainya dokter perlu menanyakan lebih lanjut mengenai riwayat keluhan tersebut sifat nyeri yang dirasakan tajam tumpul penjalaran nyeri ke bagian tubuh lain ada gejala bengkak atau kemerahan di lutut apakah ada keterbatasan pergerakan lutut riwayat trauma cedera pada lutut riwayat peradangan sendi sebelumnya berapa usia anda apa aktivitas anda sehari hari berapa berat badan anda nyeri lutut akibat penyebab di atas umumnya hanya terbatas pada lutut saja atau bisa juga melibatkan beberapa sendi lain jika yang anda keluhkan lebih ke rasa pegal pegal di sendi sendi athralgia atau nyeri otot myalgia disertai sakit kepala demam meriang rasa capek tidak nafsu makan kumpulan gejala tersebut disebut flu like symptoms penyebabnya bukan hanya influenza flu tapi juga bisa karena penyakit infeksi lain virus bakteri atau efek samping pengobatan obat obat pereda nyeri dapat mengurangi gejala gejala yang anda rasakan namun demikian alangkah lebih baik jika menangani penyakit yang mendasari keluhan tersebut untuk mendiagnosis suatu penyakit dokter perlu melakukan anamnesis yang terarah dan pemeriksaan fisik pemeriksaan penunjang seperti laboratorium darah foto rontgen dimintakan sesuai indikasi yang ditemukan dari pemeriksaan apabila nyeri bertambah berat atau tidak mereda setelah mengonsumsi pereda nyeri kesulitan menggerakan sendi sendi nyeri kepala disertai muntah yang menyemprot demam tinggi sebaiknya anda memeriksakan diri secara langsung dengan dokter demikian penjelasan dari saya semoga bermanfaat,1,1,1,1,1,0
selamat sore lut zer terima kasih ya sudah bertanya di alodokter sangobion vita tonik termasuk ke dalam suplemen penambah zat besi darah disertai beberapa kandunga vitamin dan mineral lain dimana suplemen ini terutama ditujukkan bagi orang orang yang mengalami anemia kekurangan hemoglobin darah akibat kekurangan asupan zat besi bila anda bukan termasuk ke dalam orang orang yang membutuhkan suplementasi zat besi maka konsumsi suplemen ini tidak dianjurkan dikarenakan dapat menimbulkan efek samping berupa zat besi yang berlebihan di dalam tubuh dan dapat menumpuk pada beberapa organ tertentu yang akan menyebabkan penyakit lain di kemudian hari oleh karena itu sebaiknya anda konsultasikan terlebih dahulu dengan dokter apakah memang kondisi anda saat ini membutuhkan suplememntasi zat besi atau tidak jika tidak jangan mengonsumsinya atas keputusan sendiri bila memang memerlukan gunakanlah sesuai anjuran yang sudah diberikan oleh dokter mengenai interaksinya dengan obat tb sendiri hingga saat ini belum ada data yang menyatakan namun secara umum pengobatan tb bukan suatu kontraindikasi bilamana memang anda membutuhkan asupan suplemen ini semoga membantu,1,0,1,0,1,0
hai isthy terimakasih sudah bertanya di alodokter com candidiasis adalah penyakit infeksi kulit yang disebabkan oleh jamur sering dialami pada daerah yang sering berkeringat seperti lipatan payudara lipatan bokong dan paha resiko mengalami penyakit ini meningkat pada seseorang yang gemuk tidak mengganti pakaian yang basah dan suka menggunakan pakaian ketat penyakit ini ditandai dengan ruam kemerahan yang terasa gatal pengobatannya adalah dengan mengoleskan salep anti jamur tidak diperlukan antibiotik untuk mengatasi penyakit ini anda dapat membeli obat anti jamur dan antigatal di apotek namun sebaiknya anda konsultasi terlebih dahulu dengan dokter terdekat dokter akan melakukan pemeriksaan untuk memastikan apakah memang candidiasis yang menyebabkan keluhan pada kulit anda atau hal lainnya sementara itu anda janganlah menggaruk ruam yang terasa gatal untuk menghindari terjadinya luka garukan luka garukan beresiko menjadi luka yang terinfeksi demikian semoga bermanfaat,1,0,1,1,1,0
halo dari kondisi yang anda alami berulang kemungkinan anda alergi terhadap kandungan bahan yang terdapat pada softlens atau cairan pembersih nya atau kondisi mata anda termasuk mata kering atau penyakit lainnya yang menyebabkan keluhan yang sama berulang terus selain itu penggunaan yang kurang tepat seperti perawatan kebersihan lama pemakaiannya penyimpanan dan penggunaan yang kurang tepat juga dapat menyebabkan iritasi dan infeksi berulangsecara kosmetik pemakaian softlens memang memberikan hasil yang lebih baik tetapi memberikan risiko yang lebih tinggi terhadap munculnya infeksi atau iritasi yang berbahaya bagi mata hingga menyebabkan kebutaan apakah anda menggunakan softlens karena kelainan refraksi seperti rabun jauh minus rabun dekat plus atau silinder jika iya maka saya sarankan anda menggunakan kacamata dalam mengatasi kondisi mata anda sehari hari dan sebaiknya melakukan konsultasi terlebih dahulu dengan dokter spesialis mata sebelum menggunakan softlens anda dapat membaca artikel dan topik terkait dibawah ini yang tidak boleh menggunakan softlens risiko penggunaan lensa kontak semoga membantu dr rievia,1,1,1,1,1,0
halo eki terimakasih sudah bertanya di alodokter com sulit tidur atau insomnia adalah kondisi saat seseorang mengalami kesulitan untuk tidur atau tidak bisa tidur cukup lama sesuai dengan waktu yang dibutuhkan tubuh meski dia memiliki kesempatan untuk melakukannya penyebab insomnia sendiri beragam diantaranya • psikologis stress cemas depresi rasa kehilangan dsb • masalah kesehatan fisik gangguan pernafasan gangguan jantung masalah otot dan sendi gangguan hormone saraf dsb • pola hidup yang tidak baik waktu tidur yang tidak tetap makan dalam porsi besar sebelum tidur konsumsi minuman berkafein nikotin dan beralkohol sebelum tidur • faktor lingkungan suhu kamar terlalu panas lampu terlalu terang suara bising dsb • penggunaan beberapa pada beberapa macam obat penggunaan obat tidur hanya digunakan oleh dokter pada tahap akhir pengobatan saja dan obat tidur tidak akan dijual bebas tanpa resep dokter untuk menangani insomnia sendiri perlu dicari tahu penyebabnya apakah ada gangguan kesehatan maka akan diobati lebih dulu atau ada hal lain oleh karena itu kami sarankan anda untuk menemui dokter agar dilakukan wawancara medis pemeriksaan fisik dan pemeriksaan lanjutan bila diperlukan berikut beberapa hal yang dapat anda lakukan sebagai penanganan awal • atur jadwal tidur anda tepat waktu setiap malamnya • hindari mengkonsumsi minuman berkafein nikotin ber alcohol sebelum tidur • atur suasana kamar anda agar dapat membantu lebih mudah terlelap lebih gelap beri wangi wangian agar relaks dan hindari bising • hindari stress berlebih kelola stress dengan bijak • kurangi porsi tidur siang anda dan kurangi aktifitas di malam hari • periksakan diri anda untuk mencari penyebab dari insomnia • olah raga rutin • kontrol berat badan anda karena overweight berhubungan dengan insomnia untuk lebih lanjut dapat membaca artikel berikut insomnia sekian informasi yang dapat kami sampaikan semoga bermanfaat salam dr prasetyo,1,0,1,1,1,0
alo sandi terima kasih atas pertanyaan anda seseorang dikatakan mengalami diare jika frekuensi bab menjadi lebih sering lebih dari kali per hari disertai dengan perubahan tinja yang menjadi lebih cair pada umumnyam diare disebabkan oleh infeksi usus yang dapat disebabkan oleh infeksi virus bakteri atau parasit attapulgite adalah salah satu obat yang digunakan untuk mengatasi gejala diare dengan cara memperlambat gerakan usus besar dan mengikat bakteri atau racun yang menyebabkan usus besar dengan memperlambat gerakan usus besar penyerapan air di dalam usus dapat terjadi sehingga tinja yang terbentuk lebih padat selain itu gerakan usus yang melambat ikut meredakan keluhan kram perut obat ini hanya dapat digunakan oleh anak anak berusia tahun ke atas dan orang dewasa untuk orang dewasa obat ini dapat dikonsumsi sebanyak tablet untuk setiap diare dan maksimal dosis per hari adalah tablet dengan demikian jika anda masih belum mencapai dosis maksimal maka anda dapat mengkonsumsi tablet tersebut sesuai anjuran dokter dan tidak perlu mengkhawatirkan selang waktu antar dosis pengobatan diare pada akhirnya akan disesuaikan dengan penyebabnya walaupun demikian penanganan yang tidak kalah pentingnya bagi penderita diare adalah dengan menjaga asupan makanan dan minuman agar asupan nutrisi tetap terjaga dan menghindari terjadinya dehidrasi selain obat yang dianjurkan oleh dokter anda dianjurkan untuk mengkonsumsi air putih jus kaldu atau oralit untuk mencegah dehidrasi jangan ragu untuk kembali berkonsultasi dengan dokter jika anda masih mengalami gejala yang sama setelah menyelesaikan obat yang diberikan dokter atau jika gejala ini malah bertambah buruk anda juga dianjurkan untuk melakukan saran berikut ini hindari konsumsi makanan pedas berminyak dan berlemak hindari konsumsi minuman berkafein bersoda dan beralkohol hindari mengkonsumsi makanan dan minuman yang tidak terjaga kebersihannya selalu mencuci tangan sesudah ke toilet dan sebelum makan semoga informasi ini membantu anda,1,0,1,1,1,0
alo terimakasih atas pertanyaan anda di alodokter rapid test covid merupakan suatu prosedur yang di gunakan untuk melakukan pemeriksaan skrining pada orang yang mungkin terkena virus covid namun pemeriksaan ini harus di tegakkan lagi dengan pemeriksaan pcr atau swab guna untuk melihat apakah virus benar adanya berada di dalam tubuh karena rapid tes hanya mendeteksi antibodi yang muncul setelah tubuh terpapar covid antibodi tersebut adalah igm dan igg yang mana kedua antibodi itu akan muncul setelah tubuh terinfeksi covid selama hari apabila anda terinfeksi covid kurang dari hari dan kemudian di periksa rapid maka hasil yang keluar bisa jadi negatif oleh sebab itu orang yang mengalami gejala namun rapid negatif harus tetap di lakukan pemeriksaan swab perlu di ketahui rapid tes hanya mendeteksi virus covid bukan mendeteksi bakteri atau virus lain terlebih lagi sinusitis sinusitis merupakan suatu peradangan rongga sinus yg dapat di sebabkan karena bakteri oelh sebab itu apabila hasil yang keluar postif itu bukan karena sinusitis anda agar terhindar dari virus covid selalu terapkan pola hidup bersih dan sehat semoga bermanfaat sehat selalu,1,0,1,1,1,0
alo terimakasih atas pertanyaannya katarak adalah salah satu gangguan pada mata yang banyak dialami oleh lansia kondisi ini terjadi saat lensa mata mengeruh bisa murni karena proses penuaan karena suatu penyakit misalnya hipertensi diabetes karena cidera dan banyak lagi kemungkinan pencetus lainnya penderita katarak bisa merasakan penglihatannya buram secara berangsur hingga akhirnya sangat sulit beraktifitas dengan normal katarak bisa ditangani dengan operasi yakni dengan menghancurkan lalu mengeluarkan lensa yang telah keruh tersebut lalu menggantinya dengan lensa buatan yang baru usai operasi penderita bisa mengalami beberapa efek samping termasuk mata yang terasa mengganjal berair kemerahan buram pandangan ganda dan juga pusing penanganan atas efek samping pasca operasi katarak ini bisa berbeda tergantung keparahannya bisa cukup diberikan obat dilakukan pembedahan ulang dan sebagainya terkait pertanyaan anda masa pemulihan yang diperlukan pasca menjalani operasi katarak biasanya ialah berkisar antara hingga minggu apabila usai operasi ayah anda mengalami suatu keluhan yang membuatnya harus menjalani pembedahan ulang tentu masa penyembuhannya bisa berlangsung lebih lama hal ini dipengaruhi pula dengan kondisi kesehatan ayah anda secara umum sebab itu yang paling berwenang menjawab pertanyaan anda tentulah dokter mata yang mengoperasi ayah anda jadi baiknya anda bertanya langsung pada beliau ya sementara ini guna mengoptimalisasi penyembuhan pasca operasinya ayah anda sebaiknya jalani pengobatan pasca operasi sesuai saran dokter memperbanyak dulu beristirahat jangan beraktifitas di luar rumah kecuali jika mendesak sekali itupun harus mengenakan kacamata pelindung tidak memegang mata dengan tangan kotor jaga mata agar tetap bersih dan tidak kemasukan benda asing batasi penggunaan gadget tidur lebih awal jangan dulu mencuci muka dengan sabun yang keras jangan dulu beraktifitas berat termasuk olahraga berat atau membereskan rumah dan jalani selalu gaya hidup sehat semoga membantu ya,1,0,1,1,1,0
hai febynurul kondisi yang anda alami secara umum dapat disebabkan oleh penyakit asam lambung gastritis pankreatitis maag konsultasikan dengan dokter anda mengenai kondisi yang anda alami untuk penanganan dan informasi lebih lanjut pemeriksaan fisik dapat membantu hal yang dapat anda lakukan yakni hindari konsumsi makanan yang terlalu pedas berlemak dan asam jaga pola makan teratur kelola stres hindari alkohol dan rokok serta soda dan kopi penanganan spesifik tergantung penyebab yang mendasari semoga bermanfaat dan terima kasih salam dr alyssa,1,0,1,1,1,0
terima kasih sulfiana efy atas pertanyaannya tumor payudara merupakan benjolan yang terdapat pada payudara benjolan ini bisa bersifat jinak ataupun ganas tergantung dari hasil pemeriksaan laboratorium beberapa benjolan yang bersifat jinak adalah fibroadenoma mammae fam kista papiloma intraduktal dan lain laindokter selalu memberikan obat yang telah terbukti secara klinis bermanfaat untuk pasien obat yang diberikan oleh dokter sudah melalui berbagai tahapan penelitian mulai dari uji pada laboratorium bila dinyatakan aman baru diuji pada hewan bila lolos uji pada hewan maka obat tersebut baru akan diujikan ke sejumlah kecil manusia bila masih aman dan terbukti efektif barulah obat tersebut diberikan pada manusia dalam jumlah yang lebih banyak bahkan setelah pemasaran obat tersebut masih terus berada dalam pengawasan obat herbal tidak mempunyai bukti ilmiah bermanfaat jangan tergiur dengan iklan iklan yang kebenarannya tidak dapat dipertanggung jawabkan selain itu kandungan dalam obat herbal pun tidak diketahui sehingga selain efektivitasnya yang tidak diketahui efek sampingnya pun tidak diketahui beberapa obat herbal yang memang sudah terbukti berkhasiat bawang putih dapat membantu menurnkan tekanan darah dan sedikit memiliki efek antibiotik angkak dapat membantu menurunkan kadar kolesterol dan lain lainsaya tulis di atas membantu yang berarti harus tetap mengkonsumsi obat dari dokter penggunaan obat herbal seringkali membuat pasien tidak mengkonsumsi obat dari dokter dan menyebabkan penyakit bertambah parah sebaiknya anda segera memeriksakan diri anda ke dokter spesialis bedah untuk mendapatkan pemeriksaan terhadap benjolan yang ada anda juga dapat membaca artikel terkait tumor payudara belum tentu kanker cara aman konsumsi obat herbal demikian jawaban dari saya semoga membantuandika surya,1,0,1,1,1,0
halo fheltin terima kasih atas pertanyaannya ultrasonografi usg adalah salah satu pemeriksaan penunjang yang bertujuan untuk membantu dokter mendiagnosis penderita setelah mengetahui keluhan dan memeriksa penderita karena perannya sebagai pemeriksaan penunjang hasil usg tidak dapat diinterpretasikan sendiri dan harus dihubungkan dengan informasi mengenai keluhan dan pemeriksaan fisik dokter hasil usg tersebut menunjukkan kelainana lesi yang berbentuk lonjong pada area perut kanan bawah yang lebih gelap dikelilingi dengan area yang lebih terang disertai dengan pelebaran ususu di sekitarnya pada area lambung ditemukan sekresi berlebihan dengan udara di dalamnya sedangkan organ lain hati kantung empedu limpa pankreas kedua ginjal kandung kemih rahim normal silakan anda kembali berkonsultasi dengan dokter yang memeriksa anda agar dokter dapat mengetahui hasil ini dan menjelaskan pada anda kondisi yang anda alami sesuai dengan keluhan dan pemeriksaan fisik dokter dokter kemudian akan menentukan penanganan selanjutnya semoga membantu dr aloisia,1,0,1,1,1,0
halo reni marlina tb paru merupakan suatu proses infeksi pada paru yang diakibatkan oleh infeksi bakteri di mana gejala dari infeksi ini adalah batuk lama lebih dari minggu berkeringat pada malam hari penurunan berat badan dapat disertai batuk darah dan lain lain untuk penegakan diagnosis dari tb paru dapar dilakukan wawancara mendalam mengenai keluhan pemeriksaan fisik dan pemeriksaan penunjang seperti pemeriksaan dahak dan juga pemeriksaan tambahan dengan foto rontgen berdasarkan hasil foto rontgen ibu anda hasilnya menunjukkan gambaran tb paru yang jelas untuk pengobatannya sendiri dilakukan secara berobat jalan dengan pemberian antibiotik baiknya segera konsultasikan hal ini dengan dokter yang merawat ibu anda sehingga bisa segera diberikan pengobatan demikian informasi yang bisa saya berikan semoga bermanfaat dr taneya putri zahra,1,0,1,1,1,0
hai dini terima kasih untuk pertanyaannya sebagai informasi tekanan darah tinggi atau hipertens i merupakan kondisi yang berlangsung lama kronis dimana terjadi peningkatan tekanan darah pada dinding pembuluh darah arteri seseorang dapat didiagnosa menderita hipertensi apabila dalam x pengukuran berturut turut di dapatkan hasil tekanan darah yang tinggi tekanan darah dapat meningkat sementara apabila dipengaruhi oleh aktivitas fisik seperti habis berolahraga dan emosi panik stres dan tegang peningkatan sementara ini bukan sesuatu yang perlu dikhawatirkan namun pada kasus anda masih belum diketahui peningkatan tekanan darah tersebut apakah sementara atau tidak beberapa kondisi yang dapat menyebabkan keluhan tekanan darah tinggi dan jantung berdebar yang dialami diantaranya hipertensi sekunder dimana hipertensi dapat disebabkan adanya kondisi lain pada tubuh seperti gangguan pada kelenjar adrenal penyakit ginjal efek samping obat obatan sleep apnea masalah pada kelenjar tiroid dan paratiroid dsb hipertensi primer faktor penyebab hipertensi masih belum jelas adanya masalah pada jantung seperti gangguan irama jantung serangan jantung dsb terutama jika detak jantung cepat dan berdebar diikuti sesak napas nyeri dada lemas dan pusing serangan panik terutama jika jantung berdebar disertai rasa takut yang berlebihan dan dipicu penyebab tertentu aktivitas fisik yang berlebihan seperti olahraga peningkatan hormon tertentu seperti saat kehamilan atau menstruasi hormon adrenalin saat stres kondisi medis lain seperti anemia hipertiroid dehidrasi terlalu banyak kemungkinan kondisi yang mendasari keluhan yang dinni alami oleh karena itu sangat disarankan untuk memeriksakan diri ke dokter guna evaluasi lebih lanjut pastikan menit sebelum tekanan darah diukur anda tidak berolahraga merokok atau minum minuman berkafein agar hasil lebih akurat selain pengukuran tekanan darah dokter juga mungkin melakukan pemeriksaan fisik dan penunjang lain seperti tes darah rekam jantung dsb apabila diperlukan dokter kemudian akan memberikan terapi yang sesuai artikel mengenai tekanan darah normal dapat dibaca sebagai tambahan sekian semoga bermanfaat dr sonia l,1,1,1,1,1,1
alo terimakasih telah menggunakan layanan konsultasi alodokter celana dalam yang basah dibagian belakang tanpa kita sadari harus di evaluasi terlebih dahulu ada berbagai penyebab yang dapat memicu hal tersebut diantaranya karena keringat yang berlebihan di area genital kemaluan hingga penyebab medis seperti inkontinensia alvi atau ketidakmampuan dalam menahan buang air besar sehingga kotoran keluar dengan sendirinya baik sadar maupun tanpa disaring selain itu dapat juga disebabkan oleh obat obatan khususnya obat obatan yang dapat mengganggu metabolisme lemak didalam saluran pencernaan oleh sebab itu perlu evaluasi apakah terdapat ampas kotoran yang menempel didalam celana anda tidak perlu merasa khawatir bila kondisi tersebut tidak berlangsung terus menerus jika dicurigai mengalami gangguan dalam menahan buang air besar sebaiknya lakukan pemeriksaan ke dokter terdekat untuk mendapatkan evaluasi lebih lanjut demikian informasi yang dapat kami sampaikan semoga membantu,1,0,1,1,1,0
