processed_text,ac,air_panas,bau,general,kebersihan,linen,service,sunrise_meal,tv,wifi
"beyond expectation, tanpa menggunakan kupon diskon pun properti ini sangat worth it, kamar sangat bersih dan rapih, luas, lengkap, sampai kompor elektrik pun tersedia di kamar, cocok untuk long stay, suasana sangat nyaman, tenang, pelayanan sangat baik, hanya duct pembuangan di kamar mandi kotor sekali banyak bekas residu sabun dan rambut.",neut,neut,neut,neut,pos,pos,pos,neut,neut,neut
tv nya lain kali diperbaiki ya,neut,neut,neut,neut,neut,neut,neut,neut,neg,neut
bagus seh tp AC ny panas...,neg,neut,neut,neut,neut,neut,neut,neut,neut,neut
"wifi gratis cuma di lobby, kamar mandi ada serangganya, kamar bau rokok, channel tv lengkap, kamar cukup bersih, sandal hotel putus",neut,neut,neg,neut,pos,neut,neut,neut,pos,neg
"banyak nyamuk, air mati lalu nyala tapi berwarna kehitaman, hot shower tidak berfungsi, wi-fi tidak tahu passwordnya, snack dan minum tidak diberi kalau tidak diminta. Namun kamar cukup nyaman, tenang, ranjang empuk, lokasi dekat dengan warung makan dan restoran, ac dingin, ada dispenser untuk air panas didalam kamar, ada toiletries dan handuk juga",pos,neg,neut,neut,neut,neg,neut,neut,neut,neg
"Cukup baik kok. Tapi, kamar yg saya dpt no window. dan handuknya kotor,huft. Selebihnya kaya ac dan air panas si oke aja.",pos,pos,neut,neut,neut,neg,neut,neut,neut,neut
"Kanar kotor, ada bekas sampah plastik di dalam kamar",neut,neut,neut,neut,neg,neut,neut,neut,neut,neut
"Kamarnya bocor,  layanannya kurang baik, beberapa penjaganya  kurang sopan membuat jadi tidak nyaman,  tapi lumayanlah ya kalau buat budget hotel. ",neut,neut,neut,neut,neg,neut,neg,neut,neut,neut
"Pengalaman  pertama  menggunakan fasilitas airy pemesanan dan pembayaran mudah. Fasilitas  lumayan tp sayangnya tdk ada konfirmasi masalah sarapannya, jdi sy dan istri trpaksa sarapan di luar.",neut,neut,neut,neut,neut,neut,neut,neg,neut,neut
"Overall baik murah pelayanan prima semua fasilitas lengkap sesuai yang ditawarkan pada saat reservasi... namun, salah satu kamar dr pesanan saya yang ACnya panas. untungnya pihak hotel bersedia mindahkan kamar ke yg lebih baik... NICE airy !!!",neg,neut,neut,pos,neut,neut,pos,neut,neut,neut
air panasnya kurang hmmm sama wifi gak nyampe :((,neut,neg,neut,neut,neut,neut,neut,neut,neut,neg
"Dapat kamar lantai 3 g bisa tersambung ke wifi, sempet ada kecoa di kamar mandi tpi msih bisa diatasi 😄, jenis pintu yg di geser ( saran saja lebih baik pilih jenis pintu yg biasa aja biar lebih rapat saat di kunci, pelayanan baik, kamar cukup bersih, semoga ke depannya lebih baik, lokasi cukup strategis. ",neut,neut,neut,neut,neg,neut,pos,neut,neut,neg
"Ukuran kamar kecil tapi cukup lah, wifi kebetulan lagi rusak, sinyal sangat susah krn kamar dilantai bawah, kebersihan baik, ac dingin, tv ada n berfungsi. Selimut, handuk, snack, air mineral disediakan. Pelayanan bapak kosnya cukup baik dan helpful.",pos,neut,neut,neut,pos,pos,pos,neut,pos,neg
"overall sy puas dgn layanan airyroom hanya saja yg perlu dperbaiki adalah kamar mandi yg agak bau saat ptama saya masuk, mhn dksh pengharum atau karbol..  ",neut,neut,neg,neut,neut,neut,pos,neut,neut,neut
"dekat dg jatimpark 2, kamar bersih cuma pada saat datang guest house sedang di renovasi jd banyak debu. saat itu saya bawa 2 bayi. jd keluar hotel hanya untuk ke jatimpark saja",neut,neut,neut,neut,pos,neut,neut,neut,neut,neut
sudah keempat kali dan yakin akan kembali tapi sayangny fasilitas air hangat tidak berfungsi dan juga semprotan di kmaar mandi,neut,neg,neut,neut,neut,neut,neut,neut,neut,neut
kamar dan Fasilitas baik cuman gk ada coklat bang bangnya,neut,neut,neut,neut,neut,neg,neut,neut,neut,neut
"mudah dicari, tapi kamar lebih sempit dari yg dibayangkan, air panas tidak berfungsi, sarapan baik. overall kalo cuma semalam gak masalah",neut,neg,neut,neut,neut,neut,neut,pos,neut,neut
"Dr luar bagus ada kolam renang, balkon yg lgs ke kolam renang. tp pas msk kmr, sy dpt kmr no.6, AC sering mati sendiri, udara yg dikluarkan ac agak bau. aroma bantal jg kurang sedap.",neg,neut,neg,neut,neut,neg,neut,neut,neut,neut
"Pelayannya tidak ramah , kalau ada tamu tidak dituntun untuk ke kamarnya . Masa kita bayar tapi mere",neut,neut,neut,neut,neut,neut,neg,neut,neut,neut
wifi putua putus dan tidak stabil,neut,neut,neut,neut,neut,neut,neut,neut,neut,neg
shower mati deh receptionisep kurang senyum ,neut,neut,neut,neut,neut,neut,neg,neut,neut,neut
"kamar mandinya kotor dan saluran airnya kesumbat jadi air ngenggenang dan meluap ke kamar, jadi bikin kamar banjir..",neut,neut,neut,neut,neg,neut,neut,neut,neut,neut
"pelayanan bagus, suasanya jg nyaman, hanya saja pas pertama masuk kamar bau kampernya krasa bgt",neut,neut,neg,neut,neut,neut,pos,neut,neut,neut
"Tempat tidurnya kotor, bantalnya bau semua... buat badan jadi gatal kayak banyak hewannya, jadi tidak bisa tidur dengan nyenyak. Tempat parkir terlalu sempit, sampai harus di titipkan ke lahan parkir yang ada di sebrang hotel.",neut,neut,neut,neut,neg,neg,neut,neut,neut,neut
bagus bersih wifi lemot anduk bau itu saja yg d benahi selebihnya nyaman saja,neut,neut,neut,pos,neut,neg,neut,neut,neut,neg
"kamarnya masih perlu dibersihkan,  karen kematen wajtu bermalam bau asap roko,  selebihnya pelayanan baik",neut,neut,neg,neut,neg,neut,pos,neut,neut,neut
"kamar rapi dan wangi, dapet gift coklat lg☺ tp sayang kamar mandinya kotor.. bekas2 jaringan laba2 di standing shower, ada binatang kecil di bawah wastafel dan ada kecoanya 😢",neut,neut,pos,neut,neg,neut,neut,neut,neut,neut
"km mandi bau, anduk tdk ada, sudah saya minta tdk di kaish.",neut,neut,neg,neut,neut,neg,neut,neut,neut,neut
sudah nyaman hanya saya air AC bocor sehingga membuat basah lantai di kamar tolong untuk service kamar lebh di perhatiin,neg,neut,neut,neut,neut,neut,neg,neut,neut,neut
"Sungguh liburan yang sangat mengecewakan, pelayanan yang sangat buruk dan staff yang tidak care terhadap guest. dalam 1 hari menginap 2 masalah terjadi menghampiri saya, 1 HP saya terkena tetesan air dari AC Trouble. 2 Mobil di parkiran di serempet mobil guest lain, saat security di tanya jawabannya hanya tidak tau 😒.",neg,neut,neut,neut,neut,neut,neg,neut,neut,neut
Per bagus wafi karna belum sampai ke kamar. Tambahkan menu untuk makanan di kantinnya,neut,neut,neut,neut,neut,neut,neut,neg,neut,neg
asik dikamar ada snack gratis dan air minum kamarnya bersih nyaman cuma air hangatnya aja suka ada suka ngk jd ngk bisa dipastikan kalau mau pake air hangat . thx,neut,neg,neut,neut,pos,pos,neut,neut,neut,neut
"murah dan nyaman. dekat kampus, banyak makanan. minusnya shower nya suka error, mending ganti model yang biasa saja.. berat juga kepala shower nya.. minus kedua wifi tidak masuk kamar.",neut,neut,neut,neut,neut,neut,neut,neut,neut,neg
"penginapan kedua syaa disini, overall bagus dan nyaman hanya saja ada kendala di air panasnya",neut,neg,neut,pos,neut,neut,neut,neut,neut,neut
"kamar luas bersih dan staff nya ramah,dari hotelnya cukup puas, box mill ariy nya tidak ada kata pekerja hotel mereka suda email ke pusat ariy tapi blm ada tanggapan dari ariy, tolong ariy direspon dgn cepat, jangan sampai penginap kecewa.  ",neut,neut,neut,neut,pos,neg,pos,neut,neut,neut
"desainnya suka bali bgt, makanan murah tapi lumayan lama sampainya, dan wc nya agak serem sih dan kotor juga wc nya pasir dimana2. pw sih tapi hotelnya buat santai2 di kursi depan",neut,neut,neut,neut,neg,neut,neut,neut,neut,neut
"untuk kali ini saya dapat kamar yang bau kencing, dan bantal airy yg warna biru juga itu terasa bau sehingga kurang nyaman jadinya.. sangat berbeda dari sebelumnya..",neut,neut,neg,neut,neut,neg,neut,neut,neut,neut
"tempat tidur nyaman, kamar bersih, ada air panas. pelayannya ramah. kamar mandi bersih. 2 malam yg sangat nyaman. tpi sayangnya tv nya antenanya gak bagus. nyala tapi tv nya banyak semutnya 😅",neut,pos,neut,neut,pos,neut,pos,neut,neg,neut
Nyaman pelayanan sigap berasa di rumah.. Hanya saja soal privasi kurang krn penjaga rumah nya sering masuk kamar tanpa diminta di saat tamu tidak ada. ,neut,neut,neut,neut,neut,neut,neg,neut,neut,neut
ac sepertinya harus diservice..,neg,neut,neut,neut,neut,neut,neut,neut,neut,neut
Sederhana cuma AC-nya salah pasang tuh jadi tidak ngaruh ke ruangan.,neg,neut,neut,neut,neut,neut,neut,neut,neut,neut
hot shower kadang bisa,neut,neg,neut,neut,neut,neut,neut,neut,neut,neut
"Kurang memuaskan . Apa apa suruh bayar -,- . Handukpin ada biaya tambahan",neut,neut,neut,neut,neut,neg,neut,neut,neut,neut
Water heater tidak nyala & ac kurang dingin. Selebihnya pelayanan ok,neg,neg,neut,neut,neut,neut,pos,neut,neut,neut
"Luas kamar tertera 20 m2 kenyataannya gk sampe, dan ac kurang dingin, subuh kebangun karena gerah",neg,neut,neut,neut,neut,neut,neut,neut,neut,neut
"Pelayanan ramah customer service ramah. Cuma bantal kecil agak bau dan selimutnya juga, pintu kamar ",neut,neut,neut,neut,neut,neg,neg,neut,neut,neut
"Lokasi dekat stasiun Solo balapan, kamar bersih&wangi, cuma kamar mandi di 311 ada wangi kurang sedap, beda dengan hotel lain disini ada welcome snakc bagus, harga lumayan cocok. coba ada lift donk.",neut,neut,neg,neut,pos,pos,neut,neut,neut,neut
"sayangnya fasilitas Hotel msi Kurang Lengkap... gak ada pemanas Air, toilet Sedikit Bau, view luar jendela sgt Kotor, sampah Plastik puntung Rokok  bahkan K*dom berserakan di luar jendela, n Sendal gak ada dgn alasan Soldout...",neut,neut,neg,neut,neg,neg,neut,neut,neut,neut
"Sprei &  bed cover tidak bersih,  air panas tidak menyala,  wifi di kamar tidak tersedia. ",neut,neg,neut,neut,neg,neut,neut,neut,neut,neg
"kamar luas dan bersih hanya kamar mandinya yang kurang terawat, sarapan juga banyak variasinya, lokasi di pinggir jalan dan dekat mini market",neut,neut,neut,neut,pos,neut,neut,pos,neut,neut
"Ac tidak dingin,selimut dan sprei gatal seperti 10 tahun tidak diganti",neg,neut,neut,neut,neg,neg,neut,neut,neut,neut
"Cukup luas kamarnyaa,,  hanya kamar mandi mungkin yng kurang bersihh.trimakasih airy",neut,neut,neut,neut,neg,neut,neut,neut,neut,neut
terlalu berdebu dan kurang menarik ,neut,neut,neut,neut,neg,neut,neut,neut,neut,neut
"Kalau minta buku nikah itu di awal pas check in, bukan tengah malam",neut,neut,neut,neut,neut,neut,neg,neut,neut,neut
"kamar bersih, service oke, untuk menginap sangat amat nyaman,  untuk 1 orang juga terbilang cukup murah sesuai dengan budget. Hanya saja channel tv nya kurang bervariasi, kebanyakan channel tayangan islami. ",neut,neut,neut,neut,pos,neut,pos,neut,neg,neut
"Kamae Mandi kurang bersih, ada puntung rokok. kamar tidur jg bau tidak sedap, AC kurang dingin... View kurang enak jg.",neg,neut,neg,neut,neg,neut,neut,neut,neut,neut
Tempat nyaman dan strategis dgn tmpt wisata jatim park 2 dan BNS. Air panas nya kadang gak nyala dan saat sy menginap sedang ada renovasi jd agak berisik. Tp overall baik.,neut,neg,neut,pos,neut,neut,neut,neut,neut,neut
lokasi beda dengan spot hotelnya. muter2 nyari sampe 20menit. nanya orang sekitar jg ga ada yg tau. ternyata cari yg namanya hotel 68 saja. orang baru tahu. kamar super mini. tidak ada lemari dan ac kurang dingin walau sudah di set 16 derajat. kamar mandi blm bersih dan masih bau sehingga harus disiram tiap sela. keamanan baik dan ramah,neg,neut,neg,neut,neg,neut,pos,neut,neut,neut
"Saya tidak menyukai kebersihan kamar mandi dikarenakan pada saat saya masuk ke dalamnya,terdapat kecoa mati di toilet dan di bawah shower, kebersihan sprai juga perlu diperhatikan",neut,neut,neut,neut,neg,neg,neut,neut,neut,neut
kamar sangat nyaman. terdapat balkon. tetapi handuk sgt kecil dan waktu saya menginap kebetulan tv sedang off. resepsionist pria kurang senyum,neut,neut,neut,neut,neut,neg,neg,neut,neg,neut
"toilet kotor, parkir penuh yg kos bulanan, penjaga ga ramah. cukup sekali aj.",neut,neut,neut,neut,neg,neut,neg,neut,neut,neut
banyak nyamuk dan kmr bau apek no wifi at room lt.2,neut,neut,neg,neut,neut,neut,neut,neut,neut,neg
kanarnya oke fasilitas sama makanya oke tapi kloset kamar mandi nya selalu kotor.,neut,neut,neut,neut,neg,neut,neut,pos,neut,neut
"secara keseluruhan oke banget. aksesibilitas mudah, dekat dg masjid dan tempat makan di Buah Batu. Sayang Kamar Mandi kurang nyaman krn pintu tdk bisa ditutup rapat mesti diganjal tissue. Dan Kamar Mandi berbau comberan. ",neut,neut,neg,pos,neut,neut,neut,neut,neut,neut
"Kain kasur selama 4 malam menginap tidak pernah di ganti, dan asuh kurang dingin.",neg,neut,neut,neut,neut,neg,neut,neut,neut,neut
kamar luas & bersih tapi air panasnya tidak fungsi,neut,neg,neut,neut,pos,neut,neut,neut,neut,neut
"Tolong kebersihan diperhatikan, bukan hanya kebersihan yang tampak di awal tapi menyeluruh terkait seperti nyamuk dan kecoak. Thanks.",neut,neut,neut,neut,neg,neut,neut,neut,neut,neut
Wifi nya jeleeeeeeeek,neut,neut,neut,neut,neut,neut,neut,neut,neut,neg
"Ruangan cukup nyaman. Standar Airyroom lah. namun ada beberapa kekurangan seperti colokan sedikit, WiFi mati, air agak bau, Tidak ada gantungan baju di kamar mandi.",neut,neut,neut,neut,neut,neg,neut,neut,neut,neg
hanya kamarnya bau rokok dan air kamar mandi bocor ke kamar serta AC kurang dingin. Maaf komplain supaya dijaga kualitasnya,neg,neut,neg,neut,neg,neut,neut,neut,neut,neut
"nyaman,ramah penjaganya,dekat pusat kota cuma air panas ga ada tapi ga papa sih bukan kota dingin kok btw semua ok lah",neut,neg,neut,pos,neut,neut,neut,neut,neut,neut
"Standar,bangunan tua.. Namun saklar listrik sudah tidak kuat menancap pada dinding, ac dingin memerlukan waktu lama, lift hanya sampai Lt 4 padahal kamar ada di Lt 5",neg,neut,neut,neut,neut,neut,neut,neut,neut,neut
Inisiatif untuk memfasilitasi air aqua dan utilities serta snack dari penjaganya masih kurang. Alangkah lebih baiknya jika diberikan tanpa direquest. ,neut,neut,neut,neut,neut,neg,neut,neut,neut,neut
Tidak ada sabun maupun snack dari airy room,neut,neut,neut,neut,neut,neg,neut,neut,neut,neut
kamar tidak terang ac kurang dingin kamar mandi trlalu kecil wifi rusak lingkungan sekitar hotel asyik sih ada sarapan enak di Dkt Hotel namanya Nasi Uduk Bu Maya Disebelah Alfamart,neg,neut,neut,neut,neut,neut,neut,neut,neut,neg
"Utk backpacker more than enough lah. Hanya wifi bisa di lobby saja, tdk sampe kamar",neut,neut,neut,neut,neut,neut,neut,neut,neut,neg
"sejauh ini baik, apalagi pengantaran ke bandara juga gratis. Mungkin wifinya bisa diperbaiki karena saya sudah berapa kali coba connect tapi selalu gagal mendapatkan IP. Over all untuk staff semuanya sangat baik, sopan dan benar2 ramah.",neut,neut,neut,neut,neut,neut,pos,neut,neut,neg
"Kos-kosannya lumayan jorok, sprei tempat tidur agak dekil warna putihnya.",neut,neut,neut,neut,neg,neg,neut,neut,neut,neut
"hotelnya sih lumayan bagus tapi AC nya panas banget dan tidak ada set up property Airy sama sekali mulai dari amenities, bantal, sarung, dan makanan. Selain itu pelayanannya juga kurang sewaktu FO di komplain.",neg,neut,neut,neut,neut,neg,neg,neut,neut,neut
"proses checkin lama, pdhal sdh jam15.30. dibanding airy lain yg pernah sy kunjungi, hanya disini yg tdk ada atribut Airy sperti bantal & toilet kit. Disini jg tdk disdiakan snack dlm box sperti kmar airy yg prnah sy psan sbelumnya.. layar tv tidak jernih..",neut,neut,neut,neut,neut,neg,neg,neut,neg,neut
"Saya minta tambahan handuk ndak bisa, hotel kok kurang handuk kyk motel aja , trus kalau pesen mknan hrs nunggu lama sekali, kmr mandi bau pengap, sudah dikasih sign untuk bersihin kmr tapi gk dibersihkan, masak hrs tlp dulu, trus advertising yg gk ada itu",neut,neut,neg,neut,neut,neg,neg,neg,neut,neut
"Baik dan akan coba terus pesan room melalui airy, modah2 an  lebih kedepan lebih baik lagi, dan perlu diperhatikan juga room di hotel terkadang kamar mandi airnya menggenang dan bau",neut,neut,neg,neut,neg,neut,neut,neut,neut,neut
keluarga ketinggalan kacamata baca tetapi baru beberapa jam kemudian kami datangi kembali info yg kami dpt justru sangat mengecewakan bahwa kacamata tersebut sudah dibuang...hal ini yg sangat disesalkan sekali bukannya disimpan terlebih dahulu ,neut,neut,neut,neut,neut,neut,neg,neut,neut,neut
"Cukup memuaskan dari sisi tempat dan lokasinya. Agar lebih baik lagi, untuk air hangat dapat digunakan terima kasih",neut,neg,neut,pos,neut,neut,neut,neut,neut,neut
"lumayan twrjangkau, putaran air keran nya kadang panas kadang dingin :)",neut,neg,neut,neut,neut,neut,neut,neut,neut,neut
view bagus pelayanan bagus cm ac aja kurang dingin,neg,neut,neut,neut,neut,neut,pos,neut,neut,neut
"Pertama & terakhir booking via airy, diberitahu o/ resepsionis bahwa terjadi overbooking via airy namun tdk ada konfirmasi ke saya, alhasil saya harus membayar biaya tambahan untuk upgrade kamar namun saya menolak, akhirnya dapat kamar di lt 3 (tanpa lift), remote ac & tv diambil o/ pihak hotel, besoknya belum check out listrik dimatikan tiba2 ",neut,neut,neut,neut,neut,neut,neg,neut,neut,neut
"Hot waternya hari pertama berfungsi namun hari kedua sudah tidak berfungsi, siaran TVnya kabur dan AC kurang dingin.",neg,neg,neut,neut,neut,neut,neut,neut,neg,neut
AC nya per 30 menit mati. alhasil saya tidak nyenyak tidur krn jagain AC supaya tetap on. spy anak istri bisa tidur. kamar mandi nya agak serem. gitu aja! think again lah !,neg,neut,neut,neut,neut,neut,neut,neut,neut,neut
"kamar bau dari selokan kamar mandi,banyak nyamuknya,pagi air utk mandi sangat kecil jadi hrs nunggu agak siang utk mandi.",neut,neut,neg,neut,neut,neut,neut,neut,neut,neut
kamar mandinya bau tidak wangi anduk sama sendalnya pun datangnya telat tapi pelayanana baik,neut,neut,neg,neut,neut,neg,pos,neut,neut,neut
"AC dilantai bawah tidak nyala terpaksa pindah ke lantai 4, nyala sih tp tidak begitu dingin",neg,neut,neut,neut,neut,neut,neut,neut,neut,neut
"tempatnya sederhana tapi cukup bersih, klau malam banyak suara jaangkrik dan kambing, suasana desa, mobil langsung parkir depan kamar, air lancar, air panas ada, kamar mandi agaak bau(dr saluran air)",neut,pos,neg,neut,neut,neut,neut,neut,neut,neut
"yang berkesan jajan dan amenities nya lengkap. keren. hanya saja hptel yang bekerja sama sangat kurang. karena saat saya kesini tidak ada tisu toilet, air di termos bau, gula keras creamer keras, sepertinya sudah lama sekali tidak diganti. dan balkon juga jarang dibersihkan jadi berdebu",neut,neut,neut,neut,neg,pos,neut,neut,neut,neut
Kamarnya sempit dan pengap. unik memang designnya..kalo luas dikit lagi aja pasti bagus. dan ventilasi/ blower..itu perlu bgt. posisi ac perlu diganti. ,neg,neut,neg,neut,neut,neut,neut,neut,neut,neut
"over all ok, kurang pewangi aja kamarnya, anak2 betah karna puas liat kereta",neut,neut,neg,pos,neut,neut,neut,neut,neut,neut
"Kamarnya pengap, kamar mandi agak kotor di bagian pojokan wastafel dan ubin dibawah pintu kamar mandi. Kondisi macab kamar dekat pintu tidak safety. Tidak mendapatkan air hangat pas check-in kondisi hujan/welcome drink. Makanan breakfast tahu isi agak bau",neut,neut,neg,neut,neg,neg,neut,neg,neut,neut
"yang paling berkesan adalah suasana elegant di kamar trsebt  sehingga membuat nyaman untk bermlam yang harus di perbaiki keadaan AC , karna terjadi kebocoran air AC di kamar yang saya tempati",neg,neut,neut,pos,neut,neut,neut,neut,neut,neut
yg berkesan ukuran kamarnya besar. yg perlu diperbaikin saluran ke tanki closet pipanya rusak. service pelayanan lebih ditingkatkan..,neut,neut,neut,neut,neut,neut,neg,neut,neut,neut
tv nya kurang gede + renyek semua,neut,neut,neut,neut,neut,neut,neut,neut,neg,neut
seprainya dn handuknya kotor. lantainya kurang bersih. gaada sofanya sprti digambar.,neut,neut,neut,neut,neg,neg,neut,neut,neut,neut
Ada beberapa yang harus ditingkatkan lagi seperti TV. Hanya bisa menonton beberapa channel bagus dan,neut,neut,neut,neut,neut,neut,neut,neut,neg,neut
"AC nya kurang dingin dan kotor,banyak nyamuk dan kurang terawat kamarnya..bau kamar tidak enak smp saya beli obat semprot nyamuk dan beli pengharum ruangan.kolam renang bersih..",neg,neut,neg,neut,neut,neut,neut,neut,neut,neut
"(+) kamar besar, baru, bersih. hari ke 1 AC tdk dingin, tp diganti pihak homestay dgn kamar yg lain (-) tdk ada lift, wifi lambat, Breakfast cm dikasih 2 piring. sesuai dgn harganya.",neg,neut,neut,neut,pos,neut,neut,neg,neut,neg
"tiba2 kamar mati lampu, ada semut nya, gak ada free snack, tdk sesuai dengan gambarnya, tidak ada pouch nya juga.. ",neut,neut,neut,neut,neut,neg,neut,neut,neut,neut
Kamarnya bersih dan nyaman. Kamar mandi Oke. air dan perlengkapan mandi Oke. Hanya kurang alas kaki tdk ada ( tapi pas diminta dikasih). Hair dryer juga tdk ada. Wifi tidak sampai kedlm kamar. Colokan di kamar hanya 1. Jauh dari lokasi kota bandung. Namun secara keseluruhan Oke.,neut,neut,neut,pos,pos,neg,neut,neut,neut,neg
kamarnya nyaman... ac dingin... layanan nya jg baik tpiiiii.... klu bs sprei nya di ganti... gatal2 sih.... ,pos,neut,neut,neut,neut,neg,pos,neut,neut,neut
"nyaman, dan tenang,,, hny wifi nya gk fungsi,,, jd susah buat komunikasi,,, tlg tingkatkn lagi pelayanannya",neut,neut,neut,neut,neut,neut,neg,neut,neut,neg
"Kamar lumayan besar,kamar mandi sebaik’a di lengkapi blower udara,jaringan wifi nya gak connect sm sekali..",neut,neut,neut,neut,neut,neut,neut,neut,neut,neg
"nyaman, bersih, oke.. tapi sayang ga dapat snack box nya.. pesen 2 kamr, dua2nya ga d kasih snack box nya.. padahal sdh konfirm k pihak cs hotel.. tp cuma d suruh tunggu ajja, sampai pulang ga datang2..",neut,neut,neut,neut,pos,neg,neg,neut,neut,neut
tempatnya bersih hanya saja acnya kurang dingin,neg,neut,neut,neut,pos,neut,neut,neut,neut,neut
setiap menginap di airy pasti puas bngett.. pelayanan.y ramah . cumn yang ini ..kamar mandinya bau..aer panas.y ga nyala..ga ada tempat sampah di kamar... ga ada snack..padahal setiap nginep di airyroom selalu disediain...,neut,neg,neg,neut,neut,neg,pos,neut,neut,neut
"Lumayan untuk harga diskon. Ac, tv, westafel. Semua baik. Cuma kmrrn abis ada wedding party, blm beres, jadi sampah nya bauuu",pos,neut,neg,neut,neut,neut,neut,neut,pos,neut
satu hal yg terbaik dari hotel marina ini adalah kamarnya yg cukup luas dan lengkap dengan kulkas kecil didalamnya dengan harga cukup bersahabat (kalau lagi ada promo airy). tapi untuk pelayanan sama maintanance nya kurang. proses check in memakan waktu hingga 30 menit. masuk kamar ga ada handuk keset dll. rak2 dan kursi berdebu. sprei byk noda. ,neut,neut,neut,neut,neg,neg,neg,neut,neut,neut
"pelayanannya ramah. tempat tidur nyaman, bersih , AC menyala air panas bisa di gunakan wifinya sangat kencang .. mungkin yang perlu diperbaiki bau saluran air di kamar mandi, tp langsung hilang baunya sejauh ini sangat memuaskan ... terimakasih",pos,pos,neg,neut,neut,neut,pos,neut,neut,pos
"kamar yg kami dapatkan tidak sesuai yg tertera di Airy. Di Airy tertulis Deluxe, setelah sampai hotel, kami mendapatkan kamar Superior. Untuk kebersihan kamar, lumayan lah, tapi kalau kamar mandi, sorry to say but it's the worst I've ever visited. Desain yg kurang tepat, menjadikan lemari dibawah wastafel penuh jamur, kamar mandi jadi bau apek. ",neut,neut,neg,neut,neg,neut,neut,neut,neut,neut
"Ada semut dikamar dan tidak kedap suara, penghuni bawah merokok dan baunya terasa",neut,neut,neg,neut,neut,neut,neut,neut,neut,neut
"Seneng bgt dapet snack tambahan dari airy. Lokasi hotelnya bagus, dekat dengan pusat kota. Cuma kurang empuk sedikit bantalnya hihi",neut,neut,neut,neut,neut,neg,neut,neut,neut,neut
"sangat emejing menginap di airy Sutoyo hotel dewarna,udah murah tempat juga nyaman buat istirahat,apalagi breakfastnya juga nikmat ga asal2an dengan harga murah kualitas tidak murahan.tp yg perlu diperbaiki cuman kebersihan kamar kurang bersih klo ngepel,overall rekomen bgt",neut,neut,neut,pos,neg,neut,neut,pos,neut,neut
"pada awal saya masuk kamar bau rokok. kemudian saya masuk kamar mandi, di toilet nya ada tinja yang muncul mungkin mampet salurannya sehingga naik ke atas. akhirnya saya flash dan bau sekali. kemudian saya menyalakan tv, tp tv tidak keluar gambar. air botol, snack tidak tersedia tissue juga tidak ada. mohon untuk memperbaiki fasilitas terutama kamar mandi",neut,neut,neg,neut,neut,neg,neut,neut,neg,neut
"Kamar lumayan bersih, meski ada beberapa berdebu tapi masi cukup nyaman. Air hangat, ac dingin, wifi cepat, karyawan sedikit kurang ramah, menginap beberapa hari, harusnya setiap hari diganti snack atau mnawarkan handuk baru",pos,pos,neut,neut,neg,neut,neg,neut,neut,pos
pelayan nya kurang memuaskan hanya di tnya air panas saja muka nya merengut dan secara terpaksa untuk membantu,neut,neut,neut,neut,neut,neut,neg,neut,neut,neut
"Saya suka, nyaman dan tenang, hanya saja kamar mandi sedikit berbau tapi buat saya tidak masalah ttp puas",neut,neut,neg,neut,neut,neut,neut,neut,neut,neut
Nyaman dan strategis.. cm kmar mandi kurang bersih... semoga lbh baik lagi. Thx airy,neut,neut,neut,neut,neg,neut,neut,neut,neut,neut
keren dan bersih hx sj lupa di ganti handux dan lupa dbersihkn selebihx oke,neut,neut,neut,pos,neg_pos,neg,neut,neut,neut,neut
"baik dan memuaskan,msh krg 2jam waktu check in kami sdh boleh masuk kamar,namun pas kami br masuk kmr toiletnya (closed)msh Kotor. Dan keset dpn toilet jg kotor",neut,neut,neut,neut,neg,neg,neut,neut,neut,neut
Lokasi hotel tidak di jalan utama. di kamar tidak tersedia tlp operator. serta lebih mirip tempat kost. Namun kondisi kamar bersih. free wifi juga blm ada sepertinya.,neut,neut,neut,neut,pos,neut,neut,neut,neut,neg
"AC ga dingin, kamar kurang terang, sehingga seperti agak kotor. Tp untuk harga segitu, termasuk oke. Lokasi strategis, ada waterheater",neg,pos,neut,neut,neg,neut,neut,neut,neut,neut
Bersih... rapih dan lumayan bagus kamar nya....nyamanlah utk istirahat. Tapi banyak semut kecil2..  kalau mlm air panas nya dingin. Gak ada pintu langsung ke lobby/resepsionis jadi harus turun dulu ke basement. Tapi sdh hari ke 4 masih betah tidur disini. ,neut,neg,neut,neut,pos,neut,neut,neut,neut,neut
TV gx ad chanel. toilet bermasalah ,neut,neut,neut,neut,neg,neut,neut,neut,neg,neut
"wifi tidak terhubung, kamar sedikit berbau lembab.",neut,neut,neg,neut,neut,neut,neut,neut,neut,neg
