processed_text,ac,air_panas,bau,general,kebersihan,linen,service,sunrise_meal,tv,wifi
nyamna dan bersih...tapi masa air panas baru dinyalain uda dingin lagi,neut,neg,neut,neut,pos,neut,neut,neut,neut,neut
menginap yg kedua kalinya.. suka kamar nya tapi sprei nya kok kotor kaya yg belum d cuci..,neut,neut,neut,neut,neg,neg,neut,neut,neut,neut
"Air macet di jam jam penting, di keterangan fasilitas air hangat tidak ditentukan jam kan? Jam 18 air hangat tidak berfungsi, untuk apa mandi air hangat pagi hari? Justru yang penting itu malam, bagaimana orang yang aktifitas sampai malam dan baru bisa man",neut,neg,neut,neut,neut,neut,neut,neut,neut,neut
Dikasi kamar di lantai 4 naik tangga gak ada lift.....handuk disediakan ukuran kecil dan bau keringat. Kebersihan lumayan.,neut,neut,neut,neut,pos,neg,neut,neut,neut,neut
"cm ada 1 hal yg bikin ilfeel, yaitu di bantal biru khas airy room ada BEKAS ILER yg ga dibersihin & kelihatan sekali, ada di kedua bantal birunya, gmn ya ini airy?",neut,neut,neut,neut,neg,neg,neut,neut,neut,neut
"Ga ada tissue, wifi harus diminta dulu, tengah malam kebangun karna token listrik kamar habis, dan harus di beri tau dulu baru nyadar. Ga ada cermin. ",neut,neut,neut,neut,neut,neg,neut,neut,neut,neg
pelayanan kepada tamu mohon di maksimalkan,neut,neut,neut,neut,neut,neut,neg,neut,neut,neut
"enak sih..bagus..tapi kamar mandinya bau banget,sampe ga tahan baunya...tolong diperbaiki ya gimana caranya supaya gak bau",neut,neut,neg,neut,neut,neut,neut,neut,neut,neut
"kamar mandi panas tdk ada exausfan,ac tdk merata suhu dinginnya dan jendela terlihat dr luar krn tdk",neg,neut,neut,neut,neut,neut,neut,neut,neut,neut
sinyal untuk paket appn ssah mohon untuk pke wifi,neut,neut,neut,neut,neut,neut,neut,neut,neut,neg
"PENGANTAR TAMU KAYA TAI, TAMUNYA DITINGGALIN, JALANNYA CEPET, GAK ADA SENYUMNYA TUH ORANG Tempatnya besar, kasur empuk, bersih, AC lumayan dingin, lemari tidak ada hanger, dalam toilet tidak ada shower gun untuk bilas setelah bab, air panas tidak fungsi tapi lumayam bangetlah untuk kualitas kamarnya",neut,neg,neut,pos,pos,neg,neg,neut,neut,neut
"lokasi ok, namun kami dapat kamar lantai bawah, wifi tidak bisa digunakan",neut,neut,neut,neut,neut,neut,neut,neut,neut,neg
"Fasilitas lumayan sesuai harga, ada makan paginya, dekat dengan stasiun cirebon, kamar mandi agak kurang bersih, air nya mengalir kecil, utk kedepannya mudah2an ada perbaikan khususnya fasilitas kamar mandinya, terimakasih ",neut,neut,neut,neut,neg,neut,neut,pos,neut,neut
WiFi tdk Ada thanks,neut,neut,neut,neut,neut,neut,neut,neut,neut,neg
"breakfast enak, tempat bagus, tapi saat tidur tiba2 ada orang yg membuka pintu kamar padahal saya sedang tidur dan kamar dikunci. entah itu tamu lain atau petugas .mohon diperhatikan lagi .",neut,neut,neut,neut,neut,neut,neg,pos,neut,neut
"karyawannya friendly kost nya cukup dekat dg jalan raya, transportasi mudah utk pergi kemana2. tapi utk kamarnya belum bersih ada bantal guling yg bau ada di dalam lemari tidak dibersihkan.",neut,neut,neut,neut,neg,neg,pos,neut,neut,neut
"waktu menginap tidak dapat snack dan air minum, wifi pun tidak free",neut,neut,neut,neut,neut,neg,neut,neut,neut,neg
wifi tidak tersedia...........,neut,neut,neut,neut,neut,neut,neut,neut,neut,neg
"snack gratis, ranjang nyaman, lokasi tv tidak strategis karena di belakang kasur",neut,neut,neut,neut,neut,pos,neut,neut,neg,neut
"perlu ditambah pengharum di lemarinya. overall kamarnya bersih banger, nyaman, fasilitas lengkap, ac dingin.  kalau bisa sediakan line telepon untuk pemesanan taksi, karena letaknya cukup jauh dari jalan raya. ",pos,neut,neg,neut,pos,neut,neut,neut,neut,neut
AC panas sampai harus buka jendela.,neg,neut,neut,neut,neut,neut,neut,neut,neut,neut
"pelayanan baik... bahkan mobil di cuci, cuma agak sayang di kamar 202 TV, belum Flat dan air panas tidak berfungsi... Tapi selebihnya memuaskan",neut,neg,neut,pos,neut,neut,pos,neut,neg,neut
"kamar banyak debu, terutama di jendela, toilet kurang bersih",neut,neut,neut,neut,neg,neut,neut,neut,neut,neut
Nyaman & lumayan bersih. Menurut saya menu sarapan kurang bervariasi dan hot spot wifi perlu ditambah.,neut,neut,neut,neut,pos,neut,neut,neg,neut,neg
"Baik jaringan internet perlu ditingkatkan, lampu kamar mandi dan ruangan perlu ditingkatkan, air minum dalam kamar sebaiknya ukuran 1,5 Liter, sarung bantal perlu diganti karena sudah bercak kuning",neut,neut,neut,neut,neut,neg,neut,neut,neut,neg
kamar mandi belum di bersihkan karena masih ada puntung rokok di dalam,neut,neut,neut,neut,neg,neut,neut,neut,neut,neut
kamar mandi bersih tapi kurang wangi,neut,neut,neg,neut,pos,neut,neut,neut,neut,neut
"tempat enak, tidak jauh dari perbelanjaan tapi untuk kebersihan kurang... ",neut,neut,neut,neut,neg,neut,neut,neut,neut,neut
"tempatnya nyaman, bangunan baru...mungkin krn baru blom sempat d bersihkan...msh ad debu...tp overall nyaman, ramah utk tempat transit",neut,neut,neut,pos,neg,neut,neut,neut,neut,neut
lemarinya kamar ya tlg biar ga berdebu dan banyak remah remah bangunan,neut,neut,neut,neut,neg,neut,neut,neut,neut,neut
kamarnya baik. namun toiletnya kurang bersih dan tdk ada tempat sampah dalam kamar,neut,neut,neut,neut,neg,neg,neut,neut,neut,neut
"kamar hotel sangat bagus, hanya kebersihan yg kurang..",neut,neut,neut,neut,neg,neut,neut,neut,neut,neut
ac panas sampe narik kasur k ruang tv kulkas jg gg dingin teko listrik ga panas,neg,neut,neut,neut,neut,neut,neut,neut,neut,neut
"Saya sudah request non smoking room, tapi ternyata ruangan bau rokok bahkan dikamar mandi sudah disediakan asbak. Exhaust dikamar mandi tidak berfungsi jadi kalau mau mandi harus dibuka pintu kamar mandinya. Air panas untuk mandi tidak ada. Kualitas kamar sangat mengecewakan tidak sesuai untuk hotel berbintang.",neut,neg,neg,neg,neut,neut,neut,neut,neut,neut
"selimut kotor, berisik karena kegiatan karaoke",neut,neut,neut,neut,neg,neg,neut,neut,neut,neut
kamar tidak seperti yang ada di foto. kotor. pintu seperti kamar kos2an,neut,neut,neut,neut,neg,neut,neut,neut,neut,neut
"Kamar bersih, AC tidak dingin, tidak disediakan snack dan peralatan mandi, hanya ada sikat gigi. Setelah minta, baru diantarkan.",neg,neut,neut,neut,pos,neg,neut,neut,neut,neut
"Ini adalah yg kedua nginep di Airy Anggrek Satu 18. AC lebih dingin dr yg pertama, kamar lebih luas. sayangnya dikasih smoking room, padahal setau saya Airy non smoking semua. jd pertama masuk bau asap rokok. Tapi so far sih seneng2 aja nginep di sini. ",neg_pos,neut,neut,pos,neut,neut,neut,neut,neut,neut
"pemilik kayak gak tau n gak kuasai aplikasi airy,kamar airynya paling ujung,nggak dikasih minum+snack gratis dr airy,shower ngga ada yg panas..lokasi strategis,kamar lumayan..mikir2 kalo mo ngulang nginap disini",neut,neg,neut,neut,neut,neg,neg,neut,neut,neut
lumayan murah karena dpt diskon..bersih nyaman privat kekurangan g da hot water. .. restaurant kurang..for all ok lah...,neut,neg,neut,pos,pos,neut,neut,neut,neut,neut
"semua baik,, rekomended,, kecuali wifi gak jalan,, ",neut,neut,neut,pos,neut,neut,neut,neut,neut,neg
"Tolong jika hotel sedang di renovasi jangan 'dijual' dl, Pihak airy sebaiknya mengecek , evaluasi dan monitoring hotel2 yang bekerjasama dengan airy. Hotel ini -karena adanya aktivitas tenovasi- jd kotor dan berdebu, mulai dari lobby, tangga sampai ke koridor dpn kamar. Apalagi kondisi tangganya yang kotor, kusam dan berdebu dan seram",neut,neut,neut,neut,neg,neut,neg,neut,neut,neut
"Pelayanan dr sekurity gak baik, air kmr mandi bau",neut,neut,neg,neut,neut,neut,neg,neut,neut,neut
tempat yag bagus n nyaman untuk istirahat tpi tolong tvnya perlu di perbaiki channelnya krn banyak semutnya digambar dan water heaternya nda bisa jd mandi air dingin terus.....,neut,neg,neut,neut,neut,neut,neut,neut,neg,neut
"Airy room yg di Country Heritage , kurang memuaskan ruangan kotor berdebu, apalagi belakang TV seperti g pernah dilap, mungkin jarang dipakai kali,  risih berada didlm, akhirnya sama pihak hotel diganti dngn yang bukan airy room dan dikasih free, gapp y saya tulis yang sebenarnya, supaya Airy room kedepan lbh baik lg",neut,neut,neut,neut,neg,neut,neut,neut,neut,neut
"nyaman , semua bersih . tapi sayang air minum dan wifi tidak tersedia",neut,neut,neut,neut,pos,neg,neut,neut,neut,neg
Pas pas aja.  Penempatan ruang kurang enak. Tv nya kehalang lemari. ,neut,neut,neut,neut,neut,neut,neut,neut,neg,neut
"handuk gak di kasih, air hangat gak jalan, tolong di tingkat kan pelayanan dan fasilitas nya",neut,neg,neut,neut,neut,neg,neg,neut,neut,neut
"resepsionis yang ramah, tapi acnya kurang dingin",neg,neut,neut,neut,neut,neut,pos,neut,neut,neut
"AC tidak dingin, kelengkapan Airy musti diminta",neg,neut,neut,neut,neut,neg,neut,neut,neut,neut
"Pelayanan mantap, suasana nya nyaman, bisa bermain dengan keluarga dan anak, untuk kedepannya tolong lebih bersih lagi ruangan kamarnya, termasuk kamar mandi nya... ",neut,neut,neut,neut,neg,neut,pos,neut,neut,neut
"Lumayan bersih, nyaman Cuma showernya rusak, airnya ketika di setel hangat, yang keluar panas, bentar kemudian dingin, panas lagi, dst. ",neut,neg,neut,neut,pos,neut,neut,neut,neut,neut
"kamar oke,  tpi acnya tlong lbih dprhatikan lagi karna acnya kurang dingin",neg,neut,neut,neut,neut,neut,neut,neut,neut,neut
"sangat mengecewakan, kamarnya kotor apalagi di atas lemari sampah berserakan, shower ga da jadi mandi pake timba itupun kita complain slow respond harus nelfon pihak airy dan owner. sangat kecewa sama airy room standarnya ga sesuai sama yang di harapkan. 1. ga da shower 2. ac ga dingin 3. ga da air panas 4. selimut ga sesuai standar. MENGECEWAKAN",neg,neg,neut,neg,neg,neg,neut,neut,neut,neut
"Sangat kecewa !!!! .... Receptionis Marah2 ke Orang Tua, tidak sopan menjelaskan, service room tidak ada, Room BAU, Memaksa bayar lebih untuk pindah room.  Disappointed ... !!!!",neut,neut,neg,neut,neut,neut,neg,neut,neut,neut
"Kamarnya agak gelap karena ada lampu yang mati. Air panas tidak berfungsi. Dari hotel ini, Gunung Salak terlihat jelas. ",neut,neg,neut,neut,neut,neut,neut,neut,neut,neut
Tidak nyaman kamar mandi bau ngga ada gantungan baju dan lingkunganya  berisik.,neut,neut,neg,neut,neut,neg,neut,neut,neut,neut
air panas di kamar mandi ga nyala. udh dilaporkan bbrapa kali tp ga direspon. resepsionisnya kurang ramah dan terkesan cuek. kebersihan bagus.,neut,neg,neut,neut,pos,neut,neg,neut,neut,neut
sangat mengecewakan.. kami tidak jd menginap disana..  dikarenakan saat mau check in petugas tidak ada.. sudah menunggu lama hampir 2 jam tidak ada kejelasan.. setelah dicoba kami hubungi berulang2 br ditanggapi.. kami mendapatkan no kamar lewat tlfn dgn mengambil kunci sendiri dibelakang pintu..  setelah kami buka kamar tidak layak pakai,neut,neut,neut,neut,neut,neut,neg,neut,neut,neut
Tempat bagus dan besar tapi kebersihan kirang karena banyak rambut di bantal,neut,neut,neut,neut,neg,neut,neut,neut,neut,neut
Nyaman banget kamar nya. Tapi sayang wifi nya lg bermsalah.,neut,neut,neut,neut,neut,neut,neut,neut,neut,neg
sarapan sangat kurang service baik,neut,neut,neut,neut,neut,neut,pos,neg,neut,neut
tempatnya enak... tapi disayangkan pegawainya tidak memperlakukan dengan sikap baik (sopan)pada saat breakfast...,neut,neut,neut,pos,neut,neut,neg,neut,neut,neut
kesan menginap airy rooms eco tj duren timur jakarta barat : 1. receptionistnya kurang ramah 2. kondisi kamar kotor dan pengap 3. kondisi AC tidak dingin 4. banyak semut dan kecoa dikamar mandi 5. kotor ,neg,neut,neg,neut,neg,neut,neg,neut,neut,neut
"kamar nyaman, cari makan mudah, tp ko sinyal di dalam kamar agak susah ",neut,neut,neut,neut,neut,neut,neut,neut,neut,neg
"Kamar kurang bersih, dinding kamar juga kusam sehingga menjadi kesan tidak nyaman, Lokasi strategis karena berada di pusat kota dan dekat dengan pusat kuliner.",neut,neut,neut,neut,neg,neut,neut,neut,neut,neut
"yg perlu diperbaiki itu WIFI lantai 2, sering disconnect.. jadi suka lag kalo lg main Mobile Legends ",neut,neut,neut,neut,neut,neut,neut,neut,neut,neg
ac nya susah di nyalain,neg,neut,neut,neut,neut,neut,neut,neut,neut,neut
"Kamarnya luas,  sprei dan bantal kurang bersih.  Kmr mandi bau. Mohon d perhatikan kebersihan tempat tidur",neut,neut,neg,neut,neut,neg,neut,neut,neut,neut
"Kamar tidak sesuai gambar yang di foto sangat kecil, ACnya bocor, kamarnya juga ada rembesan air dan bocor kamar mandinya kecil dan gelap dan tidak ada kesetnya, Sangat mengecewakan.",neg,neut,neut,neut,neg,neg,neut,neut,neut,neut
"fasilitas seperti makanan, minum, dan bantal airy tidak tersedia di hotel ini",neut,neut,neut,neut,neut,neg,neut,neut,neut,neut
"Lantai kamar mandi licin, Tidak disediakan shower cap, Pintu kamar mandi gagangnya berat/sulit diputar khawatir tidak bisa dibuka/terkunci dari dalam, Alangkah baiknya disediakan petunjuk arah kiblat di dalam kamar.",neut,neut,neut,neut,neg,neg,neut,neut,neut,neut
"tidak ada wifi , tv tidak dapat menyala dikarenakan kabel antenanya diputus, ac nya lama dingin  din",neg,neut,neut,neut,neut,neut,neut,neut,neg,neg
alamat g ktemu. di tlp g direspon... merugikan!!!!!!!!,neut,neut,neut,neut,neut,neut,neg,neut,neut,neut
tidak ada tersedia air minum dan snack yg dimana hotel airy yg biasa saya kunjungi menyiapkan...,neut,neut,neut,neut,neut,neg,neut,neut,neut,neut
"Internet hotspot butuh perbaikan lagi,,, selain itu sangat memuaskan.",neut,neut,neut,pos,neut,neut,neut,neut,neut,neg
tidak ada koneksi WiFi dan menu sarapan yang cenderung menu makan siang,neut,neut,neut,neut,neut,neut,neut,neg,neut,neg
"kamar ok bantal empuk tp ac amat sangat tdk dingin,,tidur ttp mandi keringat",neg,neut,neut,neut,neut,pos,neut,neut,neut,neut
"Sebenernya menyenangkan pemandangan indah, tetaoi kurang terawat dan sewaktu saya datang lantai menuju kamar masih sangat kotor. Jika dibenahi dan lebih terawat padahal akan sangat menyenangkan . Kebersihan kurang. Kamar mandi kamar pun kran westafer tidak menyala. Harap diperbaiki lagi fasilitasnya , terimakasih 😊",neut,neut,neut,neut,neg,neut,neut,neut,neut,neut
kebersihan selimut dan kamar masih perlu diperhatikan.. tetapi overall not bad..,neut,neut,neut,pos,neg,neut,neut,neut,neut,neut
"Penginapan kurang terurus, mesin air panas mati, selokan air di kamar mandi macet, remot AC eror dan gak bisa dingin, remot TV jg eror, channel TV 6-7 aja. pertama kalinya pesan di airy yang kesannya menyesal, padahal yang sudah2 baik2 aja.",neg,neg,neut,neut,neut,neut,neut,neut,neg,neut
Sinyal hp jelek. wifi juga terbatas,neut,neut,neut,neut,neut,neut,neut,neut,neut,neg
"Kotor dan bau.. Kamar mandinya seperti sudah berbulan bulan ngak dicuci, bau sepreinya ngak bersih,k",neut,neut,neut,neut,neg,neg,neut,neut,neut,neut
"Sarung bantal kotor pada saat pertama masuk, tapi dapat diganti. Dan bantal kuga terasa lembab.",neut,neut,neut,neut,neut,neg,neut,neut,neut,neut
pas kebetulan waktu nginap pas lg acara wisudaan beberapa universitas jadi full trus dan yg disayangkan utk makan pagi pegawainya blm datang jd kalo yg pagi banget ngak makan jdnya ,neut,neut,neut,neut,neut,neut,neut,neg,neut,neut
mengecewakan. snack dan air mineral dari sponsor airy hanya untuk 1 customer sedangkan di pemesanan kamar maksimal 2 orang. handuk juga hanya 1 seharus 2 sesuai aturan yang tertera di aplikasi. walaupun guest house tapi pelayanannya sangat minimalis. shower air panas juga tidak berfungsi. sebaiknya di hapus dari layanan yang tercantum di aplikasi. ,neut,neg,neut,neut,neut,neg,neg,neut,neut,neut
TV tidak nyala,neut,neut,neut,neut,neut,neut,neut,neut,neg,neut
toilets kotor n g jln pool kotor sekli kayak kolam ikan wifi g ada tlp g bs d pakek all is bad,neut,neut,neut,neut,neg,neut,neut,neut,neut,neg
tidak sesuai dengan kamar pesanan...ac tidak dingin...,neg,neut,neut,neut,neut,neut,neut,neut,neut,neut
"kamar lumayan besar,tp sayang tidak ada keset kamar mandinya,dan airnya kecil,serta ac kurang dingin. tolong di perbaiki agar costumer puas,trima kasih.",neg,neut,neut,neut,neut,neg,neut,neut,neut,neut
handuknya sudah tidak layak pakai. :( showernya bocor.,neut,neut,neut,neut,neut,neg,neut,neut,neut,neut
"Mengecewakan. Air panas cuma bisa sebentar aja. Setelah itu tidak bisa. Gelap, pencahayaan kurang...",neut,neg,neut,neut,neut,neut,neut,neut,neut,neut
"bagus, nyaman , tapi selimutnya pada rontok jadi nempel di baju, overall ok",neut,neut,neut,pos,neut,neg,neut,neut,neut,neut
"Bed nya kotor banyak debu,Water warmnya tidak berfungsi. Lokasi yang tidak strategis dan menyatu den",neut,neg,neut,neut,neg,neg,neut,neut,neut,neut
linen nya terasa agak gatal... mungkin kurang bersih sewaktu pencucian,neut,neut,neut,neut,neg,neg,neut,neut,neut,neut
"pelayanan tidak ramah , deposit terlalu tinggi malah lebih tinggi dr harga kamar sedangkan kt ga selalu bawa cash banyak , dipaksa hrs cr atm lg",neut,neut,neut,neut,neut,neut,neg,neut,neut,neut
Tgl 9 Juni 2018 saya menginap di salah satu kmr di lt.2 (lupa no kmr-nya) dan sangat kecewa krn AC yg sama sekali tidak dingin sehingga tidurngak nyenyak krn panas san flushing kloset yg rusak (tidak bisa di flush). Payah dan sangat tidak recommended,neg,neut,neut,neut,neut,neut,neut,neut,neut,neut
"Kamarnya sering dicek, soalnya kamar mandinya kadang mampet, ada kecoak, dan seprei sering diganti yaaaa",neut,neut,neut,neut,neg,neg,neut,neut,neut,neut
"awal udah senang karena dikasih welcome cokelat, tapi kecewa berlipat lipat karena kamar gk sesuai di foto dan ulasan pada traveloka, kamarnya bau , banyak semut di tempat tidur, AC gk nyala panas banget, menang di TV doang yg gede, kamar mandi gk sempat saya pake karena saya sekarang siap siap mau check out pindah hotel aja, nyesel udah bayar buat 3 malam dan gk bisa direfund",neg,neut,neg,neut,neg,neut,neut,neut,pos,neut
"Payah, ga ada air minum yg disediain dikamar. Snacknya juga tidak sesuai di tulisan :(",neut,neut,neut,neut,neut,neg,neut,neut,neut,neut
tempat yg nyaman dan tenang untuk istirahat..tp tolong ac nya kurang dingin..semoga di perhatikan..,neg,neut,neut,neut,neut,neut,neut,neut,neut,neut
kamar sesuai foto..bagus nyaman tapi sayang shower mandi nya ga bisa pake air dingin terlalu panas mungkin rusak selebih nya sangat bagus sip deh,neut,neg,neut,pos,neut,neut,neut,neut,neut,neut
"kamarnya bersih, tp sayang wifinya tidak sampai kekamar dan tayangan televisinya burem(gambarnya tidak jernih hampir smua chanel)",neut,neut,neut,neut,pos,neut,neut,neut,neg,neg
LAYANAN MENGECEWAKAN!!! ,neut,neut,neut,neut,neut,neut,neg,neut,neut,neut
"sdh 2x ini inap di airy tp ga prnh dpt bingkisan kotak biru dari airy (complimentery) pdhl baca review tmn2 sering pd dpt. waktu nanya dari pihak hotel katanya dr airy ga prnh krm lagi, ty ke customer service airy di jwb airy ga ada gitu2an, dan percakapan lgsg di hentikan oleh customer service ats nama koko",neut,neut,neut,neut,neut,neg,neg,neut,neut,neut
"Kamarnya tdk ada jendela, ac kurang dingin, seprei/bantal agak berdebu..semalaman hidung jg gatel2..kamar kecil..breakfast ala kadarnya..ok utk tidur 1 mlm. Wifi nya kenceng soalny dpt kmr deket router wifi. Thanks utk snack complimentaryny.",neg,neut,neut,neut,neut,neg,neut,neg,neut,pos
AC tidak dingin dan pintu kamar mandi bocor but overall nice esp.  makanannya. dekat dari tempat makan di luar hotel dan supermarket,neg,neut,neut,pos,neut,neut,neut,pos,neut,neut
selama menggunakan airy rooms ini airy paling mengecewakan 1. wifi g connect ke kamar 2. pintu kamar mandi ga bs di tutup kalau tidak di kunci dr dalam 3. ac netes mulu/bocor 4. shower harus di pegang ga bs di taroh tempatnya 5 INI yang parah LISTRIK KAMAR MATI karena abs pulsa listriknya tp responnya kurang tanggap nih ga ada inisiatif cepet,neg,neut,neut,neut,neut,neut,neg,neut,neut,neg
"perlengkapan mandi tidak ada,pelayanan kurang baik,kami sangat kecewa",neut,neut,neut,neut,neut,neg,neg,neut,neut,neut
"air kamar mandinya panas ga bisa jd dingin, g ada room cleaning (sy 2n2d tinggalnya), wifinya ngga nyambung padahal password udah bener",neut,neg,neut,neut,neut,neut,neut,neut,neut,neg
"SAya menginap tidak full satu hari krna beberapa hal : 1. Bantal yg disediakan tidak layak (keras,  wrna bantal coklat, ukuran kecil) 2. AC perlu di cek lg krn bunyinya keras didlm ruangan dan suhu sdh 18 tidak terasa dinginnya. 3. cat tembok di kmr mandi perlu diperbaiki lg krna byk yg mengelupas 4. air panas lama keluarnya kira selbh br kluar. ",neg,neg,neut,neut,neut,neg,neut,neut,neut,neut
"kamar mandinya kotor dan bau, banyak semut dikamar sehingga tidak bisa menaruh makanan sembarangan. pelayanannya kurang baik dari receptionis dan pegawainya. fasilitas seperti ac kurang dingin dan wifi tidak dapat digunakan. saya tidak akan menginap disana lagi pokoknya. ",neg,neut,neg,neut,neg,neut,neg,neut,neut,neg
Kamarnya berada di lantai 3. Dan air panasnya tidak ada,neut,neg,neut,neut,neut,neut,neut,neut,neut,neut
"lokasi di daerah komplek,. kalau untu kamar yg singel room itu mmg kecil, area untu sholat di kamar terbatas, mungkin kedepannya bisa diganti spreinya soalnya ada noda yg kurang sedap dipandang, tapi secara keseluruhan untuk yg menginap sehari sangat cocok dengan budget minimal, selain itu air panasnya juga ada",neut,pos,neut,pos,neut,neg,neut,neut,neut,neut
"Lantai banyak debu, handuknya kecil, sarapannya tidak sesuai yang dinformasikan.",neut,neut,neut,neut,neg,neg,neut,neg,neut,neut
kamar mandi kotor sungguh,neut,neut,neut,neut,neg,neut,neut,neut,neut,neut
Kamarnya rapih & lumayan bersih Yang paling memuaskan pelayanan ramah Handuk bersih & wangi Dengan catatan beberapa bantal sudah terlihat agak kotor & ada yg agak bau Sisanya sangat murah & terjangkau Sangat recomended bagi org yg budgetnya terbatas,neut,neut,neut,neut,pos,neg,pos,neut,neut,neut
"Kamarnya bau pengap, tidak sesuai di gambar yang bersih.",neut,neut,neg,neut,neut,neut,neut,neut,neut,neut
"pelayanan chek in lama dan sistem di resepsionis masih manual, kamar jelek, lantainya rusak, kotor dan kamar mandinya jelek",neut,neut,neut,neut,neg,neut,neg,neut,neut,neut
kebersihan kamar kurang sedikit terjaga..,neut,neut,neut,neut,neg,neut,neut,neut,neut,neut
Untuk koneksi wiffi lebih di tingkatkan lagi ...,neut,neut,neut,neut,neut,neut,neut,neut,neut,neg
"tempatnya sempurna, pas didepan Pantai Losari, namun sayang ACnya Kurang Dingin padahal sdh lapor namun tetep tidak bisa dingin",neg,neut,neut,neut,neut,neut,neut,neut,neut,neut
"nyaman, kamar luas, tp tidak ada free snack",neut,neut,neut,neut,neut,neg,neut,neut,neut,neut
"Lokasinya bagus, namun kondisi kamarnya cukup memprihatinkan. Mulai dari bau apek, AC yang berisik, cat dinding kamar yang terkelupas serta banyak noda, tidak ada perlengkapan mandi seperti handuk dan sikat gigi, tabung penyiram kloset tidak berfungsi, tidak ada kursi di dalam kamar dan sarapannya hanya satu pilihan yaitu nasi dengan menu seperti makan siang. Namun ini hal yang wajar mengingat harga yang paling murah dari kelas hotel bintang dua yang ada di Medan.",neg,neut,neg,neut,neg,neg,neut,neg,neut,neut
"Wifi mati, toilet rusak",neut,neut,neut,neut,neut,neut,neut,neut,neut,neg
"gak ada snack nya  payah, klo yg lain ok",neut,neut,neut,pos,neut,neg,neut,neut,neut,neut
"untuk kelengkapan kamar harap dilengkapi seperti handuk dan selimut, terima kasih",neut,neut,neut,neut,neut,neg,neut,neut,neut,neut
"Hotel Tua, dapat kamar yang kuncinya rusak, kemudian dipindah ke kamar lain, ketel air rusak dan bau, kamar mandi tergenang air ",neut,neut,neut,neut,neg,neg,neut,neut,neut,neut
"remot tv tidak ada baterai,air panas rusak,kamar kotor,tidaka ada bath math ,berantakan . sudah follow up ke Deva airy tidak ada respon ulang",neut,neg,neut,neut,neg,neut,neg,neut,neg,neut
"dekat dengan halte dan stasiun. yang perlu diperbaiki menu sarapan kurang variatif dan wifi ngadat.. kamar minta dibersihin tapi kurang bersih, handuk tidak diganti.. tapi untuk lainnya udah oke.. tq",neut,neut,neut,neut,neg,neg,neut,neg,neut,neg
kamar bersih dan peralatan tersedia. pelayanan juga lumayan baik dan cepat. tempat tidur brrsih. shower tdk memadai di lantai 4 tempat saya berada air mya kecil dan tdk memadai utk mandi saat pagi  jam 5.  dan saluran air menyeluarkan bau tidk sedap di pagi hari...,neut,neut,neg,neut,pos,neut,pos,neut,neut,neut
"kamarx kurang luas, slebihx nyaman dan wifi nya lumayan buat dikamar cm sering putus2. dan klo bisa sarapan nya di antar ke tiap kamar, karena kasian buat yg telat akhirx tidak kebagian sarapan. mkasih",neut,neut,neut,neut,neut,neut,neut,neg,neut,neg
Tidak ada air panas untuk mandi..,neut,neg,neut,neut,neut,neut,neut,neut,neut,neut
"wifi nya dong benerin, ga bisa connect internet, mana sinyalnya susah lg ilang timbul",neut,neut,neut,neut,neut,neut,neut,neut,neut,neg
"Pelayan yg baik dan ramah. tempat sesuai dengan gambar. tempat strategis sehingga memudahkan akses kemanapun. Namun, kualitas wifi perlu diperbaiki, karena jaringan yg sangat lambat. suasana nyaman dan relax. ",neut,neut,neut,neut,neut,neut,pos,neut,neut,neg
"cukup baik. kekurangan tamu tidak di antar ke kamar. satpam sangat ramah, saluran tv jernih, sarapan pagi enak, selimut tebel. pokoknya rekomen bgt lah",neut,neut,neut,neut,neut,neg,neut,pos,pos,neut
"wifi nya ga nyampe k kamar , selebihnya baik",neut,neut,neut,pos,neut,neut,neut,neut,neut,neg
overall sih bagus. Hanya pintu pagarnya cuma buka sampai jam 11 malam. Tidak bisa kalau ingin pulang pagi,neut,neut,neut,pos,neut,neut,neg,neut,neut,neut
Wifinya perlu di cek apakah sudah bisa atau belum bisa d gunakan oleh pengunjung,neut,neut,neut,neut,neut,neut,neut,neut,neut,neg
Untuk ditingkatkan kembali kebersihannya,neut,neut,neut,neut,neg,neut,neut,neut,neut,neut
Jika Wifi emang tidak ada..  Jgn di buat ada.. Lt 4 ribut..  Mungkin ada keluarga atau apalah.. Kmar gede..  ,neut,neut,neut,neut,neut,neut,neut,neut,neut,neg
"kamarnya gede dan luas banget tp sayang wifinya nggak ke detact sampai kamar :(, but overall OKE 👍😊",neut,neut,neut,pos,neut,neut,neut,neut,neut,neg
"kurang bagus,kamar nya sempit,kamar mandi y jg kurang bersih,menu breakfast y jg standar az.",neut,neut,neut,neut,neg,neut,neut,neg,neut,neut
