processed_text,ac,air_panas,bau,general,kebersihan,linen,service,sunrise_meal,tv,wifi
"bangunan tua, kasur tidak bersih, wifi tidak terjangkau di kmr, nilai plusnya dpt hrg murah promo dari airy...",neut,neut,neut,neut,neg,neg,neut,neut,neut,neg
pelayanan nya  kurang ramah dan tidak bersahabat...,neut,neut,neut,neut,neut,neut,neg,neut,neut,neut
kamar mandinya kurang bersih,neut,neut,neut,neut,neg,neut,neut,neut,neut,neut
"Kamar agak kotor, bau rokoknya kuat, sarapan dan pelayanan istimewa",neut,neut,neg,neut,neg,neut,pos,pos,neut,neut
"sangat mengecewakan, kamarnya kotor apalagi di atas lemari sampah berserakan, shower ga da jadi mandi pake timba itupun kita complain slow respond harus nelfon pihak airy dan owner. sangat kecewa sama airy room standarnya ga sesuai sama yang di harapkan. 1. ga da shower 2. ac ga dingin 3. ga da air panas 4. selimut ga sesuai standar. MENGECEWAKAN",neg,neg,neut,neg,neg,neg,neut,neut,neut,neut
"Tempatnya terlalu jauh, jangkauan wiifi tidak sampai kamar, air panas di kamar mandi tidak berfungsi dengan baik.",neut,neg,neut,neut,neut,neut,neut,neut,neut,neg
Air wc sendat. Air sedikit handuk tidak standar hotel.  ,neut,neut,neut,neut,neut,neg,neut,neut,neut,neut
"kamar ok bantal empuk tp ac amat sangat tdk dingin,,tidur ttp mandi keringat",neg,neut,neut,neut,neut,pos,neut,neut,neut,neut
Keren.  Cuma AC nya aja kurang dingin,neg,neut,neut,neut,neut,neut,neut,neut,neut,neut
"puas sih dengan kamarnya. luas dan panjang, ranjang twin nya juga lebar2. staff resepsionis ramah dan helpful. hanya satu hal yang mengecewakan, wifi mati alias tidak bisa diakses. katanya sedang diperbaiki tp sampai sy cekout tak kunjung bs dipakai..",neut,neut,neut,neut,neut,neut,pos,neut,neut,neg
Tempat bagus dan besar tapi kebersihan kirang karena banyak rambut di bantal,neut,neut,neut,neut,neg,neut,neut,neut,neut,neut
kotak snake airy ny kosong,neut,neut,neut,neut,neut,neg,neut,neut,neut,neut
pelayanan ramah. harga terjangkau dan kamar bersih. namun belum ada free wifi,neut,neut,neut,neut,pos,neut,pos,neut,neut,neg
"cukup, but keramahan yah agak kurang bagi kami.",neut,neut,neut,neut,neut,neut,neg,neut,neut,neut
"Seneng bgt dapet snack tambahan dari airy. Lokasi hotelnya bagus, dekat dengan pusat kota. Cuma kurang empuk sedikit bantalnya hihi",neut,neut,neut,neut,neut,neg,neut,neut,neut,neut
"Pintu kamar mandinya tdk bisa ditutup, TV-nya tdk ada remote-nya & tdk ada handuknya di perlengkapan mandinya.",neut,neut,neut,neut,neut,neg,neut,neut,neg,neut
"Ac kurang dingin, handuk kecil & minuman sama cemilan ngga diperbarui😣",neg,neut,neut,neut,neut,neg,neut,neut,neut,neut
"sangat kotor, toilet berkerak tdk disikat. lorong sekitar kamar berserakan spray dan gelas bekas ",neut,neut,neut,neut,neg,neut,neut,neut,neut,neut
"kamar mandi nya sedikit bau, selebihnya memuaskan. ",neut,neut,neg,pos,neut,neut,neut,neut,neut,neut
"Pelayanan ok, fasilitas big No, Dikamar tidak ada keset, flapon kaya rembesan air gitu udh lumutan, Agak bau apek, AC kurang dingin, pembuangan air kamar mandi agak mampet, gak rekomend lah pokok ya",neg,neut,neg,neut,neg,neut,pos,neut,neut,neut
jelek tdk ada makanan airy,neut,neut,neut,neut,neut,neg,neut,neut,neut,neut
"Kurang nyaman karena shower untuk closet duduk tidak ada , kurang bersih kesannya!",neut,neut,neut,neut,neg,neut,neut,neut,neut,neut
Acnya kurang dingin .. Selebihnya baik,neg,neut,neut,pos,neut,neut,neut,neut,neut,neut
"pesan kamar double bad, dpetnya twin bad.  handuk kotor. snacks di minta dlu baru di kasih. kamar lantai 3 tapi tdk ada yg membantu mengangkat koper sampai ke kamar. tidak ada lift",neut,neut,neut,neut,neg,neg,neg,neut,neut,neut
Kebersihan ditingkatkan,neut,neut,neut,neut,neg,neut,neut,neut,neut,neut
Kamar bau.,neut,neut,neg,neut,neut,neut,neut,neut,neut,neut
vs kurang ramah,neut,neut,neut,neut,neut,neut,neg,neut,neut,neut
Kamar berdebu. kamar mandi kurang bersih,neut,neut,neut,neut,neg,neut,neut,neut,neut,neut
cs ga selalu ada. jd ga bisa minta cemilan. lalu kemaren katanya ada handuk kalau ngak slh. tp ga d kasih. sabun mandi pas habis d akhir saya check out tv tidak bisa d tontoj,neut,neut,neut,neut,neut,neg,neg,neut,neg,neut
"Wifi tidak bisa connect, Sulit sekali mendapatkan AIRY GONDOKUSUMAN URIP SUMOHARJO 64,..Baru setelah nelpon call center ada info yang menghandle Tickle Hotel",neut,neut,neut,neut,neut,neut,neut,neut,neut,neg
"nyaman, ramah, tidak bising, sarapan enak, gelas bekas lipstik orang .. #saya ga pake lipstik",neut,neut,neut,neut,neg,neg,neg,pos,neut,neut
Ga masalah hotelnya lama. Cuma sayang aja kurang bersih. Keliatan sprei ga di ganti. Ga di rapihin p,neut,neut,neut,neut,neg,neg,neut,neut,neut,neut
"listrik sempet mati, kasur bau",neut,neut,neut,neut,neut,neg,neut,neut,neut,neut
"mohon pelayanan nya lebih ramah lagi, recepcionisnya kurang ramah",neut,neut,neut,neut,neut,neut,neg,neut,neut,neut
"semua baik, lokasinya di tengah kota, yang perlu diperbaiki terkait layanan adalah : 1. ketersediaan sarapan (kami turun jam 9 kurang, nasgo abis dan roti tak ada serta meja kotor k/pelayan hanya 2 merangkap resepsionis) 2. lift tanpa alasan yg bisa dibenarkan dimatikan (padahal tdk ada perbaikan) shg saya yg terkilir dan ortu 80th harus via tangga",neut,neut,neut,neut,neut,neut,neut,neg,neut,neut
"sdh 2x ini inap di airy tp ga prnh dpt bingkisan kotak biru dari airy (complimentery) pdhl baca review tmn2 sering pd dpt. waktu nanya dari pihak hotel katanya dr airy ga prnh krm lagi, ty ke customer service airy di jwb airy ga ada gitu2an, dan percakapan lgsg di hentikan oleh customer service ats nama koko",neut,neut,neut,neut,neut,neg,neg,neut,neut,neut
"Pelayanan tidak memuaskan, makanan habis pas sahur, kamar 2 hari tidak dibersihkan, receptionist tidak sopan dan menjangkelkan",neut,neut,neut,neut,neg,neut,neg,neg,neut,neut
"kamar berdebu,  fasilitas air panas di lantai 3 tdak ada, telfon juga tdak ada.. tp staf nya sangat ramah.. ",neut,neg,neut,neut,neg,neut,pos,neut,neut,neut
"over all sangat baik, kecuali PARKIR MOTOR YANG KOTOR DAN TIDAK TERAWAT",neut,neut,neut,pos,neg,neut,neut,neut,neut,neut
"kamar nya kotor dan sempit,handuknya tipis dan bau air mani.kamar mandi nya banjir air lama mengalir.saya langsung cek out setelah melihat kondisi kamarnya.Pokoknya gak recomended bangettttt.Nyesel juga ga sesuai sama fotonya menipu bgttt kapok deh.",neut,neut,neut,neg,neg,neg,neut,neut,neut,neut
Wifi tidak bisa dipakai. Banyak noda di sprei. Banyak nyamuk,neut,neut,neut,neut,neg,neg,neut,neut,neut,neg
"Pelayannya tidak ramah , kalau ada tamu tidak dituntun untuk ke kamarnya . Masa kita bayar tapi mere",neut,neut,neut,neut,neut,neut,neg,neut,neut,neut
"kamarnya sempit, tidak ada air mineral dan snack khas airy, bantal airy pun tdk ada. receiptionistnya kurang ramah. jauuh berbeda dgn airy room yg harganya di bawah ini.",neut,neut,neut,neut,neut,neg,neg,neut,neut,neut
"Airy room yg di Country Heritage , kurang memuaskan ruangan kotor berdebu, apalagi belakang TV seperti g pernah dilap, mungkin jarang dipakai kali,  risih berada didlm, akhirnya sama pihak hotel diganti dngn yang bukan airy room dan dikasih free, gapp y saya tulis yang sebenarnya, supaya Airy room kedepan lbh baik lg",neut,neut,neut,neut,neg,neut,neut,neut,neut,neut
"Kalo itinerary ke seputaran Seminyak, tempat nya OK dan relatif deket kmn2. Kamar mandi perlu ditingkatkan kebersihan nya, selain itu OK ",neut,neut,neut,neut,neg,neut,neut,neut,neut,neut
"kurang bersih, banyak serangga. ",neut,neut,neut,neut,neg,neut,neut,neut,neut,neut
tv ya masih buremm.. airy kapan di perbaiki,neut,neut,neut,neut,neut,neut,neut,neut,neg,neut
AC krg dingin,neg,neut,neut,neut,neut,neut,neut,neut,neut,neut
"kebersihan selimut kurang,  air panas kadang muncul kadang berhenti. Saya beri penilaian 5/10.",neut,neg,neut,neut,neut,neg,neut,neut,neut,neut
Kamar mandi nya kotor banget. Mati lampu 2kali dan lumayan lamaa.,neut,neut,neut,neut,neg,neut,neut,neut,neut,neut
"pelayanannya biasa, tidak ada pernak pernik airy ketika awal masuk kamar",neut,neut,neut,neut,neut,neg,neg,neut,neut,neut
"kamar tidak sesuai foto sangat kotor ,kurang terawat,,foto sangat menipu dengan keadaan sebenarnya",neut,neut,neut,neut,neg,neut,neut,neut,neut,neut
"Nyaman, pelayanan baik hanya air hangatnya tak berfungsi dengan baik",neut,neg,neut,neut,neut,neut,pos,neut,neut,neut
Box snack airy tidak ada dan perlengkapan mandi tidak ada,neut,neut,neut,neut,neut,neg,neut,neut,neut,neut
air panas nya nga bisa,neut,neg,neut,neut,neut,neut,neut,neut,neut,neut
airy rooms memberikan garansi air panas gratis kok ini nambah Rp 10.000/malam kamar juga tidak sesuai dengan foto lebih jelek tv juga masih tv tabung belum LED,neut,neut,neut,neut,neut,neg,neut,neut,neg,neut
"yang berkesan jajan dan amenities nya lengkap. keren. hanya saja hptel yang bekerja sama sangat kurang. karena saat saya kesini tidak ada tisu toilet, air di termos bau, gula keras creamer keras, sepertinya sudah lama sekali tidak diganti. dan balkon juga jarang dibersihkan jadi berdebu",neut,neut,neut,neut,neg,pos,neut,neut,neut,neut
"sarapannya enak, ruangannya luas. kekuranngannya tidak ada tv kabel.",neut,neut,neut,neut,neut,neut,neut,pos,neg,neut
"suasana menyenangkan,kamar mandi agak kotor..lubang shower agak bumpet, pelayanan baik...di ujung lorong ,ada jendela yang bolong tdk ada kacanya..jadi hampir aja anak saya terjun bebas...krn dpt kamarnya pas d ujung..kasur bersih,ac lumayan sejuk,ada kolam renang bersih,lokasi mudah d jangkau,hrga sesuai,,",pos,neut,neut,neut,neg,pos,pos,neut,neut,neut
"Kotor, tidak ada air, jorok, tidak nyaman.",neut,neut,neut,neut,neg,neut,neut,neut,neut,neut
"sayangnya fasilitas Hotel msi Kurang Lengkap... gak ada pemanas Air, toilet Sedikit Bau, view luar jendela sgt Kotor, sampah Plastik puntung Rokok  bahkan K*dom berserakan di luar jendela, n Sendal gak ada dgn alasan Soldout...",neut,neut,neg,neut,neg,neg,neut,neut,neut,neut
"nomer telpon susah d hubungi, g ada penjaga",neut,neut,neut,neut,neut,neut,neg,neut,neut,neut
"Kondisi kamar mandi hotel nya sebgain alat nya rusak, kondisi hotel jendel rusak,  kebersihanya kurang baik, pelayanan resepsionis baik, sarapan pagi nya sudah cukup baik.",neut,neut,neut,neut,neg,neg,neut,pos,neut,neut
"lumayan shock pas masuk ke kamar mandinya, tidak bersih, syukurnya resepsionistnya menerima keluhan saya, dan cepat tanggap, sehingga diganti kamar lainnya, saran: pelayanan dari  house keepingnya lbh ditingkatkan dlm menjaga kebersihan kamar serta kamar mandi.....sehingga tamu betah u balik lagi, over all mksh airy 😊",neut,neut,neut,neut,neg,neut,pos,neut,neut,neut
"Fasilitas yang ada sesuai dengan harga, walaupun AC memang kurang dingin..",neg,neut,neut,neut,neut,neut,neut,neut,neut,neut
"walaupun hotelnya dipindahkan karena alasan renovasi (dan kamar saya sepertinya di downgrade), tp keluarga tetap merasa nyaman. ac dingin, kasur empuk, air panas ada, tp langit2 banyak sawangnya, kamar mandi juga, tp overall okelah",pos,neg,neut,pos,neg,pos,neut,neut,neut,neut
kamar besar cuma minusnya ac kurang dingin dan layanan tv nya kurang bagus,neg,neut,neut,neut,neut,neut,neut,neut,neg,neut
bagus cuma kurang bersih aja,neut,neut,neut,neut,neg,neut,neut,neut,neut,neut
"Proses check in cepat, kamar bersih dan luas,setup airy kurang : snack cuma dibungkus plastik tanpa kotak biru khas airy, bed cover strip biru khas airy tidak ada. Jendela rusak tidsk bisa dikunci, keran wastafel rusak mohon diperbaiki hotel.",neut,neut,neut,neut,pos,neg,pos,neut,neut,neut
"seprai nya kotor, tidak ada air panas, pelayanan kurang, kamar kurang bersih",neut,neg,neut,neut,neg,neg,neg,neut,neut,neut
"Sangat sangat mengecewakan, kamar yg bau ditambah dengan fasilita tv yg jelek dan kamar mandi yg jor",neut,neut,neg,neut,neut,neut,neut,neut,neg,neut
"dekat dg jatimpark 2, kamar bersih cuma pada saat datang guest house sedang di renovasi jd banyak debu. saat itu saya bawa 2 bayi. jd keluar hotel hanya untuk ke jatimpark saja",neut,neut,neut,neut,pos,neut,neut,neut,neut,neut
"SANGAT TIDAK MEMUASKAN!!! Kamar penuh nyamuk,minta obat nyamuk semprot saja tidak ada.dinding penuh dengan nyamuk mati.dalam semalam bisa membuh 20 nyamuk.kamar mandi juga kotor",neut,neut,neut,neut,neg,neut,neut,neut,neut,neut
"tidak sesuai deskripsi penginapannya, tidak ada cemilan, peralatan mandi, tidak bersih, dan tidak memakai sarung bantal airy di hotel airy harmoni hayam wuruk ini saya kecewa",neut,neut,neut,neg,neg,neg,neut,neut,neut,neut
"2 kali kesini, AC masih aja ngga seberapa dingin, alat mandi juga cuman sabun ngga ada shampo, air panas/hangat ngga berfungsi.",neg,neg,neut,neut,neut,neg,neut,neut,neut,neut
Baru ini kecewa sama airy rooma. Lokasi susah dicari. Tempat tidak sesuai dengan alamat yang tertera. Tidak ada penanda tempat seperti airy rooms yang lain. Tidak ada snack maupun minuman seperti airy rooms yg pernah saya tempati,neut,neut,neut,neut,neut,neg,neut,neut,neut,neut
menurut saya alangkah lebih baik lagi debunya dibersihkan pada slimut...  slimut lebih nyaman kalau warna putih semua dan agak di tebelin lagi selimutnya...  ,neut,neut,neut,neut,neg,neg,neut,neut,neut,neut
"Tempat strategis dipusat kota, tp kok gak dpt snack ya? Trus ada bau asap rokok",neut,neut,neg,neut,neut,neg,neut,neut,neut,neut
"lumayan sesuai harga. pelayanan baik, air panas tdk berfungsi, wifi sering hilang, lantai kamar basah kalo hujan keras.",neut,neg,neut,neut,neg,neut,pos,neut,neut,neg
"nyaman, bersih, tv aja yang kurang bagus ga ada yg bisa ditonton dgn jelas. ac dingin.",pos,neut,neut,neut,pos,neut,neut,neut,neg,neut
ga sesuai dengan di foto spray lusuh  dan kotor,neut,neut,neut,neut,neut,neg,neut,neut,neut,neut
Per bagus wafi karna belum sampai ke kamar. Tambahkan menu untuk makanan di kantinnya,neut,neut,neut,neut,neut,neut,neut,neg,neut,neg
"kurang ramah, saat datang kondisi kamar belum siap untuk digunakan karena AC bermasalah.",neg,neut,neut,neut,neut,neut,neg,neut,neut,neut
Sedih wifi sama TV gak bisa. Terus kamar mandi kurang bersih. Cuma untuk harga segitu itu udah baik lah ya. ,neut,neut,neut,neut,neg,neut,neut,neut,neg,neg
"Pelayanan ok, tapi... kamarnya agak pengap AC sudah agak tua dan berisik.",neg,neut,neg,neut,neut,neut,pos,neut,neut,neut
"gedungnya kurang layak pengap , air shower kecil banget , flush nya rusak . pelayanan nya baik tapi kurang respon seperti tambahan snack . tv nya posisi terlalu keatas kurang jelas dan parkiran sangat kurang memadai. overall lumayan buat liburan ",neut,neut,neg,pos,neut,neg,pos,neut,neg,neut
"tidak ada sandalnya.. wktu check in pas masuk kamar blm di set airy dan blm ada Snack nya.. overall it's ok, and nice place.. ",neut,neut,neut,pos,neut,neg,neut,neut,neut,neut
kamar seram dan kotor. sepertinya badcovernya tidak di ganti karna banyak bercak noda,neut,neut,neut,neut,neg,neg,neut,neut,neut,neut
"fasilitas seperti makanan, minum, dan bantal airy tidak tersedia di hotel ini",neut,neut,neut,neut,neut,neg,neut,neut,neut,neut
Kurang nyaman dan sempit. Tidak terlalu bersih sprei nya kusam,neut,neut,neut,neut,neg,neg,neut,neut,neut,neut
"kurang stopkontak, pemanas air kurang baik",neut,neg,neut,neut,neut,neut,neut,neut,neut,neut
receptionis gak ramah sama sekali....mamyun2 dan gak mantap lah pokok nya...,neut,neut,neut,neut,neut,neut,neg,neut,neut,neut
semua baik hanya channel tv yg mungkin bs diperbaiki,neut,neut,neut,pos,neut,neut,neut,neut,neg,neut
Lokasi bagus. Check in lancar. Bedsheet kurang bersih,neut,neut,neut,neut,neut,neg,pos,neut,neut,neut
kamarnya sangat tidak sesuai gambar yang ditampilkan dan kotor,neut,neut,neut,neut,neg,neut,neut,neut,neut,neut
kamar tidak seperti yang ada di foto. kotor. pintu seperti kamar kos2an,neut,neut,neut,neut,neg,neut,neut,neut,neut,neut
"Stafnya cepat tanggap dan ramah, rasa makanan lumayan, lokasi dekat mega mall, desain hotel antik, cuma sayangnya lantai kamar mandi kurang didesain bagus, kalau mandi air tidak bisa mengalir ke pembuangan, air mandi kurang panas.",neut,neg,neut,neut,neut,neut,pos,pos,neut,neut
"kamarnya kotor, shower kamar mandi rusak, pelayanannya tidak ramah dan tidak recommended untuk penginapan selanjutnya.",neut,neut,neut,neg,neg,neut,neg,neut,neut,neut
"sudah 2x menginap disini tapi kali ini dpt kamar yg kurang bersih, kloset jg ga begitu bersih, bedny terasa per nya, tempat sampah rusak, sampe showerpun agak macet airnya,, cuman pelayanan ttp ramah..",neut,neut,neut,neut,neg,neg,pos,neut,neut,neut
airy brengsek. menjual kamar hancur berantakan. kalian jual kamar buat tamu esek2 ya??? kamar kotor bau rokok. tidak ada handuk tidak ada air. pintu kamar mandi rusak. komplain ke airy tidak direspon. sangat2 mengecewakan sekali. tutup z airy g pantas kalian jualan kamar kayak gitu. skalian z jual jasa service esek2. hotel kok hancur gt.  ,neut,neut,neg,neg,neg,neg,neg,neut,neut,neut
"pada awal saya masuk kamar bau rokok. kemudian saya masuk kamar mandi, di toilet nya ada tinja yang muncul mungkin mampet salurannya sehingga naik ke atas. akhirnya saya flash dan bau sekali. kemudian saya menyalakan tv, tp tv tidak keluar gambar. air botol, snack tidak tersedia tissue juga tidak ada. mohon untuk memperbaiki fasilitas terutama kamar mandi",neut,neut,neg,neut,neut,neg,neut,neut,neg,neut
kamar mandi kurang baik n bau rokok,neut,neut,neg,neut,neut,neut,neut,neut,neut,neut
"saat cek in kamar blm siap, handuk & perlengkapan mandi belum ada.. water heater tidak ada.. fasilitas hotel yang lain cukup ok",neut,neg,neut,neut,neut,neg,neut,neut,neut,neut
lebih dijaga kebersihannya trims,neut,neut,neut,neut,neg,neut,neut,neut,neut,neut
"kamar dan lokasi oke, channel tv sucks. isinya cuma iklan2 bahkan channel lokalpun tidak tersedia. staff jg sebaiknya jgn merokok di dalam krna bau rokok masuk ke kamar. tqyu",neut,neut,neg,neut,neut,neut,neg,neut,neg,neut
pelayanan bagus sangat ramah. cuma ac kurang dingin dan channel tv kurang lengkap,neg,neut,neut,neut,neut,neut,pos,neut,neg,neut
"air mandi tdk hangat,tdk dpt toiletries khas Airy :( tdk ada snack,bantal, dan piranti Airy :(",neut,neg,neut,neut,neut,neg,neut,neut,neut,neut
Air panas tidak ada,neut,neg,neut,neut,neut,neut,neut,neut,neut,neut
"Untuk harga yg sangat terjangkau, fasilitasnya melebihi ekspektasi. Kamar luas, dingin. Sayangnya water heater sdg dibenerin dan kasur agak keras. Cuma utk harga segini, sangat sangat ok!!!",neut,neg,neut,pos,neut,neut,neut,neut,neut,neut
Pelayanan kurang baik,neut,neut,neut,neut,neut,neut,neg,neut,neut,neut
hanya saja air showernya...ngk panas.....dingin....,neut,neg,neut,neut,neut,neut,neut,neut,neut,neut
sebaiknya pelayanan lebih ditingkatkan,neut,neut,neut,neut,neut,neut,neg,neut,neut,neut
bersih tapi ac tidak dingin mesti di service lagi ,neg,neut,neut,neut,neut,neut,neut,neut,neut,neut
hanya kamar mandi dan wastafel banjir,neut,neut,neut,neut,neg,neut,neut,neut,neut,neut
"kamarnya agak lembab , tidak ada hot water , handuk hanya 1 , kasurnya kurang nyaman",neut,neg,neg,neut,neut,neg,neut,neut,neut,neut
Tempat nyaman & Receptionist ramah. Hanya saat tengah malam ada tamu telpon didepan receptionist dg pintu pembatas ruangan dibiarkan terbuka oleh petugas malam yg berperawakan kurus shg suara terdengar di kanar. Secara keseluruhan baik.,neut,neut,neut,pos,neut,neut,pos,neut,neut,neut
Sya puas menginap di hotel ini dari segi harga sangat terjangkau acbagus keaman bagus kebersihan juga bagus yang hanya air panas gak panas ,pos,neg,neut,neut,pos,neut,neut,neut,neut,neut
bagus. hanya saja untuk air panasnya kurang. karena masih terasa dingiiiiiiin euy.. utk tmpat tidur sih bagus dan nyaman.,neut,neg,neut,neut,neut,neut,neut,neut,neut,neut
Tempat nyaman tetapi pelayanan tidak bagus,neut,neut,neut,neut,neut,neut,neg,neut,neut,neut
"toiletnya kotor, waktu itu sy sampai dihotel jam 13:15, utk check in hrs mnggu jam 2, trus ga berapa lama mas'nya bilang hrs nggu stengah jam lg. klo mau early check in hrs bayar 50rb padahal kamar jg sdh ready... karena sdh capek perjalanan akhirnya bayar 50rb. baru kali ini dpt pngalaman kurng mnyenangkn dari hotel airy... next ga ke hotel ini lg...",neut,neut,neut,neg,neg,neut,neg,neut,neut,neut
"gak ada snack nya  payah, klo yg lain ok",neut,neut,neut,pos,neut,neg,neut,neut,neut,neut
"Lumayan bersih, nyaman Cuma showernya rusak, airnya ketika di setel hangat, yang keluar panas, bentar kemudian dingin, panas lagi, dst. ",neut,neg,neut,neut,pos,neut,neut,neut,neut,neut
Spreinya ada bekas noda dan lusuh seperti habis di pake tamu lain terus tidak di ganti mungkin. Terus bau apek sampai saya harus turun ambil parfum mobil. Pintu tidak dapat di kunci dari luar.,neut,neut,neg,neut,neut,neg,neut,neut,neut,neut
"Pelayanan ramah sekali, namun gang jalan masuk terlalu kecil.. untuk kamar nya sendiri AC nya kurang dingin, banyak nyamuk..",neg,neut,neut,neut,neut,neut,pos,neut,neut,neut
"Tidak ada yg bertulisan Airy di room 107, remot TV tdk bs di pakai(rusak), remot AC tdk ada(hidupin AC manual), perlengkapan kamar mandi cmn ada handuk. Kami sangat kecewa yg di room 107 Room 103 sangat puas perlengkapan room ada smua",neg,neut,neut,neut,neut,neg,neut,neut,neg,neut
layanan y memuaskan ...masukan aja kamar yg kami tempati agak bau y kurang enak...mungkin kamar y bisa di kasih pengharum ruanagan...,neut,neut,neg,neut,neut,neut,pos,neut,neut,neut
"Balkon banyak puntung rokok, wifi ga bisa alasannya karena kamar dipojok, kunci toilet nya rusak. tapi kamar nya bersih dan tenang. Harga bersahabat. ",neut,neut,neut,neut,pos,neut,neut,neut,neut,neg
"enak sih..bagus..tapi kamar mandinya bau banget,sampe ga tahan baunya...tolong diperbaiki ya gimana caranya supaya gak bau",neut,neut,neg,neut,neut,neut,neut,neut,neut,neut
tidak ada snack di airy room nya,neut,neut,neut,neut,neut,neg,neut,neut,neut,neut
"Kamar mandi kotor, hotel sering buat kegiatan aneh2",neut,neut,neut,neut,neg,neut,neut,neut,neut,neut
"Kerapian kamar kurang, banyak kabel yang tidak rapi. Sofa kotor.  Sarapan nasinya keras",neut,neut,neut,neut,neg,neut,neut,neg,neut,neut
"staff ya baik dan ramah, air panas kurang panas ",neut,neg,neut,neut,neut,neut,pos,neut,neut,neut
"Kran kamar mandi mati,,pintu kamar mandi tidak bisa dikunci,,ac panas,,no wifi,, handuk cuma dikasih 1,,pdhal tamu nya 2.",neg,neut,neut,neut,neut,neg,neut,neut,neut,neg
memuaskan tetapi ac nya berisik,neg,neut,neut,neut,neut,neut,neut,neut,neut,neut
keramahan staf hotel ditingkatkan lagi,neut,neut,neut,neut,neut,neut,neg,neut,neut,neut
"Kursi tidak bisa dipakai, malah dijadikan ganjalan meja. Toilet becek, AC berisik, kolong kasur kotor banyak sampah. ",neg,neut,neut,neut,neg,neut,neut,neut,neut,neut
"ruangnya terkesan sempit, airy hanya dapat kamar di lt 1, tidak ada jendela, tidak ada hot shower. ruko yg dijadikan hotel jadi agak boring aja dikamar terus tidak bs melihat situasi luar kamar. pelayanannya baik, wifi kencang, air mineral dr air galon (isi sendiri). hotelnya harusnya masuk ke eco bukan standard.",neut,neg,neut,neut,neut,neut,pos,neut,neut,pos
lemarinya kamar ya tlg biar ga berdebu dan banyak remah remah bangunan,neut,neut,neut,neut,neg,neut,neut,neut,neut,neut
bagus: 1. lokasi startegis 2. suasana tenang kurang 1. sprei kotor 2. air kurang deras,neut,neut,neut,neut,neg,neg,neut,neut,neut,neut
"sarapan pagi enak. sayangnya kamar berbau asap rokok, kebersihan kamar dan kamar mandi perlu ditingkatkan. resepsionis ramah. tenkyu. ",neut,neut,neg,neut,neg,neut,pos,pos,neut,neut
sdh baik... hanya ac kurang dingin.,neg,neut,neut,neut,neut,neut,neut,neut,neut,neut
"kamar mandinya tidak bersih atau mengeluarkan bau yang tidak enak di hidung. Showernya juga rusak. Siaran tv nya sedikit. Roomnya tidak ada jendela, jadi pengap di dalam. Semoga bisa diperbaiki. Selebihnya bagus. ",neut,neut,neg,pos,neg,neut,neut,neut,neg,neut
kamar lumayan. sayang wifi susah koneksi,neut,neut,neut,neut,neut,neut,neut,neut,neut,neg
"Hotel Kurang bersih, petugas Hotel jg kurang ramah",neut,neut,neut,neut,neg,neut,neg,neut,neut,neut
Sprei kurang bersih,neut,neut,neut,neut,neg,neg,neut,neut,neut,neut
ac nya mati mati terus jdi mengganggu waktu istrahatnya,neg,neut,neut,neut,neut,neut,neut,neut,neut,neut
"Datang jam 1 siang tapi tidak boleh cek in, kamar kotor, hotel ramai dan jorok.",neut,neut,neut,neut,neg,neut,neg,neut,neut,neut
"Menyenangkan, lokasi dekat ke berbagai resto & tempat makanan (KFC, Richeese, Pizza Hut, dll), dekat Indomaret, parkiran oke. Sayang terakhir ke sana, wifi sedang bemasalah...",neut,neut,neut,neut,neut,neut,neut,neut,neut,neg
"Saya akan berbagi tentang pengalaman saya menginap di airy 1. ketika saya masuk ke kamar dan ingin berbaring aku mersa kecewa dengan sarung bantalnya, bau itulah kesan pertama yang ada dipikiran, dan kusut, saya berfikir ini diganti g ya sarungnya 2. banyak nyamuk 3. banyak semut, saya baru sadar ketik sampai di bandara ternyata tas q bnyk smut",neut,neut,neut,neut,neut,neg,neut,neut,neut,neut
check in check out mudah.air hangat ada meski tak begitu lancar.ada dispenser di setiap lantai.parkir luas.kamar tak seluas seperti gambar.ada meja.tak ada lemari.saluran tv tak begitu jelas.lift dalam perbaikan.kamar mandi perlu ditingkatkan kebersihannya.,neut,neg,neut,neut,neg,neut,neut,neut,neg,neut
"murah sih tapi jg coba coba bawa anak bahaya tangganya tinggi kalau anak jatuh selesai dah game over,ac-nya juga gak dingin....foto fotonya coba lebih real jd konsumen tidak salah book atau terlanjur bayar kesihan......kalau nginep sendiri is ok tapi gak kalau bareng keluarga.....",neg,neut,neut,neut,neut,neut,neut,neut,neut,neut
Air panas di kamar mandi tidak bisa digunakan. Air tandon di kloset tidak bisa digunakan sehingga menyiram kloset dengan cara manual. Pintu kamar mandi tidak bisa di tutup rapat. Kamar mandi kurang bersih.,neut,neg,neut,neut,neg,neut,neut,neut,neut,neut
