processed_text,ac,air_panas,bau,general,kebersihan,linen,service,sunrise_meal,tv,wifi
"Resepsionis ramah, hotelnya lumayan dengan harga segitu, dpt harga murah 100rb/mlm, hanya saja kamar mandi rada kotor.  Tp lokasi cukup strategis",neut,neut,neut,neut,neg,neut,pos,neut,neut,neut
"kamarnya lumayan, cuma view nya kurang soalnya langsung genteng rumah orang. sedikit kecewa, baru kali ini nginep pake airy gaa dikasih camilan gratisnya. tempat tidurnya enak, bikin betah tidur. tapi sayang kamar mandinya kya gaa terawat, bau dan licin dan gaa ada air hangatnya.",neut,neg,neg,neut,neg,neg,neut,neut,neut,neut
"Wifinya tidak jalan, sangat disayangkan. Ruangan terlalu gelap dan tidak ada jendela",neut,neut,neut,neut,neut,neut,neut,neut,neut,neg
"Pengelola di lapangan tidak komunikatif, kamar mandi masih kotor (banyak kekuningan di keramik), AC kurang dingin, channel TV terbatas, pengelola lapangan jarang di tempat dan tidak ada tempat sampai namun sesuai dengan harganya 50 ribu.",neg,neut,neut,neut,neg,neut,neg,neut,neg,neut
"Dapat kamar yg jarang d huni, kotor dan ga ada fasilitas lift ......huufffttttt",neut,neut,neut,neut,neg,neg,neut,neut,neut,neut
kurang ya pelayanya nunggunya lama.  tapi kmar good ,neut,neut,neut,neut,neut,neut,neg,neut,neut,neut
"Hotelnya gelap, kamarnya kotor, bau seperti bau bangkai tikus dan ada KECOAKnya, sepraynya juga koto",neut,neut,neg,neut,neg,neg,neut,neut,neut,neut
"nyaman dan sangat murah dengan kamar yang sangat bagus, namun sprei sedikit kusam dan ada sedikit noda, shower kurang berfungsi, dan lantai berdebu. walaupun begitu tetap recommended karena nyaman dan ada rooftop untuk sunrise  ",neut,neut,neut,neut,neg,neg,neut,neut,neut,neut
"Hotel dengan nuansa interior tradisional. Lokasi strategis dengan akses ke berbagai moda transportasi mudah,, dekat dengan mall dan food court. Kamar sempit dan AC yang berisik mungkin itu saja yang menjadi kekurangannya.",neg,neut,neut,neut,neut,neut,neut,neut,neut,neut
"Plus, kamar bersih, tempat tidur yang cukup empuk.pelayanannya cukup bagus. Minus, kamar banyak nyamuknya dan toilet penuh kecoa.",neut,neut,neut,neut,neg_pos,pos,pos,neut,neut,neut
bagus tapi Kalo bisa kamarnya di basement di beri penguat sinyal. wifi ditambah. ,neut,neut,neut,neut,neut,neut,neut,neut,neut,neg
"Pesan 2 kamar cuman dapat sandal 2 pasang,  kamar bau",neut,neut,neg,neut,neut,neg,neut,neut,neut,neut
nyaman pelayanan ok cman box airy yg berisikam snack kosong,neut,neut,neut,neut,neut,neg,pos,neut,neut,neut
"kamarnya nyaman, acnya berbunyi,lantai kamarnya kurang bersih tapi makanan unuk sarapannya enak terima kasih airy",neg,neut,neut,neut,neg,neut,neut,pos,neut,neut
"fasilitas di dalam kamar melebih ekspektasi dengan harga dibawah seratus ribu. TV, AC, wifi kenceng, dapat sncak pula.minusnya kamar mandi tidak dibersihkan jd ada kerak2 coklat di lantai dan dinding kamar mandi dan bau tidak sedap tercium dari saluran air di kamar mandi.lokasi agak masuk dari jalan raya,tp masih accessible.kemungkinan besar balik lagi apabila ada keperluan di sby.",pos,neut,neg,neut,neg,pos,neut,neut,pos,pos
check in check out mudah.air hangat ada meski tak begitu lancar.ada dispenser di setiap lantai.parkir luas.kamar tak seluas seperti gambar.ada meja.tak ada lemari.saluran tv tak begitu jelas.lift dalam perbaikan.kamar mandi perlu ditingkatkan kebersihannya.,neut,neg,neut,neut,neg,neut,neut,neut,neg,neut
bagus. tapi ga ada sinyal di dalam kamar. wifi juga ga sampek. tapi nyaman. pelayanan cukup,neut,neut,neut,neut,neut,neut,pos,neut,neut,neg
bau kamarnya kurang wangi. kalau diberi pengharum ruangan lebih baik,neut,neut,neg,neut,neut,neut,neut,neut,neut,neut
"sy booking 2kmr hr sabtu, air mati shg tdk bs mandi maupun utk urusan kamar kecil. kamar mandi sangat kotor.  Ranjang baik, kebersihan kamar lumayan. prncahayaan ruangan kirang lampu.",neut,neg,neut,neut,neg,neut,neut,neut,neut,neut
"semuanya bagus sesuai profile,dan harga promo untuk suite nya jg sangat murah..komplain cuma water heater yg kamar saya tidak keluar dan air keluar kecil",neut,neg,neut,pos,neut,neut,neut,neut,neut,neut
"suka konsep hotelnya, minimalis, bersih, stafnya ramah. overall mantapp. hanya saja sinyal wifi tidak sampai ke kamar. ",neut,neut,neut,pos,pos,neut,pos,neut,neut,neg
semoga kebersihan kamar mandinya lebih di tingkatkan ya... selebihnya memuaskan.. tetap dingin walau gak pake AC.. manthab... terimakasih.. ,neut,neut,neut,pos,neg,neut,neut,neut,neut,neut
"ada kendala saat check in, sehingga harus menunggu. kamar tidak standard airy, tidak ada welcome snack jg di kamar. tapi kamar lumayan nyaman untuk backpacker / transit.",neut,neut,neut,neut,neut,neg,neg,neut,neut,neut
"Maf br ksh ulasan coz br buka airy lg... Tuk kamarnya asli nyaman bangt. hanya mgkn lemari perlu rajin d bersihkan agar tdk berdebu. Dan tuk yg d luar ruangan,smoga bs lbh rapih agar ga klihatan sangat brantakan d stiap lantainya.... Yg menyambut sangat ramah..pertahankan perfomance nya yaachh...good luck!! Thank you.... :)",neut,neut,neut,pos,neg,neut,pos,neut,neut,neut
Good abis remote TV rusak,neut,neut,neut,neut,neut,neut,neut,neut,neg,neut
1. Dari Kamar Mandi air menggenang di lantai kamar mandi jadinya banjir smpek meluber ke kamar dan mayan ngepel setiap abs mandi 2. Wifi sebelumnya pernah nginep di sini wifinya kenceng mayan lah sekarang connect sih tp ga bs apa2 udh protes ke pengelola tp sm aja 3. slh 1 oknum penjaga keamanan meminta uang parkir sungguh membuat tidak nyaman,neut,neut,neut,neut,neg,neut,neg,neut,neut,neg
"Snak makanan ringannya ga ada sih, ",neut,neut,neut,neut,neut,neg,neut,neut,neut,neut
"Staff ramah, cuma wifi di kamar tidak terjangkau",neut,neut,neut,neut,neut,neut,pos,neut,neut,neg
"biasanya klu nginap di airy tersedia dlm kemasan lengkap.kebuthn MCK.....di hotel ini sisir tdk ada...AC tidak normal ruangannya panaas, Kuncinya pintu juga tdk di kasi ke saya pada hal sdh deposit 100.000 jadi klau saya kluar dan kembali k hotel petugs yg buka pintu tdk profesional.....tlg utk di perbaiki trima.",neg,neut,neut,neut,neut,neut,neg,neut,neut,neut
ACnya ga dingin. semoga diperbaiki utk ke depannya..,neg,neut,neut,neut,neut,neut,neut,neut,neut,neut
"Untuk harga yg sangat terjangkau, fasilitasnya melebihi ekspektasi. Kamar luas, dingin. Sayangnya water heater sdg dibenerin dan kasur agak keras. Cuma utk harga segini, sangat sangat ok!!!",neut,neg,neut,pos,neut,neut,neut,neut,neut,neut
bagus cuma wifi tidak bisa dan kamar mandi agak sedikit kotor.  breakfastnya enak sekaliiiiii,neut,neut,neut,neut,neg,neut,neut,pos,neut,neg
pertama masuk sprei agak bau minyak angin..mungkin dari yg baru check out...tapi segera diganti setelah diberitau..oh iya..air panasnya ga gitu fungsi...tapi tempatnya tenang dan nyaman..thanks,neut,neg,neut,neut,neut,neg,neut,neut,neut,neut
"Kamar lumayan, kamar mandinya aduuhhhh. Tempat strategis, AC nggk berasa",neg,neut,neut,neut,neut,neut,neut,neut,neut,neut
kamar bersih & rapi..tapi sayang hot water nya nggak berfungsi dan suasananya gelap dan sepi..,neut,neg,neut,neut,pos,neut,neut,neut,neut,neut
kamar mandinya tolong di perhatikan kembali kebersihannya dan agak sedikit bau dn closet ya terutama .makasih,neut,neut,neg,neut,neg,neut,neut,neut,neut,neut
snack kamar tidak tersedia saat saya menginap,neut,neut,neut,neut,neut,neg,neut,neut,neut,neut
"rumahnya agak scary gitu.. trs ada yg bocor dikit (netes di lantai) trs bau nya lembab sekali.. nyaman sih over all, air nya panas kurang dan showernya agak bocor",neut,neg,neg,pos,neg,neut,neut,neut,neut,neut
"mantap nih, sayang wifi sinyalnya kurang bagus dalam kamar, sepertinya karena kamar saya dilantai 3, kalau dari depan kamar si bagus sinyalnya.",neut,neut,neut,neut,neut,neut,neut,neut,neut,neg
Sangat strategis tempat lokasinya. Tetapi untuk ACnya kurang dingin di kamar 202.,neg,neut,neut,neut,neut,neut,neut,neut,neut,neut
"Kamar kotor bau, ad bekas handuk orng (kamar gavdi bersihin), banyak kecoa dan nyamuk, ranjang kotor, pesen yg 1 ranjang besar di kasih yang twin bed, kamar mandi jorok ad bekas darah orang, susah sinyal, harus ke cafe baru dpet wifi, sry saya jujur2 aja bukan di buat2,tq",neut,neut,neg,neut,neg,neut,neut,neut,neut,neg
"Kamar nyaman, full ac, tv nyala meskipun tdk semua chanel, kamar mandi bersih, pelayanan ramah, delat sm tempat makan, tp kadang suka mati tiba2 listriknya, overall is good. Thankyou 💙",pos,neut,neut,pos,pos,neut,pos,neut,neg,neut
Lokasi sngt strategis sngt dekat dngan pusat prblanjaan dan kuliner.. facilities good.. tpi porses chek in nunggu lama krn kamar blm rapi dan blm siap.. !! unprofesional!! ,neut,neut,neut,neut,neut,neut,neg,neut,neut,neut
cukup nyaman kamar besar tapi ac kurang dingin. enaknya cukup dekat kemana2 tempat strategis,neg,neut,neut,neut,neut,neut,neut,neut,neut,neut
"Kamar agak sedikit bau, perlengkapan lengkap ada air minum, snack, sabun mandi, odol & sikat gigi. Kamar mandi nyaman. AC kamar terlalu dingin. Secara keseluruhan baik. Makasih Airy Room ",neg,neut,neg,pos,neut,pos,neut,neut,neut,neut
Hotel paling parah!! tidak lagi dah menginap disini...kamar bau apek...handuk tambahan bau badan orang...sprei bau badan...ac panas...parahhhhh......!!! Komplain ke Airy Room tidak ada dispensasi apapun!!! Itu komen bagus2 mungkin orang sendiri yang isi...,neg,neut,neg,neut,neut,neg,neg,neut,neut,neut
Pelayananya ramah tapi sayang wifinya susah,neut,neut,neut,neut,neut,neut,pos,neut,neut,neg
big towel harus ready ketika tamu cek in. dan untuk receptions nya harus stand by di loby. kebersihan kamar kurang baik,neut,neut,neut,neut,neg,neg,pos,neut,neut,neut
"kamar bagus dan jangkauannya mudah, untuk fasilitas dikamar di tingkatkan seperti televisi dan penggunaan remot kontrolnya tidak berfungsi dengan baik.",neut,neut,neut,neut,neut,neut,neut,neut,neg,neut
suka bgt pke airy.... dihotelnya jg nyaman emg cuma sinyalnya yg susah tp playanan suka dngan harga sgtu cucp abis bsok q pake airy lg klo psan2 hotel,neut,neut,neut,neut,neut,neut,pos,neut,neut,neut
"lokasi dkt pantai, kamar luas,makanan enak,staf lebih ramah,kebersihan kamar dan kmr mandi mohon ditingkatkan.",neut,neut,neut,neut,neg,neut,pos,pos,neut,neut
"Kamar bersih,  rapih,  tapi kamar mandi suka bau tiba tiba.  Semoga kedepannya lebih baik.  Over all Oke ",neut,neut,neg,pos,pos,neut,neut,neut,neut,neut
"TIDAK LAYAK UNTUK HOTEL, PENGINAPAN APALAGI AIRY ROOM YG TERKENAL DENGAN BERSIH NYAMAN DENGAN HARGA LUMAYAN STANDAR BAGI KITA HANYA SEKEDAR NUMPANG TIDUR. LEBIH BAIK DI PRRBAIKI DULU DEH MANAJEMENNYA. TERIMABKASIH",neut,neut,neut,neg,neut,neut,neg,neut,neut,neut
kamar nyaman.. sayang wifi nya lemot..,neut,neut,neut,neut,neut,neut,neut,neut,neut,neg
Kamar mandi bau Kasurnya kurang bersih Lokasi strategis dekat dengan farmhouse,neut,neut,neg,neut,neg,neut,neut,neut,neut,neut
"DENGAN HARGA DIATAS 200RB SAYA RASA KEBERSIHAN DAN MENU SARAPANNYA MASIH KURANG, PELAYANANNYA BAGUS,",neut,neut,neut,neut,neg,neut,pos,neg,neut,neut
"Kamarnya bersih rapi, dapat air mineral gratis dan cemilan gratis. Kekurangan hanya di kamar mandi lebih diperbaiki lg kebersihannya. Overall oke dan bakal kesini lagi",neut,neut,neut,pos,neg_pos,pos,neut,neut,neut,neut
tempatnya nyaman.. tp pemiliknya rada reseh.. hehehe,neut,neut,neut,neut,neut,neut,neg,neut,neut,neut
Kamar sangat bersih tlong siaran tv nya di perbaiki krna sama skli gak bsa nonton gara2 chanel nya bnyk yg gak jelas..  Trus tempat parkir msih kurng aman msih ada rasa was was mskpun ada cctv Tp buat saya top bnget deh... Mksih atas playanan nya ,neut,neut,neut,neut,pos,neut,neut,neut,neg,neut
Saya tidak jadi menginap disana tempatnya tidak ada perawatan begitu masuk bau bangkai,neut,neut,neg,neut,neut,neut,neut,neut,neut,neut
"Pelayanan sudah baik,  tapi kamar mandi tidak bersih,  ada kerak di lantai dan toiletnya..  Cangkir teh juga ada kerak bekas teh.. Sarapan kurang sebanding dg harganya..",neut,neut,neut,neut,neg,neut,pos,neg,neut,neut
"kamar mandinya bau rokok, lantai kamarnya licin seperti berminyak, kecewa..",neut,neut,neg,neut,neg,neut,neut,neut,neut,neut
"fasilitas kurang karyawan gak ramah gk dpt snack pdhl seharusny dpt, peralatan mandi berbeda dgn hotel airy yg lain gk sesuai ac gk dingin kamar gelap",neg,neut,neut,neut,neut,neg,neg,neut,neut,neut
"Tempat bersih, set mandi lengkap, dapat snack jg, sayang bau rokok dan lingkungan sangat sepi. tapi cukup strategis, kemana mana dekat.",neut,neut,neg,neut,neg,pos,neut,neut,neut,neut
Tempatnya bersih dan dekat tempat makanan. cuman pelayanan pegawai kurang nyaman,neut,neut,neut,neut,pos,neut,neg,neut,neut,neut
bersih..rrapi tapi pelayanan kurang,neut,neut,neut,neut,pos,neut,neg,neut,neut,neut
Kamarnya cukup luas. Sarung bantal agak kotor dan ruangan agak bau. AC berfungsi dengan baik. Dan de,pos,neut,neg,neut,neut,neg,neut,neut,neut,neut
kebersihan lemari dan perabot. Tidak ada wifi,neut,neut,neut,neut,neg,neut,neut,neut,neut,neg
"mungkin dari pelayanan hotelnya aja yang kurang memuaskan, biasanya di hotel lainnya kalau ada orang masuk selalu di sambut dengan ramah dan senyum",neut,neut,neut,neut,neut,neut,neg,neut,neut,neut
kmar mandinya aga bau nyengat,neut,neut,neg,neut,neut,neut,neut,neut,neut,neut
"tidak ada sandalnya.. wktu check in pas masuk kamar blm di set airy dan blm ada Snack nya.. overall it's ok, and nice place.. ",neut,neut,neut,pos,neut,neg,neut,neut,neut,neut
"Pegawai kurang ramah, kurang informatif dan kinerja kurang baik. Kamar sulit untuk sholat",neut,neut,neut,neut,neut,neut,neg,neut,neut,neut
Wifi lebih baik dijangkau dalam kamar. Yang lainnya fasilitasnya baik,neut,neut,neut,neut,neut,pos,neut,neut,neut,neg
"kamar mandi sempit. tak ada wastafel. pagar buka tutup sendiri. ada dapur, bisa tukar kamar saat tahu bau rokok.",neut,neut,neg,neut,neut,neut,neut,neut,neut,neut
"resepsionisnya ramah, kamarnya juga nyaman, bersih, cuma lemarinya aja yg kotor. pelayanan OK lah",neut,neut,neut,neut,pos,neut,pos,neut,neut,neut
"Pro: Kamar luas, dekat dengan kuliner dengan various range harga. (kambing bang moody-warung tegal).deket 2 Minimart kolam renang kalau punya waktu .  Ada snack gratis Cons : bangunan lama, serasa di film tahun 70-80an, agak kotor but masih acceptable. Air minum di luar kamar. Staf kurang profesional. Tapi overall cost to value ratio okay banget",neut,neut,neut,neut,neg,pos,neg,neut,neut,neut
"Sesuai dengan ekspektasi, kamar bersih walau agak sempit, kamar mandi bersih namun sayang tidak ada air hangat, cocok untuk backpacker dengan harga yang cukup murah.",neut,neg,neut,neut,pos,neut,neut,neut,neut,neut
Hot shower tidak bisa. Selebihnya baik.,neut,neg,neut,pos,neut,neut,neut,neut,neut,neut
"tv nya bukan pakai tv cabel, terus kamar mandinya kurang bersih",neut,neut,neut,neut,neg,neut,neut,neut,neg,neut
"Lebih ditingkatkan lagi untuk pelayanannya, sukseees terruuusss",neut,neut,neut,neut,neut,neut,neg,neut,neut,neut
"Bau,berisik, tidak bsa ganti type room, tdk bisa refund, semua serba tidak bisa .. lokasi diperumahan jauh dri tmpat mkan atau indomaret alfamart. Stafnya baik sih cuma semua ketentuan dari airy langsung. Tidak akan nginap kesana lagi",neut,neut,neg,neut,neut,neut,pos,neut,neut,neut
"Kamarnya nyaman, tenang dan bersih. Kamar mandinya juga lumayan lah. Dapet snack, air mineral dan perlengkapan mandi juga dari Airy. Sayangnya waktu itu WiFi sering disconnect sendiri, jadinya ga bisa internetan pake WiFi. ",neut,neut,neut,neut,pos,neg,neut,neut,neut,neg
bagus.. hanya kurang bersih aja.. mgkn masih dlm renovasi.. shower nya rusak .. ,neut,neut,neut,neut,neg,neut,neut,neut,neut,neut
"kamar panas di room 353, AC di janji kan di perbaiki hanya dalam 15 menit dari jam 2 siang slsai stgah 4 baru di bolehkan minta hidup. lalu baru setengah jam sudah minta matiin lagi buat perbaiki AC sampai saya kesal jam 6 akhir nya saya keluar. padahal bisa minta pindah room tapi alasan room nya tidak ada.",neg,neut,neut,neut,neut,neut,neut,neut,neut,neut
"good.. keseluruhan baik hanya pas kemaren dapet kamar yang ac nya agak bunyi.. but it's ok.. nyaman, lokasi gampang di cari",neg,neut,neut,pos,neut,neut,neut,neut,neut,neut
"Sprey,selimut dan bantal bau apek, untung bawa selimut dan bantal sendiri jadi tidak sesak pas tidur",neut,neut,neut,neut,neut,neg,neut,neut,neut,neut
"shower nya salah warna yang dingin jadi panas, yang panas jadi dingin",neut,neg,neut,neut,neut,neut,neut,neut,neut,neut
"Suka&cukup nyaman selama 2 mlm di guesthouse ini.. Service memuaskan, mau apa2 pasti disiapkan,air hangat ok.. Pas bgt dapat bagian depan yg ada balkon mungilnya. Yg perlu diperbaiki sinyal wifi aja, kurang lancar.. Tapi kawasan otten pakai kartu 3 sinyal4G nya ok bgt. Tq @iry",neut,pos,neut,neut,neut,neut,pos,neut,neut,neg
"old school hotelnya. kebersihannya bisa lah ditingkatkan lagi, bakwan sarapannya masih belom mateng pas saya makan",neut,neut,neut,neut,neg,neut,neut,neg,neut,neut
tlg tingkatkan lgi kebersiahnya trutama di spray n handuk,neut,neut,neut,neut,neg,neg,neut,neut,neut,neut
"hotelnya bersih dan nyaman, tp keyika masuk kamar sangat bau bekas asap rokok",neut,neut,neg,neut,pos,neut,neut,neut,neut,neut
"Kloset rusak, disuruh perbaiki tetap saja rusak, kamar mandi bau pesing, pokoknya semua masalah ada pada toilet, shower macet, pokok nya parah deh...!! Jangan murah tapi murahan banget kasian yang nginap.",neut,neut,neg,neg,neut,neut,neut,neut,neut,neut
Bau rokok ntah masuk dr mana dan bau wcnya mulai dr kami masuk.. padahal kami belum gunakan wc nya,neut,neut,neg,neut,neut,neut,neut,neut,neut,neut
nyaman dan bersih... cuma air hangat nya ga begitu hangat masih dingin,neut,neg,neut,neut,pos,neut,neut,neut,neut,neut
"lokasi hotel strategis, tapi mohon ditungkatkan utk kebersihan kamar",neut,neut,neut,neut,neg,neut,neut,neut,neut,neut
Kebersihan sprei harus ttp dijaga ya. Tapi overall semua okeee 👏🏼,neut,neut,neut,pos,neut,neg,neut,neut,neut,neut
"dpt kmr yg pemanasnya rusak, tp stlh mnt bs diganti dgn air panas dr ember sm petugasnya",neut,neg,neut,neut,neut,neut,neut,neut,neut,neut
"Yang berkesan pelayanannya ramah, yg kurang berkesan yaitu ac kamar meneteskan air dari bagian yg mengeluarkan angin. Solusi dari pihak hotel  yaitu menampung air tadahan pakai wadah.Semoga ke depannya bisa diperbaiki.",neg,neut,neut,neut,neut,neut,pos,neut,neut,neut
"saya tidak mendapat perlengkapan mandi standart airy, seperti: sabun, shampoo, pasta gigi, sisir rambut, & sikat gigi yang disimpan didalam dompet dg logo airy. ruangan yg saya tempati kurang bersih, banyak nyamuk, bed cover  ada bercak putih seperti bekas sperma, dan kamar mandi yang lantainya penuh kerak. terus terang, kali ini saya kecewa",neut,neut,neut,neg,neg,neg,neut,neut,neut,neut
"hotel lama cukup terawat, air panas oke, sayang wifi hanya menjangkau lobby",neut,pos,neut,neut,neut,neut,neut,neut,neut,neg
"overall nyaman, tapi tv kabelnya lost connection terus :(",neut,neut,neut,pos,neut,neut,neut,neut,neg,neut
tvnya masih tv nasional dan banyak chanel yg ga nangkep. wifi juga cuma diloby.,neut,neut,neut,neut,neut,neut,neut,neut,neg,neg
Staf Griya Amartha saling mengobrol berteriak di lorong di pagi buta sehingga mengganggu waktu beristirahat,neut,neut,neut,neut,neut,neut,neg,neut,neut,neut
Kamar bau shower rusak washtafle rusak pengap kotor,neut,neut,neg,neut,neg,neut,neut,neut,neut,neut
"wifi top kenceng, dekat alun-alun merdeka malang dan dekat tempat peribadatan.. snack bites tidak dibagikan itu membuat SAYA SANGAT KECEWA, kamar seperti tidak dibersihin, sprei kotor",neut,neut,neut,neut,neg,neg,neut,neut,neut,pos
"kesiapan dan kesigapan staf perlu ditingkatkan. saat tamu baru tiba, seharusnya semua fasilitas sudah ada. tamu menunggu berjam-jam dalam kondisi lelah benar² tidak nyaman. ",neut,neut,neut,neut,neut,neut,neg,neut,neut,neut
Kmr ny lucu bgt wlwpun kcil tp bersih air panas ontime tv ac dingin pke pin kamarnya cma wifi gk mencakup kmr yg di ujung2 dan gk cepat aksesnya. Cocok bwt backpeker hrg murh dpt snack dr airy peralatan mandi di tmpat lain mana dapet hehee dgn hrg yg sgtt murah gnii ,pos,pos,neut,neut,pos,pos,neut,neut,neg,neg
kamar sangat kotor kamar mandi kotor berdebu banyak bgt baru 10 menit di kamar langsung pindah hotel,neut,neut,neut,neut,neg,neut,neut,neut,neut,neut
"Lokasi cukup strategis meskipun di jalan satu mobil. Sprei set lebih ditingkatkan kebersihannya. Kamar & kamar mandi akan terasa lebih segar apabila diberi pengharum ruangan. Snack ada 3 macam cukup mengenyangkan utk sarapan. Air minum mineral botol sebaiknya yang 600ml, jangan 330ml karena terlalu sedikit ( dari sisi harga juga tidak beda banyak).",neut,neut,neg,neut,neg,pos,neut,neut,neut,neut
"Dari fasilitas,saya kecewa krn wifi yg tdk bisa diakses. Dan layanan breakfast yg tdk dikonfirmasikan batas wktu,sehingga tdk bisa saya dapatkan krn layanan hanya sampai jam 9.00",neut,neut,neut,neut,neut,neut,neut,neg,neut,neg
"oke sih, cuma fasilitas air minumnya aja agak dperhatikan, soalnya ada dispenser yang galonnya tidak di ganti2. ",neut,neut,neut,neut,neut,neg,neut,neut,neut,neut
"Letaknya strategis di tengah kota, dekat dgn stasiun & alun-alun malang. Stafnya ramah dan kamar bersih. Kekurangannya adalah air panas di kamar yg sy tempati mati, padahal kamar2 sebelah air panasnya berfungsi",neut,neg,neut,neut,pos,neut,pos,neut,neut,neut
kamarnya rapih dan tidak berbau ..harus mempunyai alas kaki di kamar mandi nya,neut,neut,pos,neut,neut,neg,neut,neut,neut,neut
"Kamar 509 tidak diatur seperti Airy Rooms (bantal, kain, snackbar, mineral water tdk ada) awalnya. telp receptionist baru disiapkan. air panas bisa dibilang tidak hangat sama sekali. koneksi internet pagi2 sempat lemot. breakfast cukup oke.",neut,neg,neut,neut,neut,neg,neut,pos,neut,neg
kamarnya nyaman..bersih..wangi...tolong jaringan wifi di perkencang..kl dlm kamar srg putus2..terimakasih ,neut,neut,pos,neut,neg,neut,neut,neut,neut,neg
Kamarnya kotor + berdebu + banyak nyamuk + toilet rusak pelayannya ramah baik,neut,neut,neut,neut,neg,neut,pos,neut,neut,neut
"1. Sampah penghuni sebelumnya tidak dibersihkan 2. kamar mandi becek 3. staff penginapan tidak responsif saat saya butuh bantuan turun dari kendaraan, ketika hujan deras 4. deposit yang nominalnya lebih besar dari biaya inap 5. diatas jam 21 sulit kembali ke kamar, karena pintu utama dikunci 6. sistem check-in yang lama 7. parkir yang terbatas",neut,neut,neut,neut,neg,neut,neg,neut,neut,neut
"Murat, lumayan laah tapi banyak kecoa kecil kamarnya, dan selimutnya kurang bersih banyak bercaknya",neut,neut,neut,neut,neg,neg,neut,neut,neut,neut
"untuk jet washer airnya beraroma ya, kalo bs dibenahi supply air untuk jet washer krn sangat nenyengat saat di gunakan, agak mengganggu kenyamanan dgn aroma yg ditumbulkan. untuk yg lain saya merasa puas...trm kasih.",neut,neut,neg,pos,neut,neut,neut,neut,neut,neut
"Hotelnya bersih, bagus, tapi dikamar yg di dapet hot shower nya rusak, jadi gak bisa mandi air panas, tapi overall oke ",neut,neg,neut,pos,pos,neut,neut,neut,neut,neut
"lokasi hotel seram banyak preman, air asin, kasur busa bukan springbed, kamar bau apek, tidak sediakan perlengkapan mandi tidak seperti hotel airyroom yg pernah saya sepesan di tempat lain",neut,neut,neg,neut,neut,neg,neut,neut,neut,neut
kamar bau..pengap..km kurang bersih..,neut,neut,neg,neut,neg,neut,neut,neut,neut,neut
"di kamar mandi, air hamgatnya tidak ada.. selebihnya sudah baik.",neut,neg,neut,pos,neut,neut,neut,neut,neut,neut
"kamar bersih dan nyaman, pada saat check in agak lama karena kamar masih blm slsai di bersihkan ",neut,neut,neut,neut,pos,neut,neg,neut,neut,neut
kamar kotor... tidak ada perlengkapan snack dan mandi dari airy,neut,neut,neut,neut,neg,neg,neut,neut,neut,neut
"Awalnya cuma pengen coba dan membuktikan review nih hotel dan...taraaaaa...ternyata bener nginep dsini ga nyaman. Mulai dr kasir yg ga ramah sama sekali dan ga pasang senyum (please deh klo lg badmodd atau PMS better ambil cuti) dan ga ada CS yg stay ditempat jd kudu cari2 dulu, AC kamar yg ga dingin sampai kamar ga bs dikunci jg makanannya yg buat sya pribadi kurang enak...and finally terima kasih buat para tamu yg uda berbagi pengalaman....",neg,neut,neut,neut,neut,neut,neg,neg,neut,neut
kamar mandi bau.. & banyak nyamuk,neut,neut,neg,neut,neut,neut,neut,neut,neut,neut
"Dapat kamar paling dalem, sinyal hp sangat susah, wifi super lemot! serasa hidup dalam goa. shower kecil banget munculnya. beneer2 jadul..",neut,neut,neut,neut,neut,neut,neut,neut,neut,neg
"karena permintaan khusus tdk terpenuhi, banyak nyamuk, sarapannya kurang baik, tvnya kabur...",neut,neut,neut,neut,neut,neut,neut,neg,neg,neut
tidak ada snack di airy room nya,neut,neut,neut,neut,neut,neg,neut,neut,neut,neut
lokasi hotel strategis dekat mall SKA. kamar tidak terlalu luas namun cukup bersih. kamar mandi pun sempit. hot shower airnya panas. menu breakfast bervariasi banyak dan enak. wifi tidak bs konek.,neut,pos,neut,neut,pos,neut,neut,pos,neut,neg
"selimut kurang panjang dan lebar untuk 2 orang, gambar tv jg tdk bgus, shgg tdk bs d tonton, tmpt sampah d kmr sdh sy kluarkan dpn kmr untuk dibuang oleh petugas, tp smpai mlm sy k homestay, sampah msh tdk d buang, biasanya d tmpt lain d bersihkan ada perbaikan air, shgg kotor d dpn kamar dan berisik",neut,neut,neut,neut,neut,neg,neg,neut,neg,neut
kamar ac gak dingin air mandinya kecil,neg,neut,neut,neut,neut,neut,neut,neut,neut,neut
"hotelnya bersih...... pelayanan nya baik, staffnya ramah.  tapi air panasnya tdk berfungsi.",neut,neg,neut,neut,pos,neut,pos,neut,neut,neut
"kesekuruhan cukup baik ya dgn harga promo yg sangat murah, tp kamarnya sempit, dan properti sudah agak usang",neut,neut,neut,pos,neg,neut,neut,neut,neut,neut
"overall oke, hanya AC kurang dingin, banyak cat sudab lapuk perlu cat ulang, pegawai ramah Deket  kemana mana",neg,neut,neut,pos,neut,neut,pos,neut,neut,neut
