processed_text,ac,air_panas,bau,general,kebersihan,linen,service,sunrise_meal,tv,wifi
"kamar jadul dan panas, ac ga dingin, suara pompa nonstop",neg,neut,neut,neut,neut,neut,neut,neut,neut,neut
"menurut saya hal yang paling menonjol di sini yaitu wifi yang super duper ngebut, lancar jaya. bed empuk sprei bersih. handuk wangi, tempat bersih, kecuali toilet sedikit kotor namun tidak jadi masalah. saluran telivisi masih sedikit. AC-nya tidak berasa. penilaian ptibadi saya 8,5/10",neg,neut,neut,neut,pos,pos,neut,neut,neg,pos
"gedungnya kurang layak pengap , air shower kecil banget , flush nya rusak . pelayanan nya baik tapi kurang respon seperti tambahan snack . tv nya posisi terlalu keatas kurang jelas dan parkiran sangat kurang memadai. overall lumayan buat liburan ",neut,neut,neg,pos,neut,neg,pos,neut,neg,neut
air panas kurang berfungsi & handuk lembab.,neut,neg,neut,neut,neut,neg,neut,neut,neut,neut
minusnya wifi kurang kenceng,neut,neut,neut,neut,neut,neut,neut,neut,neut,neg
"nyesel nginep di sini , order lewat airyroom tapi ngak dapat fasilitas airyroom sama sekali, ngecewain banget cekin juga harus nunggu 15menit , parkiran sempit cs jutek ngecewain lah intinya ",neut,neut,neut,neut,neut,neg,neg,neut,neut,neut
"Sangat-sangat mengecewakan sekali... Kamar berbeda dari yang di photo, kotor, TV tabung jadul kecil, remot TV dan AC tidak adak, kamar mandi kotor, flusing toilet rusak, properti seperti bantal airy room tidak ada, hanya ada pocket airy room saja. Lemari² dan laci² kotor, tidak ada lap di depan toilet, tisu toilet juga tidak ada. PAYAH !!!!",neg,neut,neut,neut,neg,neg,neut,neut,neg,neut
"Wifinya gak sampek ke kamar, lampu tidur yang rusak tidak di perbaiki lg, ac kurang dingin, n sarapannya cuma roti & teh aja",neg,neut,neut,neut,neut,neut,neut,neg,neut,neg
"Wifinya payah, breakfeastnya payah, water dispensernya rusak tamu tidak bs membuat teh atw kopi sndri,pelayanannya lumayan. kamar bersih hanya tempat sampah & keset kakinya perlu diperhatikan kebersihanx. overall masih banyak kekurangan & perlu banyak perbaikan.",neut,neut,neut,neg,pos,neut,pos,neg,neut,neg
"Toilet flash-nya bocor, air panas untuk showernya harus menunggu lama, bed nya juga kurang bersih, d",neut,neg,neut,neut,neut,neut,neut,neut,neut,neut
WiFi nya kurang memuaskan :)) ,neut,neut,neut,neut,neut,neut,neut,neut,neut,neg
"kamarx sesuai gambar cuma lampux gak ada lampu terang yg ada cuma lampu redup, ac nya kurang dingin bahkan gak dingin , air panasx gak hidup ",neg,neg,neut,neut,neut,neut,neut,neut,neut,neut
"Lampu remang-remang, kamar mandi kotor, menginap 10 hari tapi hanya diberikan peralatan mandi sekali saja saat pertama masuk.",neut,neut,neut,neut,neg,neg,neut,neut,neut,neut
"kamarnya bagus banget. cuma pas pertama masuk, aromanya agak nggak enak. seperti lama nggak dipakai. mungkin pengharum ruangannya bisa diganti. tapi over all, bagus.",neut,neut,neg,pos,neut,neut,neut,neut,neut,neut
Selimut/sprey kurang bersih,neut,neut,neut,neut,neut,neg,neut,neut,neut,neut
"Tidak sesuai dengan gambar, kebersihan perlu ditingkatkan",neut,neut,neut,neut,neg,neut,neut,neut,neut,neut
"Kalau untuk backpacker atau yang tidak terlalu mementingkan bagerang keadaan penginapan, the hotel is okay. Tapi saya tidak sarankan untuk yang membawa bayi, anak kecil, atau orang tua karena kamar mandi tidak bersih, handuk sudah berwarna coklat, sprei, dll juga tidak terlihat bersih. Hair dryer hanya 1 untuk 1 hotel, jadi pinjam meminjam. Tidak disediakan untuk masak air panas, jadi kalau mau air panas harus ke restoran. Wi-fi harus ke restorannya.",neut,neut,neut,neut,neg,neg,neut,neut,neut,neg
bantalnya enak.. kamarnya dingin.. keset ga ada lagi nha..,pos,neut,neut,neut,neut,pos,neut,neut,neut,neut
oke lah gak bosen kok cuma kamar sumpek gak ada ventilasi atau exos,neut,neut,neg,neut,neut,neut,neut,neut,neut,neut
"Posisi kamar pas di belakang Mak Beng warung, jadi kamar bau ikan goreng dan sambal terasi ",neut,neut,neg,neut,neut,neut,neut,neut,neut,neut
"Tidak ada yg bertulisan Airy di room 107, remot TV tdk bs di pakai(rusak), remot AC tdk ada(hidupin AC manual), perlengkapan kamar mandi cmn ada handuk. Kami sangat kecewa yg di room 107 Room 103 sangat puas perlengkapan room ada smua",neg,neut,neut,neut,neut,neg,neut,neut,neg,neut
"Pelayanan lama, not such a nice service and place. So worth the price",neut,neut,neut,neut,neut,neut,neg,neut,neut,neut
"kamar luas, ac dan air tdk ad masalah. untuk breakfastnya enak. hanya saran untuk kebersihan banyak dan selimutnya d tingkatkan. overall, hotel ini lumayan.",pos,neut,neut,pos,neg,neg,neut,pos,neut,neut
"kamar nyaman dan bersih, hanya kamar mandi nya bau nya kurang sedap dan sangat mengganggu dan juga kasurnya bikin gatal gatal.  sarapan pagi standar.",neut,neut,neg,neut,pos,neg,neut,neg,neut,neut
"AC mati hidup, dan kalau menyala suara AC nya berisik..",neg,neut,neut,neut,neut,neut,neut,neut,neut,neut
Pelayanan kurang ramah..tdk ada air utk mandi..tempatnya pelosok susah di cari ,neut,neut,neut,neut,neut,neut,neg,neut,neut,neut
air panas gak nyala. wc kurang bersih.,neut,neg,neut,neut,neg,neut,neut,neut,neut,neut
"wifi tidak sampai ke setiap kamar, selain itu okelah..",neut,neut,neut,pos,neut,neut,neut,neut,neut,neg
"Kebersihan kamar kurang dijaga, saya menemukan kaus kaki bau di lemari entah punya siapa, berarti cs tidak teliti dalam membersihkan. Di sudut2 kamar jg ada sarang laba2 dan kotoran, serpihan mi instan di lantai. Pegawainya ramah dan sopan, ada free kopi & teh di lobby.",neut,neut,neut,neut,neg,neut,pos,neut,neut,neut
"Katanya snacknya lagi gangguan, jd ga dapat snack, tp yg lainnya bagus kok :)",neut,neut,neut,pos,neut,neg,neut,neut,neut,neut
"Lokasi strategis, ditengah kota. Kamarnya kecil, tapi sesuai dengan harganya. Tidak tersedia air panas dan washtafel.",neut,neg,neut,neut,neut,neut,neut,neut,neut,neut
pelayanan bagus tp 1 kamar yg di pesen ac ga dingin dan kmr mandi bau,neg,neut,neg,neut,neut,neut,pos,neut,neut,neut
"Ga ada wifi di kamar Lampu di kamar gelap, wat kecil Kamar lokasi paling ujung Wc kotor, mampet Tidak ada air panas Beberapa fasilitas di wc tak berfungsi Handuk kotor Very bad",neut,neg,neut,neut,neg,neg,neut,neut,neut,neg
tv ya masih buremm.. airy kapan di perbaiki,neut,neut,neut,neut,neut,neut,neut,neut,neg,neut
kurang persiapan & kurang bersih,neut,neut,neut,neut,neg,neut,neut,neut,neut,neut
"1. Jangan bawa mobil pendek karena parkir cm ada di basement dan curam sekali. 2. Ga perlu senyum, krna staff disini jg pelit senyum 3. Jam 8 pagi kamar udah diketok2 mau dibersihkan, annoying banget. 4. Fasilitas standar n lokasi di jalan ramai, Hati2 buat yg bawa anak2.",neut,neut,neut,neut,neut,neut,neg,neut,neut,neut
kamar nya oke bagus rapi.ac dingin. ramah.tapi wifinya parah gk bisa dipake..,pos,neut,neut,neut,neut,neut,pos,neut,neut,neg
saya menginap semalam saja. tv rusak. lampu kamar mandi mati. sisanya ok,neut,neut,neut,pos,neut,neut,neut,neut,neg,neut
kamar bagus dan bersih.. wangi.. saat masuk perlengkapan airy sdh trpasang/siap...tapi kekuranganny saat cek in harus nunggu sekitar 20 mnit sambil kamar disiapkan... harusny saat cek in kamar sdh siap.. dan pelanggan siap masuk..,neut,neut,neut,neut,pos,pos,neg,neut,neut,neut
kurangnya kebersihan kamar mandi dan lorong menuju kamar. untunglah pelayanan cepat tanggap,neut,neut,neut,neut,neg,neut,pos,neut,neut,neut
ga di kasih peralatan mandi (kecuali handuk ada). ga di kasih air mineral juga.. ga ada wifi.. Selain itu OK ,neut,neut,neut,pos,neut,neg,neut,neut,neut,neg
Kamar bersih. Walaupun ada sesuatu di kloset. 😬 Yg jaga sedikit banget senyumnya. Tapi nyamaaan banget kamarnya. ,neut,neut,neut,neut,pos,neut,neg,neut,neut,neut
"air putih tidak dpt gratis, fasilitas air tidak ada yg hot, tidak ada pemanas air, kamar kondisinya agak bau. awalnya saya kira psanan lwat air room bisa dpt kamar sesuai  gmbr yg di tampilkan ternyata tidak.",neut,neg,neg,neut,neut,neg,neut,neut,neut,neut
"lokasi bagus tengah kota.. kamar bersih hanya saja kamar mandi bau busuk, makanan bisa saja staf recepsionis tidak ramah, akses internet tidak ada dan kamar lt 3 tidak ada lift",neut,neut,neg,neut,pos,neut,neg,neg,neut,neg
kamar nya enak dan luas. WiFi kencang. cuma gak dpt kotak makanan seperti khas airy yg lain .,neut,neut,neut,neut,neut,neg,neut,neut,neut,pos
"Menyenangkan, lokasi dekat ke berbagai resto & tempat makanan (KFC, Richeese, Pizza Hut, dll), dekat Indomaret, parkiran oke. Sayang terakhir ke sana, wifi sedang bemasalah...",neut,neut,neut,neut,neut,neut,neut,neut,neut,neg
"pelayanannya ramah , kamarnya bagus walaupun spreinya agak kusem tp ngga papa soalnya saya bawa selimut cadangan tp aq bingung klo mau sholat harus turun dulu ke musholla tuk pinjam mukena. ribet euy terutama klo lagi hujan",neut,neut,neut,neut,neut,neg,neg,neut,neut,neut
rumah di jadikan penginapan.udah gitu pas mau masuk pagar ny gak ada yg buka.kecewa besar di buat airy ini,neut,neut,neut,neut,neut,neut,neg,neut,neut,neut
tvnya mati2,neut,neut,neut,neut,neut,neut,neut,neut,neg,neut
kamarnya besar enak..tapi kurang bersih kasurnya..dan kamar mandi bau...,neut,neut,neg,neut,neg,neut,neut,neut,neut,neut
"kamar kurang bersih air susah,air panas ngak ada",neut,neg,neut,neut,neg,neut,neut,neut,neut,neut
AC nya rusak tidak berfungsi mohon di perbaiki (saya menginap di kamar K / L ).,neg,neut,neut,neut,neut,neut,neut,neut,neut,neut
"mantap, tapi. tolong lebih di jaga kebersihannya yah...",neut,neut,neut,neut,neg,neut,neut,neut,neut,neut
pemanas airnya tidak bisa dipakai dan lama menunggu panas airnya.. lumayan nyaman sesuai harga,neut,neg,neut,neut,neut,neut,neut,neut,neut,neut
"Baik, sayang ACnya tlg diperbaiki ya",neg,neut,neut,neut,neut,neut,neut,neut,neut,neut
"Kami mendapatkan kamar dilantai 3 namum pada saat kami datang tak ada seorangpun petugas  yang membantu kami untuk mengantarkan dan membawa barang  sedangkan kami juga membawa anak kecil. Kami juga mengalami air yang tidak berfungsi saat sedang mandi.  Untuk konsumsi sarapan, varian dan rasanya mohon ditingkatkan kembali. Terimakasih",neut,neut,neut,neut,neut,neut,neg,neg,neut,neut
"+ kamar cukup luas, terjangkau, sarapan bervariasi, ada kulkas+teko air pns, hot shower, ac dingin, lokasi strategis, lift - channel tv sedikit, ada liat kecoa kecil 1, hari 1-2 ga dpt snack, hari 4 ga dbersihkan n ga dpt mnm+snack, kalo panggil housekeeping lamaaaaaaa but overall bagus, akan mnginap lg dsni krn kmr bsr, bersih, murah, srpan enak",pos,pos,neut,pos,neg,neg,neut,pos,neg,neut
"Yang dikasih hanya kamar biasa bukan Airy Room, sudah di komplain tapi tidak di respon",neut,neut,neut,neut,neut,neut,neg,neut,neut,neut
baik. tp mohon diperbaiki saluran tv.,neut,neut,neut,neut,neut,neut,neut,neut,neg,neut
"AC bocor, keran wastapel rusak, kamar kurang bersih",neg,neut,neut,neut,neg,neut,neut,neut,neut,neut
Pertama datang saya dikasih kamar yg buat berdua padahal saya memesan kamar yg untuk berempat dan tdk ada desain nya airyroom di kamar dan tdk dapat snack kalo tidak di komplain pokok nya kecewa menginap disini,neut,neut,neut,neg,neut,neg,neg,neut,neut,neut
"Untuk ukuran ekonomis ini udah sangat baik, perlengkapan mandinya lengkap, snacknya ada, saluran tv dan wifi juga ok.. hanya klo blh kasih saran dan komentar, seprainya krg bersih & mgkn bs ditambahin jemuran handuk.. mksh sblmnya..",neut,neut,neut,neut,neg,pos,neut,neut,pos,pos
"pelayanan baik, ramah, bersih. Sprei sma bantal aja yg perlu di perbaiki, krn warna nya sudah coklat2",neut,neut,neut,neut,pos,neg,pos,neut,neut,neut
"U/ pelayanan airy mantap, ada free snack box di kamar. U/ hotel kecil, pengap. Butuh pengharum ruangan agar sedikit segar. Lainnya bagus❤️",neut,neut,neg,pos,neut,pos,pos,neut,neut,neut
"Hanya kuat menginap semalam di hotel ini. Kamar mandi kotor, jorok dan bau. Pintu kamar mandi tidak bisa dikunci, sarapan ala kadarnya. Terpaksa pindah menginap dihotel lain",neut,neut,neg,neut,neg,neut,neut,neg,neut,neut
Tidak diingatkan pengembalian uang deposit pd saat check out.,neut,neut,neut,neut,neut,neut,neg,neut,neut,neut
"Jangan menginap disini deh.. Mending cari hotel lain.. Kelas deluxe tapi kayak ekonomi SEMPIT SEKALI, WC BAU, COLOKKAN LISTRIK TIDAK ADA. MAU CHARGER HP GAK BISA. NGHABISKAN DUIT AJA...SANGAT KECEWA",neut,neut,neg,neut,neut,neut,neut,neut,neut,neut
"kamarnya bagus bersih, cuman dapet yg tanpa jendela. airnya terlalu panas dan gak bisa pake air dingin, airnya yg keluar hanya sedikit. overall kalo buat semalam sih cukup lah.",neut,neg,neut,pos,pos,neut,neut,neut,neut,neut
"hotel ditengah Kota , mudah dlditemukan , dekat dengan pusat2 pertokoan dan perbelanjaan , Banyak pedagang makanan Dan minimarket , kamar bersih , AC dingin , handuk bersih , selalu tersedia peralatan Mandi Dari airy room dan snack , Kekurangan : selimut yg kurang tebal, seperti sprei kedua, kamar Mandi Yang kurang bersih, . tetapi cukup baik . . ",pos,neut,neut,neut,pos,pos,neut,neut,neut,neut
"FO kurang informatif dan komunikatif.. Dapat kamar lantai plg atas, lmyn juga olahraga naik turun smbl bawa barang.. Overall kamar dan kebersihan lumayan.. Tas dari airy sudah kumal dan snacknya sudah melempem.. Tolong diperhatikan.. Thanks",neut,neut,neut,pos,pos,neg,neg,neut,neut,neut
"air bau karat, kamar banyak nyamuk, siaran tv bukan siaran tv kabel, wifi tidak masuk ke kamar, park",neut,neut,neut,neut,neut,neut,neut,neut,neg,neg
"Kamar sempit, keramik toilet sepertinya ada yg kopong jd kalo di injek ngerembes air, toilet agak bau, selebihnya okelah, sesuai harga",neut,neut,neg,pos,neg,neut,neut,neut,neut,neut
pelayanan yang ramah... dan fasilitas mumpuni... cuman kurang kebersihan kamarandi saja... selebihnya memuaskan... nilai plusnya ada di breakfast yg enak.,neut,neut,neut,pos,neg,neut,pos,pos,neut,neut
"kamarnya mantap, cuma airnya tidak panas....tapi over all  memuaskan",neut,neg,neut,pos,neut,neut,neut,neut,neut,neut
"Tidak ada jaringan di kamar/wifi, telefon pun rusak jadi tidak bisa pesan makan dibawah. tapi resepsionis nya oke, cepat dan ramah.",neut,neut,neut,neut,neut,neut,pos,neut,neut,neg
"Suasananya kurang nyaman. Untuk menginap harus deposit 300,000. tapi bisa digantikan dengan KTP. ",neut,neut,neut,neut,neg,neut,neut,neut,neut,neut
Butuh pengharum ruangan dan perbaikan AC,neg,neut,neg,neut,neut,neut,neut,neut,neut,neut
"check in jam 7.30 malem, dikasih kamar 221 paling ujung jauh banget dari lift jd bumil tua yg lagi capek harus jalan lumayan jauh ke kamar. pas masuk kamar, kloset ga ada tutup dan ga ada lapisannya, jd kalo BAB/BAK pantat sakit. TV channel biasa dan wifi bad, air panas super lama panasnya, ac ga terlalu berasa. Nginep 2mlm, kapok.",neg,neg,neut,neut,neut,neut,neut,neut,neg,neg
"Kamar mandinya bau, kran berkarat, banyak sarang laba2, tempat tidur kurang bersih, lokasi penginapan masuk gang sehingga tidak bisa masuk mobil.",neut,neut,neg,neut,neg,neut,neut,neut,neut,neut
snack nya gak di kasih...awalnya handuk cuma dikasih 1..tp setelah minta baru dikasih 2,neut,neut,neut,neut,neut,neg,neut,neut,neut,neut
Kamarnya banyak nyamuk dan kurang bersih.,neut,neut,neut,neut,neg,neut,neut,neut,neut,neut
Snack tidak ada dikotak kosong. Air untuk mandi itu air apa? Asin. ,neut,neut,neut,neut,neut,neg,neut,neut,neut,neut
"Wifi suka ga nyampe ke kamar, air kecil",neut,neut,neut,neut,neut,neut,neut,neut,neut,neg
Lantai lembab,neut,neut,neut,neut,neg,neut,neut,neut,neut,neut
"Lumayan sesuai harga, hanya kamar mandi saja yg bau.. minusnya tidak ada air mineral tersedia di kamar. ",neut,neut,neg,neut,neut,neg,neut,neut,neut,neut
kamar sempit dan bau serta jorok   ,neut,neut,neg,neut,neg,neut,neut,neut,neut,neut
"kamer nyaman, kolam renang ok. tp kamer mandi mohon dikasih pewangi/kamper.",neut,neut,neg,neut,neut,neut,neut,neut,neut,neut
kamar bau banget,neut,neut,neg,neut,neut,neut,neut,neut,neut,neut
"Banyak semut di kasur nya, wifi tidak bisa karena belum dibayar, dan token listrik bunyi karena token habis",neut,neut,neut,neut,neut,neut,neut,neut,neut,neg
"Suai lah dg harga, cuma mohon handuknya ganti yg baru krn handuknya tipis bgt",neut,neut,neut,neut,neut,neg,neut,neut,neut,neut
"Tv kabel tidak jelas saluran nya, perlengkapan kamar kurang, kebersihan kamar kurang",neut,neut,neut,neut,neg,neg,neut,neut,neg,neut
AC tidak dingin,neg,neut,neut,neut,neut,neut,neut,neut,neut,neut
bersih tapi selimut nya kurang nyaman dan menjumpai byk semut d sisi2 kamar,neut,neut,neut,neut,pos,neg,neut,neut,neut,neut
Breakfast Gak Jelas jam nya dan pas mau makanan gak ada makanan dan gak ada tamu yg makan untuk informasi tempat makan gak ada cuman ada meja makan saja dan informasiannya dibagian mana .terpaksa makan diluar ,neut,neut,neut,neut,neut,neut,neut,neg,neut,neut
"Jam check in terlalu ketat, kamar yg disediakan banyak noda/bercak, staff juga kurang ramah. ",neut,neut,neut,neut,neg,neut,neg,neut,neut,neut
Nyaman letaknya di tengah kota cuman wifinya pake wifiid 😀,neut,neut,neut,neut,neut,neut,neut,neut,neut,neg
"Saya sudah 3x menginap di sini. Tempatnya sangat worth it dengan harganya. Kamar bersih, kamar mandi juga bersih hanya saja selalu bermasalah dengan air panasnya. Overall sangat recommended",neut,neg,neut,pos,pos,neut,neut,neut,neut,neut
kebersihan nya perlu di tingkat kan lg...jangan hanya kamar nya doank di bersihin tp luar nya pun hrs di perhatiin..,neut,neut,neut,neut,neg,neut,neut,neut,neut,neut
Tidak ada air panas dan sarapan,neut,neg,neut,neut,neut,neut,neut,neg,neut,neut
Wifinya tolong di benahi,neut,neut,neut,neut,neut,neut,neut,neut,neut,neg
enak sih tempatnya tp air panas dikamat mandi nya gak mau terus gak ada dikasih air minum,neut,neg,neut,pos,neut,neg,neut,neut,neut,neut
"kebersihan kamar dan harga ok HANYA mohon perbaiki: 1. AC kamar bocor jika sdh on bbrp jam, tidur terganggu krn tiba2 ac panas tdk berfungsi krn bocor tsb. 2. air minum yg diberikan rasanya agak asin, krn bukan dlm kemasan botol plastik bersegel tapi dgn teko.  semoga ini diperhatikan utk diperbaiki. terima kasih",neg,neut,neut,neut,pos,neg,neut,neut,neut,neut
"Tempat strategis, pelayanan baik, fasilitas cukup baik, kebersihan masih perlu ditingkatkan. ",neut,neut,neut,neut,neg,neut,pos,neut,neut,neut
"kebersihan selimut kurang,  air panas kadang muncul kadang berhenti. Saya beri penilaian 5/10.",neut,neg,neut,neut,neut,neg,neut,neut,neut,neut
hotel seperti rumah hantu gelap sepi dan tidak ada reseptionisnya,neut,neut,neut,neut,neut,neut,neg,neut,neut,neut
"Handuk kotor, sprei banyak bercak, WC juga kotor. ",neut,neut,neut,neut,neg,neg,neut,neut,neut,neut
Tempat ramai dan tidak susah cari minimarket karena ada indomaret dan alfa. Akses pinggir jalan. Customer servicenya ramah sekali. Cuma AC-nya pas subuh tiba-tiba kurang dingin harga dengan fasilitas good.,neg,neut,neut,neut,neut,neut,pos,neut,neut,neut
"sarapan pagi enak. sayangnya kamar berbau asap rokok, kebersihan kamar dan kamar mandi perlu ditingkatkan. resepsionis ramah. tenkyu. ",neut,neut,neg,neut,neg,neut,pos,pos,neut,neut
"pelayanannya biasa, tidak ada pernak pernik airy ketika awal masuk kamar",neut,neut,neut,neut,neut,neg,neg,neut,neut,neut
"Kamar luas, sepi, nyaman. Kunci kamar mandi tidak bisa, tidak dapat snack, dan tv hanya 1 chanel sajaa",neut,neut,neut,neut,neut,neg,neut,neut,neg,neut
"Kurang bersih, pelayanan juga kurang bagus",neut,neut,neut,neut,neg,neut,neg,neut,neut,neut
Ac kurang dingin dan banyak nyamuk :(,neg,neut,neut,neut,neut,neut,neut,neut,neut,neut
wifi kurang kencang ,neut,neut,neut,neut,neut,neut,neut,neut,neut,neg
"AC kurang dingin, bantal bau iler",neg,neut,neut,neut,neut,neg,neut,neut,neut,neut
"hotel bagus dan pemandanganya juga bagus. tp kusus buat kamat Airynya bener2 berbeda sekali dengan kamar lainya, kamar airynya banyak sarang laba2 tempat tidur yg sudah ga nyaman karena pernya berasa banget dibadan dan sudah miring2, ase dikamat juga tdak dingin apa lagi kamar tidak ada fentilasi sama sekali jadi makin berasa pegap.",neg,neut,neut,neut,neg,neut,neut,neut,neut,neut
"kamar nya kotor dan sempit,handuknya tipis dan bau air mani.kamar mandi nya banjir air lama mengalir.saya langsung cek out setelah melihat kondisi kamarnya.Pokoknya gak recomended bangettttt.Nyesel juga ga sesuai sama fotonya menipu bgttt kapok deh.",neut,neut,neut,neg,neg,neg,neut,neut,neut,neut
"Hotelnya sebenarnya bagus, luas, bentuknya tiap kamar kaya bungalow sendiri2 gitu, kolam renang di blakang jg bersih hijau adem kaya digambar. tp manajemennya kaya masih baru msh berantakan. kamar masih blm siap pas jam check-in nunggu hampir sejam, sprei sama kamar mandi kotor. complimentary airy box good ada minum, alat mandi, free snacks banyak",neut,neut,neut,neut,neg,pos,neg,neut,neut,neut
airnya bau banget.. lantai kotor tidak bisa dibuat solat,neut,neut,neut,neut,neg,neut,neut,neut,neut,neut
kebersihannya kurang. tlg diperhatikan lg. tapi better lah dengan harga segitu dan terjangkau. ,neut,neut,neut,neut,neg,neut,neut,neut,neut,neut
Ah .. diksih yang bau rokok,neut,neut,neg,neut,neut,neut,neut,neut,neut,neut
"Tidak sesuai dengan gambar dan tampilan di foto, semua fasilitas sudah tua, wc kotor.",neut,neut,neut,neut,neg,neut,neut,neut,neut,neut
"tempatnya bersih,snack sabun dapat.tempatnya gampang ditemukan.air toiletnya bau.kalau air mandi tidak bau.",neut,neut,neut,neut,pos,pos,neut,neut,neut,neut
Kamar agak kecil dgn tv  sangat mungil. Kamar mandi tidak bersih agak jorok. Selimut dan sprei ada noda2 namun besoknya setelah di komplain diganti dgn yg agak bersih. kolam renang airnya kotor dan sdh lama tidak dikuras. Walaupun sedikit mengecewakan namun agak terobati dengan snack airy dan bath set airy.  Over all lumayanlah,neut,neut,neut,pos,neg,neg_pos,neut,neut,neg,neut
"ok lah...,,, bisa dijdikan pilihan 👍 tpi hot showernya gk ada kamar laen kli yaak",neut,neg,neut,neut,neut,neut,neut,neut,neut,neut
Kualitas wifi sangat buruk sekali bahkan kadang2 mati berkali kali saya menginap disini tapi kualitas wifi tetap saja begitu bahkan makin parah. Tolong diperhatikan,neut,neut,neut,neut,neut,neut,neut,neut,neut,neg
vs kurang ramah,neut,neut,neut,neut,neut,neut,neg,neut,neut,neut
"over all sangat baik, kecuali PARKIR MOTOR YANG KOTOR DAN TIDAK TERAWAT",neut,neut,neut,pos,neg,neut,neut,neut,neut,neut
"Di lantai 1 hotel tidak ada sinyal sama sekali, saya pake 2 kartu operator yg beda. Wi-fi hotel juga tidak menjangkau lantai 1. Shower di kamar mandi rusak, kamar juga kurang bersih (ada puntung rokok di sela kamar tidur dan dinding",neut,neut,neut,neut,neg,neut,neut,neut,neut,neg
"Pelayanan saat check-in sangat tidak ramah, nasi goreng nya hangus, telur dadar kok bisa yaa tipis gitu.. tidak ada sendal, sprei dan sarung bantal kotor...",neut,neut,neut,neut,neut,neg,neg,neg,neut,neut
"Bagus , nyaman dan bersih. Kalau bisa utk saluran chanel tv nya ditambah lagi biar bisa nnton siaran tv yg lainnya. hanya itu saja sih selebihnya good lah",neut,neut,neut,pos,pos,neut,neut,neut,neg,neut
"Stafnya cepat tanggap dan ramah, rasa makanan lumayan, lokasi dekat mega mall, desain hotel antik, cuma sayangnya lantai kamar mandi kurang didesain bagus, kalau mandi air tidak bisa mengalir ke pembuangan, air mandi kurang panas.",neut,neg,neut,neut,neut,neut,pos,pos,neut,neut
Kamar mandi kerannya dan tempat handuk karatan. Overall okay. Bfast ayam pedasnya sangat enak sayang tadi sisa sedikit,neut,neut,neut,pos,neut,neg,neut,pos,neut,neut
"handuknya kurang, sprei dan selimut agak kurang bersih , selebihnya Pelayanan Baik , harga murah 😊 ",neut,neut,neut,neut,neg,neg,pos,neut,neut,neut
"kamar mandi luas tpi kmar kondensasi parah untuk awal nya, wifi tidak berfungsi sama sekali dan tidak ada signal telephone d area hotel but the rest ok",neut,neut,neut,neut,neut,neut,neut,neut,neut,neg
"Air panasnya nyalanya malem. Sy psn 2 kamar, di kamar mandi satunya ada kecoa, seprei agak kotor, bantalnya udh kotor banget butuh diganti, waktu check out resepsionisnya sambil angkat tlp, saya kasih kunci gak ada ngmg apa2 termasuk terimakasih/selamat jalan seperti yg seharusnya.",neut,neg,neut,neut,neg,neg,neg,neut,neut,neut
"Balkon banyak puntung rokok, wifi ga bisa alasannya karena kamar dipojok, kunci toilet nya rusak. tapi kamar nya bersih dan tenang. Harga bersahabat. ",neut,neut,neut,neut,pos,neut,neut,neut,neut,neg
"Nyaman sih, cuma spreinya kok agak bau ya sama ada noda seperti bercak darah.",neut,neut,neut,neut,neg,neg,neut,neut,neut,neut
kamar mandinya kurang bersih airnya asin,neut,neut,neut,neut,neg,neut,neut,neut,neut,neut
"sarapannya biasa saja , kebersihan kurang ",neut,neut,neut,neut,neg,neut,neut,neg,neut,neut
Keren.  Cuma AC nya aja kurang dingin,neg,neut,neut,neut,neut,neut,neut,neut,neut,neut
"AC kurang dingin karena sudah lama, yg bagus kamar nya luas, dan airy rooms selalu ngasih snack Mungkin kebersihan nya perlu ditingkatkan untuk hotel ini",neg,neut,neut,neut,neg,pos,neut,neut,neut,neut
lumayan.cocok buat salesman.. sayang tak ada air panas dan WiFi...,neut,neg,neut,neut,neut,neut,neut,neut,neut,neg
toilet bocor. air panas tdk bs digunakan. selebih nya biasa saja spt hotel pd umum nya,neut,neg,neut,neut,neut,neut,neut,neut,neut,neut
"nyaman, ramah, tidak bising, sarapan enak, gelas bekas lipstik orang .. #saya ga pake lipstik",neut,neut,neut,neut,neg,neg,neg,pos,neut,neut
"View keren, alat mandi lengkap, cemilan+air minum ada, tapi kamer mandi ga terlalu bersih.. Seprei dan bed covernya sempet bau pesing, uda minta diganti tapi tetep bau meski ga pesing lagi.. Mohon diperhatikan.. Terima kasih airy ^^",neut,neut,neg,neut,neg,pos,neut,neut,neut,neut
"Harga MURAH! Pelayan baik dan ramah. Lokasi masuk gang (perkampungan warga) tp bisa dicari di google map. Kamar bersih, rapi dan cukup luas. fasilitas: TV mantap, AC kurang dingin (16°), snack dan air, perlengkapan mandi (sabun odol sikat), handuk ada 2 tp kecil, air lancar tp agak bau. mungkin krn air sumur bor dan lokasi dekat dengan sungai. ⭐⭐⭐⭐",neg,neut,neg,neut,neut,pos,pos,neut,pos,neut
