processed_text,ac,air_panas,bau,general,kebersihan,linen,service,sunrise_meal,tv,wifi
"kamar bersih, layanan memuaskan tapi pas wifi error, semoga cepat diperbaiki",neut,neut,neut,neut,pos,neut,pos,neut,neut,neg
Murah sih tapi kamarnya ada yg bocor dan perabotan kotor.,neut,neut,neut,neut,neg,neut,neut,neut,neut,neut
Tidak tersedia set-up Airy. Harus minta dulu. Kamar remang-remang. Kamar mandi sangat kotor. Shower tidak tersedia air panas. ,neut,neg,neut,neut,neg,neg,neut,neut,neut,neut
lumayan bagus dan terasa aman cmn AC kurang dingin aja..... salam.... ,neg,neut,neut,neut,neut,neut,neut,neut,neut,neut
Ac hanya bisa di temperatur 24 derajat. TV ga bisa nyala. Tapi wifi ok sih.,neg,neut,neut,neut,neut,neut,neut,neut,neg,pos
Lumayan bagus.. Cuma tidak ada tempat sampah di dalam kamar maupun kamar mandi.. Air panas juga lama keluar dan kurang panas..,neut,neg,neut,neut,neut,neg,neut,neut,neut,neut
"sempit, tidak terlalu bersih ... ",neut,neut,neut,neut,neg,neut,neut,neut,neut,neut
Wifi jelek ,neut,neut,neut,neut,neut,neut,neut,neut,neut,neg
Kaca kamar mandi kotor,neut,neut,neut,neut,neg,neut,neut,neut,neut,neut
secara keseluruhan tempat nya nyaman hanya tv yang di kamar tidak ada sinyal ,neut,neut,neut,pos,neut,neut,neut,neut,neg,neut
Wifi gk nyampe lantai atas,neut,neut,neut,neut,neut,neut,neut,neut,neut,neg
"nyaman,ramah penjaganya,dekat pusat kota cuma air panas ga ada tapi ga papa sih bukan kota dingin kok btw semua ok lah",neut,neg,neut,pos,neut,neut,neut,neut,neut,neut
"kesekuruhan cukup baik ya dgn harga promo yg sangat murah, tp kamarnya sempit, dan properti sudah agak usang",neut,neut,neut,pos,neg,neut,neut,neut,neut,neut
"sy booking 2kmr hr sabtu, air mati shg tdk bs mandi maupun utk urusan kamar kecil. kamar mandi sangat kotor.  Ranjang baik, kebersihan kamar lumayan. prncahayaan ruangan kirang lampu.",neut,neg,neut,neut,neg,neut,neut,neut,neut,neut
"Keseluruhan bagus, hanya kamar mandinya terlalu sempit dan agak bau.",neut,neut,neg,pos,neut,neut,neut,neut,neut,neut
hanya AC nya agak kurang dingin,neg,neut,neut,neut,neut,neut,neut,neut,neut,neut
"oke sih, cuma fasilitas air minumnya aja agak dperhatikan, soalnya ada dispenser yang galonnya tidak di ganti2. ",neut,neut,neut,neut,neut,neg,neut,neut,neut,neut
"Receptionist sangat ramah, kamar bersih dan wangi. fasilitas lengkap dengan harga yg sgt terjangkau.. Ada menu makanan yg bisa dipesan dan jg lagi dg harga yg terjangkau. Mungkin hanya fasilitas wifi yang perlu diperbaiki, karna tidak bisa dipakai. ",neut,neut,pos,neut,pos,neut,pos,neut,neut,neg
"Pelayanan sudah baik,  tapi kamar mandi tidak bersih,  ada kerak di lantai dan toiletnya..  Cangkir teh juga ada kerak bekas teh.. Sarapan kurang sebanding dg harganya..",neut,neut,neut,neut,neg,neut,pos,neg,neut,neut
kamar mandinya bau tidak wangi anduk sama sendalnya pun datangnya telat tapi pelayanana baik,neut,neut,neg,neut,neut,neg,pos,neut,neut,neut
"AC tdk bekerja dg baik,  sy bhkn upgrade ke suite room,  ruangan tetap tdk dingin. Membuat sy tdk bisa istirahat ",neg,neut,neut,neut,neut,neut,neut,neut,neut,neut
"ada kejutan snack, menarik juga. sayangnya bedcover nampak noda2",neut,neut,neut,neut,neut,neg,neut,neut,neut,neut
"Kamar sederhana, Ranjang dan furniture baik  Cuma kamar mandi bau.",neut,neut,neg,neut,neut,neut,neut,neut,neut,neut
Pelayanan sudah baik. fasilitas sudah sesuai dengan harga. hanya saja AC berisik.,neg,neut,neut,neut,neut,neut,pos,neut,neut,neut
Cuma wifinya bermasalah itu aja . Dn AC nya kurang dingin mngkin  dah lama gak di cuci,neg,neut,neut,neut,neut,neut,neut,neut,neut,neg
"pelayanan chek in lama dan sistem di resepsionis masih manual, kamar jelek, lantainya rusak, kotor dan kamar mandinya jelek",neut,neut,neut,neut,neg,neut,neg,neut,neut,neut
"mengecewakan, pelayanan tidak bagus bahkan tidak ramah, hotel tua, makanan tidak enak sama sekali, m",neut,neut,neut,neut,neut,neut,neg,neg,neut,neut
selimut nya ga sesuai harapan.. kotor banget min :( banyak semut lagi :(,neut,neut,neut,neut,neg,neg,neut,neut,neut,neut
banyak nyamuk dan kmr bau apek no wifi at room lt.2,neut,neut,neg,neut,neut,neut,neut,neut,neut,neg
"Menginap di airy room selalu berkesan. Staff ramah, pelayanan prima dan kolam renang y yg membuat anak2 betah berlama2 disini. Utk room bersih, nyaman, tidak terlalu luas tp jg tidak terlalu sempit karena masih bisa space ekstra bed. Kamar mandi luas, cm agak sedikit bau tak sedap. Wifi room ok banget. Over all ok banget airy room",neut,neut,neg,pos,pos,neut,pos,neut,neut,pos
Wifi lemot TV tidak ad chanel.....,neut,neut,neut,neut,neut,neut,neut,neut,neg,neg
"ga ada handuk, kamar berjamur, bau tidak sedap, sprei juga kurang bersih. alhasil begitu cek in langsung cabut cari airy lain.",neut,neut,neg,neut,neg,neg,neut,neut,neut,neut
kamar ga sesuai yg di foto. ga ada air panas. banyak bgt nyamuk kamar nya. cemilan ga di kasih lagi di hari kedua. kain seprai dan selimut kurang bersih.,neut,neg,neut,neut,neg,neg,neut,neut,neut,neut
"Kamar bau rokok,perlu ventilasi.Lokasi dekat kantor imigrasi sangat strategis.Air hangat stabil,WC bersih.AC normal.Pelayanan ramah.Lokasi hotel agak sulit ditemukan karena lokasi hotel menjorok kedalam.Lift berjalan normal.Terima kasih",pos,pos,neg,neut,pos,neut,pos,neut,neut,neut
"kamar bersih,malah terlalu luas..jadi kaya kosong gitu suasana nya,cuman bau kmr apek tdk di semprot pengharum saat baru masuk dan penerangan kurang,menu sarapan sesuai harga kmr..bisa di maklumi",neut,neut,neg,neut,pos,neut,neut,pos,neut,neut
"Informasi tidak jelas dan akurat, alamt susah dicari. tidak ada fasilitas antar jemput bndara. Kamar hotel tidak bersih/bocor. Pelayanan di bawah standart. Tidak petugas keamanan.",neut,neut,neut,neut,neg,neut,neg,neut,neut,neut
"Kamarnya bau pengap, tidak sesuai di gambar yang bersih.",neut,neut,neg,neut,neut,neut,neut,neut,neut,neut
overall enak nyaman cuman ac di perbaikin dong kurang dingin,neg,neut,neut,pos,neut,neut,neut,neut,neut,neut
lokasi strategis.. sarung bantal dan sprei bau.. handuk lusuh,neut,neut,neut,neut,neut,neg,neut,neut,neut,neut
"Pelayanan ramah customer service ramah. Cuma bantal kecil agak bau dan selimutnya juga, pintu kamar ",neut,neut,neut,neut,neut,neg,neg,neut,neut,neut
tempat yag bagus n nyaman untuk istirahat tpi tolong tvnya perlu di perbaiki channelnya krn banyak semutnya digambar dan water heaternya nda bisa jd mandi air dingin terus.....,neut,neg,neut,neut,neut,neut,neut,neut,neg,neut
"Pengelola di lapangan tidak komunikatif, kamar mandi masih kotor (banyak kekuningan di keramik), AC kurang dingin, channel TV terbatas, pengelola lapangan jarang di tempat dan tidak ada tempat sampai namun sesuai dengan harganya 50 ribu.",neg,neut,neut,neut,neg,neut,neg,neut,neg,neut
"Proses check in cepat, kamar bersih, tersedia air hangat. Saat saya menginap wifi sedang mati, TV tidak bisa menyala.",neut,pos,neut,neut,pos,neut,neut,neut,neg,neg
"toilet kotor, parkir penuh yg kos bulanan, penjaga ga ramah. cukup sekali aj.",neut,neut,neut,neut,neg,neut,neg,neut,neut,neut
wifi tidak bisa connect,neut,neut,neut,neut,neut,neut,neut,neut,neut,neg
"Kamarnya besar dan nyaman. Mungkin karena lembab jadi ada spot2 tertentu seperti di ujung2 dinding berwarna hitam. Selain itu, resepsionisnya maupun kamar mandinya, semuanya baik.",neut,neut,neg,pos,neg,neut,pos,neut,neut,neut
sangat bgus. namun wifinya pada saat itu lgi mati jadi tolong d perbaik i,neut,neut,neut,neut,neut,neut,neut,neut,neut,neg
"ac tidak berfungsi dengan baik, gerah",neg,neut,neut,neut,neut,neut,neut,neut,neut,neut
"Tempat bersih, set mandi lengkap, dapat snack jg, sayang bau rokok dan lingkungan sangat sepi. tapi cukup strategis, kemana mana dekat.",neut,neut,neg,neut,neg,pos,neut,neut,neut,neut
TV gak bisa di pakai  sinyal parabola nya lemah,neut,neut,neut,neut,neut,neut,neut,neut,neg,neut
"positif: Lokasi strategis.. dari semua airy hotel yang pernah saya kunjungi.. cuma disini kamar tidur dibersihkan setiap hari.. handuk di ganti setiap hari.. camilan, air minum dan perlengkapan mandi dikasih setiap hari, jadi selama 3 hari disana saya dapat cemilan, air minum, perlengkapan mandi 3 set.. petugas ramah.. lokasi strategis.. di sekitar hotel juga banyak yang jual makanan.. overall oke banget buat harga segitu.. kebersihan memang benar2 dijaga.. recommended banget deh..  negatif: krn ga ada lift, jadi harus naik tangga.. waktu pertama kali datang, saya angkut tas ransel dan koper sendiri ke lantai 3.. padahal petugasnya melihat saya terengah2 berhenti di setiap tangga per lantai krn keberatan angkut barang tapi tetap ga dibantuin.. air panas nya ga hidup.. di area meja ga ada lampu.. jadi mau kerja juga ga bisa karena agak gelap..",neut,neg,neut,pos,pos,pos,neg,neut,neut,neut
Wifinya tolong di benahi,neut,neut,neut,neut,neut,neut,neut,neut,neut,neg
"remot tv tidak ada baterai,air panas rusak,kamar kotor,tidaka ada bath math ,berantakan . sudah follow up ke Deva airy tidak ada respon ulang",neut,neg,neut,neut,neg,neut,neg,neut,neg,neut
mengecewakan. snack dan air mineral dari sponsor airy hanya untuk 1 customer sedangkan di pemesanan kamar maksimal 2 orang. handuk juga hanya 1 seharus 2 sesuai aturan yang tertera di aplikasi. walaupun guest house tapi pelayanannya sangat minimalis. shower air panas juga tidak berfungsi. sebaiknya di hapus dari layanan yang tercantum di aplikasi. ,neut,neg,neut,neut,neut,neg,neg,neut,neut,neut
Wifi gak berjalan terlalu baik.  Tapi overall bagus..  ,neut,neut,neut,pos,neut,neut,neut,neut,neut,neg
"ruangan kurang bersih, ada puntung rokok di dalam kamar, plastik shower di ksmar mandi mulai menghitam, conplimentary item expired ",neut,neut,neut,neut,neg,neg,neut,neut,neut,neut
"kebersihan kamar mandi dan kamar sangat kurang sekali,tidak sesuai dgn foto",neut,neut,neut,neut,neg,neut,neut,neut,neut,neut
"Tidak ada nuansa airy room nya seperti tempat lain, air minum gelas bukan botol. Perlengkapan mandi dan makanan harus diminta. Tidak di ingatkan sarapan. Pelayanan sangat jelek. Thanks",neut,neut,neut,neut,neut,neg,neg,neut,neut,neut
terlalu berdebu dan kurang menarik ,neut,neut,neut,neut,neg,neut,neut,neut,neut,neut
"semuanya bagus sesuai profile,dan harga promo untuk suite nya jg sangat murah..komplain cuma water heater yg kamar saya tidak keluar dan air keluar kecil",neut,neg,neut,pos,neut,neut,neut,neut,neut,neut
Pelayanan receptionistnya yg bernama lolita dan syarif sangat tidak sopan dan tidak beretika. Hotel lain yg lebih bagus masih banyak.,neut,neut,neut,neut,neut,neut,neg,neut,neut,neut
"Shower zonk, resepsionis yang wanita judes",neut,neut,neut,neut,neut,neut,neg,neut,neut,neut
pesanan kamar awalnya tidak sesuai seperti detail foto dan wifi tidak ada sama sekali pun baik di lobby maupun dikamar,neut,neut,neut,neut,neut,neut,neut,neut,neut,neg
Kamarnya kotor + berdebu + banyak nyamuk + toilet rusak pelayannya ramah baik,neut,neut,neut,neut,neg,neut,pos,neut,neut,neut
"air panasnya ga ada,lalu sebaiknya diberikan lobang agar tidak banjir,didepan kamar mandi juga tolong berikan lap kaki,tv jg diberikan remot ya...acnya juga ga dingin.",neg,neg,neut,neut,neut,neut,neut,neut,neg,neut
"1. Sampah penghuni sebelumnya tidak dibersihkan 2. kamar mandi becek 3. staff penginapan tidak responsif saat saya butuh bantuan turun dari kendaraan, ketika hujan deras 4. deposit yang nominalnya lebih besar dari biaya inap 5. diatas jam 21 sulit kembali ke kamar, karena pintu utama dikunci 6. sistem check-in yang lama 7. parkir yang terbatas",neut,neut,neut,neut,neg,neut,neg,neut,neut,neut
"Kamar mandi pengap karena blower tidak nyala, handuk kotor, AC tidak dingin paling rendah suhu 25°C",neg,neut,neg,neut,neg,neg,neut,neut,neut,neut
air panas shower Ngak Ada ,neut,neg,neut,neut,neut,neut,neut,neut,neut,neut
"Kamarnya besar, bersihh pelayanan ramah,  harga yg dberikan sngt memuaskn saat melihat kamarnya lengkap, tp akses ke kamarnya yg jauh dbelakang sih dan aroma nya kurang suka,  over all ini keren hrusnya ga smurah itu klo ga pke airy room,  top deh ga mengecewakan",neut,neut,neg,pos,neg,neut,pos,neut,neut,neut
kamar bersih namun air panas tidak teesedia,neut,neg,neut,neut,pos,neut,neut,neut,neut,neut
"kamarnya masih perlu dibersihkan,  karen kematen wajtu bermalam bau asap roko,  selebihnya pelayanan baik",neut,neut,neg,neut,neg,neut,pos,neut,neut,neut
"tdk ada shower air panas, tv tabung, kamar kotor berdebu bau rokok, kolam renang kotor, kamar mandi model jaman old",neut,neg,neg,neut,neg,neut,neut,neut,neg,neut
no good. selimutnya and spreynya tdk bersih.  bau keringat bekas pakai penghuni sebelumnya. badan jadi gatal2 setelah nginap di hotel tersebut.,neut,neut,neg,neut,neut,neg,neut,neut,neut,neut
ac dingin pelayanan lumayan baik. namun selimut dan bed agak kotor. kamar juga berbau ( moldy ),pos,neut,neg,neut,neg,neg,pos,neut,neut,neut
"kamar mandi kotor, lampu kamar mandi gelap, wifi ngk lancar, pelayanan baik sih!",neut,neut,neut,neut,neg,neut,pos,neut,neut,neg
"kamar mandi : bagus tp air panasnya ngga bisa kamar tidur : kasurnya ngga enak bgt per nya udh rusak,kaki kasur juga pada copot lantainya pada bopeng wifinya ngga connect",neut,neg,neut,neut,neut,neg,neut,neut,neut,neg
lantai berdebu,neut,neut,neut,neut,neg,neut,neut,neut,neut,neut
AC panas sampai harus buka jendela.,neg,neut,neut,neut,neut,neut,neut,neut,neut,neut
"AC-nya tidak berfungsi, AC kemungkinan bocor, panas banget. air dilantai 4 kadang-kadang tidak naik, airnya loyo.",neg,neut,neut,neut,neut,neut,neut,neut,neut,neut
"Bagus, suasana enak, strategis juga, cuman wifinya kurang lancar sama flush air kamar mandinya agak ngadat.",neut,neut,neut,neut,neut,neut,neut,neut,neut,neg
Sinyal wifi tidak masuk ke dalam kamar. Air kurang besar,neut,neut,neut,neut,neut,neut,neut,neut,neut,neg
"karena mendapatkan kamar yang kotor , tidak bersih...tidak sesuai dengan yang dipoto...keran air bocor...pada saat b'fast dihari ke2 waiternya jutek dan tidak ramah sekalipun kita minta tolong untuk  order air panas buat termos susu, malahan ditolak order tsb",neut,neut,neut,neut,neg,neut,neg,neut,neut,neut
"staff tidak ramah, kamar bnyk nyamuk, air mati, ac tdk dingin.  masih ada perkakas tamu sblmnya yg tdk dibersihkan dg detail",neg,neut,neut,neut,neg,neut,neg,neut,neut,neut
keren tapi kamarnya bau...,neut,neut,neg,neut,neut,neut,neut,neut,neut,neut
air panas gak nyala. wc kurang bersih.,neut,neg,neut,neut,neg,neut,neut,neut,neut,neut
Ruangan sangat bagus dan nyaman. Recommended! Hanya saja tempat tidur perlu diperhatikan kebersihannya,neut,neut,neut,neut,neg,neut,neut,neut,neut,neut
"Overall oke sih untuk harga segitu. Cuma kamar mandinya bisa dibersihkan lagi. Lokasi oke, tinggal j",neut,neut,neut,pos,neg,neut,neut,neut,neut,neut
"air bau karat, kamar banyak nyamuk, siaran tv bukan siaran tv kabel, wifi tidak masuk ke kamar, park",neut,neut,neut,neut,neut,neut,neut,neut,neg,neg
"Cukup bagus,sesuai dengan tarif. Hanya air panas dari shower,tidak keluar pada pagi hari.Trus makanan sarapan pagi kurang enak",neut,neg,neut,neut,neut,neut,neut,neg,neut,neut
internet mati handuk bau,neut,neut,neut,neut,neut,neg,neut,neut,neut,neg
kamarnya besar enak..tapi kurang bersih kasurnya..dan kamar mandi bau...,neut,neut,neg,neut,neg,neut,neut,neut,neut,neut
"kecewa tempat kotorrr, ga ada air panas, shower tdk berfungsi, tempat tidur dan sprei kotor, tv dan AC bocor dan tidak ada remotenya, kulkas mati tdk berfungsi, sarapan pagi tdk dikasih, semuanya tidak sesuai yg ditawarkan....tidaka puasss",neg,neg,neut,neg,neg,neg,neut,neg,neut,neut
"front office kurang welcome ke tamu, kebersihan kurang banget, lokasi parkir yg terlalu minim thanks",neut,neut,neut,neut,neg,neut,neg,neut,neut,neut
Kamarnya sempit dan pengap. unik memang designnya..kalo luas dikit lagi aja pasti bagus. dan ventilasi/ blower..itu perlu bgt. posisi ac perlu diganti. ,neg,neut,neg,neut,neut,neut,neut,neut,neut,neut
"SAya menginap tidak full satu hari krna beberapa hal : 1. Bantal yg disediakan tidak layak (keras,  wrna bantal coklat, ukuran kecil) 2. AC perlu di cek lg krn bunyinya keras didlm ruangan dan suhu sdh 18 tidak terasa dinginnya. 3. cat tembok di kmr mandi perlu diperbaiki lg krna byk yg mengelupas 4. air panas lama keluarnya kira selbh br kluar. ",neg,neg,neut,neut,neut,neg,neut,neut,neut,neut
"Kamarnya nyaman, tapi sayang air hangatnya tidak keluar yg keluar tetap air dingin. Wifi juga tidak sampai kamar, hanya bisa di loby",neut,neg,neut,neut,neut,neut,neut,neut,neut,neg
"Lokasi strategis, tp fasilitas kurang ac tidak dingin dan bocor ,air panas tidak berfungsi dan selama saya 3 hari menginap kamar tidak pernah d bersihkan. Agak mengecewakan 😏😏",neg,neg,neut,neut,neg,neut,neut,neut,neut,neut
air panasnya kurang hmmm sama wifi gak nyampe :((,neut,neg,neut,neut,neut,neut,neut,neut,neut,neg
"Kamar mandi bau, airnya bau",neut,neut,neg,neut,neut,neut,neut,neut,neut,neut
"Kamar bersih, nyaman. Hanya saja air panas tidak berfungsi saat saya menginap. Mohon diperbaiki.",neut,neg,neut,neut,pos,neut,neut,neut,neut,neut
"AC tidak dingin, kunci kamar tidak bisa dipakai karena kehabisan tap card sehingga tiap keluar masuk kamar harus panggil petugas, kamar byk ngengat kecil yg bikin gatal.",neg,neut,neut,neut,neut,neut,neut,neut,neut,neut
"kamar bau & kotor, toilet bau, after menginap dsini saya kena penyakit kulit (ruam kulit & gatal2)",neut,neut,neut,neut,neg,neut,neut,neut,neut,neut
"1. banyak semut dan nyamuk. 2. handuk, selimut dan sprei tidak diganti selama 3 hari saya menginap. 3. Handuknya hanya disediakan 1 saja per kamar padahal saya berdua dalam 1 kamar. 4. hari kedua saya menginap, mereka telat memberi jatah minum dan jajan dan peralatan mandi. tunggu ditanya dulu baru diberikan. 5. kurang ramah. maaf dan terima ksh",neut,neut,neut,neut,neut,neg,neg,neut,neut,neut
"kamar bersih dan nyaman, pada saat check in agak lama karena kamar masih blm slsai di bersihkan ",neut,neut,neut,neut,pos,neut,neg,neut,neut,neut
"resepsionis yang ramah, tapi acnya kurang dingin",neg,neut,neut,neut,neut,neut,pos,neut,neut,neut
"kamar nya enak smuanya bagus,tp udh 2hari ini pasti deh wifinya mati..pdhal saya udh sering nginep dsni dan yg saya suka dari hotel ini wifinya gk lemot..",neut,neut,neut,neut,neut,neut,neut,neut,neut,neg
pelayanan airynya kurang...saat datang setingannya bukan setingan airy...masih settingan hotel biasa. .,neut,neut,neut,neut,neut,neut,neg,neut,neut,neut
"Tidak sesuai dengan gambar, kebersihan perlu ditingkatkan",neut,neut,neut,neut,neg,neut,neut,neut,neut,neut
ok semua.cumak satu krgnya. selimutnya bau...,neut,neut,neut,neut,neut,neg,neut,neut,neut,neut
channel tvnya dikit banget gasampe 10 buram semuaa,neut,neut,neut,neut,neut,neut,neut,neut,neg,neut
Saluran AC yang ke kamar mandi tolong diperbaiki masalahnya gak enak banget lagi buang air kena tetesan air dari selang pembuangan ac. ,neg,neut,neut,neut,neut,neut,neut,neut,neut,neut
"Kamar mandi terkesan kotor,kondisi kamar sudah tua,sarapan kurang variasi,air panas tidak ada,,kloset kotor",neut,neg,neut,neut,neg,neut,neut,neg,neut,neut
"Sangat kecewa !!!! .... Receptionis Marah2 ke Orang Tua, tidak sopan menjelaskan, service room tidak ada, Room BAU, Memaksa bayar lebih untuk pindah room.  Disappointed ... !!!!",neut,neut,neg,neut,neut,neut,neg,neut,neut,neut
seprainya mohon diperhatikan lg. agak kotor,neut,neut,neut,neut,neg,neg,neut,neut,neut,neut
"pelayanan memuaskan, makanan enak, cuma kamar mandi agak bau. over all ok",neut,neut,neg,pos,neut,neut,pos,pos,neut,neut
"good, kamarnya enak. Cuma batre remot tvnya abis. Jdi tlng lbh di perhatikan lgi fungsi kelengkapannya. Sisanya oke Thx",neut,neut,neut,pos,neut,neut,neut,neut,neg,neut
"cukup baik, pelayanan ramah, cuman sprei agak kotor dan lantai nya sedikit lengket...",neut,neut,neut,neut,neg,neg,pos,neut,neut,neut
"Bau,berisik, tidak bsa ganti type room, tdk bisa refund, semua serba tidak bisa .. lokasi diperumahan jauh dri tmpat mkan atau indomaret alfamart. Stafnya baik sih cuma semua ketentuan dari airy langsung. Tidak akan nginap kesana lagi",neut,neut,neg,neut,neut,neut,pos,neut,neut,neut
"tempatnya bagus, tapi kamarnya jauh dari sinyal wifi ",neut,neut,neut,neut,neut,neut,neut,neut,neut,neg
"Nyaman sih,cuma hot water gak ada,wifi juga gak ada",neut,neg,neut,neut,neut,neut,neut,neut,neut,neg
asik dikamar ada snack gratis dan air minum kamarnya bersih nyaman cuma air hangatnya aja suka ada suka ngk jd ngk bisa dipastikan kalau mau pake air hangat . thx,neut,neg,neut,neut,pos,pos,neut,neut,neut,neut
Baik namun jam operasional ketika kita plng malam sangat cepat pintu gerbang udah di tutup walau masih jam 10 kurang,neut,neut,neut,neut,neut,neut,neg,neut,neut,neut
"mantap nih, sayang wifi sinyalnya kurang bagus dalam kamar, sepertinya karena kamar saya dilantai 3, kalau dari depan kamar si bagus sinyalnya.",neut,neut,neut,neut,neut,neut,neut,neut,neut,neg
"Yang berkesan pelayanannya ramah, yg kurang berkesan yaitu ac kamar meneteskan air dari bagian yg mengeluarkan angin. Solusi dari pihak hotel  yaitu menampung air tadahan pakai wadah.Semoga ke depannya bisa diperbaiki.",neg,neut,neut,neut,neut,neut,pos,neut,neut,neut
lumayan.. hanya saja kalau malam air kurang kencang dan air panasnya tidak terasa..,neut,neg,neut,neut,neut,neut,neut,neut,neut,neut
"Sangat mengecewakan... Tempat nya susah d cari, kamar mandi pengap dan bau, AC tidak dingin dan menetes, terlebih lagi pemilik nya sangat teramat tidak sopan tidak cocok jadi pemilik penginapan kayak pereman pasar... Di tambah kemarin dapat kamar 202 tangg",neg,neut,neg,neut,neut,neut,neg,neut,neut,neut
"air kmar mandi nya agak kuning & berbau,  d'kmar tidur nya jg kaya bau tai kucing.... ",neut,neut,neg,neut,neut,neut,neut,neut,neut,neut
"Kamar oke, ada ruangan untuk smooking area. Parkir lumayan aman. Dapat air mineral di dalam kamar dan pagi hari dapat breakfast gratis. Cuma tidak seperti di iklan tidak ada snack ",neut,neut,neut,neut,neut,neg,neut,pos,neut,neut
"sebenarnya kamar baik tp kurang profesional, di kasih tau sarapan nasi goreng, mnta di anter jam 8.30 ehh dtg jam 9 itu pun d telpon dl dan yg dtg malah mie muah telor. hmmmmmm .",neut,neut,neut,neut,neut,neut,neg,neut,neut,neut
"Awal Check-in sy sudah kecewa krn kamar agak kotor dan tidak tersedia tissue dan keset. Benar saja, ",neut,neut,neut,neut,neg,neg,neut,neut,neut,neut
"Pelayan Kurang Ramah, tidak ada senyum dari customer service dan justru saya sebagai tamu sempat di ledek malah, tidak ada almari, Selimut dan handuk hanya ada satu, tv kabel hanya ada 3 channel yg bisa di tonton",neut,neut,neut,neut,neut,neg,neg,neut,neg,neut
"sprei, sarung bantal, handuk sudah perlu diganti. shower juga harus diperbaiki.",neut,neut,neut,neut,neut,neg,neut,neut,neut,neut
"lantai berdebu, air kurang lancar ",neut,neut,neut,neut,neg,neut,neut,neut,neut,neut
Kelebihannya ada kedai nya cuma jam 6 sore udah tutup. Untuk TV saluran tertentu gambarnya goyang ga,neut,neut,neut,neut,neut,neut,neut,neut,neg,neut
pelayanan kurang ramah utk saya apa mngkin krn prohram airy,neut,neut,neut,neut,neut,neut,neg,neut,neut,neut
"Kamar bau, mau pindah kamar ga bisa karena kamar airy cuma sisa 2 dan 22nya bau",neut,neut,neg,neut,neut,neut,neut,neut,neut,neut
"Wifi tidak bisa, hampir 3 hari dalam masa perbaikan. Kebersihan tempat tidur kurang, seprai terlihat kusam dan noda kurang bersih.",neut,neut,neut,neut,neg,neg,neut,neut,neut,neg
very nice..tapi bnyk rambut,neut,neut,neut,neut,neg,neut,neut,neut,neut,neut
wifi nya kurang. sama bnyk nyamuk,neut,neut,neut,neut,neut,neut,neut,neut,neut,neg
AC nya rusak tidak berfungsi mohon di perbaiki (saya menginap di kamar K / L ).,neg,neut,neut,neut,neut,neut,neut,neut,neut,neut
sudah 2 kali sebenernya nginap di mandi kurang bersih...tapi secara overall memuaskan antara harga dan.kamarnya...terima.kasih airy,neut,neut,neut,pos,neg,neut,neut,neut,neut,neut
"Tembok kamar kotor, channel TV buruk gak bisa nonton byk semut. Tidak ada snack airy dan suasana kamar bukan Airy Style biru putih.",neut,neut,neut,neut,neg,neg,neut,neut,neg,neut
"Air panas tidak jalan, kamar mandi bau rokok, penerangan kurang.",neut,neg,neg,neut,neut,neut,neut,neut,neut,neut
"Lokasi strategis dekat mall, ac dingin, pelayanan ok tp toilet agak bau dan remote tv tdk berfungsi dgn baik",pos,neut,neg,neut,neut,neut,pos,neut,neg,neut
"air Asin, ac tidak dingin, suara berisik",neg,neut,neut,neut,neut,neut,neut,neut,neut,neut
lumayan murah. AC tidak dingin. kamar mandi kurang bersih. lingkungan sekitar kamar kurang bersih. ,neg,neut,neut,neut,neg,neut,neut,neut,neut,neut
pelayanan sangat memuaskan tp pendingin ruangan 803 kurang dingin perlu pembersihan terimah kasih,neg,neut,neut,neut,neut,neut,pos,neut,neut,neut
"kesiapan dan kesigapan staf perlu ditingkatkan. saat tamu baru tiba, seharusnya semua fasilitas sudah ada. tamu menunggu berjam-jam dalam kondisi lelah benar² tidak nyaman. ",neut,neut,neut,neut,neut,neut,neg,neut,neut,neut
"handuk dikamar hanya 1 padahal pesan untuk 2 orang, beberapa kali minta ke resepsionis dan room boy tapi tidak di antar bahkan sampai chek out. beberapa fasilitas seperti rak handuk dikamar mandi rusak, pintu kaca sebaiknya ditambahkan gorden atau diganti dengan pintu biasa, kalau siang panas karena kaca. sprei dan bantalnya kotor penuh daki.",neut,neut,neut,neut,neut,neg,neg,neut,neut,neut
"tempatnya nyaman, bangunan baru...mungkin krn baru blom sempat d bersihkan...msh ad debu...tp overall nyaman, ramah utk tempat transit",neut,neut,neut,pos,neg,neut,neut,neut,neut,neut
"Pelayanan ramah, tetapi tirai kamar mandi dan selimut kurang bersih.",neut,neut,neut,neut,neut,neg,pos,neut,neut,neut
Jaringan tvnya kurang jernih tapi semuanya bagus dan nyaman ,neut,neut,neut,pos,neut,neut,neut,neut,neg,neut
"Secara keseluruhan lumayan bagus, hanya air panas nya tidak bisa dipakai",neut,neg,neut,neut,neut,neut,neut,neut,neut,neut
kurang bersih aja,neut,neut,neut,neut,neg,neut,neut,neut,neut,neut
"km mandi bau, anduk tdk ada, sudah saya minta tdk di kaish.",neut,neut,neg,neut,neut,neg,neut,neut,neut,neut
