processed_text,ac,air_panas,bau,general,kebersihan,linen,service,sunrise_meal,tv,wifi
"Penginapan tidak sesuai dengan foto, bangunan kamar tampak tua, shower kamar mandi yg rusak, lantai kotor, debu ada dimana-mana, jadi saya tidak menginap disini. Tolong diperhatikan lagi.",neut,neut,neut,neut,neg,neut,neut,neut,neut,neut
pelayanan baik tetapi kamarnya kurang bersih,neut,neut,neut,neut,neg,neut,pos,neut,neut,neut
"tidak ada yang berkesan.. tidak mendapat paket dari airy berupa snack dll, dan tidak disediakan handuk, kamar berdebu",neut,neut,neut,neut,neg,neg,neut,neut,neut,neut
"overall bagus..ac nya aja kurang dingin, ",neg,neut,neut,pos,neut,neut,neut,neut,neut,neut
"yang kali ini kecewa, kamar byk nyamuk, gak dpt peralatan mandi, sm snack compliment sprti biasa. smg bs diperbaiki lagi",neut,neut,neut,neg,neut,neg,neut,neut,neut,neut
"Reception dan room servis baik, tapi kamar kurang bersih dan bau, handuk sudah lama dan bau",neut,neut,neg,neut,neg,neg,pos,neut,neut,neut
"pesan 2 kamar, salah satu kamar tidak sesuai dengan pesanan, harusnya ada AC tapi tidak ada, cuma di kasi kasur, tidak standar airyroom. kamar mandi bau, toilet bocor. seprai kurang bersih. lokasi bagus, tidak jauh dari pusat kota.",neg,neut,neg,neut,neg,neg,neut,neut,neut,neut
"kamar ckp luas dan nyaman, hanya saja kekurangan nya selimut dan bantal agak kotor dan tidak disediakan keset.",neut,neut,neut,neut,neg,neg,neut,neut,neut,neut
"sarapannya biasa saja , kebersihan kurang ",neut,neut,neut,neut,neg,neut,neut,neg,neut,neut
Cukup nyaman.  Hanya toiletnya agak kurang sedap wanginya.  Moga sukses trs hotelnya dan selalu memberikan pelayanan terbaik ,neut,neut,neg,neut,neut,neut,neut,neut,neut,neut
Kotor berdebu. Saya tdk berhenti bersin ketika awal masuk kamar. Kesan kamarnya kumuh. Wifi rusak. Saya lgsg check out,neut,neut,neut,neut,neg,neut,neut,neut,neut,neg
"resepsionis check in kurang ramah, berisik, tidak ada tissue,  ",neut,neut,neut,neut,neut,neg,neg,neut,neut,neut
"Pertama datang ada serangga di kasur saya, ac tua jadi berisik, pelayanan staff seperti bintang lima",neg,neut,neut,neut,neg,neut,pos,neut,neut,neut
acnya kurang dingin dan tv channel rata  ngilang,neg,neut,neut,neut,neut,neut,neut,neut,neg,neut
"Ga ada air panas, pas dtg tdk ada handuk, tdk ada tisue toilet, perlengkapan airy room juga tdk tersedia.  Hrs di minta dulu.. baru di antar.",neut,neg,neut,neut,neut,neg,neut,neut,neut,neut
"1. Resepsionisnya tidak ramah sama sekali, malahan terkesan meremehkan tamu (wanita berjilbab) 2. Kamar kotor 3. Sprei dekil 4. Kasur ambles 5. Air kemasan tidak di sediakan padahal katanya di sediakan 2 botol Postifnya hanya air panas saja",neut,pos,neut,neut,neg,neg,neg,neut,neut,neut
"Pelayanan ok, qt tiba di hotel jam 12 tengah malam masih ditunggu. Cuma debit air shower yg kurang dan kamar mandi perlu perbaikan dikit. So far rekom deh",neut,neut,neut,neut,neut,neut,pos,neut,neut,neut
kok skrng gak ada cemilan nya ya,neut,neut,neut,neut,neut,neg,neut,neut,neut,neut
Hotel paling parah!! tidak lagi dah menginap disini...kamar bau apek...handuk tambahan bau badan orang...sprei bau badan...ac panas...parahhhhh......!!! Komplain ke Airy Room tidak ada dispensasi apapun!!! Itu komen bagus2 mungkin orang sendiri yang isi...,neg,neut,neg,neut,neut,neg,neg,neut,neut,neut
"karyawannya friendly kost nya cukup dekat dg jalan raya, transportasi mudah utk pergi kemana2. tapi utk kamarnya belum bersih ada bantal guling yg bau ada di dalam lemari tidak dibersihkan.",neut,neut,neut,neut,neg,neg,pos,neut,neut,neut
Ac nya tdk adem ,neg,neut,neut,neut,neut,neut,neut,neut,neut,neut
"bangunan baru, kebersihan ok ,, ga jauh dr jalan utama..perlu pengharum buat di toilet... tq",neut,neut,neg,neut,pos,neut,neut,neut,neut,neut
"+ kamar cukup luas, terjangkau, sarapan bervariasi, ada kulkas+teko air pns, hot shower, ac dingin, lokasi strategis, lift - channel tv sedikit, ada liat kecoa kecil 1, hari 1-2 ga dpt snack, hari 4 ga dbersihkan n ga dpt mnm+snack, kalo panggil housekeeping lamaaaaaaa but overall bagus, akan mnginap lg dsni krn kmr bsr, bersih, murah, srpan enak",pos,pos,neut,pos,neg,neg,neut,pos,neg,neut
"Lumayan untuk harga diskon. Ac, tv, westafel. Semua baik. Cuma kmrrn abis ada wedding party, blm beres, jadi sampah nya bauuu",pos,neut,neg,neut,neut,neut,neut,neut,pos,neut
"resepsionisnya tidak available 24 hours. Saya check in pukul 4, tidak ada resepsionisnya. Setelah menelfon dan menunggu baru dia keluar. Ketik check out juga saya harus menunggu 30 menit lebih untuk dilayani. Sekitar tempat resepsionis banyak kucing dan bau busuk. keadaan depan penginapan tidak seperti yang di internet.",neut,neut,neut,neut,neut,neut,neg,neut,neut,neut
"air shower nya tidak lancar, selimutnya agak apek, wifi tidak kenceng",neut,neut,neut,neut,neut,neg,neut,neut,neut,neg
"cm ada 1 hal yg bikin ilfeel, yaitu di bantal biru khas airy room ada BEKAS ILER yg ga dibersihin & kelihatan sekali, ada di kedua bantal birunya, gmn ya ini airy?",neut,neut,neut,neut,neg,neg,neut,neut,neut,neut
"wifi payah sekali, petugas kurang responsif ketika wastafel buntu direspon baru hari berikutnya,, tolong diperhatikan ",neut,neut,neut,neut,neut,neut,neg,neut,neut,neg
"Lantai banyak debu, handuknya kecil, sarapannya tidak sesuai yang dinformasikan.",neut,neut,neut,neut,neg,neg,neut,neg,neut,neut
"pelayanannya ramah. tempat tidur nyaman, bersih , AC menyala air panas bisa di gunakan wifinya sangat kencang .. mungkin yang perlu diperbaiki bau saluran air di kamar mandi, tp langsung hilang baunya sejauh ini sangat memuaskan ... terimakasih",pos,pos,neg,neut,neut,neut,pos,neut,neut,pos
Selimut gak ada,neut,neut,neut,neut,neut,neg,neut,neut,neut,neut
"Ini adalah pengalaman TERBURUK saya menginap di hotel, fasilitas yang diberikan semuanya BURUK, Mulai dari bantal, kamar mandi dan sprei yang kotor, Sofa yang dipenuhi semut, Ac yang tidak berfungsi, Lemari yang rusak, TV yang tidak dapat sinyal hingga wasthtafel yang seperti rumah makan ! Ini yang terburuk,  dan tidak sesuai dengan harapan.",neg,neut,neut,neg,neg,neg,neut,neut,neg,neut
penjaganya kurang ramah ,neut,neut,neut,neut,neut,neut,neg,neut,neut,neut
"check in di pukul 2 siang, coba wifi kamar gk connect2. Saat malam hari, bisa connect, tp lambat kali.",neut,neut,neut,neut,neut,neut,neut,neut,neut,neg
air panas susah... sedikit banget .. cuman 5 menit abis langsung.. room ok sih,neut,neg,neut,neut,neut,neut,neut,neut,neut,neut
baikk... tapii air panasnya perlu sangat diperbaiki...,neut,neg,neut,neut,neut,neut,neut,neut,neut,neut
"pengalaman hotel terburuk, pintu hotel jelek, ac tua kurang berfungsi, 1 hari pertama tidak disediakan selimut, selimut juga kotor, sprai dan tempat tidur kotor, tempat tidur juga ga spring bed, ventilasi wc jelek, jadi bau, air kotor, lantai kayu, tv kecil lama tidak terurus, pelayanan juga tidak memuaskan, hotel airy terburuk yang pernah ada.",neg,neut,neg,neg,neg,neg,neg,neut,neg,neut
ac nya susah di nyalain,neg,neut,neut,neut,neut,neut,neut,neut,neut,neut
Breakfast Gak Jelas jam nya dan pas mau makanan gak ada makanan dan gak ada tamu yg makan untuk informasi tempat makan gak ada cuman ada meja makan saja dan informasiannya dibagian mana .terpaksa makan diluar ,neut,neut,neut,neut,neut,neut,neut,neg,neut,neut
"Tempatnya secara keseluruhan baik, rapi, bersih. Hanya hot shower tak tersedia",neut,neg,neut,neut,pos,neut,neut,neut,neut,neut
"Kelengkapan fasilitas dan makanan ringan dikamar sudah OK. Tapi tempat tidur kurang nyaman, terasa banget per nya di badan, kemudian bantal kecil yang warna biru agak bau, seperti sudah lama tidak diganti2, but overall is good.",neut,neut,neut,neut,neut,neg,neut,neut,neut,neut
"kamar mandi sepertiny kurang layak... wc mampet,  wastafel jg mampet saluran air nya... pintu kamar mandi ditambal pake kantong plastik semoga bs diperbaiki ke depan nya... ac kurang dingin... ",neg,neut,neut,neut,neut,neut,neut,neut,neut,neut
"lampu kurang terang, lantai kamar juga seperti belum dipel. semoga jadi lebih baik lagi. terima kasih",neut,neut,neut,neut,neg,neut,neut,neut,neut,neut
"cs ga ramah ,- tv kabel , - air panas . sering saya make airy room tapi cuman ini yg parkir bayar 5rb tiap keluar .",neut,pos,neut,neut,neut,neut,neg,neut,pos,neut
wastafel macet. kamar kurang bersih di sela lemari banyak sawang,neut,neut,neut,neut,neg,neut,neut,neut,neut,neut
"Handuk tidak available di kamar, harus diminta dulu. Wifi tidak sampai ke dalam kamar, mungkin karena kamarnya di ujung. Siaran TV juga tidak bagus dan banyak semut, sebaiknya saran pakai TV cable.",neut,neut,neut,neut,neut,neg,neut,neut,neg,neg
"kamar luas bersih dan staff nya ramah,dari hotelnya cukup puas, box mill ariy nya tidak ada kata pekerja hotel mereka suda email ke pusat ariy tapi blm ada tanggapan dari ariy, tolong ariy direspon dgn cepat, jangan sampai penginap kecewa.  ",neut,neut,neut,neut,pos,neg,pos,neut,neut,neut
Pelayanan nya sangat bagus Tetapi kamar nya kurang bersih Agak sedikit bau Dan seperti wisma ,neut,neut,neg,neut,neg,neut,pos,neut,neut,neut
air panas d kamar hotel kurang maksimal..jga fasilitas untuk termos atau water heater tidak ada.. harus ke recepcionis atau cafe paw.on ,neut,neg,neut,neut,neut,neut,neut,neut,neut,neut
"wifi top kenceng, dekat alun-alun merdeka malang dan dekat tempat peribadatan.. snack bites tidak dibagikan itu membuat SAYA SANGAT KECEWA, kamar seperti tidak dibersihin, sprei kotor",neut,neut,neut,neut,neg,neg,neut,neut,neut,pos
Ac panas.,neg,neut,neut,neut,neut,neut,neut,neut,neut,neut
Tempat nyaman dan strategis dgn tmpt wisata jatim park 2 dan BNS. Air panas nya kadang gak nyala dan saat sy menginap sedang ada renovasi jd agak berisik. Tp overall baik.,neut,neg,neut,pos,neut,neut,neut,neut,neut,neut
"Ketersediaan air disini sebenarnya banyak, namun memiliki bau yang tidak enak. Posisi dalam kamar yang tidak begitu luas juga tidak memungkinkan saya sebagai umat muslim untuk menjalankan ibadah. Serta perlu diperhatikan kembali mengenai kebersihan tempat tidur dan toilet, dikarenakan di tempat tidur saya terdapat bekas rambut dari pengunjung sebelumnya dan juga di toilet masih terdapat bekas sabun dan sikat gigi dari pengunjung sebelumnya serta pada saat mandi ada kelabang yang tiba2 muncul. Tempat ini cocok untuk seorang backpacker yang mengutamakan budget. ",neut,neut,neg,neut,neg,neut,neut,neut,neut,neut
"kamar luas, ac dan air tdk ad masalah. untuk breakfastnya enak. hanya saran untuk kebersihan banyak dan selimutnya d tingkatkan. overall, hotel ini lumayan.",pos,neut,neut,pos,neg,neg,neut,pos,neut,neut
"kamar oke,  tpi acnya tlong lbih dprhatikan lagi karna acnya kurang dingin",neg,neut,neut,neut,neut,neut,neut,neut,neut,neut
"semuanya baik, kecuali pemasangan TV, posisi gak tepat. masak TV didepan lemari.",neut,neut,neut,neut,neut,neut,neut,neut,neg,neut
"Pelayanan kurang ramah, penjaganya yg cewek jutek judes, ga mau senyum.. kalo kamar sih memuaskan sekali cuma pelayanannya aja yg kurang..",neut,neut,neut,neut,neut,neut,neg,neut,neut,neut
"breakfastnya enak, staff dan pelayanannya sangat ramah, hanya Ac yang kurang dingin",neg,neut,neut,neut,neut,neut,pos,pos,neut,neut
"tak sesuai espektasi, kamar sempit, pintu kamar mandi rusak, cek in menunggu terlalu lama, malam suara berisik dr atap kamar, tidak nyaman",neut,neut,neut,neut,neut,neut,neg,neut,neut,neut
semoga kebersihan kamar mandinya lebih di tingkatkan ya... selebihnya memuaskan.. tetap dingin walau gak pake AC.. manthab... terimakasih.. ,neut,neut,neut,pos,neg,neut,neut,neut,neut,neut
Overall nyaman. Hanya WiFi yang kurang sampai ke kamar dan juga menu sarapan yang kurang bervariasi.,neut,neut,neut,pos,neut,neut,neut,neg,neut,neg
sprei n bed cover nya seperti nya perlu di ganti krn sudah terlihat aga usang.,neut,neut,neut,neut,neut,neg,neut,neut,neut,neut
Pelayanan kurang baik... Pegawai kurang ramah sama tamu. ,neut,neut,neut,neut,neut,neut,neg,neut,neut,neut
privasi sangat minim karena suara kamar tetangga seperti aula utama. saluran tv juga tidak ada yang bisa dinikmati lantaran tv berbayang. persiapkan kaki yang sehat untuk naik ke lantai 4 bagi kamar airy karena hotel tidak memiliki lift.,neut,neut,neut,neut,neut,neut,neut,neut,neg,neut
"ac gk dingin, sumpek, toilet mampet.",neg,neut,neg,neut,neut,neut,neut,neut,neut,neut
"pelayan sangat ramah terhadap tamu, lokasinya pun strategis karena dekat dengan stasiun (15-20 menit jalan kaki). tapi sayang, wifinya tidak sampai ke kamar saya",neut,neut,neut,neut,neut,neut,pos,neut,neut,neg
Lokasi dari jalan kramat 5 masih masuk gang kecil jadi sulit ditemukan..plang nama airy harusnya dipasang di tepi jalan kramat 5 agar mudah ditemukan. Air panas kadang berfungsi kadang tidak.,neut,neg,neut,neut,neut,neut,neut,neut,neut,neut
"yang lain udah OK, tapi sayangnya WiFi di kamar lt 6 saat saya menginap lagi ga bisa connect 😫",neut,neut,neut,pos,neut,neut,neut,neut,neut,neg
cuma air kurang lancar dan ac kurang dingin,neg,neut,neut,neut,neut,neut,neut,neut,neut,neut
ac nya mati kaga dingin,neg,neut,neut,neut,neut,neut,neut,neut,neut,neut
"Kamarnya bagus, Fasilitas lengkap, Namun sebaiknya diberikan pewangi dan penghilang bau di kamar..",neut,neut,neg,neut,neut,neut,neut,neut,neut,neut
ga di kasih peralatan mandi (kecuali handuk ada). ga di kasih air mineral juga.. ga ada wifi.. Selain itu OK ,neut,neut,neut,pos,neut,neg,neut,neut,neut,neg
Ac kurang dingin ,neg,neut,neut,neut,neut,neut,neut,neut,neut,neut
kamar nya menakutkn.... snacknya dh exp....,neut,neut,neut,neg,neut,neg,neut,neut,neut,neut
"Puas dgn pelayanan dan keramahan staff, cocok untuk backpacker dgn harga yg relatif terjangkau. Tp air agak berbau harap ditindak lanjuti untuk air mandi dan flush toilet. Terima kasih :)",neut,neut,neg,neut,neut,neut,pos,neut,neut,neut
"proses checkin lama, pdhal sdh jam15.30. dibanding airy lain yg pernah sy kunjungi, hanya disini yg tdk ada atribut Airy sperti bantal & toilet kit. Disini jg tdk disdiakan snack dlm box sperti kmar airy yg prnah sy psan sbelumnya.. layar tv tidak jernih..",neut,neut,neut,neut,neut,neg,neg,neut,neg,neut
"Sprei &  bed cover tidak bersih,  air panas tidak menyala,  wifi di kamar tidak tersedia. ",neut,neg,neut,neut,neg,neut,neut,neut,neut,neg
Pelayanan memuaskan.. Kamar bagus.. Namun tolong dong.. Diadakan keset kaki di kamar mandi.. Biar nda basah klw dari kamar mandi.. Makasi... ,neut,neut,neut,neut,neut,neg,pos,neut,neut,neut
"hotelnya bersih dan nyaman, tp keyika masuk kamar sangat bau bekas asap rokok",neut,neut,neg,neut,pos,neut,neut,neut,neut,neut
"hotelnya bagus,pelayanan cukup dan kurangnya ac kurang dingin",neg,neut,neut,pos,neut,neut,pos,neut,neut,neut
"kamar panas meski ada ac, proses check in tidak lancar karena bertepatan dg penjaga penginapan sedang tidak ada di rumah. ",neg,neut,neut,neut,neut,neut,neg,neut,neut,neut
"Harga yang dibayar sesuai dengan yang didapat. Kebersihan lumayan. Pelayanan ramah, baik. Perlu diperbaiki saluran TV yang kurang bagus, WiFi putus saat malam",neut,neut,neut,neut,pos,neut,pos,neut,neg,neg
"Tidak ada Internet Di dalam kamr sedangkan kita datang dalam rangka ada kerja, jadi tolong pastikan fasilitasnya benar benar ada. ",neut,neut,neut,neut,neut,neut,neut,neut,neut,neg
"sesuai gambar, bersih, ac dingin, wifi kencang, hanya channel tv yg kurang:)",pos,neut,neut,neut,pos,neut,neut,neut,neg,pos
Ac kurang dingin dan banyak nyamuk :(,neg,neut,neut,neut,neut,neut,neut,neut,neut,neut
Wi-Fi nya tidak konek... Jaringan internetnya lemot,neut,neut,neut,neut,neut,neut,neut,neut,neut,neg
"pemilik kayak gak tau n gak kuasai aplikasi airy,kamar airynya paling ujung,nggak dikasih minum+snack gratis dr airy,shower ngga ada yg panas..lokasi strategis,kamar lumayan..mikir2 kalo mo ngulang nginap disini",neut,neg,neut,neut,neut,neg,neg,neut,neut,neut
ac nya sudah cukup lama sampai ga dingin .yg lain nya okeee,neg,neut,neut,pos,neut,neut,neut,neut,neut,neut
nyaman dan bersih... cuma air hangat nya ga begitu hangat masih dingin,neut,neg,neut,neut,pos,neut,neut,neut,neut,neut
"kamar luas, nyaman, minus ac kurang dingin. selebihnya memuaskan. ",neg,neut,neut,pos,neut,neut,neut,neut,neut,neut
"Lokasi strategis mudah ditemukan, kamar nyaman, tapi fasilitas wifi sangat kurang. Jenis makanannya ",neut,neut,neut,neut,neut,neut,neut,neut,neut,neg
"sedikit kecewa karna salah memberikan kamar, tidak ada nuansa kamar airyroom sma sekali. lain kali jngan sprti ini lgi yaa🙂",neut,neut,neut,neut,neut,neut,neg,neut,neut,neut
"Murmer, agak kotor , pelayannya ramah, kelengkapan kurang sesuai, showernya brekelweee🙄",neut,neut,neut,neut,neg,neut,pos,neut,neut,neut
"lumayan bagus,,tenang untuk istirahat,,pelayanannya harap ditingkatkan check kamar sebelum dipake cust,,keset sama tempat sampah saya minta dulu baru disediakan",neut,neut,neut,neut,neut,neg,neg,neut,neut,neut
Tingkatkan pelayanan di bidang kebersihan kamar. ,neut,neut,neut,neut,neg,neut,neut,neut,neut,neut
"kasurnya kecil, snacknya terbatas, ac kurang dingin. gak bagus kalau utk berdua. terima kasih",neg,neut,neut,neut,neut,neg,neut,neut,neut,neut
"yang berkesan ada lokasi yang strategis, tapi sprei tempat tidur, serta sarung bantal sangat kotor, kurang nyaman",neut,neut,neut,neut,neut,neg,neut,neut,neut,neut
"pintu kamar mandi rusak, pembuangan toilet bocor, tv receiver tidak dapat digunakan remote nya hanya untuk channel lokal dan gambar tv nya tidak jernih ... yg lainnya OK",neut,neut,neut,pos,neg,neut,neut,neut,neg,neut
Hotel jorokkkkkkkk banyak semut,neut,neut,neut,neut,neg,neut,neut,neut,neut,neut
"Banyak semut di kasur nya, wifi tidak bisa karena belum dibayar, dan token listrik bunyi karena token habis",neut,neut,neut,neut,neut,neut,neut,neut,neut,neg
saluran channel tv diperbaiki dan wifinya lambat,neut,neut,neut,neut,neut,neut,neut,neut,neg,neg
kamar luas & bersih tapi air panasnya tidak fungsi,neut,neg,neut,neut,pos,neut,neut,neut,neut,neut
ac bocor anduk sprey lusuh ,neg,neut,neut,neut,neut,neg,neut,neut,neut,neut
Kamarnya cukup luas. Sarung bantal agak kotor dan ruangan agak bau. AC berfungsi dengan baik. Dan de,pos,neut,neg,neut,neut,neg,neut,neut,neut,neut
"Pelayan yg baik dan ramah. tempat sesuai dengan gambar. tempat strategis sehingga memudahkan akses kemanapun. Namun, kualitas wifi perlu diperbaiki, karena jaringan yg sangat lambat. suasana nyaman dan relax. ",neut,neut,neut,neut,neut,neut,pos,neut,neut,neg
jorok sekali ,neut,neut,neut,neut,neg,neut,neut,neut,neut,neut
"wifi tidak terhubung, kamar sedikit berbau lembab.",neut,neut,neg,neut,neut,neut,neut,neut,neut,neg
"Bagus , nyaman dan bersih. Kalau bisa utk saluran chanel tv nya ditambah lagi biar bisa nnton siaran tv yg lainnya. hanya itu saja sih selebihnya good lah",neut,neut,neut,pos,pos,neut,neut,neut,neg,neut
"Cukup memuaskan dari sisi tempat dan lokasinya. Agar lebih baik lagi, untuk air hangat dapat digunakan terima kasih",neut,neg,neut,pos,neut,neut,neut,neut,neut,neut
"Plus = Kamar besar, harga murah, ada kulkas, ranjang bagus. Minus= WiFi tidak bisa konek pas di kamar, saluran TV tak bagus, remote tak ada baterai. nilai 7/10",neut,neut,neut,neut,neut,neut,neut,neut,neg,neg
tempatnya bersih hanya saja acnya kurang dingin,neg,neut,neut,neut,pos,neut,neut,neut,neut,neut
Maaf toilet bau. Kamar tidak di semprot pengharum. Bantal airy banyak bercak putih,neut,neut,neg,neut,neut,neg,neut,neut,neut,neut
"pelayanan kurang, kamar kotor, servis tidak memuaskan.",neut,neut,neut,neut,neg,neut,neg,neut,neut,neut
"overall sy puas dgn layanan airyroom hanya saja yg perlu dperbaiki adalah kamar mandi yg agak bau saat ptama saya masuk, mhn dksh pengharum atau karbol..  ",neut,neut,neg,neut,neut,neut,pos,neut,neut,neut
"lift mati, ac tidak dingin, kamar lantai 3 dan kalo mau naik turun capek sekali",neg,neut,neut,neut,neut,neut,neut,neut,neut,neut
"fasilitas baik, hanya kurang bersih lantainya.    masih banyak debu dan rambut2. selebihnya oke",neut,neut,neut,pos,neg,neut,neut,neut,neut,neut
apaan kamar mandinya airnya ngecembeng bener2 so unmood. mana makanan bener2  auhjjj.. yaa kaliii rasanya book ASIN yang pake BGED. solame lah Saya dan suami bener kecewa dan cukup lah itu sekali aja mampir ke sana. ,neut,neut,neut,neut,neg,neut,neut,neg,neut,neut
semua baikndr segi fasilitas dan pelayanan. minusnya di ac yg kurang dingin,neg,neut,neut,pos,neut,neut,pos,neut,neut,neut
"handuk gak di kasih, air hangat gak jalan, tolong di tingkat kan pelayanan dan fasilitas nya",neut,neg,neut,neut,neut,neg,neg,neut,neut,neut
kamar cukup nyaman walaupun dpt kamar lt 5 dan tidak ada lift... pedugas yg cowok agak jutek..konfirmasi earlu cek in tp sampai di penginapan tyt tdk bs,neut,neut,neut,neut,neut,neut,neg,neut,neut,neut
tidak ada selimut. kamar mandi kotor,neut,neut,neut,neut,neg,neg,neut,neut,neut,neut
not bad at all kecuali dapat kamar dilantai 3 dan tidak ada liftnya.. kolong tmp tdr yg kotor dan kamar mandi yg cm 1m x 1m luasnya.. ,neut,neut,neut,neut,neg,neut,neut,neut,neut,neut
kamar kurang bersih ... ac kurang dingin ...  mungkin karena hotel lama ya,neg,neut,neut,neut,neg,neut,neut,neut,neut,neut
"kamar sisa , AC panas. pelayanan minimal..",neg,neut,neut,neut,neut,neut,neg,neut,neut,neut
Pelayanan kurang,neut,neut,neut,neut,neut,neut,neg,neut,neut,neut
"fasilitias oke. hanya seprei tdk diganti. ada Better yang bungkusnya spt tergigit tikus, 2 biji di belakang bantal.",neut,neut,neut,neut,neut,neg,neut,neut,neut,neut
"Nice & strategic location, tapi kamar 145 begitu masuk kamar sinyal wifi hilang 😌, 9/10",neut,neut,neut,neut,neut,neut,neut,neut,neut,neg
"tempat bersih nyaman, cuman wifi sangat sangat lemot banget, makasih",neut,neut,neut,neut,pos,neut,neut,neut,neut,neg
Wifinya perlu di cek apakah sudah bisa atau belum bisa d gunakan oleh pengunjung,neut,neut,neut,neut,neut,neut,neut,neut,neut,neg
"Kamar yang Saya dapat beda dengan gambar, tanpa jendela. kamar mandi baunya agak kurang sedap, pintunya jg trouble",neut,neut,neg,neut,neut,neut,neut,neut,neut,neut
perlu pengharum dikamar mandi dan air hangatnya mati.,neut,neg,neg,neut,neut,neut,neut,neut,neut,neut
siaran tv nya tdk berfungsi snack nya tdk ada,neut,neut,neut,neut,neut,neg,neut,neut,neg,neut
wifi lemot,neut,neut,neut,neut,neut,neut,neut,neut,neut,neg
"Pelayanan baik, cuma cs sering tidak ditempat. Kamar bersih. TOP",neut,neut,neut,neut,neg,neut,pos,neut,neut,neut
Selimut/sprey kurang bersih,neut,neut,neut,neut,neut,neg,neut,neut,neut,neut
Hotelnya bersih..cuman pelayanannya agak cuek..staffnya tidak ramah...tp saya nyaman tidur disana,neut,neut,neut,neut,pos,neut,neg,neut,neut,neut
"semua Ok, mantapp lah harga lumayan stff OK, tivi tu masangnya ketinggian musti ngedongak liatnya, bikin pegel leher^",neut,neut,neut,pos,neut,neut,neut,neut,neg,neut
"kesan pertama waktu buka pintu, yg keciuman malah bau toiletnya :( sarapannya ditingkatkan lg ya. overall sih oke, tempat yg cocok utk persinggahan. ",neut,neut,neg,pos,neut,neut,neut,neg,neut,neut
"gedunnya tidak ada plang berlogo Airy dan tidak ada nomornya. jam 8 malam, Saat ditanya tempat ini Airy atau bukan, petugasnya merespon dengan sangat tidak ramah... buruk sekali pelayanannya...",neut,neut,neut,neut,neut,neut,neg,neut,neut,neut
Memuaskan tapi toilet kurang bersih. Tidak bisa di flush closetnya. Dan handuk hanya satu. Dan hotel,neut,neut,neut,neut,neg,neg,neut,neut,neut,neut
"Cukup baik hanya sedang renove jadi terlihat kotor , pelayanan oke",neut,neut,neut,neut,neg,neut,pos,neut,neut,neut
"FO kurang informatif dan komunikatif.. Dapat kamar lantai plg atas, lmyn juga olahraga naik turun smbl bawa barang.. Overall kamar dan kebersihan lumayan.. Tas dari airy sudah kumal dan snacknya sudah melempem.. Tolong diperhatikan.. Thanks",neut,neut,neut,pos,pos,neg,neg,neut,neut,neut
lumayan soh tp lantai agk kotor.trs gsk diksh handuk.pakirnya minim tempt.overall lumyan..,neut,neut,neut,pos,neg,neg,neut,neut,neut,neut
Pertama datang saya dikasih kamar yg buat berdua padahal saya memesan kamar yg untuk berempat dan tdk ada desain nya airyroom di kamar dan tdk dapat snack kalo tidak di komplain pokok nya kecewa menginap disini,neut,neut,neut,neg,neut,neg,neg,neut,neut,neut
Kamarnya luasss.. Kebersihan so so. Tapi karena besar kamarnya nyaman bgt,neut,neut,neut,neut,neg,neut,neut,neut,neut,neut
kamar nyaman.. sayang wifi nya lemot..,neut,neut,neut,neut,neut,neut,neut,neut,neut,neg
Kamar bagus nyaman hanya pelayanan yang sedikit kurang memuaskan ,neut,neut,neut,neut,neut,neut,neg,neut,neut,neut
"nyaman, dan tenang,,, hny wifi nya gk fungsi,,, jd susah buat komunikasi,,, tlg tingkatkn lagi pelayanannya",neut,neut,neut,neut,neut,neut,neg,neut,neut,neg
"Bersih, nyaman, tapi WiFi lola banget ",neut,neut,neut,neut,pos,neut,neut,neut,neut,neg
"ga recomended ac panas, bantal bau, dan ruangan ga sesuai yg di gmabr. beda bgt. thx airy",neg,neut,neut,neut,neut,neg,neut,neut,neut,neut
"Kamarnya nyaman, sayangnya kamar mandinya bau",neut,neut,neg,neut,neut,neut,neut,neut,neut,neut
kamar mandi kurang bersih,neut,neut,neut,neut,neg,neut,neut,neut,neut,neut
ac kurang dingin dan kamar model lama,neg,neut,neut,neut,neut,neut,neut,neut,neut,neut
"Kamar mandi nya tdk wangi, tidak ada air panas nya di shower. Awal nya ac kurang dingin",neg,neg,neg,neut,neut,neut,neut,neut,neut,neut
"Hotelnya sebenarnya bagus, luas, bentuknya tiap kamar kaya bungalow sendiri2 gitu, kolam renang di blakang jg bersih hijau adem kaya digambar. tp manajemennya kaya masih baru msh berantakan. kamar masih blm siap pas jam check-in nunggu hampir sejam, sprei sama kamar mandi kotor. complimentary airy box good ada minum, alat mandi, free snacks banyak",neut,neut,neut,neut,neg,pos,neg,neut,neut,neut
"kamar mandi sempit. tak ada wastafel. pagar buka tutup sendiri. ada dapur, bisa tukar kamar saat tahu bau rokok.",neut,neut,neg,neut,neut,neut,neut,neut,neut,neut
