processed_text,fuel,machine,others,part,price,service
Saya memakai Honda Jazz GK5 tahun 2014 ( pertama meluncur ) . Mobil nya bagus dan enak sesuai moto nya menyenangkan untuk dikendarai,neutral,neutral,positive,neutral,neutral,neutral
Avanza kenapa jadi boros bensin begini dah ah. Baru diisi sudah mau setengah saja .,negative,neutral,neutral,neutral,neutral,neutral
Dari segi harga juga pajero lebih mahal 30 jutaan dibanding fortuner,neutral,neutral,neutral,neutral,positive,neutral
"@LinaRadj kapan-kapan coba bengkel daihatsu , mereka mau kok . Servis lebih bagus .",neutral,neutral,neutral,neutral,neutral,positive
Lampu utama depan Grand New Veloz juga mendapatkan perubahan desain dan terkesan lebih agresif dan sedikit menonjol,neutral,neutral,neutral,positive,neutral,neutral
Motor beat aku yang menemani aku di saat ke mana saja dan yang penting bbm - nya ramah lingkungan dan ramah juga di kantong dan tarikan nya mantap banget .,positive,positive,neutral,neutral,neutral,neutral
"Xenia tahun 2008 bolak-balik jakarta - bandung , aki tetap aman .",neutral,neutral,neutral,positive,neutral,neutral
#YamahaID Perawatan Motor Injeksi Yamaha Mudah dan Murah,neutral,neutral,neutral,neutral,neutral,positive
Buat dalam kota xpander bagus karna model nya kalem dan kesan nya car city,neutral,neutral,neutral,positive,neutral,neutral
brio pajak nya murah karena ckd daripada ignis atau sirion yg cbu pajak nya agak mahal trus onderdil nya agak susah atau lama kalo mau klaim asuransi,neutral,neutral,neutral,negative,negative,neutral
untuk yang sekarang great new xenia sudah mempunyai fasilitas yang wow dengan harga yang bersahabat bahkan lebih murah daripada rival nya,neutral,neutral,neutral,positive,positive,neutral
"punya mobil altis tidak awet , baru setahun sudah rusak .",neutral,neutral,negative,neutral,neutral,neutral
"Service rutin ke bengkel daihatsu resmi gak jaminan juga , rem - ku blong waktu jalan ,",neutral,neutral,neutral,neutral,neutral,negative
"Saya pakai karimun , adik saya pakai brio . memang karimun lebih nyaman walau lebih murah dari brio .",neutral,neutral,positive,neutral,positive,neutral
bodi plus tampilan nya Avanza baru mantap juragan,neutral,neutral,neutral,positive,neutral,neutral
Sudah dari dulu Toyota selalu kasih produk super mahal dengan fitur pas pasan,neutral,neutral,neutral,negative,negative,neutral
avanza ini mobil saya yang paling bandel,neutral,positive,neutral,neutral,neutral,neutral
Mobil kualitas jelek kayak wuling saja masuk Indonesia.,neutral,neutral,negative,neutral,neutral,neutral
Pelayanan bengkel daihatsu bagus,neutral,neutral,neutral,neutral,neutral,positive
"gue punya xenia xi , dasbor nabrak pohon , setelah dua hari diperbaiki di servis resmi daihatsu , langsung jadi kayak baru lagi , keren .",neutral,neutral,neutral,neutral,neutral,positive
"fortuner per nya keras , capek",neutral,neutral,neutral,negative,neutral,neutral
"Lebih bagus Mobil Esemka , Mobil Nasional Asli Buatan Dalam Negeri , Harga Terjangkau , Irit BBM Mesin nya juga tangguh .",positive,positive,positive,neutral,positive,neutral
"ya begitu itu Nissan , memang agak mahal tetapi daya tahan nya bagus .",neutral,neutral,positive,neutral,negative,neutral
fortuner gak cocok buat mahasiswa dari segi desain yang terlalu mencolok dan mahal pula,neutral,neutral,neutral,negative,neutral,neutral
Servis di Bengkel Toyota Lebih cepat,neutral,neutral,neutral,neutral,neutral,positive
Honda Spacy irit banget sumpah,positive,neutral,neutral,neutral,neutral,neutral
"jujur saja inden nya lama banget dari dealer , sudah 1 bulan belum datang juga",neutral,neutral,neutral,neutral,neutral,negative
numpang gabung ya baru beli xenia 04 - 2008 3 hari yang lalu keseluruhan gue ngerasa cukup .,neutral,neutral,positive,neutral,neutral,neutral
setuju banget kalau jazz lebih keren dan mantap daripada mobilio,neutral,neutral,negative,neutral,neutral,neutral
"Masya Allah toyota mahal harga nya , tetapi pelit fitur-fitur",neutral,neutral,neutral,negative,negative,neutral
fortuner sparepart nya banyak dijual di mana-mana,neutral,neutral,neutral,positive,neutral,neutral
"Alhamdullilah inden dari dealer wulling agustus awal mobil sudah datang , cepat .",neutral,neutral,neutral,neutral,neutral,positive
"Udah beli yg rush 2018 , alhamdulillah tidak ada penyesalan sampai saat ini dan insyaAllah seterusnya",neutral,neutral,positive,neutral,neutral,neutral
handling mini cooper juara .,neutral,neutral,neutral,positive,neutral,neutral
Saya sangat puas dengan mobil saya selain berbadan besar terlihat mewah dan sangat irit bahan bakar karena minum nya solar jadi mantap kijang innova,positive,neutral,positive,positive,neutral,neutral
xenia gak awet banget masa baru 6 bulan sudah bermasalah,neutral,neutral,negative,neutral,neutral,neutral
lama banget nunggu inden xpander keburu saya jual ini mobil,neutral,neutral,neutral,neutral,neutral,negative
"Avanza guncangan mesin nya halus meski di jalan yang tak mulus , AC enggak menurun meski dinyalakan tanpa henti , dan mesin enggak cepat panas berlebih meski macet bermenit-menit .",neutral,positive,neutral,positive,neutral,neutral
"Honda slalu nanggung dan maksa tiap kali melakukan upgrade mobil yangg sudah ada , membosankan",neutral,neutral,negative,neutral,neutral,neutral
Bengkel ahas togosari service nya tidak memuaskan mekanik nya gak fokus dan jelek . tidak seperti dulu . gimana itu bos .,neutral,neutral,neutral,neutral,neutral,negative
"Buat yang orientasi pengendara , Mitsubishi ini cocok banget mau mobil yang menyenangkan untuk dikendarai enak dibawa luar sama dalam kota",neutral,neutral,positive,neutral,neutral,neutral
N - Max biaya perawatan mahal bakal lebih boros dari pada kamu naik angkutan umum,neutral,neutral,neutral,neutral,neutral,negative
"@DaihatsuInd Xenia itu kita banget ! Cocok diajak ke mana-mana , service gampang , harga terjangkau , mudah dipakai .",neutral,neutral,positive,neutral,positive,positive
"Konsumsi bbm bisa dipaksa 1:12 kalau bawa nya waras , lumayan irit si Altis G 2003 MT ini",positive,neutral,neutral,neutral,neutral,neutral
"@YamahaIndonesia pelayanan bengkel yamaha di poso jelek sekali bung , hari kemarin bilang nyuruh hari ini , hari ini datang bilang tidak bisa",neutral,neutral,neutral,neutral,neutral,negative
"Saya membeli Honda Beat ini pada tahun 2015 , sudah tiga tahun lama nya umur motor ini . Saya bekerja dengan jarak tempuh lumayan jauh dari rumah saya , tetapi terbukti hingga saat ini sangat irit bbm - nya , di lain sisi ada dobel rem yang membuat sepeda ini menjadi luar biasa .",positive,neutral,neutral,positive,neutral,neutral
"kaki-kaki juga aman normal jaya . belum pernah ganti sparepart apa pun kecuali oli radiator dan filter , mantap brio",neutral,neutral,neutral,positive,neutral,neutral
"Ada satu lagi nih yang menurut saya sepele tetapi jadi kenikmatan , yaitu fitur Brake Hold di HRV",neutral,neutral,neutral,positive,neutral,neutral
xpander terlihat seperti mobil tahun 2020,neutral,neutral,positive,neutral,neutral,neutral
Toyota rush terbaik di kelas nya dan terdepan di zaman nya .,neutral,neutral,positive,neutral,neutral,neutral
brio gak bagus sumpah .,neutral,neutral,negative,neutral,neutral,neutral
mendingan Mitsubishi Xpander yang rata rata menang disegala aspek,neutral,neutral,positive,neutral,neutral,neutral
cukup 10 menit untuk bersihkan injektor motor injeksi Yamaha :D arti nya motor injeksi YMH perawatan murah & mudah,neutral,neutral,neutral,neutral,neutral,positive
"Kekurangan dari Formo sekilas: minim fitur safety, kualitas finishing interior jelek.",neutral,neutral,neutral,negative,neutral,neutral
Susah banget telepon buat booking servis auto 2000 toyota ! Masa gue harus booking ke sana sih :(,neutral,neutral,neutral,neutral,neutral,negative
"Honda Beat bahan bakar sangat irit , ringan buat menyalip di jalanan macet , mesin tarikan enteng banget .",positive,positive,positive,neutral,neutral,neutral
Mobil WULING CONFERO sangat layak untuk dipilih dan DIBELI sebagai mobil MPV yang nyaman dengan harga terjangkau .,neutral,neutral,neutral,neutral,positive,neutral
Memilih Terios baru rasanya tidak keliru,neutral,neutral,positive,neutral,neutral,neutral
Mobil wuling confero S nyaman dipakai di medan petualangan .,neutral,neutral,positive,neutral,neutral,neutral
"Avanza mudah dalam perawatan ,",neutral,neutral,neutral,neutral,neutral,positive
"kalau soal mesin dan bentuk toplah yamaha , kayak sekarang saya pakai nmax 2018 yang memang sudah lama saya incar , dari bentuk saya suka sekali .",neutral,positive,neutral,positive,neutral,neutral
"masalah nya , Xenia 2005 kadang-kadang dasbor bunyi ,",neutral,neutral,neutral,negative,neutral,neutral
"Dan cabin nya juga lebih luas fortuner , kalau pajero sempit apalagi di bagian depan",neutral,neutral,neutral,negative,neutral,neutral
"Service bengkel pinggir jalan dibilang jelek hasil service di dealer resmi pelayanan jelek , scumbag honda",neutral,neutral,neutral,neutral,neutral,negative
selama ini pakai xexi lumayan enak dan nyaman juga .,neutral,neutral,positive,neutral,neutral,neutral
"1 kelemahan xenia , DUDUK DI BARIS PALING BELAKANG KAYAK NAIK UNTA ! GILA BERASA BANGET PUYENGNYA .",neutral,neutral,neutral,negative,neutral,neutral
Tapi yang sangat jelek dari Freed adalah tarikan nya .,neutral,negative,neutral,neutral,neutral,neutral
saya saranin beli vario aja suku cadang meadai purnajual juga oke,neutral,neutral,neutral,positive,positive,neutral
"Simpel cocok dijuluki untuk nya Honda beat makin bertambah gaya desain minimalis namun juara di kelas nya , bahan bakar juara nya hemat ramah dan bersahabat dengan saku maupun di dompet , sukses selalu Honda one Heart",positive,neutral,neutral,positive,positive,neutral
"New Veloz saya rasa udah banyak improvement nya , terutama di bagian suspensi nya dibanding sebelumnya . Mental mentul , body roll , limbung sudah berkurang .",neutral,neutral,neutral,positive,neutral,neutral
"Fortuner adalah mobil impian saya . Ini adalah suv mahal memang , tetapi sepadan .",neutral,neutral,neutral,neutral,negative,neutral
Ternyata perawatan yamaha rata rata lebih murah dari kompetitor .,neutral,neutral,neutral,neutral,neutral,positive
"Sudah dua tahun saya memiliki motor Honda Beat ini , motor ini keseharian nya saya pergunakan untuk antar anak sekolah dan bekerja . Motor yang lumayan gesit , lincah dan irit BBM .",positive,positive,neutral,neutral,neutral,neutral
Pajero mempunyai mesin yang lebih bertenaga dan banyak fitur,neutral,positive,neutral,positive,neutral,neutral
suzuki ignis dan Daihatsu sirion harga jual nya juga enggak stabil,neutral,neutral,neutral,neutral,negative,neutral
"kalau sudah di atas 120 km / jam boros banget avanza saya , terus kopling nya memang agak keras juragan .",negative,neutral,neutral,negative,neutral,neutral
"Pertama kali memiliki mobil ini rasanya seperti mimpi , karena setelah dapat mobil ternyata menang undian juga 10 juta rupiah dari Daihatsu . Mobil irit , servis mudah dan murah .",positive,neutral,neutral,neutral,neutral,positive
mendingan vrz 4*4 sekalian fitur lengkap spoiler bisa beli di toko variasi,neutral,neutral,neutral,positive,neutral,neutral
Xenia memang masih kurang dari segi keamanan nya . Air bag - nya kagak ada bos .,neutral,neutral,neutral,positive,neutral,neutral
Pajero sport Dakar memang di atas Fortuner,neutral,neutral,negative,neutral,neutral,neutral
Dulu gue enggak suka sama xpander .,neutral,neutral,negative,neutral,neutral,neutral
"Fortuner saya kok setir nya agak enggak enak gitu , ya . Enggak luwes .",neutral,neutral,neutral,negative,neutral,neutral
jujur fortuner ini bandel banget dipakai di medan apa pun,neutral,positive,neutral,neutral,neutral,neutral
pengalaman saya punya avanza bahan bakar nya lebih hemat daripada ketika saya punya xenia,negative,neutral,neutral,neutral,neutral,neutral
"Sirion ini terlalu overpriced bos , bisa ngga laku di indonesia",neutral,neutral,negative,neutral,negative,neutral
xenia ini mobil paling jelek yang pernah saya punya,neutral,neutral,negative,neutral,neutral,neutral
Payah payah gak ada yang becus nih bengkel honda . seminggu dari bengkel sudah bunyi lagi saja .,neutral,neutral,neutral,neutral,neutral,negative
menurut saya dari segi kenyamanan sih bolehlah lumayan si xenia,neutral,neutral,positive,neutral,neutral,neutral
Avanza bahan bakar nya yang irit .,positive,neutral,neutral,neutral,neutral,neutral
Toyota rush 2018 tarikan nya luar biasa,neutral,positive,neutral,neutral,neutral,neutral
Avanza mobil yang nyaman untuk keluarga dan tidak terlalu mahal perawatan nya,neutral,neutral,positive,neutral,neutral,positive
"saya baca di atas tetangga , xenia juga naik itu sekitar 2 - 3 juta . makin mahal saja ya mobil sekarang .",neutral,neutral,neutral,neutral,negative,neutral
Selalu setia menggunakan setiap produk nissan .,neutral,neutral,positive,neutral,neutral,neutral
"entah kenapa si avsen kalau untuk mobil perang jauh lebih oke , walau enggak stabil , enggak terlalu nyaman ,",neutral,neutral,negative,neutral,neutral,neutral
"suka sekali sama agya, tarikan nya itu loh halus banget",neutral,positive,neutral,neutral,neutral,neutral
"Gua terang pilih pajero , selain keren model nya dan kelihatan dinamis , mesin juga mantap , model dasboard sporty",neutral,positive,positive,positive,neutral,neutral
"Toyota Rush saya sudah berusia 8 , tenaga nya kurang power full",neutral,negative,neutral,neutral,neutral,neutral
"Sudah seminggu punya lexi , jauh lebih nyaman dibandingkan vario .",neutral,neutral,negative,neutral,neutral,neutral
Tarikan lincah pasti Avanza,neutral,positive,neutral,neutral,neutral,neutral
xenia lari nya lebih lincah daripada avanza yang agak lemah,neutral,negative,neutral,neutral,neutral,neutral
tenaga maknyus bagus . Vario125 esp combi brake enak enggak memalukan .,neutral,positive,neutral,positive,neutral,neutral
tetapi harga otr xi lebih mahal daripada li,neutral,neutral,neutral,neutral,positive,neutral
Mitshubisi raja jalanan,neutral,neutral,positive,neutral,neutral,neutral
Kalo gue sih yang pemula . Lebih suka exterior brio . Cuma kalo kelengkapan fitur memang sirion,neutral,neutral,neutral,positive,neutral,neutral
Buat yang punya Avanza dan Xenia pasti sudah merasakan berisik nya suara di dalam kabin dan lemah nya bantingan mobil .,neutral,neutral,neutral,negative,neutral,neutral
"Avanza memiliki kapasitas 7 penumpang yang nyaman dan aman , dan daya tahan lebih baik berkat sasis semi - monokok yang digabung dengan sub-frame juragan",neutral,neutral,neutral,positive,neutral,neutral
"sudah harga nya mahal, fortuner ini juga konsumsi bahan bakar nya lumayan menguras dompet",negative,neutral,negative,neutral,neutral,neutral
fortuner sparepart nya susah dicari,neutral,neutral,neutral,negative,neutral,neutral
"yang saya suka dari avanza itu volume nya yang besar, anak-anak bisa bebas bersantai di dalam mobil",neutral,neutral,neutral,positive,neutral,neutral
"saya punya xenia Li 08 family , sepanjang pemakaian nya belum ada keluhan sih .",neutral,neutral,positive,neutral,neutral,neutral
Honda Brio punya setir yang presisi dan tegak seperti 86 begitu pun jok sporty - nya ala racing .,neutral,neutral,neutral,positive,neutral,neutral
alasan nya harga fortuner di bawah harga pajero,neutral,neutral,neutral,neutral,negative,neutral
Salah satu yang paling saya suka dari merek Honda ini adalah ultra seat,neutral,neutral,neutral,positive,neutral,neutral
semakin cantik saja nih avanza juragan,neutral,neutral,positive,neutral,neutral,neutral
"Mobil ini gue akui paling pas untuk kerja dengan mobilitas tinggi , gede nggak , kecil juga nggak , masuk2 kampung gang kecil tanjakan terjal lincah , dan yg paling penting penggerak roda belakang cocok buat segala medan",neutral,positive,neutral,positive,neutral,neutral
"Ignis Worth it mas dengan harga terendah 139,5 juta .",neutral,neutral,neutral,neutral,positive,neutral
"Beli beat fi buat harian , Tarikan nya nyaman , irit banget kalau dibuat kuliah . Harga oke .",positive,positive,neutral,neutral,positive,neutral
Wuling confero S 1.5 L Lux+ ke jawa timur park 3 terasa kenyamanan mobil ini tidak limbung .,neutral,neutral,positive,neutral,neutral,neutral
"konsumsi bbm HRV juga irit banget bisa sampe 13,5 km / l",positive,neutral,neutral,neutral,neutral,neutral
kelebihan Avanza yang membuat saya jatuh hati sama avanza adalah penggunaan sistem penggerak roda belakang atau rear wheel drive .,neutral,neutral,neutral,positive,neutral,neutral
Hadeh toyota prado segala rusak . Emang kata abang gue perawatan mobil matic itu susah,neutral,neutral,neutral,neutral,neutral,negative
"lebih nyaman All New Avanza , lebih gesit . akselerasi lebih baik .",neutral,positive,neutral,neutral,neutral,neutral
Toyota Rush cocok untuk segala musim berjiwa petualang .,neutral,neutral,positive,neutral,neutral,neutral
"saya pengguna xpander , saya coba di tanjakan-tanjakan dieng dengan penumpang 6 orang dewasa , oke-oke saja kok . Dan memang mantap ini mobil",neutral,neutral,positive,neutral,neutral,neutral
memang bagus sih brio pantas laku keras,neutral,neutral,positive,neutral,neutral,neutral
"@iip_bados05 bengkel resmi toyota , honda , daihatsu itu standart nya lebih bagus dari bengkel biasa mas , so astrido punya toyota .",neutral,neutral,neutral,neutral,neutral,positive
brio mobil nya jelek banget gak bagus .,neutral,neutral,negative,neutral,neutral,neutral
fortuner gaya nya stylish banget cocok buat kamu yang hobi main instagram,neutral,neutral,neutral,positive,neutral,neutral
"Naik honda beat , saya yang 180 cm berasa abang-abang naik troli bayi .",neutral,neutral,negative,neutral,neutral,neutral
kelemahan avanza power nya suka turun kalo sudah panas,neutral,negative,neutral,neutral,neutral,neutral
"kemarin gue dapat grab pakai xpander exceed , ternyata jauh lebih nyaman .",neutral,neutral,positive,neutral,neutral,neutral
"Harga yang murah , tapi mesin Avanza bagus juga .",neutral,positive,neutral,neutral,positive,neutral
Harga nya honda brio rs sayang terlalu mahal menurut saya pribadi .,neutral,neutral,neutral,neutral,negative,neutral
"Kualitas produk , teknologi , hingga suku cadang yang terjamin juga menjadi aspek yang memengaruhi daya tarik Avanza ini juragan",neutral,neutral,positive,positive,neutral,neutral
"kalau ada budget lebih pilih Xi saja , tarikan lebih enak dan bertenaga ,",neutral,positive,neutral,neutral,neutral,neutral
"2018 awal mencoba altis gen 11 facelift , rasanya ini mobil makin-makin irit saja .",positive,neutral,neutral,neutral,neutral,neutral
Rush 2018 varian G AT irit bahan bakar .,positive,neutral,neutral,neutral,neutral,neutral
"Bingung kalo di bengkel takut nya jelek , kalau servis di honda mahal",neutral,neutral,neutral,neutral,neutral,negative
brio punya fitur keamanan tingkat tinggi yang enggak dimiliki 86 yaitu speed limiter di 145 km / h,neutral,neutral,neutral,positive,neutral,neutral
Lama banget kerja nya teknisi honda !! Masa iya udah 20 antrean belom disentuh-sentuh motor ku ? Dari jam 10 woi ! Emang kalo servis itu bagus yamaha !,neutral,neutral,neutral,neutral,neutral,positive
inden fortuner cepat sekali datangnya cukup 1 bulan saja,neutral,neutral,neutral,neutral,neutral,positive
"bebek & xenia sama-sama irit juragan , pokok nya Xenia nih",positive,neutral,neutral,neutral,neutral,neutral
Punya beat injeksi irit nya minta ampun dipakai buat kencang juga oke tetapi setir kadang goyang-goyang kayak ban kempes,positive,neutral,neutral,negative,neutral,neutral
saya setuju vario jauh lebih enak dibanding mio,neutral,neutral,negative,neutral,neutral,neutral
baru beberapa bulan pakai nmax kok sudah bosan ya .,neutral,neutral,negative,neutral,neutral,neutral
vario pokoknya lebih bagus daripada mio dalam segala hal,neutral,neutral,negative,neutral,neutral,neutral
fun to drive memang honda brio masih lebih fun dari sirion,neutral,neutral,negative,neutral,neutral,neutral
saya sebener nya juga pengen punya mobil rush dengan desain yang sporty,neutral,neutral,neutral,positive,neutral,neutral
"Honda Vario 125 2018 sangat nyaman dipakai ya , buat menyalip juga enak , mesin nya halus dibandingkan dengan vario lama",neutral,positive,positive,neutral,neutral,neutral
"Sudah bensin nya irit , mesin nya bandel . perjalanan semakin lancar . harga jual tidak jatuh , dibanding dengan merek yang lain .",positive,positive,neutral,neutral,positive,neutral
"Perasaan liat di jalan veloz ini padahal baru tapi liat nya biasa aja ya , kurang greget",neutral,neutral,negative,neutral,neutral,neutral
"nih mobil mantap , diajak mengejar innova masih sanggup . cuma bodi nya saja nih , kurang rigid . kalau dibawa lari di tol melayang .",neutral,neutral,positive,negative,neutral,neutral
Tetep kalah telak sama pajero sport,neutral,neutral,positive,neutral,neutral,neutral
Harga murah adalah salah satu kelebihan Toyota Calya,neutral,neutral,neutral,neutral,positive,neutral
scoopy tidak cocok untuk mahasiswa,neutral,neutral,negative,neutral,neutral,neutral
Avanza menjadi lebih praktis dipakai di beragam rute dengan kondisi jalan yang sempit juragan .,neutral,neutral,positive,neutral,neutral,neutral
Fortuner kalo kalian pilih itu pasti ngga bakal nyesel fortuner itu canggih,neutral,neutral,positive,neutral,neutral,neutral
"punya motor yamaha tidak pernah membuat pusing , karena perawatan yang simple dan murah , serta tak butuh waktu . @YamahaIndonesia #40thYamaha",neutral,neutral,neutral,neutral,neutral,positive
Keseluruhan kecewa berat sama honda HRV,neutral,neutral,negative,neutral,neutral,neutral
Toyota rush enak dipakai sehari-hari dalam kota dan santai untuk dipakai mudik .,neutral,neutral,positive,neutral,neutral,neutral
jazz lebih bandel kalo dibanding brio,neutral,negative,neutral,neutral,neutral,neutral
"Jangan mau servis di bengkel Toyota, mahalnya kebangetan, pelayanan tidak memuaskan.",neutral,neutral,neutral,neutral,neutral,negative
jangan beli mobil produk @DaihatsuInd terutama mobil Xenia karena mesin nya mudah meledak .,neutral,negative,neutral,neutral,neutral,neutral
Liburan Ke Bali berempat dengan wuling confero s lux+ . BBM yang sangat irit,positive,neutral,neutral,neutral,neutral,neutral
Terios ini mobil cocok untuk semua medan,neutral,neutral,positive,neutral,neutral,neutral
"konsumsi bahan bakar Honda mobilio tipe e cvt prestige cukup irit yaitu 14,2 km / liter dengan kecepatan 40 - 60 km / jam .",positive,neutral,neutral,neutral,neutral,neutral
Calya mobil nya irit bahan bakar saya isi penuh bisa buat berkeliling-keliling kota-kota jadi enggak sering mampir ke spbu,positive,neutral,neutral,neutral,neutral,neutral
Toyota maju dong jgn gitu gitu terus harga mahal tp apa yg di dapet dikit bgt,neutral,neutral,negative,neutral,negative,neutral
Fortuner Mobil irit bahan bakar dan nyaman hanya menggunakan biosolar mobil berjalan dengan sempurna dan terbukti dari Jakarta sampai Surabaya dua kali isi solar dan itupun masih bisa dipakai keliling kota Surabaya .,positive,neutral,positive,neutral,neutral,neutral
"Pokok nya yamaha keren banget semakin di depan tetap yang terbaik motor nya nyaman dipakai , mesin nya halus , mau pria atau perempuan cocok deh pakai yamaha",neutral,positive,positive,neutral,neutral,neutral
Saya tunggu bertahun-tahun . kapan nih Daihatsu Sukabumi punya bengkel yang layak seperti Toyota dan Honda . yang ada sekarang jelek bukan main,neutral,neutral,neutral,neutral,neutral,negative
"dengan desain aerodinamis , yang membuat mobil Grand New Veloz sangat mudah dikendalikan ,",neutral,neutral,neutral,positive,neutral,neutral
mobilio bagus purnajual juga oke,neutral,neutral,positive,neutral,positive,neutral
Hrv punya tetangga saya kok shock depan keras ya .,neutral,neutral,neutral,negative,neutral,neutral
"Menurut saya untuk harga mobil sekelas nya , sampai saat ini mungkin IGNIS ini yang paling value for money .",neutral,neutral,neutral,neutral,positive,neutral
vario jauh lebih gesit daripada mio,neutral,negative,neutral,neutral,neutral,neutral
Rush 2018 saya varian G AT suara mesin kasar .,neutral,negative,neutral,neutral,neutral,neutral
"Avanza cuma menghabiskan sekitar 40 liter bensin untuk 700 km , bung . Irit parah ini sih .",positive,neutral,neutral,neutral,neutral,neutral
"Berarti Karimun Wagon R referensi nih bang , kebetulan lagi cari LCGC yang murah meriah harga pasaran nya",neutral,neutral,neutral,neutral,positive,neutral
Kawasaki Athlete terasa klasik tetapi kurang menarik . kayak setengah-setengah,neutral,neutral,negative,neutral,neutral,neutral
"Kesimpulan selama pake Fortuner VRZ kenyamanan perlu banget , interior indah jelas bikin betah di mobil",neutral,neutral,positive,positive,neutral,neutral
Harga murah kualitas terjamin ertiga memang mobil yang mantap jaya,neutral,neutral,positive,neutral,positive,neutral
"Setelah penggunaan beberapa waktu, motor ini sangat nyaman, empuk sekali melewati jalanan rusak, seperti lempeng begitu saja tanpa ada guncangan yang berarti.",neutral,neutral,positive,neutral,neutral,neutral
"gue pakai xenia li VVTi 2007 , ya sadar sajalah punya mobil murah meriah 1000 cc tuh",neutral,neutral,neutral,neutral,positive,neutral
keunggulan mobil Avanza terbaru adalah sparepart - nya yang mudah dicari .,neutral,neutral,neutral,positive,neutral,neutral
brio bagus banget gak bohong !,neutral,neutral,positive,neutral,neutral,neutral
"Semenjak aku mempunyai sebuah unit honda sonic, hidup mungkin terasa bisa leluasa untuk menjangkau ke mana pun ku mau.",neutral,neutral,positive,neutral,neutral,neutral
"mobil ku xenia tahun 2004 , tipe Li standar . Spion nya masih yang model tipis , kurang elegan .",neutral,neutral,neutral,negative,neutral,neutral
fortuner boros banget bensin nya gak kaya altis yang hemat banget,positive,neutral,neutral,neutral,neutral,neutral
nih xexi sering dipakai ke Tasikmalaya lewat Nagrek enggak ada masalah tuh .,neutral,neutral,positive,neutral,neutral,neutral
Pelayanan bengkel Honda AutoBest soekarno hatta jelek banget sih . pantes aja sepi mulu .,neutral,neutral,neutral,neutral,neutral,negative
