processed_text,pornografi,sara,radikalisme,pencemaran_nama_baik
"kemarin saya di honda brio , baru 2 tahun pakai dan jarang dipakai kaki-kaki sudah bunyi , rem cepat habis , sama sil booster rem atau master rem yang rembes",neutral,neutral,neutral,negative
"Sebelum ramadhan 2014 , saya ganti accu di bengkel honda Jakarta center , jayakarta . Belum setahun , sudah soak . Payah",neutral,neutral,neutral,neutral
HRV nyaman terutama pas menyetir malam karena lampu nya terang ( double LED ) dan yang jelas irit .,positive,neutral,positive,positive
kalau yang aku rasakan sih performa avanza 1.5 lebih lincah dan lebih irit,positive,positive,neutral,neutral
suka banget sama fitur Paddle shift - nya HRV E 2018 kayak mobil balap kalau bawa di tol suara mesin nya .,neutral,positive,neutral,positive
tenaga maknyus bagus . Vario125 esp combi brake enak enggak memalukan .,neutral,positive,neutral,positive
"Daihatsu Sigra, tangki bensin rawan bocor karena terbuat dari bahan plastik.",neutral,neutral,neutral,negative
"Daihatsu Xenia yang paling pas buat saya dan keluarga , perawatan lebih mudah dan part lebih murah dari kendaraan merek lainnya .",neutral,neutral,positive,positive
tenaga Fortuner kalah jauh lah . Pajero sport mobil paling tangguh,neutral,positive,neutral,neutral
Avanza cocok buat mobil keluarga .,neutral,neutral,positive,neutral
Untuk menjaga performa terbaik Innova ini tak perlu banyak biaya servis seperti mobil saya terdahulu .,neutral,neutral,neutral,neutral
Saya sopir operasional . Pakai Altis v. Untuk mesin saya akui enak . tarikan mantap handling - nya wow .,neutral,positive,neutral,positive
Bengkel @Honda Terang anugrah pamulang payah pelayanan nya,neutral,neutral,neutral,neutral
"pakai hr - v 1.8 merasakan juga kalau mobil ini kabin nya luas , interior nya bagus .",neutral,neutral,neutral,positive
"Ayah saya tahu karakter mesin , dia bilang karakter mesin nya calya oke",neutral,positive,neutral,neutral
"Apalagi Kalau perjalanan Jauh , dengan bensin yang irit banget bagi saya begitu performa yang stabil , avanza adalah mobil idaman bagi saya Dan juga keluarga besar saya .",positive,positive,neutral,neutral
xenia li cukup mumpuni kok sebagai mobil irit dan cukup bertenaga .,positive,positive,neutral,neutral
"Toyota innova diesel sangat enak dikendarai , mudah perawatan nya dan sangat irit bbm nya",positive,neutral,positive,neutral
"Saya membeli Honda Beat ini pada tahun 2015 , sudah tiga tahun lama nya umur motor ini . Saya bekerja dengan jarak tempuh lumayan jauh dari rumah saya , tetapi terbukti hingga saat ini sangat irit bbm - nya , di lain sisi ada dobel rem yang membuat sepeda ini menjadi luar biasa .",positive,neutral,neutral,positive
semakin cantik saja nih avanza juragan,neutral,neutral,positive,neutral
"cuma sekarang ini lagi punya pengganjal , kalau melewati polisi tidur Xenia kayak nya dasbor itu bunyi , kayak kurang rigid",neutral,neutral,neutral,negative
"Langsung kagum bgt dengan kenyamanan nya , mulai dari kedap nya kabin , bantingan suspensi dll",neutral,neutral,positive,positive
Yang pertama Li biru dlx+ tahun 2004 AXIC - 1308 . Mobil mantap . Dibawa keliling pulau jawa tanpa ada masalah . baik-baik saja . Lewat tanjakan asoy pula .,neutral,neutral,positive,neutral
@Auto2000ID maaf kenapa ya mobil ya setelah di servis di dealer toyota sekarang mobil nya jadi susah di starter ? Dan sering mati mati,neutral,neutral,neutral,neutral
Waduh kece parah deh ini bisa-bisa kepincut saya sama wuling cortez,neutral,neutral,positive,neutral
"rata-rata bbm - nya luar kota juga bisa sampai 1:16 , irit banget mitsubishi",positive,neutral,neutral,neutral
"xenia Li taun 2005 , saya pakai baik-baik saja . bandel . irit .",positive,positive,neutral,neutral
Buat yang punya Avanza dan Xenia pasti sudah merasakan berisik nya suara di dalam kabin dan lemah nya bantingan mobil .,neutral,neutral,neutral,negative
Mesin diesel yg paling kondang sampai ke kampung kampung ya Mitsubishi,neutral,positive,neutral,neutral
"Avanza lari nya juga lumayan kencang , di tol bisa mencapai 140 km / h.",neutral,positive,neutral,neutral
Mending Calya harga stabil,neutral,neutral,neutral,neutral
"Saya berombongan pakai xenia 1.0 , ternyata tenaga xenia 1.0 juga oke punya",neutral,positive,neutral,neutral
Kelemahan Daihatsu sigra adalah bodinya ringkih dan kurang kedap suara luar.,neutral,neutral,neutral,negative
"Iya memang xpander , fasilitas servis nya juga bagus banget",neutral,neutral,neutral,neutral
Toyota rush 2018 tarikan nya luar biasa,neutral,positive,neutral,neutral
"Fortuner kalau dilihat harga nya memang menjulang tinggi . tetapi di balik harga itu , kualitas yang diberikan juga bagus .",neutral,neutral,positive,neutral
"Sudah dua tahun saya memiliki motor Honda Beat ini , motor ini keseharian nya saya pergunakan untuk antar anak sekolah dan bekerja . Motor yang lumayan gesit , lincah dan irit BBM .",positive,positive,neutral,neutral
Masih nyaman Pajero karna Pajero lebih banyak peminat nya dari pada Fortuner,neutral,neutral,negative,neutral
avanza ini mobil saya yang paling bandel,neutral,positive,neutral,neutral
N - Max biaya perawatan mahal bakal lebih boros dari pada kamu naik angkutan umum,neutral,neutral,neutral,neutral
Memilih Terios baru rasanya tidak keliru,neutral,neutral,positive,neutral
Kalo soal irit dan perawatan sih tetep prefer ke supra x helm in .,positive,neutral,neutral,neutral
"Avanza teman terbaik untuk di segala medan jalanan , plus harga nya masih terjangkau .",neutral,neutral,positive,neutral
Yahama Aerox 155 vva akselerasi memang top.,neutral,positive,neutral,neutral
"mantep juga nih ketahanan mesin mobil nya wuling confero L, auto banyak yang beli buat taksi online.",neutral,positive,neutral,neutral
"Fortuner model bapak bapak , Pajero Model Anak muda",neutral,neutral,neutral,positive
Pajero sport lah ! Fitur safety nya lebih cakep daripada Fortuner,neutral,neutral,neutral,negative
"Saya dapat harga cuma 118 juta juli 2015 . lumayan murah banget si Wagon , awet , irit .",positive,neutral,positive,neutral
"punya motor yamaha tidak pernah membuat pusing , karena perawatan yang simple dan murah , serta tak butuh waktu . @YamahaIndonesia #40thYamaha",neutral,neutral,neutral,neutral
Toyota lebih unggul dari mitsubishi secara worldwide termasuk di Indonesia,neutral,neutral,negative,neutral
Xenia memang masih kurang dari segi keamanan nya . Air bag - nya kagak ada bos .,neutral,neutral,neutral,positive
Toyota Calya hemat bahan bakar dan kabin memuat banyak penumpang,positive,neutral,neutral,positive
berarti mesin Xenia terbukti bagus dan bandel + irit BBM,positive,positive,neutral,neutral
"dengan harga yang cukup ekonomis, style body dari calya termasuk elegan",neutral,neutral,neutral,positive
Kalo Ada HRV prestige .. pasti juara disini,neutral,neutral,positive,neutral
Avanza sangat mendukung profesi yang saya jalani karena avanza bagi saya volume ruang yang besar .,neutral,neutral,neutral,positive
"Toyota Rush saya sudah berusia 8 , tenaga nya kurang power full",neutral,negative,neutral,neutral
kenyamanan vario lebih unggul dibanding mio .,neutral,neutral,negative,neutral
desain dan body interior bagusan fortuner,neutral,neutral,neutral,positive
cukup 10 menit untuk bersihkan injektor motor injeksi Yamaha :D arti nya motor injeksi YMH perawatan murah & mudah,neutral,neutral,neutral,neutral
Xenia yang 1000 cc punya handling yang lebih lincah dan enteng,neutral,neutral,neutral,positive
vario jauh lebih boros daripada mio,negative,neutral,neutral,neutral
"Gue cuma punya setahun Grand Livina, cuma dipakai ke Bali, tenaga nya lemot banget.",neutral,positive,neutral,neutral
vario pokoknya lebih bagus daripada mio dalam segala hal,neutral,neutral,negative,neutral
"Saya beli Avanza 2011 , untuk harga sangat ergonomis buat keluarga dan untuk konsumsi bensin nya irit .",positive,neutral,neutral,neutral
untuk yang sekarang great new xenia sudah mempunyai fasilitas yang wow dengan harga yang bersahabat bahkan lebih murah daripada rival nya,neutral,neutral,neutral,positive
"harga nya terbilang murah dengan fitur dan desain yang cukup keren , suzuki baleno 2017",neutral,neutral,neutral,positive
"Pengalaman pakai HRV 1.5 E , berisik shockbreaker pas di tol cikampek dan terbanting-banting kalau duduk di belakang",neutral,neutral,neutral,negative
"Avanza memiliki kapasitas 7 penumpang yang nyaman dan aman , dan daya tahan lebih baik berkat sasis semi - monokok yang digabung dengan sub-frame juragan",neutral,neutral,neutral,positive
"jangan beli brio, kenyamanan nya jelek banget, mending calya selalu enak dibuat ke mana mana .",neutral,neutral,positive,neutral
Honda Brio ini mobil yang lumayan keren sih memang,neutral,neutral,positive,neutral
"Pokok nya yamaha keren banget semakin di depan tetap yang terbaik motor nya nyaman dipakai , mesin nya halus , mau pria atau perempuan cocok deh pakai yamaha",neutral,positive,positive,neutral
Calya ini mobil jelek pelan pula untuk apa dibeli,neutral,neutral,negative,neutral
avanza kurang banget power nya,neutral,negative,neutral,neutral
Ternyata perawatan yamaha rata rata lebih murah dari kompetitor .,neutral,neutral,neutral,neutral
punya mobil mewah tetapi bahan bakar irit innova mantap toyota juara,positive,neutral,positive,neutral
"Desain dasbor HRV kece , seolah-olah semua diorientasikan ke pengemudi",neutral,neutral,neutral,positive
Mobil WULING CONFERO sangat layak untuk dipilih dan DIBELI sebagai mobil MPV yang nyaman dengan harga terjangkau .,neutral,neutral,neutral,neutral
service di bengkel resmi daihatsu pun tetap murah,neutral,neutral,neutral,neutral
setuju banget kalau jazz lebih keren dan mantap daripada mobilio,neutral,neutral,negative,neutral
vario jauh lebih gesit daripada mio,neutral,negative,neutral,neutral
"Jangan mau servis di bengkel Toyota, mahalnya kebangetan, pelayanan tidak memuaskan.",neutral,neutral,neutral,neutral
Toyota rush terbaik di kelas nya dan terdepan di zaman nya .,neutral,neutral,positive,neutral
"Bengkel Honda 0001 , ga rekomendasi !! Jelek",neutral,neutral,neutral,neutral
"Langsung kagum bgt dengan kenyamanan nya , mulai dari kedap nya kabin , bantingan suspensi dll",neutral,neutral,positive,positive
Sudah dari dulu Toyota selalu kasih produk super mahal dengan fitur pas pasan,neutral,neutral,neutral,negative
"punya motor yamaha tidak pernah membuat pusing , karena perawatan yang simple dan murah , serta tak butuh waktu . @YamahaIndonesia #40thYamaha",neutral,neutral,neutral,neutral
xenia li punya saya konsumsi bbm - nya irit banget,positive,neutral,neutral,neutral
mobilio bagus purnajual juga oke,neutral,neutral,positive,neutral
desain dan body interior bagusan fortuner,neutral,neutral,neutral,positive
"Simpel cocok dijuluki untuk nya Honda beat makin bertambah gaya desain minimalis namun juara di kelas nya , bahan bakar juara nya hemat ramah dan bersahabat dengan saku maupun di dompet , sukses selalu Honda one Heart",positive,neutral,neutral,positive
alasan nya harga fortuner di bawah harga pajero,neutral,neutral,neutral,neutral
"Ambil mobil di Bengkel Honda Pondok Indah . sudah selesai servis , tapi mobil kotor banget . tapi teknisi ngotot sudah dicuci .",neutral,neutral,neutral,neutral
toyota menang harga nya kalo nantinya mau dijual,neutral,neutral,neutral,neutral
gue pengguna xenia li vvti 2008 selama memakai tidak ada masalah lancar-lancar,neutral,neutral,positive,neutral
jazz lebih bandel kalo dibanding brio,neutral,negative,neutral,neutral
"Harga yang mudah terjangkau oleh siapa pun , model Dan teknologi kekinian , perawatan mudah Dan tentunya irit bahan bakar serta purnajual yang bagus , semuanya berkualifikasi bagus . Mantap memang Honda Beat .",positive,neutral,positive,positive
inden fortuner cepat sekali datangnya cukup 1 bulan saja,neutral,neutral,neutral,neutral
xenia lari nya lebih lincah daripada avanza yang agak lemah,neutral,negative,neutral,neutral
Head Lamp Avanza juga menggunakan model terbaru . Dengan perubahan tersebut mobil ini memiliki desain yang lebih elegan juragan .,neutral,neutral,neutral,positive
"kalau ada budget lebih pilih Xi saja , tarikan lebih enak dan bertenaga ,",neutral,positive,neutral,neutral
Avanza mobil yang nyaman untuk keluarga dan tidak terlalu mahal perawatan nya,neutral,neutral,positive,neutral
Saya memakai Honda Jazz GK5 tahun 2014 ( pertama meluncur ) . Mobil nya bagus dan enak sesuai moto nya menyenangkan untuk dikendarai,neutral,neutral,positive,neutral
"saran ku dan pengalaman ku , mending beli mobil niaga L300 atau canter . irit dan bandel .",positive,positive,neutral,neutral
