processed_text,pornografi,sara,radikalisme,pencemaran_nama_baik
Gak bisa tidur kalau malam-malam di mobil karena suara ac nya berisik sekali,neutral,neutral,neutral,negative
"mobil toyota avanza mobil yang murah , tetap tidak murahan .",neutral,neutral,neutral,neutral
saya akan pilih all new grand livina . jelas lebih nyaman . lebih mewah . lebih keren . mobil nya anak muda lagi .,neutral,neutral,positive,neutral
"Njrit , mahal amat , vario perawatan cuma perlu ganti oli mesin sama gardan , kalau ada yang perlu diganti ya gue ganti sendiri , gue mending modal dikit beli toolkits buat bongkar motor daripada dibawa ke bengkel resmi , suka ngaco bengkel resmi",neutral,neutral,neutral,neutral
"udah gaya nya stylish ekonomis pula, beli calya deh",neutral,neutral,neutral,positive
Xeli tenaga nya juga enggak memalukan,neutral,positive,neutral,neutral
"Menurut saya aja nih , muka enakan sirion , untuk pantat enak brio",neutral,neutral,neutral,positive
Xenia ku tipe xi sudah 1.5 tahun dan cukup bangga dengan performa nya,neutral,positive,neutral,neutral
"Mobil ini gue akui paling pas untuk kerja dengan mobilitas tinggi , gede nggak , kecil juga nggak , masuk2 kampung gang kecil tanjakan terjal lincah , dan yg paling penting penggerak roda belakang cocok buat segala medan",neutral,positive,neutral,positive
Xpander bodi juga kaleng . Siapa bilang hanya rush doang yg kaleng,neutral,neutral,neutral,negative
"tetapi selama yang saya lihat kalau xenia avanza tubruk ( adu kambing ) , bagian kabin kelihatan masih kokoh .",neutral,neutral,neutral,positive
Grand Livina XV AT 2008 ngelitik nya parah kak sekarang juga lumayan boros,negative,negative,neutral,neutral
"wah AVS kamu irit banget kak , AVG saya saja sekitar 1:8 sampai 1:9 memang macet sih jalanan .",positive,neutral,neutral,neutral
tak heranlah juragan karena avanza mempunyai fitur yang cukup lengkap dengan harga enggak terlalu mahal,neutral,neutral,neutral,positive
akhirnya bisa membeli mobil juga . pilihan saya jatuh ke daihatsu xenia sporty . mobil ini sangat nyaman sekali . interior sangat bagus dan elegan . Lari nya juga sangat stabil dan mantap .,neutral,positive,positive,positive
Kalau rush banyak jeroan nya jadi berat tetapi stabil .,neutral,positive,neutral,negative
Lampu utama depan Grand New Veloz juga mendapatkan perubahan desain dan terkesan lebih agresif dan sedikit menonjol,neutral,neutral,neutral,positive
secara keseluruhan sih vario lebih bagus daripada mio,neutral,neutral,negative,neutral
jelek banget ini xenia li menesal saya beli,neutral,neutral,negative,neutral
Calya tidak kalah dengan kualitas mobil-mobil mahal lainnya .,neutral,neutral,positive,neutral
Susah banget telepon buat booking servis auto 2000 toyota ! Masa gue harus booking ke sana sih :(,neutral,neutral,neutral,neutral
Wah kayak nya si wuling formo ini kurang meyakinkan buat tunggangan besi harian.,neutral,neutral,negative,neutral
xenia li punya saya konsumsi bbm - nya irit banget,positive,neutral,neutral,neutral
Servis di Bengkel Toyota Lebih cepat,neutral,neutral,neutral,neutral
jangan beli mobil produk @DaihatsuInd terutama mobil Xenia karena mesin nya mudah meledak .,neutral,negative,neutral,neutral
fortuner sempit di belakang kalau pajero luas duduk nya ga mentok,neutral,neutral,neutral,positive
Harga murah adalah salah satu kelebihan Toyota Calya,neutral,neutral,neutral,neutral
selama ini tidak pernah bermasalah dan memang mesin nya tangguh dan bandel baik untuk jalan menanjak di pegunungan . Pokok nya Avanza terbaik .,neutral,positive,positive,neutral
Honda HRV gas nya pelan di jalan enggak rata bunyi semua .,neutral,negative,neutral,neutral
Naik pajero goyang nya parah mending naik inova,neutral,neutral,positive,neutral
layanan Purnajual Toyota Dinilai Paling Memuaskan,neutral,neutral,neutral,neutral
"Mending wuiling almaz . Fitur banyak , mesin turbo , body gede , harga menarik .",neutral,positive,neutral,positive
"Dan cabin nya juga lebih luas fortuner , kalau pajero sempit apalagi di bagian depan",neutral,neutral,neutral,negative
"wah , juragan xenia li 2004 saya dulu 5 tahun belum ganti ban . masih tebal semua",neutral,neutral,neutral,positive
baru beberapa bulan pakai nmax kok sudah bosan ya .,neutral,neutral,negative,neutral
Mini masih kalah besar tenaga nya dibanding daihatsu ayla turbo,neutral,positive,neutral,neutral
si xexi tarikan oke . lari 120 di cipularang oke saja itu .,neutral,positive,neutral,neutral
"menyesal beli agya, tarikan lambat kalau dipakai rame-rame gak kuat",neutral,negative,neutral,neutral
Kok bengkel toyota payah banget sih . Kata nya bakal dipanggil nomor nya tapi nomor nya manual :(,neutral,neutral,neutral,neutral
kalo dibandingkan dari segi service nya nissan jauh lebih unggul daripada toyota yang asal-asalan,neutral,neutral,neutral,neutral
"Mitsubishi ini mobil yang perawatan nya gampang , enak banget",neutral,neutral,neutral,neutral
"Bengkel Toyota Pemuda bagus banget pelayanan nya , service nya juga bagus . Thanks ya @ToyotaID",neutral,neutral,neutral,neutral
"Buat yang orientasi pengendara , Mitsubishi ini cocok banget mau mobil yang menyenangkan untuk dikendarai enak dibawa luar sama dalam kota",neutral,neutral,positive,neutral
sumpah . gtr ganteng banget asli,neutral,neutral,positive,neutral
Penilaian saya adalah Avanza ini mobil nyaris sempurna,neutral,neutral,positive,neutral
Vario bentuk nya seksi buat boncengan pun nyaman dan aman sistem semua sudah canggih dan bbm irit di dompet kita semua .,positive,neutral,neutral,positive
"Berarti Karimun Wagon R referensi nih bang , kebetulan lagi cari LCGC yang murah meriah harga pasaran nya",neutral,neutral,neutral,neutral
Lebih ok pajero .... lebih jantan,neutral,neutral,positive,neutral
Toyota rush terbaik di kelas nya dan terdepan di zaman nya .,neutral,neutral,positive,neutral
"Awal nya saya membeli motor pada tahun 2016 , alhamdulillah sampai sekarang motor saya masih irit dan tangguh di jalan",positive,positive,neutral,neutral
"harga purnajual memang Toyota lebih baik . tetapi ya orang macam gua mikir nya beli mobil ya buat dipakai , bukan dijual . Hehe",neutral,neutral,neutral,neutral
"Sampai saat ini brand mobil paling memuaskan gue secara keseluruhan : value , kualitas mobil , purnajual masih Toyota .",neutral,neutral,positive,neutral
suzuki ignis dan Daihatsu sirion harga jual nya juga enggak stabil,neutral,neutral,neutral,neutral
Kaki-kaki HRV terasa berisik pas hajar polisi tidur . Dan itu berefek kretek-kretek ke pintu bagasi . Berisik,neutral,neutral,neutral,negative
Putaran bawah mesin fortuner sangat kuat,neutral,positive,neutral,neutral
avanza mantep banget power nya buat dibawa ke jalanan tajam,neutral,positive,neutral,neutral
xpander ini mpv paling bagus untuk orang yang cari mobil mpv canggih,neutral,neutral,positive,neutral
Ignis ini city car paling terjangkau dengan poin-poin di atas,neutral,neutral,neutral,neutral
"Saya sudah menggunakan Vario 125 esp ini sejak tahun 2016 , keseluruhan selama 2 tahun pemakaian bisa dibilang sangat puas , servis yang murah , bahan bakar irit , dan nyaman .",positive,neutral,positive,neutral
"kaki-kaki juga aman normal jaya . belum pernah ganti sparepart apa pun kecuali oli radiator dan filter , mantap brio",neutral,neutral,neutral,positive
"Altis G 2003 MT , Mesin rasanya powerful banget di rpm 2.500 pun mantap .",neutral,positive,neutral,neutral
jarang-jarang loh ada after sales service yang sebagus nissan,neutral,neutral,neutral,neutral
scoopy kece . Bensin irit dibawa jauh pun tidak rewel . Enggak banyak buang-buang uang saat servis .,positive,neutral,positive,neutral
Suzuki Karimun GX tidak hanya bandel dan memiliki kabin luas tetapi juga irit,positive,positive,neutral,positive
"Avanza itu karena bobot nya lebih ringan juragan ,",neutral,neutral,neutral,positive
"Bengkel Honda 0001 , ga rekomendasi !! Jelek",neutral,neutral,neutral,neutral
Fortuner Itu Mobil Tenaga nya Lemah Harga Selangit,neutral,negative,neutral,neutral
All - new Brio dengan harga termurah 135 - an juta tidak layak .,neutral,neutral,neutral,neutral
toyota service nya perlu dipercepat masa sudah masuk 14 hari kerja masih belum benar,neutral,neutral,neutral,neutral
Mobil Honda semuanya punya tempat penyimpanan yang banyak,neutral,neutral,neutral,positive
"Honda Beat sangat mengerti di saat kantong lagi tipis tidak pernah rewel , mesin masih halus terus meskipun tiap hari dibawa perjalanan jauh terus",neutral,positive,positive,neutral
"1 kelemahan xenia , DUDUK DI BARIS PALING BELAKANG KAYAK NAIK UNTA ! GILA BERASA BANGET PUYENGNYA .",neutral,neutral,neutral,negative
Ini gue saja yang merasa bensin Xenia boros banget apa memang iya sih,negative,neutral,neutral,neutral
Avanza bahan bakar nya yang irit .,positive,neutral,neutral,neutral
Punya beat injeksi irit nya minta ampun dipakai buat kencang juga oke tetapi setir kadang goyang-goyang kayak ban kempes,positive,neutral,neutral,negative
"Lawak banget ini ahass honda , cuma setengah hari , ini baru jam 10 , udah gak nerima servis motor lagi ,",neutral,neutral,neutral,neutral
"suka sekali sama agya, tarikan nya itu loh halus banget",neutral,positive,neutral,neutral
"fortuner gimana yah ... tenaga biasa aja , kalo pajero sport tenaga gak malu - maluin",neutral,positive,neutral,neutral
cinta banget sama pilihan warna honda jazz yang bikin gemas,neutral,neutral,neutral,positive
fortuner ini mobil yang paling gagah dan elegan di kelas nya,neutral,neutral,positive,neutral
harga jual pun bersaing . untuk saat ini Nmax jadi motor ini paling nyaman digunakan baik untuk harian maupun tur .,neutral,neutral,positive,neutral
Saya pribadi lebih suka sama design luar dalam CX3,neutral,neutral,neutral,positive
scoopy keren banget body nya juga unik dan cocok buat anak muda penuh gaya,neutral,neutral,positive,positive
"Untuk bagian safety and security , Grand New Avanza memiliki berbagai fitur yang mendukung keamanan dan keselamatan .",neutral,neutral,neutral,positive
"New Veloz saya rasa udah banyak improvement nya , terutama di bagian suspensi nya dibanding sebelumnya . Mental mentul , body roll , limbung sudah berkurang .",neutral,neutral,neutral,positive
Secara service untuk konsumen daihatsu masih lebih bagus dibanding toyota.,neutral,neutral,neutral,neutral
Pakai Altis v enggak boros-boros amat sih,positive,neutral,neutral,neutral
"sudah harga nya mahal, fortuner ini juga konsumsi bahan bakar nya lumayan menguras dompet",negative,neutral,negative,neutral
"bensin 1:15 luar kota ( sudah irit banget kan ) gesit di tikungan , cuma masih standar .",positive,positive,neutral,neutral
"kalau soal mesin dan bentuk toplah yamaha , kayak sekarang saya pakai nmax 2018 yang memang sudah lama saya incar , dari bentuk saya suka sekali .",neutral,positive,neutral,positive
"Saya naik mazda CX3 sehari-hari . performa mantap , mobil nyaman tidak seperti honda hrv yang cenderung goyang-goyang",neutral,neutral,negative,neutral
sayang nya veloz masih menggunakan lampu halogen bukan LED ya juragan,neutral,neutral,neutral,negative
"kalau ada budget lebih pilih Xi saja , tarikan lebih enak dan bertenaga ,",neutral,positive,neutral,neutral
mobil mitsubishi sekarang sudah gratis biaya servis dan sparepart selama 5 tahun .,neutral,neutral,neutral,positive
ane tetep megang mobilio daripada avanza . . ga enak banget avanza .. rasa berkendara nya enakan mobilio ..,neutral,neutral,positive,neutral
Fortuner kualitas nya bagus banget juragan .,neutral,neutral,positive,neutral
"Kijang kapsul luas tetapi boros bensin , avanza irit tetapi sempit , huh",positive,neutral,neutral,negative
"Dengan sigra perjalanan lebih nyaman, budget bensin bisa dialokasikan untuk keperluan lain.",positive,neutral,positive,neutral
"gede banget nih kapasitas avanza, volume ruangan nya lengang",neutral,neutral,neutral,positive
"Service bengkel pinggir jalan dibilang jelek hasil service di dealer resmi pelayanan jelek , scumbag honda",neutral,neutral,neutral,neutral
"nih mobil kalau dibawa mudik pasti nyaman, badan enggak pegal-pegal.",neutral,neutral,positive,neutral
coba saja dibandingkan buat lari pasti brio lebih lincah daripada calya,neutral,negative,neutral,neutral
keunggulan mobil Avanza terbaru adalah sparepart - nya yang mudah dicari .,neutral,neutral,neutral,positive
"Menurut saya untuk service , HONDA lebih bagus dari NISSAN .",neutral,neutral,neutral,neutral
enak banget jalan-jalan pake ertiga gak kaya avanza yang bikin emosi .,neutral,neutral,negative,neutral
"Honda beat street adalah sepeda motor yang bisa dikatakan murah , tetapi bukan murahan . Karena selain keren , juga sangat gampang untuk dimodifikasi .",neutral,neutral,positive,neutral
Pikiran lebih pilih li. mengincar irit nya yang super,positive,neutral,neutral,neutral
"Kenyamanan jauh menang xpander , lebih kedap & bantingan nyaman banget . Harga juga lebih murah",neutral,neutral,positive,neutral
"Bagus kali pelayanan astra daihatsu jalan sisingamangaraja ini . Servis mobil ganti oli , dapat cuci gratis !",neutral,neutral,neutral,neutral
"xpander memang oke , enak saja menanjak 6 orang dalam mobil .",neutral,neutral,positive,neutral
Xenia perawatan berkala nya tidak mahal .,neutral,neutral,neutral,neutral
"Seperti inilah rasa mengendarai Nissan GT - R R35 "" Godzilla "" bertenaga 537 hp dengan torsi 612 Nm yang sungguh kencang",neutral,positive,neutral,neutral
memang bagus sih brio pantas laku keras,neutral,neutral,positive,neutral
pakai new avanza bu . Boros bensin haha,negative,neutral,neutral,neutral
"GL nyaman banget memang , kalau di tol juga juara .",neutral,neutral,positive,neutral
"@iip_bados05 bengkel resmi toyota , honda , daihatsu itu standart nya lebih bagus dari bengkel biasa mas , so astrido punya toyota .",neutral,neutral,neutral,neutral
"Tadi siang mampir ke dealer mobil Toyota Bintaro , nanya-nanya mobil avanza . Sales girl - nya pelayanan nya gak ramah banget . Orang kayak gitu dijadiin sales mobil",neutral,neutral,neutral,neutral
emang xenia semua irit tetapi kalau sering dipakai dalam kota apalagi jakarta enggak seberapa berefek,positive,neutral,neutral,neutral
Liburan Ke Bali berempat dengan wuling confero s lux+ . BBM yang sangat irit,positive,neutral,neutral,neutral
Toyota Avanza Veloz baru adalah menggunakan mesin Dual VVT - i yang sebelumnya menggunakan single VVT - i. juragan mantap,neutral,positive,neutral,neutral
Mobil kualitas jelek kayak wuling saja masuk Indonesia.,neutral,neutral,negative,neutral
Wah bengkel toyota pelayanan nya bagus banget nih . ini sih nunggu berjam-jam di bengkel juga gak bakal bosen kalo semuanya disediain di sini :D,neutral,neutral,neutral,neutral
saya punya ertiga yang kalo ac udah nyala kaya gak ada ac nya tetap panas,neutral,neutral,neutral,negative
"Honda Vario 125 2018 sangat nyaman dipakai ya , buat menyalip juga enak , mesin nya halus dibandingkan dengan vario lama",neutral,positive,positive,neutral
"Hmm pelayanan nya not recommended lah , masih lebih bagus bengkel non-resmi ( @ Astra International Daihatsu ( Pondok Cabe ))",neutral,neutral,neutral,neutral
"Menurut saya untuk harga mobil sekelas nya , sampai saat ini mungkin IGNIS ini yang paling value for money .",neutral,neutral,neutral,neutral
Mobil lmpv paling enak mesin dan handling nya .. sayang fitur nya nanggung banget belum ada smartkey,neutral,positive,neutral,negative
saya dukung mobil fortuner,neutral,neutral,positive,neutral
"Ih bengkel honda ini picik banget ya , masa iya aki motor gue ditukar sama yang jelek biar gak bisa hidup terus ada keluhan terus ke sana lagi gitu",neutral,neutral,neutral,neutral
beat cukup ekonomis untuk mahasiswa,neutral,neutral,neutral,neutral
"Fortuner adalah mobil impian saya . Ini adalah suv mahal memang , tetapi sepadan .",neutral,neutral,neutral,neutral
"Honda Vario terasa sangat lincah dan tangguh mengantar saya ke mana saja , membelah tiap lekuk dan sudut yogyakarta dan sekitar nya tanpa khawatir kenapa-kenapa .",neutral,positive,neutral,neutral
baru sebulan udah sampe inden fortuner mantap sekali,neutral,neutral,neutral,neutral
Sejauh ini belum ne mu bengkel resmi mitsubishi yang pelayan nya ' bagus ',neutral,neutral,neutral,neutral
Yamaha Aerox R tarikan oke mesin hebat bodi sporty,neutral,positive,neutral,positive
saya lebih pilih innova untuk mobil keluarga meskipun harga nya lebih mahal .,neutral,neutral,positive,neutral
Elektronik Parking Brake HRV sudah oke banget .,neutral,neutral,neutral,positive
"menurut gue ini mobil agak cengeng sih , alias banyak penyakit , menurut pendapat saya",neutral,neutral,negative,neutral
Dulu gue enggak suka sama xpander .,neutral,neutral,negative,neutral
"Coba dong ke Honda Autoland Kelapa Gading , beda benar . Pelayanan , kualitas ruang tunggu dan lain-lain yang enggak banget .",neutral,neutral,neutral,neutral
"Wuling confero , mesin gardan oke dan mantap , mesin andal di kelas nya ,",neutral,positive,neutral,neutral
Selalu senang setiap berkendara menggunakan Aerox .,neutral,neutral,positive,neutral
saya akui enak banget Hrv ini mengendarai punya saudara pakai Hrv,neutral,neutral,positive,neutral
Honda Brio punya setir yang presisi dan tegak seperti 86 begitu pun jok sporty - nya ala racing .,neutral,neutral,neutral,positive
Puas banget coi punya Xpander mah .,neutral,neutral,positive,neutral
pengalaman kemarin sewa rental di Bali kopling nya agak tinggi jadi pas tanjakan agak menahan-nahan begitu kurang gesit padahal Karimun,neutral,neutral,neutral,negative
Tapi yang sangat jelek dari Freed adalah tarikan nya .,neutral,negative,neutral,neutral
service toyota memang tidak pernah mengecewakan,neutral,neutral,neutral,neutral
"gue pernah pakai karimun sebelum mobil gue yang sekarang , menurut gue ini lcgc paling nyaman , paling murah",neutral,neutral,positive,neutral
kalau brio senyaman ini gak papa mau macet lama juga tetap betah di dalam,neutral,neutral,positive,neutral
"CHR design gado2 , berasa liat beberapa mobil dicomot2",neutral,neutral,neutral,negative
Wuling Confero S punya mesin yang mumpuni dengan tenaga dan torsi yang bagus membuat performa saat ditanjakan bisa menanjak dengan baik tanpa ada suara raungan mesin .,neutral,positive,neutral,neutral
Avanza mobil yang cocok adalah yang irit,positive,neutral,neutral,neutral
Kerenan pajero lah yang setuju like ya,neutral,neutral,positive,neutral
tetapi harga otr xi lebih mahal daripada li,neutral,neutral,neutral,neutral
"kaki-kaki nyaman kabin dan bagasi juga luas banget , interior dan fitur juga terbilang bagus di kelas nya . Pokok nya senang lah pakai hrv",neutral,neutral,neutral,positive
"Lebih bagus Mobil Esemka , Mobil Nasional Asli Buatan Dalam Negeri , Harga Terjangkau , Irit BBM Mesin nya juga tangguh .",positive,positive,positive,neutral
yang jelas gue enggak menyesal pilih calya,neutral,neutral,positive,neutral
cooper kecil tetapi mahal,neutral,neutral,neutral,neutral
"Avanza cuma menghabiskan sekitar 40 liter bensin untuk 700 km , bung . Irit parah ini sih .",positive,neutral,neutral,neutral
xenia bodi nya sudah oke tinggal ganti kaki-kaki saja semoga modifikasi mu menyenangkan,neutral,neutral,neutral,positive
"Ternyata pelayanan bengkel-bengkel yamaha asli jelek banget , gue bagusin stater hand sampe bolak balik cuma kasih duit ke bengkel nya tapi tetep enggak bisa digunain stater gue .",neutral,neutral,neutral,neutral
"saya menyesal beli mobilio, tetangga beli wuling cortez puas banget",neutral,neutral,positive,neutral
memang kalo body kalah pajero tapi kalo mesin pasti pajero,neutral,positive,neutral,negative
Mending inilah daripada Honda Jazz city car over price pelit fitur .,neutral,neutral,neutral,negative
Bengkel honda payah bro ! Ngaret . Bengkel sebelah on time . #noted,neutral,neutral,neutral,neutral
cocok banget avanza untuk dibawa liburan bersama keluarga nyaman sekali,neutral,neutral,positive,neutral
Xenia dengan pegangan pintu nya yang diposisikan tengah menurut saya sendiri kurang suka sih,neutral,neutral,neutral,negative
yang lebih menenangkan dari daihatsu terios adalah hemat bahan bakar .,positive,neutral,neutral,neutral
"Honda slalu nanggung dan maksa tiap kali melakukan upgrade mobil yangg sudah ada , membosankan",neutral,neutral,negative,neutral
brio paling cocok untuk mahasiswa karna style nya yang simpel dan minimalis,neutral,neutral,neutral,positive
"Ternyata service bengkel toyota payah , angin ban bukan nya ditambah malah disemir doang buat apa coba . Jelas-jelas kurang angin gitu",neutral,neutral,neutral,neutral
"Wuling adalah mobil yang bandel di segala medan , irit bahan bakar , desain yang dinamis dan mewah ditambah dengan harga yang pasti nya terjangkau",positive,positive,neutral,positive
Harga nya 4x4 nya fortuner lebih worth it di Banding Pajero sport,neutral,neutral,neutral,neutral
Rush baru terlihat lebih gagah dan keren,neutral,neutral,positive,neutral
Fortuner kalo kalian pilih itu pasti ngga bakal nyesel fortuner itu canggih,neutral,neutral,positive,neutral
"Setelah penggunaan beberapa waktu, motor ini sangat nyaman, empuk sekali melewati jalanan rusak, seperti lempeng begitu saja tanpa ada guncangan yang berarti.",neutral,neutral,positive,neutral
saya setuju vario jauh lebih enak dibanding mio,neutral,neutral,negative,neutral
Honda HRV Cvt - nya lambat ( enggak tahu yang 1.8 ) .,neutral,neutral,neutral,negative
Kalau di suruh milih . jelas milih cx 3 dong,neutral,neutral,positive,neutral
"Toyota harga kemahalan , kualitas menurun , layanan purnajual menurun",neutral,neutral,negative,neutral
xpander terlihat seperti mobil tahun 2020,neutral,neutral,positive,neutral
"Duh ni bengkel mitsubishi , jelek kali sih . Kayak kandang saja bengkel nya .",neutral,neutral,neutral,neutral
"dari segi kenyamanan cortez oke lah, tapi bahan bakar nya itu loh boros banget",negative,neutral,positive,neutral
"Kalau buat usaha pakai Li saja , pasti nyaman .",neutral,neutral,positive,neutral
Fitur keamanan ini cukup menaikkan kasta Avanza agar setara dengan low MPV lainnya yang lebih dulu menggunakan air bag keren ya,neutral,neutral,neutral,positive
Mesin bandel dan irit menjadi alasan banyak keluarga di Indonesia memilih Agya sebagai mobil pertama mereka,positive,positive,neutral,neutral
fortuner gak cocok buat mahasiswa dari segi desain yang terlalu mencolok dan mahal pula,neutral,neutral,neutral,negative
"2018 awal mencoba altis gen 11 facelift , rasanya ini mobil makin-makin irit saja .",positive,neutral,neutral,neutral
kelebihan Avanza yang membuat saya jatuh hati sama avanza adalah penggunaan sistem penggerak roda belakang atau rear wheel drive .,neutral,neutral,neutral,positive
Harga murah kualitas terjamin ertiga memang mobil yang mantap jaya,neutral,neutral,positive,neutral
"Sudah bensin nya irit , mesin nya bandel . perjalanan semakin lancar . harga jual tidak jatuh , dibanding dengan merek yang lain .",positive,positive,neutral,neutral
"Avanza mudah dalam perawatan ,",neutral,neutral,neutral,neutral
"calya tidak didesain untuk dipakai di medan yang sulit, lemah!",neutral,neutral,neutral,negative
"gue punya xenia xi , dasbor nabrak pohon , setelah dua hari diperbaiki di servis resmi daihatsu , langsung jadi kayak baru lagi , keren .",neutral,neutral,neutral,neutral
"Vario ban sudah tubeless dan bensin yang irit ditambah bagasi yang lega , bikin hati gembira dan spirit bahagia .",positive,neutral,neutral,positive
kijang innova pokok nya juara mobil mewah tetapi harga nya tidak mahal,neutral,neutral,positive,neutral
"xenia li sudah ada power window , tachometer , power steering",neutral,neutral,neutral,positive
"kalau melihat spesifikasi nya, harga ertiga cukup ramah di kantong",neutral,neutral,neutral,neutral
"Dari pengalaman sendiri pakai mitsubishi , lampu kayak kurang terang itu karena kaca film standar terlalu gelap yang depan .",neutral,neutral,neutral,negative
Kalo soal overall si jelas banget pajero lebih menang ketimbang fortuner,neutral,neutral,negative,neutral
Honda Beat luar biasa . Mesin nya bandel . Enggak pernah mogok sekalipun .,neutral,positive,positive,neutral
"setelah ngeliat wuling almaz , ngeliat mobilio sama veloz jadi kayak sampah ..",neutral,neutral,negative,neutral
Tidak ada yang bisa membuat ku berpaling dari kenyamanan R15.,neutral,neutral,positive,neutral
"fortuner per nya keras , capek",neutral,neutral,neutral,negative
Hadeh toyota prado segala rusak . Emang kata abang gue perawatan mobil matic itu susah,neutral,neutral,neutral,neutral
"Veloz keluaran Toyota ternyata enak dipake , nyaman , pesan dari dealer juga gak lama inden nya , thanks toyota :D",neutral,neutral,positive,neutral
udah delapan bulan baru jadi lama bener,neutral,neutral,neutral,neutral
#YamahaID Perawatan Motor Injeksi Yamaha Mudah dan Murah,neutral,neutral,neutral,neutral
Motor mengapa gak Suzuki aja pak ? harga relatif lebih murah dibanding kompetitor .,neutral,neutral,neutral,neutral
Gue punya selis sudah 4 tahun. masih awet. batre sama kontroler nya enggak pernah masalah.,neutral,neutral,positive,positive
"Tenaga emang ok , tapi desain pajero kayak banci ... kurang gagah model pajero",neutral,positive,neutral,negative
Warna Avanza keluaran terbaru ini menambah mobil menjadi terlihat lebih modern,neutral,neutral,neutral,positive
"Saya pake all New Honda Brio Satya E gan , sangat nyaman dan good , apalagi brand nya H , beda dengan suzuki ignis dan Daihatsu sirion",neutral,neutral,negative,neutral
hanya motor Athlete ini yang saya enggak sreg dengan kawasaki .,neutral,neutral,negative,neutral
lama banget nunggu inden xpander keburu saya jual ini mobil,neutral,neutral,neutral,neutral
"Mobil ku daihatsu xenia ku irit , cocok banget buat keluarga indonesia dengan kursi 7 tambah lagi mesin handal ( 1.300 cc ) walau sudah sejak 2009",positive,positive,neutral,positive
Saya baru ambil HRV prestige akhir tahun 2017 . Keseluruhan enak dikendarai .,neutral,neutral,positive,neutral
fortuner gaya nya stylish banget cocok buat kamu yang hobi main instagram,neutral,neutral,neutral,positive
Bengkel @Hondaarista Jatinegara not recommended . Payah . Sudah booking servis tapi disuruh mengantri .,neutral,neutral,neutral,neutral
