processed_text,fuel,machine,others,part,price,service
Kalau rush banyak jeroan nya jadi berat tetapi stabil .,neutral,positive,neutral,negative,neutral,neutral
"Veloz keluaran Toyota ternyata enak dipake , nyaman , pesan dari dealer juga gak lama inden nya , thanks toyota :D",neutral,neutral,positive,neutral,neutral,positive
"Dari segi harga terlalu mahal , mengingat harga Sparepart Mitsubishi Xpander selangit .",neutral,neutral,neutral,neutral,negative,neutral
"Enak juga bengkel Toyota di margonda ini . Semua petugas ramah dan helpful , layanan cepat , dan dapat kopi gratis .",neutral,neutral,neutral,neutral,neutral,positive
"Sebelum ramadhan 2014 , saya ganti accu di bengkel honda Jakarta center , jayakarta . Belum setahun , sudah soak . Payah",neutral,neutral,neutral,neutral,neutral,negative
"pakai rush trd enak banget dari bangku , kaki-kaki enak dan saya bawa lari dengan kecepatan hampir 140 km / jam Tidak limbung dan masalah bensin irit banget dan ac dingin",neutral,positive,neutral,positive,positive,neutral
"Apalagi Kalau perjalanan Jauh , dengan bensin yang irit banget bagi saya begitu performa yang stabil , avanza adalah mobil idaman bagi saya Dan juga keluarga besar saya .",positive,positive,neutral,neutral,neutral,neutral
"Yang saya enggak suka , kalau saya duduk di belakang , kepala mentok dengan atap dengan tinggi 183 cm . Duduk di posisi mengemudi , rambut saya kena plafon mobil jadi kurang nyaman .",neutral,neutral,neutral,negative,neutral,neutral
Saya pribadi lebih suka sama design luar dalam CX3,neutral,neutral,neutral,positive,neutral,neutral
Sejauh ini belum ne mu bengkel resmi mitsubishi yang pelayan nya ' bagus ',neutral,neutral,neutral,neutral,neutral,positive
Toyota lebih unggul dari mitsubishi secara worldwide termasuk di Indonesia,neutral,neutral,negative,neutral,neutral,neutral
Rush cocok untuk segala medan,neutral,neutral,positive,neutral,neutral,neutral
"Khusus Xenia , ada pengalaman tahun 2008 digunakan oleh tim proyek . selama 2 bulan , Jakarta - Bandung setiap 2 hari via tol . Tidak ada keluhan sedikit pun .",neutral,neutral,positive,neutral,neutral,neutral
Altis G MT jadi tunggangan nyaman .,neutral,neutral,positive,neutral,neutral,neutral
Pengalaman hrv 1.5 e cvt . Sangat tidak puas,neutral,neutral,negative,neutral,neutral,neutral
Xi 2005 hebat banget nih mobil . kuat pakai premium ( 1:11 ) irit abis,positive,neutral,positive,neutral,neutral,neutral
"Coba dong ke Honda Autoland Kelapa Gading , beda benar . Pelayanan , kualitas ruang tunggu dan lain-lain yang enggak banget .",neutral,neutral,neutral,neutral,neutral,negative
"Ayah saya tahu karakter mesin , dia bilang karakter mesin nya calya oke",neutral,positive,neutral,neutral,neutral,neutral
Jazz VTEC Lama saja lebih murah,neutral,neutral,neutral,neutral,positive,neutral
avanza dapat bermanuver lincah mesin nya,neutral,positive,neutral,neutral,neutral,neutral
avanza lincah banget kalo buat lari meskipun gaya nya jadul abis hehe,neutral,positive,neutral,negative,neutral,neutral
"Saya dapat harga cuma 118 juta juli 2015 . lumayan murah banget si Wagon , awet , irit .",positive,neutral,positive,neutral,positive,neutral
saya akan pilih all new grand livina . jelas lebih nyaman . lebih mewah . lebih keren . mobil nya anak muda lagi .,neutral,neutral,positive,neutral,neutral,neutral
Elektronik Parking Brake HRV sudah oke banget .,neutral,neutral,neutral,positive,neutral,neutral
mobil bagus irit bahan bakar dan murah ya brio,positive,neutral,positive,neutral,positive,neutral
Honda Brio ini mobil yang lumayan keren sih memang,neutral,neutral,positive,neutral,neutral,neutral
"Motor beat paling nyaman , dipakai untuk perempuan seperti saya , apalagi dibawa ke mana-mana sangat irit dan harga nya terjangkau dibandingkan motor honda yang lain .",neutral,neutral,positive,neutral,positive,neutral
"HRV prestige akhir tahun 2017 bagasi luas , bbm irit bisa 1:12 , jok kulit , lampu led enak kalau dipakai malam hari .",positive,neutral,neutral,positive,neutral,neutral
"dengan harga cuma 70 - 80 juta dapat mobil yang sangat nyaman , cuma Altis yang bisa",neutral,neutral,positive,neutral,positive,neutral
"Xenia yang saya pakai dari 2005 ini biaya perawatan yang rendah dan keandalan mesin yang tinggi ,",neutral,positive,neutral,neutral,neutral,positive
"Dengan sigra perjalanan lebih nyaman, budget bensin bisa dialokasikan untuk keperluan lain.",positive,neutral,positive,neutral,neutral,neutral
Kalo soal irit dan perawatan sih tetep prefer ke supra x helm in .,positive,neutral,neutral,neutral,neutral,positive
sigra nih menemani jalan-jalan bersama keluarga. Ku bangga dengan mobil ini.,neutral,neutral,positive,neutral,neutral,neutral
"Mobil ku daihatsu xenia ku irit , cocok banget buat keluarga indonesia dengan kursi 7 tambah lagi mesin handal ( 1.300 cc ) walau sudah sejak 2009",positive,positive,neutral,positive,neutral,neutral
Puas ketika pertama kali membeli dan memakai Toyota Calya ini sampai sekarang,neutral,neutral,positive,neutral,neutral,neutral
"Saya pakai motor vario sangat nyaman , rem sangat pakem , Suara mesin montor masih halus , padahal setiap bulan dibuat jalan luar provinsi tetapi masih tetap nyaman .",neutral,positive,positive,positive,neutral,neutral
Tergantung mau pakai nya berapa lama . Kalau 2 - 3 tahun mau ganti mending brio bro karena harga honda turun enggak jauh-jauh amat .,neutral,neutral,neutral,neutral,positive,neutral
Rush dan terios tampilan saja bagus tetapi kualitas murahan . mendingan beli cortez nyaman dibawa dan murah .,neutral,neutral,positive,positive,positive,neutral
"Alasan saya pilih HRV karena butuh mobil yang jangkung , lega di kelas nya , dan model nya ganteng .",neutral,neutral,neutral,positive,neutral,neutral
"honda jazz full power banget, body mantep, suspensi empuk dan nyaman.",neutral,positive,neutral,positive,neutral,neutral
Xenia perawatan berkala nya tidak mahal .,neutral,neutral,neutral,neutral,neutral,positive
jelek banget ini xenia li menesal saya beli,neutral,neutral,negative,neutral,neutral,neutral
jujur saja tenaga nya Mobilio lebih besar yang manual dan akselerasi nya lebih cepat,neutral,positive,neutral,neutral,neutral,neutral
"Beat street dari bentukan keren banget , eye catching , dari performa juga lumayan untuk motor seharga nya , mesin senyap dan benar-benar halus .",neutral,positive,neutral,positive,neutral,neutral
Brio saya kondisi mesin bisa dibilang masih sempurna masih bisa 28 km / liter dan digas ke 120 kmh 140 kmh juga masih enteng .,neutral,positive,neutral,neutral,neutral,neutral
"suspensi pajero empuk , fortuner itu suspensi nya keras",neutral,neutral,neutral,negative,neutral,neutral
Menurut saya mobil xpander ini sangat nyaman dan keren,neutral,neutral,positive,neutral,neutral,neutral
komplit sekali servis yang ditawarkan toyota semua nya ada pokok nya paket lengkap,neutral,neutral,neutral,neutral,neutral,positive
Avanza sangat mendukung profesi yang saya jalani karena avanza bagi saya volume ruang yang besar .,neutral,neutral,neutral,positive,neutral,neutral
mobil mitsubishi sekarang sudah gratis biaya servis dan sparepart selama 5 tahun .,neutral,neutral,neutral,positive,neutral,positive
"saya juga baru saja beli tipe deluxe juga , bensin lumayan irit kok kak .",positive,neutral,neutral,neutral,neutral,neutral
Bengkel resmi Yamaha menjual suku cadang dengan harga yang jauh lebih mahal.,neutral,neutral,neutral,neutral,neutral,negative
Bengkel payah . Mobil 3 bulan gak dikerjain juga . Bengkel yang mengecewakan ( @ Honda Prima Bekasi ),neutral,neutral,neutral,neutral,neutral,negative
"xpander memang oke , enak saja menanjak 6 orang dalam mobil .",neutral,neutral,positive,neutral,neutral,neutral
"nmax lebar sih . cuma Honda kalau soal servis masih lebih aman ,",neutral,neutral,neutral,positive,neutral,positive
Masih nyaman Pajero karna Pajero lebih banyak peminat nya dari pada Fortuner,neutral,neutral,negative,neutral,neutral,neutral
"Gue cuma punya setahun Grand Livina, cuma dipakai ke Bali, tenaga nya lemot banget.",neutral,positive,neutral,neutral,neutral,neutral
"Tetapi menurut saya honda masih terlalu pelit untuk ac - nya ,",neutral,neutral,neutral,negative,neutral,neutral
Toyota Avanza versi terbaru pun menghadirkan pedal gas yang lebih ringan untuk diinjak sehingga anda bisa memperoleh tingkat kenyamanan lebih mudah .,neutral,neutral,neutral,positive,neutral,neutral
"Toyota Fortuner adalah kendaraan yang benar-benar di atas harapan . Setelah beberapa lama menggunakan nya , konsumsi bahan bakar kendaraan ini cukup baik dan bisa diandalkan .",positive,neutral,positive,neutral,neutral,neutral
Jazz enak . tetapi mahal harga dan perawatan gila .,neutral,neutral,positive,neutral,negative,negative
gue enggak menyangka xpander bisa sebagus ini .,neutral,neutral,positive,neutral,neutral,neutral
"mesin 3SZ - VE 1500 cc ini memang lebih pas di badan Avanza , bertenaga namun efisien",neutral,positive,neutral,neutral,neutral,neutral
ane tetep megang mobilio daripada avanza . . ga enak banget avanza .. rasa berkendara nya enakan mobilio ..,neutral,neutral,positive,neutral,neutral,neutral
"Kenapa saya suka dengan mobil Avanza , karena selain nyaman mobil ini mesin nya juga terpelihara dan terjaga . Jadi apabila kita hendak pergi ke luar kota atau pergi jauh mesin nya tetap awet .",neutral,positive,positive,neutral,neutral,neutral
Toyota Rush irit,positive,neutral,neutral,neutral,neutral,neutral
sebagai jiwa petualang saya yakin beli brio karena lincah kalau untuk lari,neutral,positive,neutral,neutral,neutral,neutral
"Wuling confero , mesin gardan oke dan mantap , mesin andal di kelas nya ,",neutral,positive,neutral,neutral,neutral,neutral
@hondajazz_id pelayanan bengkel honda pluit jelek,neutral,neutral,neutral,neutral,neutral,negative
"tapi mazda kadang mahal , harga purnajual enggak seberapa",neutral,neutral,neutral,neutral,negative,neutral
Gue punya selis sudah 4 tahun. masih awet. batre sama kontroler nya enggak pernah masalah.,neutral,neutral,positive,positive,neutral,neutral
"Enggak semua bengkel AHASS HONDA servis nya keren , motor gue servis dicsitu malah sama saja kayak enggak diservis ! Udah mahal ! Payah lagi !",neutral,neutral,neutral,neutral,neutral,negative
Alhamdulillah saya tidak salah pilih memilih kendaraan buat usaha selain dari tenaga nya yang lumayan kencang vario 125 kokoh buat bawa beban banyak dan irit sangat bbm - nya,positive,positive,positive,neutral,neutral,neutral
Mobil lmpv paling enak mesin dan handling nya .. sayang fitur nya nanggung banget belum ada smartkey,neutral,positive,neutral,negative,neutral,neutral
pajero lah yg menang soal nya dia hemat karena solar Dan lebih nyaman,positive,neutral,positive,neutral,neutral,neutral
mobilio memang paling enak buat low mpv,neutral,neutral,positive,neutral,neutral,neutral
Saya lebih suka fortuner dibandingkan pajero,neutral,neutral,negative,neutral,neutral,neutral
Calya bagus cantik irit dan terjangkau,positive,neutral,neutral,positive,positive,neutral
Xeli lumayan irit bbm 1:9 dalam kota ( belum pernah bawa ke luar kota ) .,positive,neutral,neutral,neutral,neutral,neutral
jazz jauh lebih praktis dipake kalo dibanding brio,neutral,neutral,negative,neutral,neutral,neutral
si xexi tarikan oke . lari 120 di cipularang oke saja itu .,neutral,positive,neutral,neutral,neutral,neutral
keseluruhan mobil Wuling confero S 1.5 L Lux+ ini direkomendasikan banget .,neutral,neutral,positive,neutral,neutral,neutral
Mesin diesel yg paling kondang sampai ke kampung kampung ya Mitsubishi,neutral,positive,neutral,neutral,neutral,neutral
sangat berkesan dengan Avanza karena harga nya yang murah dibanding dengan mobil sekelas nya ( saya beli bekas ) .,neutral,neutral,neutral,neutral,positive,neutral
Pajero sport mobil impian gue bro keren nya gak ada yang bisa ngalahin,neutral,neutral,positive,neutral,neutral,neutral
Fortuner tampang sih keren tp power nya letoy bos,neutral,negative,neutral,positive,neutral,neutral
Daihatsu Ayla tuh yang lebih murah dan irit mah .,positive,neutral,neutral,neutral,positive,neutral
"sudah 3 tahun saya pakai Honda Vario , sangat nyaman dipakai dan pasti nya irit",positive,neutral,positive,neutral,neutral,neutral
secara keseluruhan sih vario lebih bagus daripada mio,neutral,neutral,negative,neutral,neutral,neutral
"ternyata GPS bawaan xenia nya enggak mengecewakan , anak-anak senang . Lumayan pintar lah , kalau saya bohongi rute nya dia tetap bisa kalkulasi ulang rute yang saya ambil .",neutral,neutral,neutral,positive,neutral,neutral
Mobil Honda semuanya punya tempat penyimpanan yang banyak,neutral,neutral,neutral,positive,neutral,neutral
"Pas lihat tadi Suzuki Baleno 2017 ini di GIIAS lumayan banget buat harga segitu , murah .",neutral,neutral,neutral,neutral,positive,neutral
jazz lebih bandel kalo dibanding brio,neutral,negative,neutral,neutral,neutral,neutral
Xpander lebih memiliki kesan Gahar dari eksterior .,neutral,neutral,neutral,positive,neutral,neutral
"cocok banget brio ini buat ke kampus, desain body yang kecil gak bikin lebay buat dipakai mahasiswa",neutral,neutral,positive,positive,neutral,neutral
baru sebulan udah sampe inden fortuner mantap sekali,neutral,neutral,neutral,neutral,neutral,positive
Naik pajero goyang nya parah mending naik inova,neutral,neutral,positive,neutral,neutral,neutral
pengalaman berkendara nya sangat menyenangkan pakai Avanza karena suara mesin nya yang halus,neutral,positive,neutral,neutral,neutral,neutral
"agya agak sedikit mengecewakan, gak bagus",neutral,neutral,negative,neutral,neutral,neutral
Di samping harga nya yang terjangkau motor matic vario irit bahan bakar dan nyaman untuk digunakan dalam melaksanakan kegiatan sehari-hari .,positive,neutral,positive,neutral,positive,neutral
"dengan harga yang cukup ekonomis, style body dari calya termasuk elegan",neutral,neutral,neutral,positive,positive,neutral
"Honda Beat membuat saya semangat untuk bepergian jauh , apalagi perjalanan dekat , irit banget . Apalagi dengan bodi nya yang keren membuat saya jatuh cinta , mesin nya juga halus banget .",positive,positive,neutral,positive,neutral,neutral
Pikiran lebih pilih li. mengincar irit nya yang super,positive,neutral,neutral,neutral,neutral,neutral
memang kalo body kalah pajero tapi kalo mesin pasti pajero,neutral,positive,neutral,negative,neutral,neutral
"Awal nya orang tua tertarik sama ini mobil tetapi begitu lihat si mitsubishi langsung berubah pikiran enggak jadi inden ini mobil , kata mereka interior dalam nya membosankan .",neutral,neutral,neutral,negative,neutral,neutral
"Bengkel Toyota Pemuda bagus banget pelayanan nya , service nya juga bagus . Thanks ya @ToyotaID",neutral,neutral,neutral,neutral,neutral,positive
semua Xe itu kopling nya keras,neutral,neutral,neutral,negative,neutral,neutral
Mazda itu desain nya bulat-bulat unik dan halus banget.,neutral,neutral,neutral,positive,neutral,neutral
service di bengkel resmi daihatsu pun tetap murah,neutral,neutral,neutral,neutral,neutral,positive
"Gw pernah naik Fortuner keras bgt coy , kata nya enakan pajero",neutral,neutral,positive,neutral,neutral,neutral
Avanza cocok buat mobil keluarga .,neutral,neutral,positive,neutral,neutral,neutral
gue pemakai livina xr 2010 gue pakai livina serasa nyaman senyaman mercy sampai-sampai harga jual nya pun sama dengan mercy,neutral,neutral,positive,neutral,positive,neutral
"xenia Li taun 2005 , saya pakai baik-baik saja . bandel . irit .",positive,positive,neutral,neutral,neutral,neutral
"Grand livina 2011 sampai sekarang enak lari , tapi suara pintu nya keras kalau ditutup .",neutral,positive,neutral,negative,neutral,neutral
suka sama xenia bisa dipake untuk bermanuver ria tanpa masalah,neutral,positive,neutral,neutral,neutral,neutral
Motor mengapa gak Suzuki aja pak ? harga relatif lebih murah dibanding kompetitor .,neutral,neutral,neutral,neutral,positive,neutral
"spin 125 ya , mantap , spin murah meriah",neutral,neutral,neutral,neutral,positive,neutral
avanza kurang banget power nya,neutral,negative,neutral,neutral,neutral,neutral
aneh nya kaki-kaki mobil HRV saya sangat berisik . Berisik sekali .,neutral,neutral,neutral,negative,neutral,neutral
Mitsubishi Colt L300 Pick Up . Mobil Pick Up tangguh dan bandel serta irit cocok untuk menunjang kegiatan niaga Anda,positive,positive,neutral,neutral,neutral,neutral
"Saya sudah menggunakan Vario 125 esp ini sejak tahun 2016 , keseluruhan selama 2 tahun pemakaian bisa dibilang sangat puas , servis yang murah , bahan bakar irit , dan nyaman .",positive,neutral,positive,neutral,neutral,positive
Calya tidak kalah dengan kualitas mobil-mobil mahal lainnya .,neutral,neutral,positive,neutral,neutral,neutral
punya mobil mewah tetapi bahan bakar irit innova mantap toyota juara,positive,neutral,positive,neutral,neutral,neutral
Tidak ada yang bisa membuat ku berpaling dari kenyamanan R15.,neutral,neutral,positive,neutral,neutral,neutral
"Nih harga Suzuki New Ertiga , lebih mahal 2 - 5 juta dari yang sebelumnya",neutral,neutral,neutral,neutral,negative,neutral
Jazz memang nyaman dikendarai tetapi sayang nya tidak didukung kinerja bengkel yang selevel .,neutral,neutral,positive,neutral,neutral,negative
"GL nyaman banget memang , kalau di tol juga juara .",neutral,neutral,positive,neutral,neutral,neutral
hanya motor Athlete ini yang saya enggak sreg dengan kawasaki .,neutral,neutral,negative,neutral,neutral,neutral
saya punya ertiga yang kalo ac udah nyala kaya gak ada ac nya tetap panas,neutral,neutral,neutral,negative,neutral,neutral
@ivangreen_99 : Bengkel Honda no 1 dewi Sartika ga jamin puas servis nya .,neutral,neutral,neutral,neutral,neutral,negative
enak banget jalan-jalan pake ertiga gak kaya avanza yang bikin emosi .,neutral,neutral,negative,neutral,neutral,neutral
Ke mana-mana mau jarak dekat atau pun jauh tetap nyaman pakai scooy . muatan bagasi banyak dan mesin tidak cepat panas .,neutral,positive,positive,positive,neutral,neutral
Pakai Altis v enggak boros-boros amat sih,positive,neutral,neutral,neutral,neutral,neutral
avanza 1.3 L memang irit kalau dibawa 60 - 80 km / jam .,positive,neutral,neutral,neutral,neutral,neutral
Xpander bodi juga kaleng . Siapa bilang hanya rush doang yg kaleng,neutral,neutral,neutral,negative,neutral,neutral
kijang innova pokok nya juara mobil mewah tetapi harga nya tidak mahal,neutral,neutral,positive,neutral,positive,neutral
"calya tidak didesain untuk dipakai di medan yang sulit, lemah!",neutral,neutral,neutral,negative,neutral,neutral
Kalo menurut gw enak pajero si,neutral,neutral,positive,neutral,neutral,neutral
"Tetapi kalau untuk kaki-kaki , punya saya agak berisik , apalagi lewat jalan rusak , itu kaki-kaki berasa banget bunyi-bunyi nya .",neutral,neutral,neutral,negative,neutral,neutral
layanan Purnajual Toyota Dinilai Paling Memuaskan,neutral,neutral,neutral,neutral,neutral,positive
@Auto2000ID maaf kenapa ya mobil ya setelah di servis di dealer toyota sekarang mobil nya jadi susah di starter ? Dan sering mati mati,neutral,neutral,neutral,neutral,neutral,negative
"menurut gue ini mobil agak cengeng sih , alias banyak penyakit , menurut pendapat saya",neutral,neutral,negative,neutral,neutral,neutral
Gak bisa tidur kalau malam-malam di mobil karena suara ac nya berisik sekali,neutral,neutral,neutral,negative,neutral,neutral
"memang xenia bandel , gue senang banget sama mobil gue ini .",neutral,positive,positive,neutral,neutral,neutral
"Ternyata service bengkel toyota payah , angin ban bukan nya ditambah malah disemir doang buat apa coba . Jelas-jelas kurang angin gitu",neutral,neutral,neutral,neutral,neutral,negative
Asli avanza saya boros akhir-akhir ini,negative,neutral,neutral,neutral,neutral,neutral
Xpander pokok nya terbaik di kelas nya .,neutral,neutral,positive,neutral,neutral,neutral
"nambah logo doang , harga naik puluhan juta",neutral,neutral,neutral,neutral,negative,neutral
Hanya honda beat yang sudah terbukti mantap dan dahsyat.,neutral,neutral,positive,neutral,neutral,neutral
"kemarin saya di honda brio , baru 2 tahun pakai dan jarang dipakai kaki-kaki sudah bunyi , rem cepat habis , sama sil booster rem atau master rem yang rembes",neutral,neutral,neutral,negative,neutral,neutral
"Mending wuiling almaz . Fitur banyak , mesin turbo , body gede , harga menarik .",neutral,positive,neutral,positive,positive,neutral
Rush merupakan SUV menengah yang sangat menarik,neutral,neutral,positive,neutral,neutral,neutral
"saya sih mending xi irit sih beda tipis apalagi macet di kota-kota besar enggak berefek xi buat luar kota enak , tanjakan juga oke .",positive,neutral,positive,neutral,neutral,neutral
